0,使用好人贷要开定位吗,1.0
1,操作好人贷是否需要开启定位,0.9479809210506591
2,好人贷如何主动还款,0.9438724062544832
3,好人贷提额会查询征信吗,0.9424899505104056
4,好人贷定位如何开启,0.9409236104005115
5,好人贷借款如何上报征信,0.9402456427598388
6,好人贷借款时还会审核吗,0.9400256865155235
7,好人贷-云闪付是什么,0.9399867897473252
8,好人贷账户是否为新网银行二类户？,0.9396507728367771
9,好人贷消费用途,0.9395363140869386
10,好人贷上征信吗,0.9387553643302261
11,好人贷能否人工操作提额,0.9385669756625279
12,好人贷申请是否查询芝麻信用,0.9377330625611728
13,好人贷以什么贷款类型上报人行征信？,0.937602746458562
14,好人贷支持随时借款吗,0.9374964677360008
15,新网银行好事贷如何申请,0.9361236304230257
16,好人贷-云闪付如何提前还款,0.9356446236017575
17,好人贷放款至什么账户,0.9338545992010896
18,好人贷借款规则,0.9337295511587496
19,好人贷账户如何挂失,0.9337174713139993
20,好人贷账户如何注销,0.9332817557502149
21,好人贷自动扣款规则,0.932639765249278
22,好人贷如何自助提额,0.9315821539561392
23,我行放款的其他平台借款会上报征信吗,0.9307285446773069
24,新网银行账户可以设置为好人贷借/还款账户吗,0.9306180355661814
25,再次申请好人贷会查询征信吗,0.9305939919984623
26,好人贷部分提前还款规则,0.9303726036767412
27,为何销户后还能看到好人贷信息,0.9303510575826965
28,好人贷支持扣款的银行有哪些,0.9301369078507601
29,好人贷支持在国外发起借款吗,0.9297087362681233
30,好人贷是邀请制吗,0.9288308560186471
31,如何查询好人贷借据收款银行卡,0.9282087985897829
32,好人贷-云闪付如何更换收/还款银行卡,0.9277252831919921
33,新网银行三类户是什么,0.9276204953610093
34,好人贷如何试算利息,0.9271583247051796
35,好人贷如何提前还款,0.9270433946752247
36,如何查询好人贷申请的授信结果,0.9269604166994181
37,挖财还款是否为新网银行代扣,0.9268589805886558
38,好人贷支持周末借款吗？,0.9261435632796818
39,好人贷是否有临时额度,0.9259514881397757
40,好人贷手动还款时为何提示批次执行中,0.9258714100189755
41,新网诺诺发票贷如何申请,0.9252444061263373
42,好人贷的办理时间,0.9249931868786934
43,好人贷扣款账户如何查看,0.9248558354898722
44,好人贷交易密码如何设置,0.9242262755556425
45,好人贷如何提高额度,0.9242051302416882
46,新网银行存款属于理财产品吗,0.924082568405055
47,好人贷申请能否撤销,0.9240745344108733
48,为何征信上有新网银行的贷款审批记录,0.9239366263938271
49,好人贷如何降低利率,0.9237814745321057
50,如何更换好人贷默认还款账户,0.9233650727244411
51,新网银行有招聘吗,0.9229753785272141
52,好人贷如何审核,0.9228829191725869
53,好人贷额度是否循环使用,0.9226857993117179
54,申请好人贷是否都有额度,0.9219977703501021
55,好人贷为什么额度低,0.9219494507719678
56,好事贷如何还款,0.9219251600921533
57,好人贷账户如何查询,0.9218395556214337
58,如何查看好人贷还款计划,0.9218368785020504
59,好人贷需要面签吗,0.9207305187327005
60,好人贷额度必须一次性借完吗,0.9207187928571979
61,新网银行二类户限额是多少,0.9206585865572653
62,申请好人贷需要开个人账户吗？,0.920400022845167
63,电脑端可以登录好人贷吗,0.919969951843875
64,车贷如何解绑银行卡,0.9198687431182637
65,好人贷能否绑定他人银行卡,0.9197462374240659
66,好人贷不借款会产生利息或费用吗,0.9194160358607196
67,身份证更换期间会影响好人贷贷款吗,0.9190346913158106
68,合作平台如何取消贷款,0.9189845484733052
69,好人贷是否支持提前还当期账单,0.9189615183956774
70,新网银行扣款通道是什么,0.9189195139142695
71,新网银行有企业贷款吗？,0.9188067750552301
72,好人贷有回访电话吗,0.9186527773532763
73,随心存可以在我行公众号查询/操作吗,0.918586077662686
74,新网银行二类户与好人贷是否为同一个手机号码,0.9185554622915367
75,新网银行合作的存管平台有哪些,0.9183608960363115
76,关闭其他平台额度后，能否恢复好人贷额度,0.9183460167762603
77,好人贷额度他人能否使用,0.9182323850140197
78,为什么好人贷第一期还款金额与之后不一致,0.9179152446624491
79,平台还款信息为何与新网银行不一致,0.9176432018302444
80,好人贷只能使用微信登录吗？,0.9172029908453597
81,好人贷只能通过绑定的银行卡还款吗,0.9169688766827615
82,为什么提前还款显示联合贷批次执行中？,0.9169203892542805
83,好人贷授信首页显示利率是否为固定利率,0.91674953206077
84,为何好人贷还款时提示“交易处理中”,0.9164039351890174
85,新网银行能否绑定云闪付,0.9163447341276386
86,好人贷还款后额度何时恢复,0.9161366073791448
87,好人贷借款后能否修改贷款信息,0.9157254695777941
88,好人贷有额度后如何进行贷款,0.9155601695901642
89,申请好人贷有区域或者号段等限制吗,0.9153611637672187
90,好人贷是否支持提前还款,0.9153341477433852
91,有多少人获得好人贷额度,0.9153066913410295
92,新办的手机号可以申请好人贷吗,0.9152172633916738
93,新网银行合作平台有哪些,0.9151143722669852
94,好人贷如何还款,0.9149500609182024
95,新网银行以什么名义放款,0.9147751077012641
96,新网银行有哪些产品可以提额,0.9141704592969402
97,新网银行视频认证的QQ号码是多少,0.914137378060486
98,申请好人贷后，可否更改授信结果,0.9140450876011964
99,好人贷借款记录如何查询,0.9136895232650782
100,好人贷额度为什么变低了,0.9136671828114025
101,好人贷申请是否支持人工受理,0.9134532575248934
102,好人贷是否支持归还逾期部分账单,0.9134337389762324
103,客服能否看到客户申请好人贷的信息,0.9127922577656528
104,如何进入好人贷页面,0.912444995795713
105,黑户/白户是否可以申请好人贷,0.9122179870079836
106,好人贷通过率多少,0.9121502940450129
107,存款产品的资金可以用于好人贷还款吗,0.9120243739598926
108,好人贷为何无法还款,0.9118977426017875
109,好人贷如何查看所支持的还款方式,0.9114397005046552
110,好人贷为什么无法借款,0.9114139230077795
111,好人贷必须绑定银行卡使用吗,0.911333720416907
112,新网银行的活期利率是多少,0.9112797644125229
113,好人贷还款记录如何查询,0.9112770264397129
114,新网银行账户是什么,0.9109333855855434
115,新网银行二类户如何转入/转出,0.910625689107753
116,好人贷审核时是否给填写的联系人去电,0.9106160764079533
117,好人贷如何申请,0.9105529955882983
118,为何征信上有新网银行上报的逾期,0.9104346463241937
119,好人贷提额周期是多久,0.9103799235737946
120,好人贷申请身份证可否添加水印,0.9103490116327934
121,可否按照征信订单号开据证明,0.9101100270489517
122,创客贷额度是多少,0.9100515422625176
123,好人贷额度是否会发生变化,0.9100416733459201
124,好人贷额度是多少,0.9099613033235239
125,好人贷贷款期限是多久,0.9097220352449319
126,好人贷被拒后为何没有下次开放时间,0.9096699608151579
127,银行渠道维护是指什么,0.9096249429255691
128,新网银行存款产品为何暂停交易,0.9094585961516212
129,合作平台如何还款,0.9091756922782956
130,如何查询合作平台贷款是否结清,0.9091278517868628
131,好人贷支持微信/支付宝扣款吗,0.908866526528134
132,"好人贷有回访电话吗""",0.9087674431577577
133,好人贷贷款利息如何计算,0.9087579482431755
134,申请好人贷需要下载APP吗？,0.9087022052548447
135,为何征信上有新网上报的贷款记录,0.9085034329316514
136,好人贷申请是否可以使用临时身份证,0.9082210561240581
137,新网银行是否上市,0.9079151080805989
138,新网银行以何名义查询征信,0.9074829893651901
139,车贷能否绑定他人银行卡,0.9072477823905143
140,好人贷与其他平台类似产品的区别是什么,0.9072274747803847
141,好人贷如何实名认证,0.9070336797340445
142,新网银行存款类产品有哪些,0.9069254086763114
143,好人贷借款多久到账,0.9067434211945105
144,车贷平台如何查询,0.9065501527191039
145,销户后是否上征信,0.9062762417008045
146,好人贷还款方式有哪些,0.9061153746683063
147,好人贷为什么提示“账户存在异常操作”,0.9060597505207811
148,新网银行行号是多少,0.9057526298277299
149,申请好人贷后有没有回复,0.9057044275470096
150,诺诺发票贷的利率是多少,0.9056040811595102
151,如何查询其他平台扣款银行卡,0.905264999782375
152,新网银行有信用卡吗,0.9050042517726022
153,好人贷利率为什么高,0.9047910796315703
154,在哪个平台操作提现,0.9047633361223023
155,好人贷申请的渠道有哪些,0.9045678088211907
156,好人贷可以重新申请吗,0.9045177993384731
157,好人贷收取哪些费用,0.9044403444290193
158,随心存支持提前支取吗,0.9040622961273335
159,好事贷收取哪些费用,0.90401848849822
160,如何查看好人贷相关协议/合同？,0.9039609894093199
161,新网银行如何联系客户,0.9037439776271594
162,好人贷提前还款最低还多少,0.9037413236534477
163,为何提示支付平台受发卡行资金用途限制拒绝交易,0.9037002040969097
164,如何购买新网银行存款产品,0.9036106395255405
165,为什么收到美利车金融的短信,0.9035996312938422
166,好人贷利率为什么调高了,0.9035327192538455
167,好人贷审核电话是多少,0.9034071620228961
168,好人贷还款后多久到账,0.9025686825475671
169,为何无法申请好人贷,0.9023500424256268
170,好人贷是什么,0.9023418687099177
171,新网银行开户支持的证件有哪些,0.9022263519383509
172,好人贷借款合同有效期是多久,0.902073970507612
173,联系新网银行客服有哪几种方式,0.9015598113147578
174,借款时选错收款账户怎么办？,0.9015213172431161
175,新网银行有哪些活动,0.90132832399716
176,新网银行存款是否受保障,0.9013088121426927
177,怎样用其他手机登录好人贷,0.9011675693120289
178,新网二类户上的资金是否计息,0.9008653381002105
179,好人卡绑定云闪付/微信等失败怎么办,0.9007989261423379
180,滴水贷客服电话是多少,0.9007588466679607
181,好人贷当期能否最低还款,0.9007586140627528
182,我们是四川新网银行吗,0.9002893817534138
183,新网银行人工客服电话是多少,0.9000812088041017
184,好人贷注册手机号与银行卡预留手机号是否需要一致？,0.8999616981360624
185,获取额度后多久可发起借款,0.8997518670744564
186,新网银行账户的交易记录如何查看,0.8996736691945462
187,如何操作随心存大额存款,0.8993305706684275
188,新网银行APP下载,0.8989957364408186
189,为什么银行还款存在限额？,0.8989309878934894
190,存款产品如何修改手机号,0.8988953263606947
191,什么平台的贷款,0.8988540417990885
192,新网银行公众号如何取消关注,0.8986409849849066
193,车贷支持手动还款吗,0.8985905988247508
194,银行卡是二类户影响扣款吗,0.8984358710917187
195,58车金融客服电话是多少,0.898420809502544
196,随心存T+1是什么,0.8982858274850104
197,如何邀请好友申请好人贷,0.8982321804388208
198,随心存如何查看收益情况,0.8981304881712684
199,好人贷账户如何更换手机号码,0.898073988303298
200,如何在新网银行开户,0.8979356048518072
201,为何收到新网银行还款短信,0.8977771125449416
202,好人贷支持随借随还吗,0.8969326340112417
203,如何查询转账到新网银行的记录,0.896909833728725
204,车贷如何更换还款银行卡,0.8967580239881048
205,申请诺诺发票贷需要什么条件,0.8967362959552666
206,为何提示支付平台发卡行拒绝,0.8961445071345644
207,提前还款会影响个人征信吗,0.8959724342510177
208,新网银行有实体卡片吗,0.8958528561325592
209,是否需要使用本人手机操作好人贷,0.8955118705055914
210,线上是否可开据征信版结清证明,0.8954847338324258
211,任性还款是什么,0.8954710128868363
212,随心存操作渠道有哪些,0.895406094710023
213,好人贷电话回访时间,0.8951783329970783
214,为何提示支付平台不允许持卡人进行的交易,0.8949614066831976
215,为何申请好人贷后显示未获取额度,0.8945126790644355
216,车贷扣款支持的银行卡有哪些,0.8938701006009618
217,非绑定银行卡可否与新网二类户转账,0.8937308111272254
218,平台方手机号变更导致我行无法直接开据结清证明问题,0.8936243039928875
219,如何解约快捷支付？,0.8933691541405151
220,新网银行账户可以在哪些地方使用,0.8930763948596806
221,如何注销新网二类户,0.8929579694369687
222,如何办理好人卡？,0.8929318749131636
223,线下转账如何填写新网银行开户信息,0.8928993788772464
224,如何取消征信查询及使用授权书,0.8928535542548404
225,随心存提前支取到账时间,0.8926641830448526
226,补扣会影响信用吗,0.8925865479818157
227,申请好人贷没有公司邮箱怎么办,0.8925820180836253
228,好人贷审核不通过对个人有什么影响,0.8923931803986965
229,随心存如何修改交易密码,0.8923784616683007
230,好人贷个人资料如何修改,0.8922693313009581
231,他人可以使用本人信息申请好人贷吗,0.8921327484317357
232,车贷如何提前还款,0.8920382908647212
233,可以通过他人银行卡转入到新网银行账户吗,0.8920008417626613
234,销户后为何还能解绑银行卡,0.8918878228356905
235,绑定银行卡产生费用吗,0.8916376860534139
236,查询车贷的注册手机号码是什么,0.8915414283842877
237,为何提示支付平台签约关系不存在,0.8914660755558989
238,借款成功会有短信等提醒吗,0.8914020234197947
239,为何提示支付平台该客户无默认扣款卡，交易没有发给统一支付,0.8910036062954569
240,存款需要先开立银行账户吗,0.8907369787240055
241,好人贷申请必须使用身份证原件吗,0.8905685092703378
242,车贷如何申请,0.8903192399048779
243,结清贷款后征信上是否会显示结清,0.8902841367497895
244,自助提额什么时候上线,0.8902179632412377
245,新网二类户为何无法转入/转出,0.8900896552693474
246,线上转入新网银行账户到账时间是多久,0.8898861473245492
247,新网银行的官网地址是什么,0.8898854215790767
248,如何激活新网二类户,0.8898383491495199
249,为何申请好人贷页面显示暂无资格,0.889824681114352
250,一个身份证可以申请好人贷两次吗？,0.889775915381694
251,好人贷月利率是多少,0.8895992394171705
252,好人贷借款超时未到账如何处理,0.889596971706296
253,新网二类户转入/转出收取手续费吗,0.8894068574244688
254,新网银行有几个网点,0.8890807789646535
255,为何申请好人贷无结果,0.8890521422118488
256,季得利提前支取影响已发放利息吗,0.8889921394519897
257,线上开据证明为何和征信金额不符,0.8888174792718113
258,公众号是否有还款提示,0.8881803129693715
259,好人贷注册手机号无法使用,0.8880828871437907
260,申请好人贷必须填写联系人信息吗,0.8878500113972397
261,季得利的操作渠道有哪些,0.8876789478574129
262,如何通过线下方式转入新网二类户,0.8876698506154488
263,提前结清贷款后还会扣款吗,0.8872050443542491
264,微信/支付宝等可否与新网银行账户互相绑定,0.8869898271186749
265,好人贷利率是多少,0.8869004613272041
266,如何查询车贷还款日,0.8866929668957088
267,转入新网银行使用的密码是交易密码还是银行卡密码,0.8864570235734516
268,车贷如何还款？,0.8864398455584261
269,车贷可以修改还款日吗,0.8863726187001543
270,银联在线支付是什么,0.8859468016278877
271,车贷如何办理解押手续,0.8858826013454231
272,如何冻结新网银行账户,0.8858731936126514
273,半年得利提前支取影响已发放利息吗,0.8857703028835011
274,可以让别人代还款吗？,0.885581559498696
275,什么是银行卡预留手机号？,0.8855239320368445
276,好人贷申请需要填写哪些个人信息,0.8855113921997199
277,为何提示支付平台当日交易次数超限,0.8853532686035036
278,新网银行自动扣款时间,0.8853121547643099
279,销户后可以再开户吗,0.8849938045804622
280,哪些渠道可以购买京东存款产品？,0.8845707031629152
281,如何查询存管账户流水,0.8844460555916351
282,如何修改存管账户预留手机号码,0.8843881572770675
283,好人贷申请成功会有短信通知吗,0.8843296695250332
284,未接到好人贷回访电话会被拒吗,0.8842322578983068
285,为何页面出现多个新网银行账户,0.8838574549345733
286,银行卡挂失会影响自动扣款吗,0.8837311012194999
287,如何查询是否已申请好人贷,0.8837250966252717
288,为何无法提交好人贷申请资料,0.883431131869982
289,存管账户如何注销,0.8828803001327863
290,新网二类户转入/转出有时间限制吗,0.8828308470081818
291,银行渠道维护时间一般是多久,0.8826064765375677
292,注册手机号及微信号需要实名制吗,0.8822238324852665
293,按期还款和任性还款的区别是什么,0.8821532178484535
294,借款合同是否有展示提前还款会收取违约金的情况,0.8820725096873953
295,绑卡时页面上的银行卡预留手机号码可以修改吗,0.8818782771133571
296,申请好人贷需要哪些资料,0.8815193128786706
297,存款产品如何重置交易密码,0.8813769500477151
298,如何更换借款收款银行卡,0.8812095331847323
299,定期存款操作的渠道有哪些,0.8811930511787006
300,为何提示支付平台银行卡未开通银联无卡认证支付,0.8810924813330703
301,工新借如何申请,0.8810459043353565
302,为何收到新网银行逾期提醒短信,0.8809778467188337
303,如何换绑银行卡,0.8808584468941483
304,转账到新网银行如何操作,0.8805350433071903
305,如何查看随心存购买情况,0.880515645078772
306,好人贷借款金额与到账金额是否一致,0.8804617664211647
307,更换银行卡会影响自动扣款吗,0.8804152001095645
308,车贷如何修改注册手机号码,0.8801541224307426
309,申请好人贷工作信息如何填写,0.8799684851786395
310,新网银行自动扣款次数,0.8799185407097226
311,好人贷审核时间是多久,0.8795795184586953
312,新网账户绑定微信/支付宝后支持提现或充值吗,0.8795093022547352
313,五年定期存款支持提前支取吗,0.8793385125035245
314,银行卡还款限额是多少,0.8792507178906191
315,好人贷额度有效期是多久,0.8791476236097578
316,未正常还款我行会进行催收吗,0.8791010765366877
317,他行渠道汇入新网账户的到账时间是多久,0.8789132764970381
318,如何设置存管支付密码,0.8788829893210217
319,更改银行卡预留手机号的方法,0.8788370997719397
320,使用优惠券后提前还款利息如何计算,0.8787881411314155
321,为何征信上的放款日期与实际借款日期不一致,0.8786147316350537
322,能否人工开据贷款证明,0.878427374518108
323,银行卡开通银联在线支付后是否可正常还款,0.878373141365913
324,优信扣款成功后为何显示待还款,0.8782234064717415
325,线上开据证明有次数限制吗,0.8779780400848068
326,选择任性还款/按期还款利息如何计算,0.8778119385043246
327,贷款结清之后能否删除贷款记录,0.8776290778216221
328,随心存利率是多少,0.8775795398670834
329,借款后如何判定下次还款日期,0.877507129879831
330,征信上显示的贷款金额是否包含利息,0.8772649142582823
331,收款卡发卡行拒绝放款失败什么意思？,0.8770028173725707
332,无法提供消费凭证可以取消贷款吗,0.8769188193270475
333,有额度不使用有什么影响吗,0.876915787577772
334,新网二类户可以升级为一类户吗？,0.8768407887798907
335,身份证过期可以申请好人贷吗,0.8767324379926582
336,京东存款如何修改注册手机号码,0.8765780800460197
337,如何查询新网账户,0.8764645026247275
338,如何更改其他平台的注册手机号码,0.8764425368798044
339,好人贷年化利率是多少,0.8761024496098302
340,存管是什么,0.8760970056687962
341,通过本人微信找回密码是指什么,0.8757013003639904
342,为何提示支付平台持卡人信息有误,0.8751820434949322
343,车贷还款记录如何查询,0.8751414226647817
344,工新借是什么,0.8751021959329062
345,实名认证是否查询征信,0.8749190189260421
346,如何关注新网银行公众号,0.8747371393459361
347,京东存款为什么显示当日额度为什么已售罄？,0.8746521108644214
348,名下所有卡被冻结后如何还款,0.874252344693271
349,如何修改征信上的个人信息,0.8741638668844117
350,开据证明时为何提示账户存在异常,0.8740299389903683
351,提前支取有限制吗,0.8740140468867821
352,为何提示支付平台其他错误,0.8737975672984162
353,客户咨询其他平台催收问题,0.8737869121385338
354,如何注销新网注册用户,0.8737762416688997
355,随心存利率为何会发生变化,0.873763187488287
356,为何提示支付平台暂不支持的银行或限额,0.8735597195341009
357,如何增加银行卡,0.873380335469777
358,申请好人贷需要什么条件,0.8731027224683384
359,如何修改新网随心存注册号码,0.8730643167113029
360,其他贷款怎么办理,0.8730092684783637
361,为何还款后额度恢复减少了,0.8729733404263343
362,如何把注册用户与结算用户都注销,0.8729267141029662
363,新网银行业务办理时间,0.8728316152137181
364,提前支取时为何显示存入,0.872751283547443
365,存管账户如何查询,0.8723862688090558
366,存款产品支取通用路径,0.872331070360168
367,五年定期存款是什么,0.871935716424226
368,随心存存款期限有哪些,0.8718817563886818
369,京东存款是否支持提前支取/提前部分支取？,0.8717434560717869
370,个人可以在新网开立几个账户,0.8717000068037141
371,为何提示支付平台交易金额超限,0.8716321850970556
372,银行渠道维护无法操作怎么办,0.8716279115982873
373,借款到账后页面未更新借款状态,0.8713913583213043
374,京东存款的计息规则及计息公式,0.8712259208650684
375,优信客服电话是多少,0.870908514594111
376,随心存停售后有影响吗,0.8702232229666717
377,为何提示支付平台渠道不支持的银行,0.8694976175956254
378,周得利提前支取如何计息,0.8692923521636342
379,征信是什么,0.8691733259499056
380,为什么取消了提前部分还款,0.8689086161511999
381,新网银行人工客服电话打不通,0.8688702318996366
382,微信号更换成功后何时可以正常使用,0.8684253276779987
383,当期账单支持再分期吗,0.8683062278550114
384,好人贷为什么无法登录,0.868222014685172
385,车贷合同为何无法查看,0.8682122111176305
386,为何按期还款只能选择部分贷款期限,0.8681873866155783
387,存款产品是否存满五年才能支取,0.8679678709987504
388,如何查看委托支付协议,0.8679298132553775
389,存款产品是否保本保息,0.8678753731782308
390,为何提示支付平台账户状态异常,0.867747316923215
391,还款银行卡是否需要开通银联在线支付业务,0.8677429335996723
392,系统升级会影响扣款吗,0.8676228379062207
393,申请创客贷需要什么条件,0.867601511538465
394,车贷申请多久可以放款,0.8675094875997335
395,如何查询征信报告,0.8674828616959223
396,修改手机号码的处理时间是多久,0.8671682293744326
397,平台方提供的客户审批资料能否提供给客户,0.8670434364199662
398,如何选择按期还款/任性还款,0.8669927177724412
399,我行对客邮箱是多少,0.8669187755265653
400,车贷合同如何查看,0.8668638507707194
401,如何查询当期车贷还款金额,0.8667921103235473
402,还款金额超银行卡限额怎么办,0.8666509091632705
403,美团客服热线是多少,0.8659874918000355
404,银联在线支付如何开通,0.8657036540393495
405,节假日可以操作各类存款吗,0.8656635244524206
406,新网银行发送的短信验证码的有效时长？,0.8656611365410748
407,申请好人贷后为何页面显示仍可提交申请,0.8656135030975889
408,新网银行简介,0.8654660006456044
409,征信报告是什么样的,0.8653483940666823
410,新网账户之间能否互相转账,0.8651459260971767
411,新网银行地址在哪里,0.8648645625369863
412,抵押类贷款如何办理,0.864426385543318
413,贷款证明如何开据,0.8637990745205183
414,车贷合同里的金额是否包含利息,0.863699429087782
415,借款失败怎么办,0.8630862269622643
416,车贷收取哪些费用,0.8628650648586978
417,如何更换微信号,0.8627498977220638
418,提前还款手续费是多少,0.8627304335598569
419,车贷还款只扣除部分是什么原因,0.862465235052561
420,提前还款有次数限制吗,0.8623943108316813
421,如何查询申请相关的协议书,0.8620269738440394
422,如何查看手机号是否实名制,0.8620085014330866
423,节假日可以借/还款吗,0.8618457229815444
424,申请好人贷使用的邮箱是公司邮箱还是个人邮箱,0.8615575074666791
425,存管密码被锁定怎么办,0.8613617346895918
426,什么是我的额度和可借额度,0.8613217394041074
427,车贷逾期如何还款,0.8609887625270821
428,公众号页面的“我的排号”是什么意思,0.860923333440414
429,如何解绑银行卡,0.8608535411671043
430,支持绑定的银行卡类型有哪些,0.8607359731332216
431,随心存如何登录,0.8604172519194436
