432,扣款结果会有短信提示吗,0.8603142968643142
433,如何确保还款日当天会扣款成功,0.859278787135511
434,五年定期存款的利率是多少,0.8591986129792232
435,各还款方式如何进行还款,0.8586852611926672
436,车辆信息如何查询,0.8584156214309553
437,存管提现到账时间是多久,0.8583000708523203
438,开据证明时为何需要实名认证,0.8581601620514726
439,为何结清证明显示日期与平台不符,0.857546691388029
440,实际申请金额与放款金额不一致可否取消车贷,0.857404136323812
441,选择任何还款方式都可以提前还款吗,0.857054318365067
442,自动扣款时间段是多久,0.8566186185367533
443,如何绑定银行卡,0.8563197758503626
444,如何开立存管账户,0.8561210925063056
445,目前支持的银行有哪些,0.8560646410134487
446,提额会有通知吗,0.8560442426169285
447,存管账户充值限额,0.8558736421837837
448,转账到新网银行账户是否还款成功,0.8556434267735737
449,为何存管信息与平台显示不一致,0.8552781085604434
450,公众号如何注册,0.8552156428642048
451,结清贷款后什么时候可以开据结清证明,0.8552138137386875
452,随心存到期后何时到账,0.8550513752687059
453,可否对公还款,0.8548245432488123
454,如何录制活体检测,0.8546743347117957
455,存款页面是否会显示每日收益,0.8543318774897811
456,如何查看贷款合同,0.8542624638916505
457,注销注册用户后是否可恢复？,0.8541130443987299
458,随心存存入限额,0.8537817197797337
459,存在迁户问题怎么处理,0.8537274755627154
460,车贷利息是多少,0.8535128959541823
461,定期存款到期如何支取,0.8533590693172793
462,页面为何提示“开户失败”、“账户存在异常操作/账户异常”,0.8533497394815004
463,定期存款的利率是多少,0.8533226083800183
464,注册手机号更换成功后何时可以正常使用,0.8529434491293417
465,能否开具非恶意逾期证明,0.8527492246182847
466,注销账户的处理时间,0.8523045821277261
467,新网有哪些产品,0.8522389132406161
468,视频认证的步骤是什么,0.8521798833776145
469,客服是否是随机分配,0.8517377214872658
470,可以查询注册手机号码吗,0.8515885425874248
471,额度占用问题,0.8512849212105167
472,如何登录微信公众号,0.851180345309994
473,交易密码无法设置,0.8510887098676472
474,存管查询为何提示用户不存在或者信息有误,0.8509068360409452
475,贷款证明开据失败怎么办,0.850861470241958
476,客户发送截图以及个人信息等,0.8505471149743103
477,如何查询是否开通银联在线支付,0.8505383917153908
478,征信上报周期及更新时间,0.8501158379025621
479,手机号归属地与定位地不一致是否有影响,0.8500570634033545
480,如何查询还款日,0.8500319659238499
481,如何开据存款证明,0.8499248094728575
482,进入随心存为何提示手机号码不一致,0.8497496294923793
483,人工是否可操作扣款,0.8497087794413167
484,销户与否会产生什么影响,0.8496118617971573
485,定期存款是否有存单,0.8495226371563157
486,为何提示还款存在差错,0.849380745193304
487,为何提示支付平台支取金额超过可用余额,0.8492493143753931
488,为何之前绑定的银行卡不支持扣款了,0.8490910826505956
489,修改手机号码/微信号是否会影响自动扣款,0.8490156550181317
490,还款记录如何查看,0.8488251115817308
491,还款后为何未更新还款状态,0.8487631053816209
492,存管查询的余额如何提现,0.8485200399956226
493,额度冻结怎么办,0.8483989514988567
494,如何注销公众号,0.8483037013751199
495,如何查看银行卡管理列表,0.8482191840109917
496,为何提示还款卡不存在,0.847504457441565
497,为何同时收到了还款成功和失败的短信,0.8474999508544738
498,季得利是什么,0.8469873129845341
499,贷款证明的电子章是否具有法律效应,0.8466442610678535
500,房产保证金是什么,0.8462622981025305
501,为何提示支付平台账户余额不足,0.8460600893142062
502,购买存款页面为何提示“额度不足，无法购买”,0.8456264623036513
503,在线客服是否是人工客服,0.8452005800024776
504,审核电话可更改接听电话吗,0.8450176499861372
505,为何提示用户未实名认证,0.844883321876198
506,可以查询个人信息资料吗？,0.8448461189996903
507,如何获取线上核身链接,0.8445862633645822
508,额度冻结是什么意思？,0.8445094057970529
509,如何退出微信公众号,0.8444007456533706
510,客户催促需要加急办理,0.8443926904754404
511,电话客服是否可以受理结清证明,0.8443321937214092
512,新网银行人工客服服务时间,0.8440488423143313
513,还款后页面显示等待中,0.843871006836849
514,还款日当天是否自动扣款,0.8438565832485513
515,自动扣款如何操作,0.8429246221197749
516,随心存产品停售原因,0.842307070391372
517,申请好人贷需要公积金、社保吗？,0.8420703032833038
518,白骑士认证失败是什么意思,0.8420188928209524
519,为何人脸识别提示光线太足,0.8420153587513304
520,为何存管查询提示没有密码,0.8419673463229659
521,视频认证录制失败的原因是什么,0.8414264187085982
522,为什么提示用户不存在,0.841180123942449
523,是否会发生重复扣款情况,0.8411374743487633
524,还款日可以修改吗,0.841120083040381
525,为什么收到提额短信但额度未提升,0.8410316148323257
526,实名认证失败的原因是什么,0.8409472385093351
527,什么是分批次扣款,0.8408751273794078
528,按期还款是什么,0.8408300564835445
529,关于客户个人信息安全问题,0.8406724497501689
530,扣款失败的原因,0.8405251035318706
531,如何降低/关闭额度,0.84035463228996
532,如何签署借款合同,0.8402877899589458
533,消费凭证有效期是多久,0.8401934000180471
534,批扣时间段是多久,0.8394538739815834
535,结清证明会展示哪些信息,0.8393408104450445
536,还款日当天支持手动还款吗,0.8392567264712171
537,为何无法登录存管查询,0.8390080102421201
538,怎样才能成功申请到额度,0.8387423055290476
539,什么是单笔借据和多笔借据,0.8384831006236153
540,随心存如何计息,0.8382952190033957
541,转账时为何提示未面核,0.8376985663713366
542,季得利如何支取,0.8375944485875745
543,如何查询账户是否冻结,0.8372481851975009
544,什么是风控审核中,0.8370813533457272
545,居住信息如何填写,0.8366560161120244
546,可否取消银行卡限额,0.836491324025488
547,如何删除身份证信息,0.8362874951834973
548,实名认证为什么不符,0.8354378828974958
549,能否删除个人信息,0.8350552313120339
550,如何修改实名认证手机号码,0.8349135572082171
551,开通什么业务,0.8346592029677019
552,审核电话内容是什么,0.8346264349784989
553,月得利提前支取如何计息,0.8346159883230033
554,实名认证审核时间,0.8345290026096606
555,存款利率是多少,0.8339485615464747
556,能否让客服回电,0.8339078217716187
557,接收短信的手机号是否为注册手机号,0.8336410043779157
558,人脸识别失败怎么办,0.8332566040279831
559,自动扣款失败怎么办,0.8327856216518684
560,申请被拒怎么办,0.8327259126053864
561,身份证信息变更后如何更新,0.8325209578374754
562,修改手机号后是否需要重置登录密码,0.8323239270384098
563,绑定银行卡失败,0.8323098267959567
564,什么是一、二、三类户,0.8323088303081879
565,客服能否查看聊天记录,0.8321079865121984
566,手持身份证拍照的注意事项,0.8317729766268012
567,如何查看优惠券的使用情况,0.8317633243154642
568,令牌无效是什么,0.8312753569971795
569,查询各类工单办理进度,0.8312513405668351
570,上传身份证时需填写的内容是什么,0.8310172975893492
571,拨打我行人工客服电话是否收费,0.830480898429244
572,密码被锁定怎么办,0.8300242150165361
573,注册规则是什么,0.8299750557399507
574,在线咨询是否支持客户发送语音,0.8298457823682416
575,客户表示还款成功,0.82975268502743
576,逾期后还款金额是否会增加,0.8293754719735428
577,可否补充企业邮箱,0.8293150877089521
578,人脸识别使用的是照片还是视频,0.829182293202906
579,开户失败原因,0.8291234253014694
580,活体检测失败怎么办,0.8288056975386537
581,如何查看开户结果,0.828730068127104
582,结清证明开据时间是多久,0.8283634258403878
583,开具结清证明时为何无法登录,0.8282253887065033
584,为何无法销户,0.8261321325383891
585,客户表示需要考虑,0.8259426933542628
586,什么是注册号码？,0.8259304129028708
587,关于消费凭证,0.825882418921351
588,可否延期还款,0.8251424762455932
589,周得利计息规则,0.8244804464422689
590,是否可以取消自动扣款,0.8242532462201247
591,季得利如何计息,0.8242039927361807
592,逾期造成的影响是什么,0.823915085442126
593,可绑定银行卡数量上限,0.8237688165593391
594,结清证明的发送方式有哪些,0.8224405025820495
595,美利车联系电话,0.821917340293416
596,随心存是什么,0.8216567907265762
597,客户表示知道了,0.8214779767793405
598,开户是什么意思,0.8211231697869372
599,如何知晓已注销成功,0.8208676249380341
600,登录时的图文验证码是否区分大小写,0.8207083152372829
601,为什么拍照认证时总是不成功或显示系统崩溃,0.8206717428586163
602,如何办理对公业务,0.8201332256088413
603,结清证明印章无法查看,0.8196791990862239
604,查询结清证明申请是否已提交,0.8184261257713009
605,为什么没有扣款,0.8174463089850348
606,下一次开放时间是什么意思,0.8173991287021016
607,什么情况算违约,0.816953753666573
608,为何提示交易密码验证失败,0.8168747578863241
609,企业邮箱格式是什么,0.8142811701475101
610,合同为何无法打开,0.813616753787269
611,客户要求发送相关模板,0.8125985707473214
612,开据证明为何显示没有符合要求的订单,0.8124111228222156
613,罚息介绍,0.8107597318846619
614,可以重新注册吗,0.8106860386992992
615,结清证明是否是还款记录证明,0.8103435921247474
616,结清证明的印章是否可以用公章,0.8100000308485034
617,系统繁忙是什么原因,0.8098432284827438
618,为何提示不具备开具资格,0.808758986096477
619,什么是无卡支付及免密支付,0.808041537176333
620,手机号无法使用为什么,0.8075366774501905
621,逾期未还款如何处理,0.8072306530452935
622,获取验证码次数超限怎么办,0.8071130552898185
623,罚息能否减免,0.8063167897340792
624,可以咨询吗,0.805140378623731
625,密码如何修改,0.8046863581541356
626,页面为什么异常跳转,0.8046848433792572
627,客户表示没有问题了,0.8046119522847591
628,为什么点击拍照没有反应,0.8045329265065736
629,身份证上传失败怎么办,0.8044649113635324
630,经侦是指什么,0.8043662930498481
631,什么情况算逾期,0.8029005221237417
632,客户表示有合作意向,0.8017703075890567
633,银行转账未到账怎么办,0.8014145329772001
634,什么是当期账单,0.799849128894859
635,如何进入个人中心,0.7957702592779733
636,为何提示系统异常,0.7955828361542469
637,客户提到投诉,0.7950560032723115
638,迁户是什么意思,0.7929338604125901
639,企业邮箱为何验证不了,0.7925211520692199
640,人脸拍摄规范,0.7906062400810162
641,输入身份证号码时，为何无法输入字母,0.7900356889504895
642,退汇是什么意思,0.7893194560093898
643,登录密码为何无法重置,0.788809172074415
644,客户表示不满,0.7879429145968359
645,客户表示稍等,0.787193452326356
646,什么是还款日,0.7864966198068879
647,什么是活体检测,0.7850827675205977
648,什么是综合评估,0.7849694821964103
649,为何图文验证码输入正确却提示错误,0.7811134042595954
650,忘记密码怎么办,0.7810514683999717
651,咨询可以发送图片吗？,0.7798684563055353
652,优惠券如何使用,0.779845647951487
653,企业邮箱填写错误怎么办,0.7763586827355234
654,为何重置密码后仍提示密码错误,0.7749782526029062
655,如何获得优惠券,0.77494093453282
656,页面为何无法打开,0.7733708626235773
657,客户称赞服务好,0.7700951065030599
658,为何提示缺少必要参数,0.7691719414088578
659,企业邮箱验证码可否重新获取,0.7686823570862634
660,验证码发送至什么手机号,0.7683544930756908
661,为什么无法注册,0.7629873549354286
662,什么是登录密码,0.7608063924131078
663,客户提出建议,0.7604588795614934
664,为何提示该证件已被使用,0.7425956724155477
665,核身链接失效的原因,0.7081878811818263
666,手机获取验证码失败,0.6478202646281519
