0,怎么会无法获取地理位置？,1.0
1,为什么提示用户不存在,0.8984378251388552
2,活体检测失败怎么办,0.8946868443675741
3,页面为何无法打开,0.8940252517670505
4,手机号归属地与定位地不一致是否有影响,0.8926972347678556
5,为什么拍照认证时总是不成功或显示系统崩溃,0.8913156900221243
6,为何无法申请好人贷,0.8881021619134929
7,为什么无法注册,0.8871266431673027
8,为什么点击拍照没有反应,0.8871247656744232
9,为何无法登录存管查询,0.8868271482259775
10,为何无法销户,0.8865198878812814
11,为什么没有扣款,0.8850784700916833
12,为何提示支付平台其他错误,0.8849569721873599
13,如何更换微信号,0.8848745838153397
14,页面为什么异常跳转,0.8847593956288367
15,修改手机号码/微信号是否会影响自动扣款,0.8846136940595293
16,是否需要使用本人手机操作好人贷,0.8832751725918694
17,修改手机号码的处理时间是多久,0.8831007369969317
18,视频认证录制失败的原因是什么,0.8828505168074081
19,如何录制活体检测,0.8827984620492855
20,合同为何无法打开,0.8825826233851836
21,通过本人微信找回密码是指什么,0.8825432684276435
22,页面为何提示“开户失败”、“账户存在异常操作/账户异常”,0.8815636225163956
23,如何查看随心存购买情况,0.8813764487279291
24,人脸识别失败怎么办,0.8813413935664492
25,系统升级会影响扣款吗,0.8812731021108547
26,银行渠道维护无法操作怎么办,0.8812341804901013
27,如何查询申请相关的协议书,0.8808992906947797
28,如何更改其他平台的注册手机号码,0.8807613271414267
29,为何提示缺少必要参数,0.8806103596754332
30,为何提示还款卡不存在,0.8798797024690054
31,如何查询新网账户,0.8795090498560146
32,存管密码被锁定怎么办,0.8789768088418903
33,自动扣款失败怎么办,0.8787068287650002
34,能否删除个人信息,0.87779143947814
35,为何提示系统异常,0.8777282556282412
36,为何提示用户未实名认证,0.8771169186636041
37,是否可以取消自动扣款,0.8770995936986358
38,如何取消征信查询及使用授权书,0.8766468655137153
39,为什么收到美利车金融的短信,0.8760814659926779
40,新网二类户为何无法转入/转出,0.8756515708383229
41,交易密码无法设置,0.8747345315404181
42,如何查看手机号是否实名制,0.8745912177629964
43,进入随心存为何提示手机号码不一致,0.8743661750995877
44,客服能否查看聊天记录,0.8739568402702891
45,密码被锁定怎么办,0.8739449219788021
46,如何删除身份证信息,0.8735542846526838
47,购买存款页面为何提示“额度不足，无法购买”,0.873317154179259
48,客服是否是随机分配,0.8732608053441661
49,注销注册用户后是否可恢复？,0.8727782755841356
50,为何提示支付平台该客户无默认扣款卡，交易没有发给统一支付,0.8724001824535862
51,登录密码为何无法重置,0.8721595323658732
52,实名认证失败的原因是什么,0.8720860935684661
53,可以查询注册手机号码吗,0.871395249902399
54,车辆信息如何查询,0.8712348990622705
55,为何图文验证码输入正确却提示错误,0.8711051236821502
56,为何提示支付平台持卡人信息有误,0.8708948699383854
57,修改手机号后是否需要重置登录密码,0.8707945183001475
58,如何查看委托支付协议,0.8705009729740327
59,如何获取线上核身链接,0.8703466887592667
60,手机号无法使用为什么,0.870176683051278
61,获取验证码次数超限怎么办,0.8699980398365623
62,如何增加银行卡,0.8698295869199887
63,如何修改新网随心存注册号码,0.8695216260994573
64,能否让客服回电,0.8694634243469785
65,为何提示支付平台账户状态异常,0.8694219165838313
66,如何查询是否已申请好人贷,0.8691276799280521
67,为何提示还款存在差错,0.8691106791173883
68,怎样用其他手机登录好人贷,0.8690796857477836
69,好人贷为什么提示“账户存在异常操作”,0.8686349023555223
70,存管查询为何提示用户不存在或者信息有误,0.8686282288604238
71,绑卡时页面上的银行卡预留手机号码可以修改吗,0.8686131879567742
72,微信号更换成功后何时可以正常使用,0.8685058019525654
73,实名认证为什么不符,0.868490156265518
74,车贷合同为何无法查看,0.8681166125621843
75,提前支取时为何显示存入,0.8681036256450188
76,如何激活新网二类户,0.8679503452318444
77,白骑士认证失败是什么意思,0.8677880206255727
78,京东存款为什么显示当日额度为什么已售罄？,0.8677287871091115
79,如何知晓已注销成功,0.8676025804838476
80,如何修改征信上的个人信息,0.8675277157155376
81,为何提示支付平台签约关系不存在,0.8674692772208069
82,为何同时收到了还款成功和失败的短信,0.8673425505238056
83,合作平台如何取消贷款,0.8671557194995859
84,好人贷为什么无法登录,0.8671536343426991
85,为何无法提交好人贷申请资料,0.8667926142762056
86,存款产品如何重置交易密码,0.866737512646927
87,如何设置存管支付密码,0.8667076065784433
88,为何收到新网银行还款短信,0.8666934793051355
89,为什么收到提额短信但额度未提升,0.8664332376047841
90,存在迁户问题怎么处理,0.8662090267585829
91,为何人脸识别提示光线太足,0.8659926042142453
92,为何之前绑定的银行卡不支持扣款了,0.8656107263001943
93,如何修改存管账户预留手机号码,0.8656075829427464
94,可以查询个人信息资料吗？,0.8655235411891467
95,为何页面出现多个新网银行账户,0.8648497636524581
96,存款产品如何修改手机号,0.8643739537956082
97,如何解约快捷支付？,0.8640276586508276
98,如何办理好人卡？,0.8638003879907707
99,如何查询转账到新网银行的记录,0.8631161102972178
100,为何提示交易密码验证失败,0.8629058976980808
101,申请被拒怎么办,0.862895895944414
102,如何邀请好友申请好人贷,0.8628913435079346
103,为何提示支付平台当日交易次数超限,0.8628430044078697
104,如何查看开户结果,0.8628205229574215
105,还款后为何未更新还款状态,0.8627537183668622
106,为何好人贷还款时提示“交易处理中”,0.8626613496374055
107,好人卡绑定云闪付/微信等失败怎么办,0.8625070557917025
108,扣款结果会有短信提示吗,0.8624010803055714
109,下一次开放时间是什么意思,0.862367914281798
110,京东存款如何修改注册手机号码,0.8620694030685435
111,更换银行卡会影响自动扣款吗,0.8620236883768007
112,优信客服电话是多少,0.8618623430581758
113,如何查看优惠券的使用情况,0.8610892224607736
114,为何结清证明显示日期与平台不符,0.8610533877246236
115,如何换绑银行卡,0.8609957498124805
116,审核电话可更改接听电话吗,0.8609805255527293
117,可以重新注册吗,0.8609577694304418
118,为什么取消了提前部分还款,0.8608551132520817
119,如何查询好人贷申请的授信结果,0.8608341483389794
120,开据证明时为何提示账户存在异常,0.8608111221572039
121,什么是银行卡预留手机号？,0.8606044886718641
122,为何提示支付平台暂不支持的银行或限额,0.8603673783426514
123,更改银行卡预留手机号的方法,0.8603150256649796
124,忘记密码怎么办,0.8602688605817734
125,如何注销新网二类户,0.8601263539057691
126,居住信息如何填写,0.8601243722585699
127,为何重置密码后仍提示密码错误,0.8600638947560894
128,如何修改实名认证手机号码,0.8600510729569546
129,好人贷交易密码如何设置,0.859949909781415
130,为何提示支付平台不允许持卡人进行的交易,0.8598077185402724
131,新网银行账户的交易记录如何查看,0.8596862967591101
132,如何查询征信报告,0.8596094540678371
133,为何销户后还能看到好人贷信息,0.8594847788246893
134,是否会发生重复扣款情况,0.8594436412398087
135,在线咨询是否支持客户发送语音,0.8591798649806431
136,为什么提前还款显示联合贷批次执行中？,0.8589490375010509
137,为何征信上的放款日期与实际借款日期不一致,0.8589417475612164
138,视频认证的步骤是什么,0.858864282375092
139,如何查询账户是否冻结,0.8588021183170714
140,随心存如何修改交易密码,0.8587984765120884
141,为何征信上有新网银行的贷款审批记录,0.858794287481358
142,在线客服是否是人工客服,0.8587555635341201
143,什么是注册号码？,0.8584158809880069
144,可否按照征信订单号开据证明,0.8583235768492853
145,优信扣款成功后为何显示待还款,0.8580533216387461
146,如何注销新网注册用户,0.8579452601806985
147,新网银行视频认证的QQ号码是多少,0.8579404346825054
148,如何查看银行卡管理列表,0.857778036431166
149,如何查询其他平台扣款银行卡,0.8577015217546948
150,注册手机号及微信号需要实名制吗,0.8576045340049225
151,注册手机号更换成功后何时可以正常使用,0.8575448761405946
152,新网银行发送的短信验证码的有效时长？,0.8574959290424405
153,为何申请好人贷页面显示暂无资格,0.8574277023979068
154,好人贷手动还款时为何提示批次执行中,0.857279512138412
155,如何确保还款日当天会扣款成功,0.8570384852992408
156,为何申请好人贷后显示未获取额度,0.8570163731492384
157,为何征信上有新网上报的贷款记录,0.856875737845556
158,好人贷为什么无法借款,0.8567893782109065
159,销户后为何还能解绑银行卡,0.8565614917487137
160,随心存如何登录,0.8564561394981307
161,银行渠道维护是指什么,0.8560721077308561
162,开具结清证明时为何无法登录,0.8560419407204439
163,客户发送截图以及个人信息等,0.8559082776258808
164,客服能否看到客户申请好人贷的信息,0.8555628890326803
165,车贷如何修改注册手机号码,0.8553762416004685
166,令牌无效是什么,0.854969353364243
167,系统繁忙是什么原因,0.8549496795440663
168,如何降低/关闭额度,0.8549001570032815
169,收款卡发卡行拒绝放款失败什么意思？,0.8548892108401539
170,自动扣款时间段是多久,0.8548488968789614
171,美团客服热线是多少,0.8547943824127184
172,为何存管查询提示没有密码,0.8545937334491938
173,身份证上传失败怎么办,0.8545724276431935
174,自动扣款如何操作,0.8543897933959177
175,为何还款后额度恢复减少了,0.8543338239002054
176,银行渠道维护时间一般是多久,0.8540674880418688
177,银行卡挂失会影响自动扣款吗,0.853978589706417
178,获取额度后多久可发起借款,0.8535777642755922
179,为何提示不具备开具资格,0.8526706733574174
180,如何解绑银行卡,0.852541500979694
181,转账时为何提示未面核,0.8524065081774463
182,为何提示支付平台渠道不支持的银行,0.8522747499087531
183,联系新网银行客服有哪几种方式,0.8522707224972134
184,开据证明为何显示没有符合要求的订单,0.8522426946031659
185,如何退出微信公众号,0.8520470303102726
186,好人贷审核时是否给填写的联系人去电,0.8520468312416767
187,公众号是否有还款提示,0.8518567724467352
188,怎样才能成功申请到额度,0.8517579051772554
189,新网银行公众号如何取消关注,0.8517356194489222
190,电话客服是否可以受理结清证明,0.8517231637491859
191,新网账户之间能否互相转账,0.8516219479337133
192,输入身份证号码时，为何无法输入字母,0.8516040390778512
193,新网银行账户可以在哪些地方使用,0.8512736756380641
194,公众号页面的“我的排号”是什么意思,0.8510711482979372
195,为何提示支付平台交易金额超限,0.8510290445585402
196,平台还款信息为何与新网银行不一致,0.8509737007470725
197,如何进入个人中心,0.8509511603617598
198,扣款失败的原因,0.8508960622494576
199,结清贷款后征信上是否会显示结清,0.8508900984674667
200,客户表示没有问题了,0.8508336576479415
201,如何更换好人贷默认还款账户,0.8506657437588832
202,为何提示支付平台发卡行拒绝,0.8506130670590492
203,好人贷为何无法还款,0.8501832668423516
204,新网银行如何联系客户,0.8500848887305054
205,查询车贷的注册手机号码是什么,0.8500622443481138
206,如何登录微信公众号,0.8498029371058995
207,人工是否可操作扣款,0.8497796144212354
208,自助提额什么时候上线,0.8497174479132475
209,如何查询还款日,0.8491491475705354
210,登录时的图文验证码是否区分大小写,0.8490207696347598
211,为何提示支付平台受发卡行资金用途限制拒绝交易,0.8489728534357778
212,新网银行人工客服电话是多少,0.8488290716626374
213,存款页面是否会显示每日收益,0.8488041083483981
214,密码如何修改,0.8487709314402194
215,如何注销公众号,0.8486212442507731
216,新网二类户可以升级为一类户吗？,0.8482731565892899
217,如何把注册用户与结算用户都注销,0.8482626905124596
218,新网银行能否绑定云闪付,0.8476377022266761
219,接收短信的手机号是否为注册手机号,0.8475510924629955
220,新网银行人工客服电话打不通,0.8475029777784342
221,提额会有通知吗,0.8473232715055342
222,新网银行的官网地址是什么,0.8470667831332923
223,申请好人贷后有没有回复,0.8465118836765645
224,为何征信上有新网银行上报的逾期,0.8464588998201635
225,身份证信息变更后如何更新,0.8464068722118239
226,平台方手机号变更导致我行无法直接开据结清证明问题,0.8463807320164307
227,公众号如何注册,0.8463244129430277
228,好人贷如何查看所支持的还款方式,0.8462996584394493
229,为何收到新网银行逾期提醒短信,0.8459958161963591
230,好人贷申请能否撤销,0.8455194159323653
231,注销账户的处理时间,0.8454911935162069
232,借款到账后页面未更新借款状态,0.8454828356016038
233,为什么好人贷第一期还款金额与之后不一致,0.8446992963088737
234,如何查询合作平台贷款是否结清,0.8446880272970687
235,我行对客邮箱是多少,0.8444934833696223
236,为什么银行还款存在限额？,0.8444624216988371
237,58车金融客服电话是多少,0.84429086827088
238,如何进入好人贷页面,0.8441897931103869
239,还款后页面显示等待中,0.8440412676758945
240,实名认证是否查询征信,0.8439263102762116
241,贷款结清之后能否删除贷款记录,0.8438547116392752
242,为何提示支付平台账户余额不足,0.8436788874305686
243,随心存如何查看收益情况,0.8435098732964423
244,如何冻结新网银行账户,0.8435022773923962
245,如何通过线下方式转入新网二类户,0.8433211090618487
246,绑定银行卡产生费用吗,0.8433176323154159
247,客户表示知道了,0.8429927150781753
248,无法提供消费凭证可以取消贷款吗,0.8429536976393419
249,线上开据证明为何和征信金额不符,0.8429402045090654
250,线下转账如何填写新网银行开户信息,0.8427439403413866
251,线上开据证明有次数限制吗,0.8426771449650614
252,查询结清证明申请是否已提交,0.8426695911453375
253,如何绑定银行卡,0.8426522964996076
254,平台方提供的客户审批资料能否提供给客户,0.8425412201765706
255,借款成功会有短信等提醒吗,0.8423656313009305
256,可否补充企业邮箱,0.842356059616897
257,好人贷借款后能否修改贷款信息,0.8421754629162204
258,新网银行扣款通道是什么,0.8420470289950996
259,新网二类户转入/转出有时间限制吗,0.841905132611829
260,再次申请好人贷会查询征信吗,0.841749292376215
261,申请好人贷后为何页面显示仍可提交申请,0.8416893458521575
262,如何查看好人贷还款计划,0.8413495898234228
263,好人贷账户如何更换手机号码,0.8413344137828883
264,黑户/白户是否可以申请好人贷,0.8412076888126062
265,为何提示支付平台银行卡未开通银联无卡认证支付,0.8411333223413692
266,补扣会影响信用吗,0.8406642113719761
267,销户与否会产生什么影响,0.8403546453365465
268,随心存可以在我行公众号查询/操作吗,0.840280270847074
269,好人贷被拒后为何没有下次开放时间,0.8402519967207209
270,好人贷授信首页显示利率是否为固定利率,0.8402172124095033
271,新网银行以何名义查询征信,0.8399611014029476
272,好人贷定位如何开启,0.8399412095899422
273,好人贷个人资料如何修改,0.8399091232937609
274,还款记录如何查看,0.8395877247103547
275,拨打我行人工客服电话是否收费,0.8393781753251723
276,销户后是否上征信,0.8392962435916462
277,好人贷注册手机号与银行卡预留手机号是否需要一致？,0.8392892421207032
278,车贷能否绑定他人银行卡,0.8389786138192148
279,借款时选错收款账户怎么办？,0.838968529711441
280,转入新网银行使用的密码是交易密码还是银行卡密码,0.8386175156817199
281,如何获得优惠券,0.8385567782464666
282,合作平台如何还款,0.8382885963504767
283,新网银行二类户与好人贷是否为同一个手机号码,0.8381853864147842
284,新网银行有招聘吗,0.838023672764569
285,我们是四川新网银行吗,0.8377222626029981
286,哪些渠道可以购买京东存款产品？,0.8372042523178114
287,借款失败怎么办,0.8371316929676472
288,好人贷申请是否支持人工受理,0.8371247603982046
289,为何存管信息与平台显示不一致,0.8370485747940096
290,新网银行存款产品为何暂停交易,0.836643418344368
291,身份证更换期间会影响好人贷贷款吗,0.8365810909348173
292,如何查看好人贷相关协议/合同？,0.8365650410289686
293,开据证明时为何需要实名认证,0.8365422042860786
294,名下所有卡被冻结后如何还款,0.8364114864680418
295,线上转入新网银行账户到账时间是多久,0.836065454916497
296,转账到新网银行如何操作,0.8358043361374647
297,借款后如何判定下次还款日期,0.8356002676168711
298,存款产品支取通用路径,0.8355075727774152
299,企业邮箱为何验证不了,0.8353654545840125
300,车贷如何解绑银行卡,0.8349811640363701
301,随心存停售后有影响吗,0.8349315580534317
302,"好人贷有回访电话吗""",0.834684263575032
303,查询各类工单办理进度,0.8346461339947007
304,关闭其他平台额度后，能否恢复好人贷额度,0.8346382494906812
305,如何查询车贷还款日,0.8346156663242333
306,新网银行以什么名义放款,0.8346148574779265
307,新网银行账户可以设置为好人贷借/还款账户吗,0.834600432940311
308,银行卡是二类户影响扣款吗,0.83444543708656
309,好人贷申请是否查询芝麻信用,0.8344150093157112
310,在哪个平台操作提现,0.8341048788976543
311,客户咨询其他平台催收问题,0.8340531485841903
312,上传身份证时需填写的内容是什么,0.8340281276930775
313,好人贷扣款账户如何查看,0.8339004700842217
314,申请好人贷后，可否更改授信结果,0.8337326604053203
315,新网二类户转入/转出收取手续费吗,0.8336628560398271
316,操作好人贷是否需要开启定位,0.8331255489419397
317,销户后可以再开户吗,0.8330034588862845
318,如何查看贷款合同,0.8329943302316085
319,征信报告是什么样的,0.8329521917116247
320,好人贷账户是否为新网银行二类户？,0.8329206574161337
321,新网银行账户是什么,0.8327879634846096
322,好人贷额度是否会发生变化,0.8326566978374099
323,新网银行二类户如何转入/转出,0.8321189570172471
324,审核电话内容是什么,0.8320576953857453
325,好人贷账户如何注销,0.8320126479661161
326,我行放款的其他平台借款会上报征信吗,0.8319384723811031
327,结清证明印章无法查看,0.831920482359151
328,客户表示需要考虑,0.8318612199233282
329,借款合同是否有展示提前还款会收取违约金的情况,0.8318588632214704
330,能否人工开据贷款证明,0.8316797057455776
331,申请好人贷必须填写联系人信息吗,0.831563879238325
332,批扣时间段是多久,0.8311535614864933
333,好人贷申请身份证可否添加水印,0.8310353548707264
334,微信/支付宝等可否与新网银行账户互相绑定,0.830970574735082
335,为何提示支付平台支取金额超过可用余额,0.8308701095813865
336,车贷平台如何查询,0.8308630695592575
337,可以通过他人银行卡转入到新网银行账户吗,0.8305411467374096
338,注册规则是什么,0.8303207168501896
339,客户催促需要加急办理,0.8302901113576951
340,贷款证明开据失败怎么办,0.8301585681277981
341,好人贷有回访电话吗,0.8298897343285208
342,如何更换借款收款银行卡,0.8297746373079714
343,随心存操作渠道有哪些,0.8296809516432929
344,新网有哪些产品,0.8293560269001161
345,还款日当天是否自动扣款,0.8293430532423263
346,关于客户个人信息安全问题,0.82923906016187
347,线上是否可开据征信版结清证明,0.8291651702036241
348,好人贷如何主动还款,0.8291160415847656
349,银行卡开通银联在线支付后是否可正常还款,0.8288980388312042
350,新网账户绑定微信/支付宝后支持提现或充值吗,0.8288565123015551
351,绑定银行卡失败,0.8287904025576013
352,未正常还款我行会进行催收吗,0.8287063079979757
353,好人贷申请是否可以使用临时身份证,0.8285995375834837
354,如何查询是否开通银联在线支付,0.828505623098873
355,好人贷借款记录如何查询,0.8284639081526844
356,新网银行地址在哪里,0.8284217687717568
357,好人贷账户如何挂失,0.8279779447664092
358,可否取消银行卡限额,0.8279742767990005
359,额度冻结怎么办,0.8278994800750855
360,滴水贷客服电话是多少,0.8278405554305042
361,如何查询存管账户流水,0.8277508591796389
362,随心存支持提前支取吗,0.8276632525043167
363,如何在新网银行开户,0.8276427968441908
364,新网银行存款是否受保障,0.8269183291446295
365,个人可以在新网开立几个账户,0.826831877439751
366,新网二类户上的资金是否计息,0.8267411291238088
367,他行渠道汇入新网账户的到账时间是多久,0.8265987303627018
368,有额度不使用有什么影响吗,0.8264283177294565
369,客户要求发送相关模板,0.8264125244833991
370,好人贷借款时还会审核吗,0.8260719022826902
371,企业邮箱填写错误怎么办,0.8258902533053604
372,新网银行是否上市,0.8258303530282503
373,好人贷还款记录如何查询,0.8258009562620973
374,好人贷账户如何查询,0.8255963565732362
375,好人贷借款如何上报征信,0.8255000664721875
376,其他贷款怎么办理,0.8252167796777928
377,提前支取有限制吗,0.825029750857706
378,新网银行三类户是什么,0.8248739355791221
379,好人贷能否绑定他人银行卡,0.8247474587099208
380,好人贷还款后额度何时恢复,0.8245769361396733
381,新网银行有哪些活动,0.8244711625668687
382,电脑端可以登录好人贷吗,0.8244698518475916
383,征信上显示的贷款金额是否包含利息,0.8243965091155707
384,好人贷是否有临时额度,0.8243139164536342
385,如何查询好人贷借据收款银行卡,0.8240029913174393
386,非绑定银行卡可否与新网二类户转账,0.8239766116037202
387,为何按期还款只能选择部分贷款期限,0.8237593469846785
388,新网银行自动扣款时间,0.8235988248534845
389,还款金额超银行卡限额怎么办,0.8232332641761098
390,申请好人贷有区域或者号段等限制吗,0.8230443659586809
391,存管账户如何注销,0.8228831358388717
392,可以让别人代还款吗？,0.8228780625844201
393,新网诺诺发票贷如何申请,0.8228689832943556
394,随心存T+1是什么,0.8225835156957714
395,好人贷-云闪付如何更换收/还款银行卡,0.8225820869483443
396,企业邮箱格式是什么,0.8225651209086263
397,手持身份证拍照的注意事项,0.8223733437556049
398,好人贷支持在国外发起借款吗,0.8223586501215105
399,提前结清贷款后还会扣款吗,0.8221281745395482
400,随心存产品停售原因,0.8221230238829191
401,使用优惠券后提前还款利息如何计算,0.8220604189712231
402,车贷还款记录如何查询,0.8218806231833566
403,好人贷以什么贷款类型上报人行征信？,0.8217210307376769
404,为何申请好人贷无结果,0.8216318747298235
405,挖财还款是否为新网银行代扣,0.821522426529055
406,能否开具非恶意逾期证明,0.8214831864526722
407,申请好人贷没有公司邮箱怎么办,0.8213659618119158
408,新网银行行号是多少,0.821190664751818
409,企业邮箱验证码可否重新获取,0.8211666887653277
410,开通什么业务,0.8210542739831463
411,好人贷提额会查询征信吗,0.8208975158864195
412,转账到新网银行账户是否还款成功,0.8206810544729859
413,实名认证审核时间,0.8206487011846043
414,未接到好人贷回访电话会被拒吗,0.8204485218431519
415,消费凭证有效期是多久,0.8204352836015913
416,结清证明会展示哪些信息,0.8203692869999718
417,好人贷注册手机号无法使用,0.8198591021816508
418,好人贷-云闪付是什么,0.8198165579945007
419,提前还款会影响个人征信吗,0.8197881360149354
420,车贷如何办理解押手续,0.819701669385174
421,实际申请金额与放款金额不一致可否取消车贷,0.8196652118661623
422,周得利提前支取如何计息,0.819490435473812
423,开户失败原因,0.8194498331118534
424,存款产品是否存满五年才能支取,0.8193730562302607
425,贷款证明的电子章是否具有法律效应,0.8192964084590044
426,如何查询当期车贷还款金额,0.8192817183830573
427,征信上报周期及更新时间,0.819214246954713
428,什么是我的额度和可借额度,0.8189976989815834
429,好人贷电话回访时间,0.8189387189157018
430,好人贷-云闪付如何提前还款,0.8188964551302406
