431,京东存款是否支持提前支取/提前部分支取？,0.8188169355889291
432,车贷还款只扣除部分是什么原因,0.8187846136133758
433,任性还款是什么,0.8187813739766031
434,新网银行好事贷如何申请,0.8187763707462484
435,还款日可以修改吗,0.8186584583808902
436,好人贷能否人工操作提额,0.8180770520671631
437,什么是一、二、三类户,0.8176698869637931
438,存款需要先开立银行账户吗,0.817600697589602
439,申请好人贷是否都有额度,0.8175371631227276
440,好人贷额度为什么变低了,0.8173046804953255
441,好人贷是否支持归还逾期部分账单,0.8173004697378191
442,车贷可以修改还款日吗,0.8169761966307426
443,新网银行二类户限额是多少,0.8168499923059926
444,咨询可以发送图片吗？,0.8168033762262377
445,新网银行开户支持的证件有哪些,0.8166936566214128
446,银联在线支付是什么,0.8163760920986368
447,好人贷自动扣款规则,0.816080574067526
448,可以咨询吗,0.8154475181071965
449,如何购买新网银行存款产品,0.8154446559875596
450,半年得利提前支取影响已发放利息吗,0.8153807333256495
451,有多少人获得好人贷额度,0.8153495167348966
452,如何办理对公业务,0.8153467280813196
453,为何提示该证件已被使用,0.8152601241057248
454,选择任性还款/按期还款利息如何计算,0.8151826266363483
455,什么是分批次扣款,0.815175168339906
456,车贷合同如何查看,0.8150930137962535
457,车贷如何更换还款银行卡,0.8144631774789799
458,支持绑定的银行卡类型有哪些,0.8143058604657665
459,节假日可以操作各类存款吗,0.8139680347548053
460,好人贷只能使用微信登录吗？,0.8139165068630423
461,车贷如何申请,0.8137052094574692
462,好人贷如何审核,0.8136833353739783
463,可否对公还款,0.8135422885001914
464,好人贷申请需要填写哪些个人信息,0.813453613321537
465,季得利是什么,0.8130687271949116
466,随心存利率为何会发生变化,0.8128606394127037
467,好人贷额度他人能否使用,0.8126618104924902
468,季得利提前支取影响已发放利息吗,0.8125719007573022
469,什么是登录密码,0.8125311385557652
470,客户表示不满,0.8124189285133461
471,车贷合同里的金额是否包含利息,0.8124108506178842
472,人脸识别使用的是照片还是视频,0.8122825085941362
473,新网银行合作平台有哪些,0.8122810407478783
474,存管账户如何查询,0.812218983569068
475,好人贷审核电话是多少,0.8121473652830864
476,各还款方式如何进行还款,0.812135131980514
477,好人贷借款超时未到账如何处理,0.8118337121003298
478,好人贷如何提高额度,0.8117032766919887
479,申请好人贷工作信息如何填写,0.8116794026098134
480,好人贷借款金额与到账金额是否一致,0.8115462475296925
481,季得利的操作渠道有哪些,0.8112345038642598
482,好人贷借款合同有效期是多久,0.8112280966378553
483,好人贷的办理时间,0.8111279177657985
484,好人贷如何试算利息,0.810735912231165
485,车贷如何提前还款,0.8106113374226964
486,如何操作随心存大额存款,0.8102574547270769
487,好人贷审核不通过对个人有什么影响,0.8101461812698565
488,新网银行自动扣款次数,0.8100171954871819
489,好人贷可以重新申请吗,0.8098074276045356
490,好人贷支持随时借款吗,0.809792023244605
491,当期账单支持再分期吗,0.809566222146232
492,贷款证明如何开据,0.8093580472700315
493,银行转账未到账怎么办,0.80931152272775
494,额度冻结是什么意思？,0.8092575475550668
495,可否延期还款,0.8092185529584588
496,逾期造成的影响是什么,0.809154221567856
497,客户提到投诉,0.8091059871083592
498,好人贷申请成功会有短信通知吗,0.8090167097524905
499,新网银行有几个网点,0.809010081918488
500,好人贷放款至什么账户,0.8088992033253527
501,车贷支持手动还款吗,0.8085046152129131
502,好人贷不借款会产生利息或费用吗,0.8084996862105773
503,客户表示还款成功,0.8083637359495746
504,关于消费凭证,0.8080375421794065
505,好人贷如何提前还款,0.807948309127549
506,好人贷是否支持提前还款,0.8078494510537547
507,新办的手机号可以申请好人贷吗,0.8077867021155196
508,客户表示有合作意向,0.8077591378519849
509,额度占用问题,0.8075752347417022
510,提前还款有次数限制吗,0.8074494326732954
511,工新借如何申请,0.806381258924931
512,新网银行有企业贷款吗？,0.806050885509308
513,新网银行有哪些产品可以提额,0.8059561864725838
514,按期还款和任性还款的区别是什么,0.8056628901896146
515,如何关注新网银行公众号,0.8056514865370247
516,银联在线支付如何开通,0.8056384042527495
517,银行卡还款限额是多少,0.8056338979111644
518,好人贷额度必须一次性借完吗,0.8054320872646177
519,新网银行存款属于理财产品吗,0.8053695682353241
520,好人贷如何降低利率,0.8049695133822229
521,新网银行业务办理时间,0.8048808366915379
522,什么是单笔借据和多笔借据,0.8046658743650247
523,好事贷如何还款,0.8046629224740139
524,新网银行有实体卡片吗,0.8046130001463621
525,如何选择按期还款/任性还款,0.8045369440609766
526,好人贷如何实名认证,0.8044158413152745
527,好人贷为什么额度低,0.8043353615492055
528,车贷如何还款？,0.8041694291636877
529,什么情况算违约,0.8040670909166744
530,诺诺发票贷的利率是多少,0.8037665971478039
531,申请好人贷使用的邮箱是公司邮箱还是个人邮箱,0.8033972788525643
532,好人贷是否支持提前还当期账单,0.803366871014841
533,验证码发送至什么手机号,0.8030188116009294
534,新网银行APP下载,0.802891327116866
535,什么是活体检测,0.8023692620498571
536,结清证明开据时间是多久,0.8023433638239401
537,还款银行卡是否需要开通银联在线支付业务,0.8022124370092732
538,什么情况算逾期,0.8022108510040539
539,好人贷额度是否循环使用,0.8021400299980542
540,结清贷款后什么时候可以开据结清证明,0.802122939266874
541,车贷申请多久可以放款,0.8015136394869717
542,如何签署借款合同,0.8014321321441207
543,季得利如何支取,0.8013215580213603
544,好人贷利率为什么调高了,0.8012943532907989
545,罚息能否减免,0.8011953792001125
546,新网银行简介,0.8009877531594498
547,京东存款的计息规则及计息公式,0.8009709130918515
548,好人贷需要面签吗,0.8008164080117289
549,新网银行的活期利率是多少,0.800582371651911
550,客户表示稍等,0.8004037346709811
551,节假日可以借/还款吗,0.800189950960936
552,逾期后还款金额是否会增加,0.8001340737044363
553,随心存存入限额,0.7999331812847418
554,好人贷贷款利息如何计算,0.7995915489844458
555,选择任何还款方式都可以提前还款吗,0.7992609934488616
556,随心存提前支取到账时间,0.7992378203017753
557,好人贷申请必须使用身份证原件吗,0.7991928431934672
558,好人贷有额度后如何进行贷款,0.7990670930028512
559,存管查询的余额如何提现,0.7987768297822414
560,随心存如何计息,0.7987665083171833
561,季得利如何计息,0.7985797988885137
562,申请诺诺发票贷需要什么条件,0.7982712037729155
563,结清证明的发送方式有哪些,0.7980706081517654
564,好人贷如何自助提额,0.798014817257092
565,如何开据存款证明,0.7979789248950809
566,房产保证金是什么,0.7978250497354465
567,申请好人贷需要开个人账户吗？,0.7977942617865805
568,工新借是什么,0.7976659031009224
569,好人贷贷款期限是多久,0.7971450411371512
570,好人贷只能通过绑定的银行卡还款吗,0.7968256395513262
571,好人贷借款规则,0.7965748041745591
572,人脸拍摄规范,0.796546526585001
573,可绑定银行卡数量上限,0.7963579750705226
574,新网银行有信用卡吗,0.7961535923487227
575,还款日当天支持手动还款吗,0.7959191083926914
576,什么平台的贷款,0.7957605619876151
577,存管提现到账时间是多久,0.7953460706433928
578,好人贷部分提前还款规则,0.7948557946837274
579,美利车联系电话,0.79471005882935
580,新网银行人工客服服务时间,0.7945045741196912
581,什么是风控审核中,0.7944339410972073
582,好人贷支持扣款的银行有哪些,0.794371228197833
583,创客贷额度是多少,0.794302337684398
584,好人贷审核时间是多久,0.7942077353004551
585,目前支持的银行有哪些,0.7941141591714788
586,优惠券如何使用,0.794020386368183
587,五年定期存款支持提前支取吗,0.7938469052271524
588,好人贷如何申请,0.7926963959400875
589,征信是什么,0.7923595259298913
590,好人贷还款后多久到账,0.7922181631740084
591,迁户是什么意思,0.7920582667340222
592,定期存款是否有存单,0.7919937493624771
593,什么是综合评估,0.7918999735640311
594,月得利提前支取如何计息,0.7916718682487758
595,车贷扣款支持的银行卡有哪些,0.790956294909879
596,申请好人贷需要下载APP吗？,0.7901254130216334
597,好人贷利率为什么高,0.790021947896846
598,好事贷收取哪些费用,0.7899154759703225
599,好人贷提额周期是多久,0.789906894870154
600,好人贷与其他平台类似产品的区别是什么,0.7897557586313299
601,退汇是什么意思,0.7892025701583897
602,什么是无卡支付及免密支付,0.7891278955533622
603,好人贷支持周末借款吗？,0.7890446804956922
604,结清证明的印章是否可以用公章,0.7889435596986798
605,好人贷借款多久到账,0.7883200435584973
606,新网银行合作的存管平台有哪些,0.7875551358005775
607,好人贷如何还款,0.7875150652804365
608,新网银行存款类产品有哪些,0.7871690216083832
609,车贷逾期如何还款,0.7864356781714593
610,好人贷上征信吗,0.7861843865818475
611,好人贷申请的渠道有哪些,0.7858439348278573
612,一个身份证可以申请好人贷两次吗？,0.7856286561486877
613,好人贷当期能否最低还款,0.7845248680554027
614,随心存到期后何时到账,0.7843679674028395
615,提前还款手续费是多少,0.784333640705943
616,好人贷消费用途,0.7842042941831797
617,好人贷支持微信/支付宝扣款吗,0.7840531044490383
618,罚息介绍,0.783034059580584
619,如何开立存管账户,0.7829139346854865
620,逾期未还款如何处理,0.7826928185002321
621,好人贷通过率多少,0.7825106877781605
622,抵押类贷款如何办理,0.7823258414338808
623,客户提出建议,0.7820012614600206
624,好人贷额度是多少,0.7804299107785045
625,好人贷必须绑定银行卡使用吗,0.7803594809825984
626,什么是当期账单,0.7798575166577659
627,申请创客贷需要什么条件,0.7798113781595276
628,好人贷还款方式有哪些,0.7791968747145442
629,随心存是什么,0.7790538321878004
630,他人可以使用本人信息申请好人贷吗,0.7781773599499903
631,好人贷收取哪些费用,0.7777614682313633
632,存管是什么,0.7763035456112003
633,开户是什么意思,0.7760052285420188
634,存款产品是否保本保息,0.7754231772711639
635,车贷利息是多少,0.7746251138526843
636,定期存款操作的渠道有哪些,0.7741608672946646
637,存款产品的资金可以用于好人贷还款吗,0.7739716164505538
638,车贷收取哪些费用,0.7738440538206511
639,结清证明是否是还款记录证明,0.7736022376549113
640,客户称赞服务好,0.7735731697147873
641,好人贷额度有效期是多久,0.7730079995123567
642,五年定期存款是什么,0.7710967671858702
643,随心存利率是多少,0.7710177401146382
644,存管账户充值限额,0.769336330562115
645,申请好人贷需要哪些资料,0.7690167226237867
646,定期存款到期如何支取,0.7686198828643381
647,周得利计息规则,0.7684415855814721
648,好人贷提前还款最低还多少,0.7674244412973397
649,好人贷是邀请制吗,0.7671301838480207
650,经侦是指什么,0.7661976667557263
651,随心存存款期限有哪些,0.7647285448081872
652,什么是还款日,0.7634398995654396
653,按期还款是什么,0.7619747224849099
654,申请好人贷需要什么条件,0.7616602743811826
655,五年定期存款的利率是多少,0.7586302294276065
656,存款利率是多少,0.7574062160802719
657,好人贷月利率是多少,0.7566880918795165
658,好人贷是什么,0.7557007643074606
659,好人贷利率是多少,0.7552383195898671
660,定期存款的利率是多少,0.7550114901393522
661,身份证过期可以申请好人贷吗,0.7528992119305666
662,核身链接失效的原因,0.7468533649978198
663,好人贷支持随借随还吗,0.7338985039233286
664,好人贷年化利率是多少,0.729820831840442
665,申请好人贷需要公积金、社保吗？,0.7163198736760328
666,手机获取验证码失败,0.7085377805974836
