0,58金融公司的客服电话是多少,1.0
1,58车金融客服电话是多少,0.9845868914198741
2,新网银行人工客服电话是多少,0.9757534783257623
3,优信客服电话是多少,0.974808520754379
4,拨打我行人工客服电话是否收费,0.9611460732130345
5,美团客服热线是多少,0.9593873854203064
6,电话客服是否可以受理结清证明,0.9573988865696044
7,新网银行人工客服电话打不通,0.957018065017318
8,联系新网银行客服有哪几种方式,0.9549374479806771
9,滴水贷客服电话是多少,0.9521099759867283
10,新网银行视频认证的QQ号码是多少,0.949664807113104
11,新网银行二类户限额是多少,0.9493303347780168
12,为何提示支付平台签约关系不存在,0.9488889426215433
13,我行对客邮箱是多少,0.9487442564387979
14,在线客服是否是人工客服,0.948709518951419
15,新网银行开户支持的证件有哪些,0.9486168791929157
16,客服能否看到客户申请好人贷的信息,0.9477920023210024
17,新网银行有企业贷款吗？,0.9475263140718942
18,查询车贷的注册手机号码是什么,0.9474824921135699
19,能否让客服回电,0.9471132460333455
20,新网银行行号是多少,0.9468032813817704
21,为何征信上有新网银行的贷款审批记录,0.9460737713162517
22,注销账户的处理时间,0.945836952810869
23,平台方提供的客户审批资料能否提供给客户,0.9457061183653858
24,新网银行账户的交易记录如何查看,0.9456896890895681
25,如何修改存管账户预留手机号码,0.9454678685939574
26,为何提示支付平台暂不支持的银行或限额,0.9453848252744496
27,为什么收到美利车金融的短信,0.9452751511168216
28,新网二类户上的资金是否计息,0.945158271487037
29,新网银行合作的存管平台有哪些,0.9450749116803153
30,平台方手机号变更导致我行无法直接开据结清证明问题,0.9447162764426087
31,为何征信上有新网银行上报的逾期,0.9443736407936429
32,新网银行以何名义查询征信,0.9442009035355106
33,京东存款如何修改注册手机号码,0.9441908700976724
34,为何征信上有新网上报的贷款记录,0.9441185701969632
35,新网银行存款类产品有哪些,0.9437790876662907
36,什么是银行卡预留手机号？,0.9437371319376037
37,新网银行存款是否受保障,0.9436231219852272
38,新网银行人工客服服务时间,0.9431279839369143
39,为何页面出现多个新网银行账户,0.9430651266480095
40,新网银行有哪些产品可以提额,0.9430329566741492
41,新网银行的活期利率是多少,0.9429331395393509
42,新网银行的官网地址是什么,0.9429147676278455
43,新网银行扣款通道是什么,0.9427754123810014
44,线上开据证明为何和征信金额不符,0.9424819604676985
45,新网银行账户可以在哪些地方使用,0.9424597780536756
46,可否按照征信订单号开据证明,0.9423587075286173
47,新网银行发送的短信验证码的有效时长？,0.9423519366438577
48,如何查询存管账户流水,0.9423447225852601
49,新网银行存款属于理财产品吗,0.9422128250719656
50,申请好人贷需要开个人账户吗？,0.9420677123058225
51,新网银行账户可以设置为好人贷借/还款账户吗,0.9420233126545791
52,新网银行公众号如何取消关注,0.9419161933641578
53,客服能否查看聊天记录,0.9418282014266818
54,如何开立存管账户,0.9417879433417203
55,如何查询转账到新网银行的记录,0.9416817193759455
56,新网银行如何联系客户,0.9412732013954054
57,好人贷账户是否为新网银行二类户？,0.9412668900048153
58,绑卡时页面上的银行卡预留手机号码可以修改吗,0.9411914602183692
59,结清证明的发送方式有哪些,0.9411674873664517
60,为何提示支付平台持卡人信息有误,0.9411121654183949
61,新网银行存款产品为何暂停交易,0.9409903728136725
62,平台还款信息为何与新网银行不一致,0.9408392728877656
63,如何购买新网银行存款产品,0.9408155341475856
64,提前还款手续费是多少,0.9407320798544326
65,好人贷注册手机号与银行卡预留手机号是否需要一致？,0.9406288400809771
66,更改银行卡预留手机号的方法,0.9400324772382923
67,为何提示支付平台交易金额超限,0.9398053299817527
68,新网银行能否绑定云闪付,0.9396201574315626
69,线上是否可开据征信版结清证明,0.9395832885551723
70,银行卡是二类户影响扣款吗,0.9395372689603265
71,银行渠道维护是指什么,0.939473300600144
72,支持绑定的银行卡类型有哪些,0.939468497919512
73,如何查询合作平台贷款是否结清,0.9393730886076198
74,存管账户如何注销,0.939294898227649
75,为何提示支付平台渠道不支持的银行,0.9390122867073338
76,页面为何提示“开户失败”、“账户存在异常操作/账户异常”,0.9388464262461007
77,转账到新网银行账户是否还款成功,0.93881430847566
78,线下转账如何填写新网银行开户信息,0.9387664618641475
79,注册手机号及微信号需要实名制吗,0.9387389335132375
80,存款需要先开立银行账户吗,0.938622169446006
81,好人贷支持微信/支付宝扣款吗,0.9385642642963549
82,如何查询好人贷申请的授信结果,0.9384450166092744
83,诺诺发票贷的利率是多少,0.93844299492699
84,为何提示支付平台当日交易次数超限,0.9384207573762153
85,进入随心存为何提示手机号码不一致,0.9383407291035574
86,随心存利率是多少,0.9382278876284204
87,开据证明时为何提示账户存在异常,0.9382141220927277
88,为何提示支付平台受发卡行资金用途限制拒绝交易,0.9381687508458058
89,为何收到新网银行逾期提醒短信,0.938015078374363
90,为何销户后还能看到好人贷信息,0.9379633555571553
91,京东存款的计息规则及计息公式,0.9378143156725871
92,随心存可以在我行公众号查询/操作吗,0.9377264145231958
93,如何修改新网随心存注册号码,0.9371976885510711
94,好人贷支持扣款的银行有哪些,0.9371243846016597
95,我行放款的其他平台借款会上报征信吗,0.9371165286945196
96,新网银行有几个网点,0.9369432452771699
97,挖财还款是否为新网银行代扣,0.9369395990750673
98,新网银行合作平台有哪些,0.9369207232689855
99,车贷合同里的金额是否包含利息,0.9369198451986569
100,销户后为何还能解绑银行卡,0.936833314952547
101,好人贷支持周末借款吗？,0.9367253992153194
102,公众号是否有还款提示,0.9367090747326754
103,转入新网银行使用的密码是交易密码还是银行卡密码,0.9366752567364637
104,微信/支付宝等可否与新网银行账户互相绑定,0.9366723037376529
105,为何存管信息与平台显示不一致,0.9365855107211045
106,通过本人微信找回密码是指什么,0.936511768523176
107,为何提示支付平台账户余额不足,0.9364799650996203
108,好人卡绑定云闪付/微信等失败怎么办,0.9364403270171762
109,好人贷以什么贷款类型上报人行征信？,0.936435503268137
110,存款产品如何重置交易密码,0.9362657440614888
111,为何征信上的放款日期与实际借款日期不一致,0.9361769507570665
112,如何设置存管支付密码,0.9360353892317114
113,好人贷审核电话是多少,0.9359124482554696
114,新网银行有信用卡吗,0.9356762086535594
115,为什么银行还款存在限额？,0.9355147274776962
116,存管账户如何查询,0.9354453502833616
117,银行卡开通银联在线支付后是否可正常还款,0.9354016107523815
118,在线咨询是否支持客户发送语音,0.9353459777337251
119,为何提示支付平台该客户无默认扣款卡，交易没有发给统一支付,0.9353312940965012
120,好人贷只能通过绑定的银行卡还款吗,0.9352369413677953
121,借款时选错收款账户怎么办？,0.9352358802471689
122,五年定期存款的利率是多少,0.9350834666353338
123,线上开据证明有次数限制吗,0.9350434864544501
124,审核电话可更改接听电话吗,0.9349929745091276
125,存管查询为何提示用户不存在或者信息有误,0.9349794385724614
126,公众号页面的“我的排号”是什么意思,0.9349775523049713
127,新网银行二类户如何转入/转出,0.9349548271952469
128,新网银行账户是什么,0.9349320311319171
129,为何提示支付平台不允许持卡人进行的交易,0.9347784819939868
130,新网银行以什么名义放款,0.9346770572712239
131,如何办理对公业务,0.9346098930677869
132,为何收到新网银行还款短信,0.9345815640972632
133,如何把注册用户与结算用户都注销,0.9345042294640248
134,客户咨询其他平台催收问题,0.9344957866885226
135,车贷如何修改注册手机号码,0.9344127634533118
136,白骑士认证失败是什么意思,0.9343944239309669
137,申请好人贷后，可否更改授信结果,0.9343890840409164
138,修改手机号码/微信号是否会影响自动扣款,0.9343629456571975
139,为什么提前还款显示联合贷批次执行中？,0.9342351867964805
140,车贷可以修改还款日吗,0.934131258477552
141,为何提示还款卡不存在,0.9341124125621637
142,哪些渠道可以购买京东存款产品？,0.9340629408250108
143,好人贷支持在国外发起借款吗,0.9338721935728416
144,新网诺诺发票贷如何申请,0.9338571837295739
145,如何更改其他平台的注册手机号码,0.9337489910001576
146,非绑定银行卡可否与新网二类户转账,0.9336480587623319
147,客户催促需要加急办理,0.9335986192665879
148,如何修改征信上的个人信息,0.9335443526149861
149,月得利提前支取如何计息,0.9334780875480788
150,他行渠道汇入新网账户的到账时间是多久,0.9333702301210508
151,新办的手机号可以申请好人贷吗,0.9333477010303978
152,银行渠道维护无法操作怎么办,0.9332888013977187
153,接收短信的手机号是否为注册手机号,0.933278134339249
154,好人贷交易密码如何设置,0.9332281439699626
155,季得利的操作渠道有哪些,0.9330318740305952
156,结清贷款后什么时候可以开据结清证明,0.933008558922148
157,新网银行有招聘吗,0.9328731723374255
158,为何好人贷还款时提示“交易处理中”,0.9325497765615034
159,可否取消银行卡限额,0.9325330417838721
160,销户后是否上征信,0.9325227340125821
161,申请好人贷使用的邮箱是公司邮箱还是个人邮箱,0.9324836714311836
162,新网账户之间能否互相转账,0.932440018140613
163,新网银行自动扣款时间,0.9324124935942754
164,还款银行卡是否需要开通银联在线支付业务,0.9323216680972483
165,转账到新网银行如何操作,0.9322831769273892
166,收款卡发卡行拒绝放款失败什么意思？,0.9322467197198693
167,为何提示支付平台账户状态异常,0.9322046663909813
168,好人贷账户如何更换手机号码,0.932134060500202
169,企业邮箱为何验证不了,0.9320916899507614
170,定期存款操作的渠道有哪些,0.9319921865837318
171,当期账单支持再分期吗,0.9319735955849676
172,好人贷必须绑定银行卡使用吗,0.9319058394551605
173,好人贷借款时还会审核吗,0.9318566920568332
174,银行卡还款限额是多少,0.9318388279027054
175,新网银行业务办理时间,0.9317369840417792
176,为何提示支付平台支取金额超过可用余额,0.9316780765128964
177,存款产品的资金可以用于好人贷还款吗,0.9316524294600637
178,为何提示支付平台银行卡未开通银联无卡认证支付,0.9315369735853232
179,存款产品如何修改手机号,0.9314599502966461
180,如何查看银行卡管理列表,0.9313745891298156
181,车贷合同为何无法查看,0.9313561000745537
182,如何查看委托支付协议,0.9312794690327286
183,逾期后还款金额是否会增加,0.9311906834711875
184,周得利提前支取如何计息,0.9311616235874254
185,定期存款的利率是多少,0.9311456489379509
186,借款成功会有短信等提醒吗,0.9311261905485088
187,再次申请好人贷会查询征信吗,0.931105445256402
188,为何之前绑定的银行卡不支持扣款了,0.9310840407222887
189,如何关注新网银行公众号,0.9310829796205962
190,如何查询其他平台扣款银行卡,0.9310185691204873
191,转账时为何提示未面核,0.930974635542605
192,贷款证明开据失败怎么办,0.9309618084832935
193,可以查询注册手机号码吗,0.93086218212752
194,优信扣款成功后为何显示待还款,0.9307802800432137
195,好人贷借款金额与到账金额是否一致,0.9306720800930064
196,新网银行有实体卡片吗,0.9304668689755343
197,为何提示不具备开具资格,0.9303809068138003
198,新网银行是否上市,0.9303764249193541
199,"好人贷有回访电话吗""",0.9302622304698835
200,银行转账未到账怎么办,0.9302307931407346
201,如何查询是否开通银联在线支付,0.9301415024706372
202,绑定银行卡产生费用吗,0.9300302269041051
203,如何查看手机号是否实名制,0.9299422477373823
204,实际申请金额与放款金额不一致可否取消车贷,0.9297874844761312
205,个人可以在新网开立几个账户,0.9296770636746027
206,好人贷授信首页显示利率是否为固定利率,0.9295612447180539
207,借款到账后页面未更新借款状态,0.9294829080682987
208,好人贷是否支持提前还当期账单,0.9294208609513913
209,结清贷款后征信上是否会显示结清,0.9293340662842522
210,好人贷借款超时未到账如何处理,0.929286875785535
211,新网账户绑定微信/支付宝后支持提现或充值吗,0.9292812223376486
212,为何提示支付平台其他错误,0.9292565826882007
213,如何查询好人贷借据收款银行卡,0.9292562713850865
214,未接到好人贷回访电话会被拒吗,0.9291991094921664
215,线上转入新网银行账户到账时间是多久,0.9290881893432259
216,购买存款页面为何提示“额度不足，无法购买”,0.9290733580641739
217,可否补充企业邮箱,0.9290721575942249
218,如何查看开户结果,0.9290369475276717
219,好人贷账户如何挂失,0.9290263858674798
220,身份证更换期间会影响好人贷贷款吗,0.9289062840771746
221,为何无法提交好人贷申请资料,0.9288469225254931
222,申请好人贷必须填写联系人信息吗,0.9288409343159478
223,好人贷有回访电话吗,0.9288146370583706
224,好人贷借款记录如何查询,0.9288012644962792
225,好人贷审核时是否给填写的联系人去电,0.9287892219693403
226,如何注销新网注册用户,0.9287875404756577
227,申请诺诺发票贷需要什么条件,0.9287414841943177
228,好人贷账户如何查询,0.928689667511504
229,为何提示支付平台发卡行拒绝,0.9286740576760777
230,车贷扣款支持的银行卡有哪些,0.928570750418393
231,好人贷提额会查询征信吗,0.9285379571003645
232,企业邮箱填写错误怎么办,0.9284941315257166
233,银联在线支付如何开通,0.9284664572809999
234,新网银行有哪些活动,0.9284445474299264
235,如何修改实名认证手机号码,0.9283730924121602
236,好人贷-云闪付如何更换收/还款银行卡,0.92829686802829
237,目前支持的银行有哪些,0.9282657971244763
238,新网二类户为何无法转入/转出,0.9282422427208143
239,如何更换好人贷默认还款账户,0.9281589029295819
240,未正常还款我行会进行催收吗,0.9280962824857231
241,如何查询账户是否冻结,0.9280953913596638
242,好人贷如何查看所支持的还款方式,0.9280477460015147
243,新网二类户转入/转出收取手续费吗,0.9279139875819107
244,车贷能否绑定他人银行卡,0.9276282685758745
245,好人贷-云闪付如何提前还款,0.9276050769622277
246,随心存产品停售原因,0.9275707892425034
247,实名认证失败的原因是什么,0.9274781268346725
248,五年定期存款支持提前支取吗,0.9274537033164955
249,可以通过他人银行卡转入到新网银行账户吗,0.9273946551720493
250,京东存款是否支持提前支取/提前部分支取？,0.9273226807696049
251,新网银行自动扣款次数,0.9273084954739517
252,如何确保还款日当天会扣款成功,0.9271392277998086
253,如何查询申请相关的协议书,0.927135294954641
254,好人贷申请是否查询芝麻信用,0.9271255843588918
255,开据证明为何显示没有符合要求的订单,0.9270512788365568
256,新网银行二类户与好人贷是否为同一个手机号码,0.9269273234423768
257,更换银行卡会影响自动扣款吗,0.926925817866924
258,随心存停售后有影响吗,0.9269027957014493
259,好人贷支持随时借款吗,0.9268826354740564
260,新网银行三类户是什么,0.9268362442783765
261,存管提现到账时间是多久,0.9266438119489204
262,系统升级会影响扣款吗,0.9266036064839087
263,为何同时收到了还款成功和失败的短信,0.9265866310201742
264,如何取消征信查询及使用授权书,0.9265468754944831
265,随心存存款期限有哪些,0.9265148786787892
266,好人贷是否支持提前还款,0.9265070921913637
267,能否开具非恶意逾期证明,0.9264801355592669
268,车贷如何办理解押手续,0.9264082043309402
269,随心存如何修改交易密码,0.926349310979017
270,如何查询新网账户,0.9262639855098381
271,扣款结果会有短信提示吗,0.9261686555680916
272,新网二类户可以升级为一类户吗？,0.9260904651546955
273,新网二类户转入/转出有时间限制吗,0.9259104195632976
274,好人贷是否支持归还逾期部分账单,0.9258614921411941
275,提前还款有次数限制吗,0.9258523703331427
276,如何查询当期车贷还款金额,0.9256901532433769
277,存款页面是否会显示每日收益,0.9256572757990418
278,结清证明会展示哪些信息,0.925625943442583
279,好人贷部分提前还款规则,0.9255188697794311
280,提前结清贷款后还会扣款吗,0.9255076884569751
281,好人贷注册手机号无法使用,0.9254394202402036
282,如何在新网银行开户,0.9253460371514395
283,为什么拍照认证时总是不成功或显示系统崩溃,0.9253310803471175
284,什么是无卡支付及免密支付,0.9253221391375954
285,修改手机号后是否需要重置登录密码,0.9252723876391743
286,存管账户充值限额,0.9251927497959134
287,新网银行地址在哪里,0.9251294629656818
288,注册手机号更换成功后何时可以正常使用,0.9250978155628451
289,征信上显示的贷款金额是否包含利息,0.925013880391429
290,能否人工开据贷款证明,0.9249973479649298
291,申请好人贷没有公司邮箱怎么办,0.9248824416377531
292,居住信息如何填写,0.9246474904072233
293,好人贷账户如何注销,0.9246076685349642
294,好人贷扣款账户如何查看,0.9245665345053409
295,结清证明是否是还款记录证明,0.9245561397944456
296,如何查询征信报告,0.924545148785318
297,节假日可以操作各类存款吗,0.9244723545458932
298,开具结清证明时为何无法登录,0.9243929446992509
299,修改手机号码的处理时间是多久,0.9243690659817153
300,企业邮箱验证码可否重新获取,0.9242977830752969
301,好人贷申请成功会有短信通知吗,0.9242801784945511
302,客服是否是随机分配,0.9242235406848271
303,贷款证明的电子章是否具有法律效应,0.9241906861549509
304,是否可以取消自动扣款,0.924182201806175
305,好人贷贷款利息如何计算,0.9241480764124318
306,车贷利息是多少,0.9240026283556981
307,提前还款会影响个人征信吗,0.9238753505562076
308,好人贷为什么提示“账户存在异常操作”,0.9238503964926278
309,视频认证录制失败的原因是什么,0.923847462034662
310,半年得利提前支取影响已发放利息吗,0.92384143142122
311,结清证明的印章是否可以用公章,0.9237357624878497
312,随心存提前支取到账时间,0.9237040208533169
313,选择任何还款方式都可以提前还款吗,0.9236830230905496
314,银联在线支付是什么,0.923544759922299
315,定期存款是否有存单,0.9234096337080032
316,好人贷只能使用微信登录吗？,0.9233410601065934
317,银行卡挂失会影响自动扣款吗,0.9232946679980054
318,如何查询车贷还款日,0.9232555808444353
319,为何按期还款只能选择部分贷款期限,0.9232515609124726
320,贷款结清之后能否删除贷款记录,0.9232140561352828
321,为何提示用户未实名认证,0.9231503779647223
322,如何解约快捷支付？,0.9231367341386182
323,验证码发送至什么手机号,0.9230073985674506
324,征信上报周期及更新时间,0.9229301015610528
325,季得利提前支取影响已发放利息吗,0.9229067158225843
326,如何查看好人贷相关协议/合同？,0.9228296095870161
327,注销注册用户后是否可恢复？,0.9227731622061351
328,开据证明时为何需要实名认证,0.9227154095672293
329,交易密码无法设置,0.9227016413574273
330,京东存款为什么显示当日额度为什么已售罄？,0.9223033470094029
331,使用优惠券后提前还款利息如何计算,0.9222361029912249
332,还款金额超银行卡限额怎么办,0.9221735155258467
333,存款产品是否存满五年才能支取,0.922144130149924
334,黑户/白户是否可以申请好人贷,0.9221112679338345
335,为何提示还款存在差错,0.9220387973022228
336,什么是注册号码？,0.9220197409144382
337,好人贷借款如何上报征信,0.9219591975520799
338,借款后如何判定下次还款日期,0.9219501144876189
339,好人贷上征信吗,0.9218831521075108
340,电脑端可以登录好人贷吗,0.9218063653427224
341,为什么取消了提前部分还款,0.921791946571055
342,抵押类贷款如何办理,0.9217663251373025
343,身份证信息变更后如何更新,0.9216354150314697
344,为何存管查询提示没有密码,0.9216096777719575
345,申请好人贷需要公积金、社保吗？,0.9215303167730144
346,销户后可以再开户吗,0.9213410743200575
347,如何冻结新网银行账户,0.9213007654944775
348,可绑定银行卡数量上限,0.9211478506760649
349,什么是单笔借据和多笔借据,0.9210889770454004
350,客户提到投诉,0.9210461913216307
351,为什么好人贷第一期还款金额与之后不一致,0.9210245953437172
352,好人贷被拒后为何没有下次开放时间,0.9210111982805028
353,申请好人贷后为何页面显示仍可提交申请,0.92097848956073
354,查询各类工单办理进度,0.9209315853604946
355,核身链接失效的原因,0.9208393176152789
356,申请好人贷有区域或者号段等限制吗,0.9207645961867662
357,好人贷为什么无法借款,0.9205183363358965
358,好人贷申请需要填写哪些个人信息,0.9205094563351519
359,如何操作随心存大额存款,0.9204728800486625
360,好人贷申请的渠道有哪些,0.9203698082636407
361,随心存利率为何会发生变化,0.9203616520114188
362,好人贷借款后能否修改贷款信息,0.9203035251110313
363,好人贷手动还款时为何提示批次执行中,0.9202716508435903
364,合同为何无法打开,0.9202498605689642
365,企业邮箱格式是什么,0.9199551177763562
366,如何查看贷款合同,0.9199422042597183
367,如何更换借款收款银行卡,0.9199334869816105
368,如何查看优惠券的使用情况,0.9199297636159887
369,借款合同是否有展示提前还款会收取违约金的情况,0.9198078951896144
370,银行渠道维护时间一般是多久,0.91980599390552
371,存款产品是否保本保息,0.9196564956687971
372,好人贷年化利率是多少,0.9196547137606879
373,无法提供消费凭证可以取消贷款吗,0.9193316956055897
374,好人贷提前还款最低还多少,0.919316617499231
375,是否会发生重复扣款情况,0.9193050000491476
376,车贷合同如何查看,0.9192892126643957
377,登录时的图文验证码是否区分大小写,0.9192674930688983
378,节假日可以借/还款吗,0.9192011554065068
379,好人贷-云闪付是什么,0.9191975876949341
380,好人贷通过率多少,0.919144305201464
381,为何提示交易密码验证失败,0.9191238040923726
382,还款日当天支持手动还款吗,0.9190407814294708
383,如何查看好人贷还款计划,0.9188775767006953
384,客户发送截图以及个人信息等,0.918866717830898
385,客户表示没有问题了,0.9187838702429797
386,选择任性还款/按期还款利息如何计算,0.9186161914253111
387,新网银行好事贷如何申请,0.9185236995477362
388,我们是四川新网银行吗,0.9184016653531567
389,为什么收到提额短信但额度未提升,0.9183551556011523
390,车贷支持手动还款吗,0.9183089203797485
391,手机号无法使用为什么,0.9182903708345947
392,好人贷月利率是多少,0.9182877582904522
393,为何申请好人贷页面显示暂无资格,0.9182676873615214
394,房产保证金是什么,0.9182421269971357
395,好人贷自动扣款规则,0.91810758471545
396,为何无法登录存管查询,0.9180716478067086
397,名下所有卡被冻结后如何还款,0.9179495570964459
398,如何签署借款合同,0.9178481133129758
399,可以让别人代还款吗？,0.9178037537633325
400,随心存操作渠道有哪些,0.9177960687450859
401,存款利率是多少,0.917699462754238
402,车贷收取哪些费用,0.9174614082070714
403,微信号更换成功后何时可以正常使用,0.9173601481155902
404,关于客户个人信息安全问题,0.9173517164915449
405,周得利计息规则,0.9172653014040548
406,如何查询是否已申请好人贷,0.9170248277401145
407,好人贷不借款会产生利息或费用吗,0.9168688259553688
408,存管查询的余额如何提现,0.9168342405517786
409,输入身份证号码时，为何无法输入字母,0.9168106924722043
410,如何开据存款证明,0.9166909926974276
411,身份证过期可以申请好人贷吗,0.9166568900076155
412,什么是风控审核中,0.91659846701274
413,可以查询个人信息资料吗？,0.9163773604401341
414,审核电话内容是什么,0.9160922204843379
415,自动扣款失败怎么办,0.9159967269807866
416,视频认证的步骤是什么,0.915986330460243
417,存在迁户问题怎么处理,0.915745008335614
418,人工是否可操作扣款,0.9153918773252481
419,按期还款和任性还款的区别是什么,0.9153311041725267
