420,开通什么业务,0.9152955981557545
421,如何查看随心存购买情况,0.9151692567463118
422,随心存到期后何时到账,0.9148882267213186
423,还款日可以修改吗,0.9147758950506192
424,客户要求发送相关模板,0.9147651773001944
425,补扣会影响信用吗,0.914475109580106
426,为什么提示用户不存在,0.9144567652020501
427,如何查询还款日,0.914420000548582
428,为何申请好人贷后显示未获取额度,0.9144097634422155
429,车贷还款只扣除部分是什么原因,0.9144073931803766
430,提前支取时为何显示存入,0.9140773631242586
431,好人贷借款合同有效期是多久,0.9139442829900889
432,车贷如何更换还款银行卡,0.9139091888848181
433,申请好人贷需要下载APP吗？,0.9137541961372229
434,车贷申请多久可以放款,0.9134780231359315
435,消费凭证有效期是多久,0.9133831177376022
436,申请好人贷需要哪些资料,0.9133515507054045
437,为何重置密码后仍提示密码错误,0.9132344806188838
438,如何更换微信号,0.9131383748735167
439,如何获取线上核身链接,0.913132913203003
440,好人贷额度必须一次性借完吗,0.9129946500586824
441,存管密码被锁定怎么办,0.9129634969537688
442,好人贷还款记录如何查询,0.9127941421235563
443,实名认证是否查询征信,0.9127051778370362
444,客户表示还款成功,0.9125269380435849
445,为何图文验证码输入正确却提示错误,0.9125109510247629
446,在哪个平台操作提现,0.9124878821555927
447,好人贷电话回访时间,0.9124734531644942
448,自动扣款时间段是多久,0.9124484432934745
449,结清证明印章无法查看,0.912331894824678
450,好人贷申请是否支持人工受理,0.9122493264432422
451,为何还款后额度恢复减少了,0.9121586741038579
452,获取验证码次数超限怎么办,0.912134860376407
453,身份证上传失败怎么办,0.9120898015898481
454,上传身份证时需填写的内容是什么,0.9120801759433239
455,逾期未还款如何处理,0.9119292339003806
456,好人贷支持随借随还吗,0.9119099187748305
457,关于消费凭证,0.911752499874637
458,好人贷当期能否最低还款,0.9117285838117599
459,车贷还款记录如何查询,0.9115688673852711
460,好人贷需要面签吗,0.9115471533675172
461,为何申请好人贷无结果,0.9114950049855279
462,手机号归属地与定位地不一致是否有影响,0.9114695723841645
463,好人贷利率为什么调高了,0.9114217008924068
464,咨询可以发送图片吗？,0.9113231267802367
465,车辆信息如何查询,0.9111327244206201
466,申请创客贷需要什么条件,0.9109735011266247
467,查询结清证明申请是否已提交,0.9107588110893186
468,还款后为何未更新还款状态,0.910673666998166
469,随心存如何查看收益情况,0.9103195993845433
470,一个身份证可以申请好人贷两次吗？,0.9101171902751461
471,如何绑定银行卡,0.9098952220649816
472,客户表示需要考虑,0.9098095925158483
473,好事贷收取哪些费用,0.9097812927456795
474,好人贷能否绑定他人银行卡,0.9095975572739378
475,什么是我的额度和可借额度,0.9092701506750855
476,好人贷收取哪些费用,0.9090748436828613
477,好人贷审核不通过对个人有什么影响,0.9089279114778087
478,申请好人贷工作信息如何填写,0.9086653806645429
479,借款失败怎么办,0.9084569690832781
480,随心存支持提前支取吗,0.9083658363189046
481,提额会有通知吗,0.9083306675204073
482,好人贷放款至什么账户,0.9081890119814834
483,好人贷利率是多少,0.9080709501263795
484,好人贷可以重新申请吗,0.9080322155412275
485,为何无法销户,0.907864388537806
486,好人贷还款方式有哪些,0.907735852812342
487,好人贷申请能否撤销,0.9075633588783588
488,如何换绑银行卡,0.9074458994723621
489,车贷平台如何查询,0.9073909978444747
490,自动扣款如何操作,0.9073894436290737
491,还款日当天是否自动扣款,0.9072374641988165
492,其他贷款怎么办理,0.9071785360522059
493,关闭其他平台额度后，能否恢复好人贷额度,0.9069933350670422
494,申请好人贷需要什么条件,0.9069749602649609
495,逾期造成的影响是什么,0.9069368568374818
496,申请好人贷后有没有回复,0.9065349158314278
497,如何通过线下方式转入新网二类户,0.9062004891598759
498,车贷如何解绑银行卡,0.9061302380618242
499,车贷如何提前还款,0.9060451084271764
500,他人可以使用本人信息申请好人贷吗,0.9054684633699113
501,好人贷如何试算利息,0.9047220734371029
502,开户失败原因,0.9044539909362076
503,好人贷还款后额度何时恢复,0.9043589659087821
504,获取额度后多久可发起借款,0.9043519835083845
505,操作好人贷是否需要开启定位,0.9042741278147384
506,五年定期存款是什么,0.9041497842603617
507,可以咨询吗,0.9038843501338975
508,能否删除个人信息,0.9038474196158688
509,为何提示该证件已被使用,0.9037544749532127
510,为什么点击拍照没有反应,0.9032816378264524
511,新网银行APP下载,0.902773075504286
512,客户表示有合作意向,0.9027332922507424
513,下一次开放时间是什么意思,0.9026458932014609
514,定期存款到期如何支取,0.902445983142271
515,提前支取有限制吗,0.9023701221963837
516,好人贷的办理时间,0.9022008762461577
517,如何注销公众号,0.90212185148651
518,新网银行简介,0.9020078547040646
519,美利车联系电话,0.9019474073762944
520,征信报告是什么样的,0.9019151735432235
521,结清证明开据时间是多久,0.9017954584589694
522,客户表示知道了,0.9015787985441502
523,实名认证为什么不符,0.9015614286115184
524,如何选择按期还款/任性还款,0.901527944170133
525,好人贷申请必须使用身份证原件吗,0.9000925931390188
526,实名认证审核时间,0.9000238083680759
527,活体检测失败怎么办,0.9000043355394103
528,手机获取验证码失败,0.8995852892097878
529,好人贷如何提前还款,0.8992689560140812
530,罚息能否减免,0.8992568819312888
531,为何无法申请好人贷,0.8990713929217868
532,页面为何无法打开,0.8989111377335788
533,好人贷额度是否循环使用,0.8988790299207363
534,如何删除身份证信息,0.8988632556632814
535,为何结清证明显示日期与平台不符,0.8988169900727524
536,有额度不使用有什么影响吗,0.8983751334069128
537,车贷逾期如何还款,0.8982093786163721
538,令牌无效是什么,0.89818663635204
539,新网有哪些产品,0.8978376889174169
540,如何注销新网二类户,0.8977107488317217
541,绑定银行卡失败,0.8976148697061758
542,好人贷申请身份证可否添加水印,0.8975324753764231
543,开户是什么意思,0.8974564833681306
544,是否需要使用本人手机操作好人贷,0.8968384538482064
545,如何激活新网二类户,0.8964573284645693
546,好人贷个人资料如何修改,0.8960327028355297
547,好人贷利率为什么高,0.8958562340420877
548,自助提额什么时候上线,0.8957570065867894
549,页面为什么异常跳转,0.8950988271632843
550,好人贷能否人工操作提额,0.8947539937617279
551,工新借如何申请,0.8947299118245262
552,为何人脸识别提示光线太足,0.8946248392995081
553,登录密码为何无法重置,0.8942822534120672
554,好人贷申请是否可以使用临时身份证,0.8941054769680704
555,客户称赞服务好,0.8937674765956249
556,好人贷定位如何开启,0.8936964680611579
557,为何提示缺少必要参数,0.8936181816108575
558,销户与否会产生什么影响,0.8935286488121762
559,随心存存入限额,0.8934029850602117
560,各还款方式如何进行还款,0.8933936813063375
561,还款后页面显示等待中,0.8932651575213113
562,怎样用其他手机登录好人贷,0.8930012197884711
563,如何退出微信公众号,0.8929896314390833
564,贷款证明如何开据,0.8928215739063958
565,好人贷额度是否会发生变化,0.8924057697213719
566,密码被锁定怎么办,0.8920221405278713
567,存款产品支取通用路径,0.8919961849056038
568,如何知晓已注销成功,0.891853445771516
569,公众号如何注册,0.8917537502417866
570,好人贷如何降低利率,0.8913017611990934
571,为何提示系统异常,0.8911022792439197
572,客户表示稍等,0.8910065223921291
573,注册规则是什么,0.8908122930226686
574,人脸识别失败怎么办,0.8905731440796076
575,合作平台如何取消贷款,0.8894977792250623
576,车贷如何申请,0.889341101057721
577,车贷如何还款？,0.8892159714776398
578,可以重新注册吗,0.8892069861195588
579,系统繁忙是什么原因,0.8890281857840502
580,好人贷额度为什么变低了,0.8889550968513975
581,如何办理好人卡？,0.8886807747341836
582,扣款失败的原因,0.888582364553159
583,手持身份证拍照的注意事项,0.8885554888350712
584,什么是分批次扣款,0.8885252770526714
585,人脸识别使用的是照片还是视频,0.8879124296265082
586,如何降低/关闭额度,0.8878701134713003
587,还款记录如何查看,0.8875105978427976
588,好人贷是邀请制吗,0.8874653295430099
589,好人贷有额度后如何进行贷款,0.8873378416496953
590,好人贷与其他平台类似产品的区别是什么,0.8867318363797005
591,按期还款是什么,0.8864129715326446
592,好人贷审核时间是多久,0.8862023726240646
593,好人贷为何无法还款,0.886034466334081
594,好人贷贷款期限是多久,0.8859507542307141
595,好人贷如何主动还款,0.8856002743693279
596,创客贷额度是多少,0.8854004872899803
597,怎样才能成功申请到额度,0.8846839066051359
598,忘记密码怎么办,0.8846385702862337
599,季得利如何计息,0.8833198605223499
600,如何解绑银行卡,0.8828070695081073
601,经侦是指什么,0.8823305938037619
602,优惠券如何使用,0.8820250801845139
603,好人贷提额周期是多久,0.8815324012656873
604,申请被拒怎么办,0.880998018571479
605,为什么无法注册,0.8803739612843863
606,如何增加银行卡,0.880215805685614
607,退汇是什么意思,0.8800605126383972
608,好人贷如何实名认证,0.87846003688364
609,好人贷还款后多久到账,0.8776352799726349
610,什么是登录密码,0.8776175932592026
611,好人贷借款多久到账,0.8767516093832576
612,好人贷如何审核,0.8764060391227876
613,如何录制活体检测,0.8762917326324173
614,随心存T+1是什么,0.8760175749509351
615,客户表示不满,0.8759022882959132
616,好人贷借款规则,0.8755275454839351
617,为什么没有扣款,0.8752217207367378
618,申请好人贷是否都有额度,0.8748681611781178
619,好人贷消费用途,0.874181203483829
620,什么情况算逾期,0.8729454841038083
621,什么是综合评估,0.8724975853893686
622,迁户是什么意思,0.8721783832365599
623,如何登录微信公众号,0.8719748591869938
624,可否对公还款,0.8718222938077782
625,客户提出建议,0.8700880336259023
626,好人贷额度是多少,0.8686443338998946
627,好人贷额度他人能否使用,0.8684058900119878
628,征信是什么,0.8672527547452846
629,好人贷如何自助提额,0.8669903737249032
630,什么是当期账单,0.8666537674809338
631,工新借是什么,0.866274700736872
632,批扣时间段是多久,0.8658995082189322
633,什么情况算违约,0.865167808542338
634,好人贷为什么无法登录,0.8634769831437048
635,好人贷额度有效期是多久,0.8624273989769778
636,什么是还款日,0.8623012773583693
637,如何邀请好友申请好人贷,0.8621354273845082
638,罚息介绍,0.8612627937248819
639,好人贷如何申请,0.8608057069969077
640,季得利是什么,0.8602592828568599
641,额度冻结是什么意思？,0.8600565653608466
642,好人贷是否有临时额度,0.8583876587898756
643,密码如何修改,0.8577630742134089
644,什么是活体检测,0.8558764355495586
645,存管是什么,0.853927558701899
646,有多少人获得好人贷额度,0.8507023597643594
647,如何进入个人中心,0.8458041676011162
648,好事贷如何还款,0.8417463667257709
649,如何进入好人贷页面,0.8413812553228567
650,可否延期还款,0.8408372939222947
651,随心存如何计息,0.8379030120128386
652,好人贷如何提高额度,0.8377340879020325
653,人脸拍摄规范,0.8355994794966238
654,额度占用问题,0.8353073745314413
655,合作平台如何还款,0.834400107468479
656,任性还款是什么,0.8339873566143247
657,好人贷如何还款,0.8318907788359189
658,什么是一、二、三类户,0.831526554818872
659,随心存是什么,0.8301047617543983
660,好人贷为什么额度低,0.8270165938620062
661,什么平台的贷款,0.812712189177232
662,如何获得优惠券,0.8094996720927959
663,随心存如何登录,0.8043285137409365
664,额度冻结怎么办,0.803516812653467
665,好人贷是什么,0.774967237147327
666,季得利如何支取,0.7582627477183347
