416,活体检测失败怎么办,0.9117371364453569
417,存款利率是多少,0.9116017667049525
418,好人贷额度是否循环使用,0.9115097900215148
419,身份证过期可以申请好人贷吗,0.9113192311708189
420,身份证信息变更后如何更新,0.9111362602910307
421,好人贷通过率多少,0.9111344573442826
422,车贷如何更换还款银行卡,0.9110243948367716
423,好人贷申请能否撤销,0.9108925695251509
424,一个身份证可以申请好人贷两次吗？,0.9107660917989329
425,如何办理对公业务,0.9107196557783298
426,优信客服电话是多少,0.9106199364199148
427,新网银行二类户与好人贷是否为同一个手机号码,0.9102400291410704
428,随心存操作渠道有哪些,0.9101865978833393
429,其他贷款怎么办理,0.9099743869151191
430,修改手机号码的处理时间是多久,0.9098867382360325
431,怎样才能成功申请到额度,0.9098719827460229
432,实名认证审核时间,0.9097291180499744
433,车贷合同如何查看,0.9095365380657119
434,能否删除个人信息,0.9095055365050185
435,实名认证为什么不符,0.9095029091076919
436,能否让客服回电,0.9092041217819231
437,申请好人贷需要什么条件,0.9091159573681316
438,申请好人贷工作信息如何填写,0.9090008319094471
439,他人可以使用本人信息申请好人贷吗,0.9087629848529108
440,好人贷如何试算利息,0.9084097696069993
441,可以咨询吗,0.9082791743838423
442,"好人贷有回访电话吗""",0.9082100023993323
443,可以重新注册吗,0.9081329100839807
444,新网银行有招聘吗,0.908114181252518
445,好人贷月利率是多少,0.9078454976022595
446,好人贷借款合同有效期是多久,0.9078354623330548
447,关闭其他平台额度后，能否恢复好人贷额度,0.9078013529295897
448,客户发送截图以及个人信息等,0.9073992329960139
449,新网银行有哪些活动,0.9072585644433269
450,新网银行业务办理时间,0.907210284812928
451,为何提示该证件已被使用,0.9069986518917734
452,随心存到期后何时到账,0.9069785533490994
453,如何选择按期还款/任性还款,0.9068422342278245
454,上传身份证时需填写的内容是什么,0.9065542776797907
455,验证码发送至什么手机号,0.9064597628970829
456,操作好人贷是否需要开启定位,0.9063286324234634
457,可否补充企业邮箱,0.9056979854186541
458,好人贷有回访电话吗,0.9055649559436021
459,逾期造成的影响是什么,0.905410967300463
460,电脑端可以登录好人贷吗,0.9051753662572104
461,好人贷账户如何注销,0.9049720275015117
462,视频认证的步骤是什么,0.9047552610861933
463,什么是注册号码？,0.9044570537161943
464,好人贷年化利率是多少,0.9042987081909915
465,好人贷当期能否最低还款,0.9038893934433082
466,新网银行的官网地址是什么,0.9037658071692786
467,自动扣款时间段是多久,0.9031428209083249
468,目前支持的银行有哪些,0.9029868256562816
469,如何开据存款证明,0.9024678057770589
470,银联在线支付是什么,0.902307610447518
471,如何签署借款合同,0.9022136407796139
472,什么是风控审核中,0.9018837022376025
473,新网银行有几个网点,0.9015719442032328
474,身份证上传失败怎么办,0.9014062549748046
475,如何获取线上核身链接,0.9009427080734543
476,定期存款到期如何支取,0.9008991680007478
477,存在迁户问题怎么处理,0.9007683586211179
478,销户与否会产生什么影响,0.9006286993698033
479,消费凭证有效期是多久,0.900610602206868
480,如何解约快捷支付？,0.9004902150715205
481,我行对客邮箱是多少,0.9003029937476118
482,好人贷还款方式有哪些,0.8997278976163375
483,申请好人贷后有没有回复,0.8994550398388866
484,好人贷申请必须使用身份证原件吗,0.8994054472740264
485,好人贷需要面签吗,0.8990573395787925
486,审核电话内容是什么,0.8988693750758702
487,客户要求发送相关模板,0.898086697656713
488,新网银行行号是多少,0.8980310219798913
489,如何通过线下方式转入新网二类户,0.8977485073626784
490,车辆信息如何查询,0.8970036930203279
491,好人贷额度是否会发生变化,0.8968288437026812
492,新网银行合作平台有哪些,0.8959889097992292
493,客户表示需要考虑,0.8956745331258731
494,为何无法销户,0.8953077142322573
495,开通什么业务,0.8952991387966558
496,美团客服热线是多少,0.8951972230225986
497,新网银行是否上市,0.8950970915523923
498,新网银行账户是什么,0.8948154967968893
499,好人贷利率是多少,0.8940380552771158
500,下一次开放时间是什么意思,0.8939693128317919
501,关于消费凭证,0.8939571169963628
502,车贷逾期如何还款,0.8936807532760693
503,滴水贷客服电话是多少,0.8936066883110565
504,如何知晓已注销成功,0.8935164336165863
505,好人贷能否绑定他人银行卡,0.8933781737273179
506,新网银行地址在哪里,0.893069636099291
507,车贷如何提前还款,0.8928982506703976
508,我们是四川新网银行吗,0.8926849446514423
509,为何提示缺少必要参数,0.892170147233641
510,好人贷放款至什么账户,0.8919435460086148
511,新网银行如何联系客户,0.8915539664965709
512,在哪个平台操作提现,0.8914677726091669
513,还款记录如何查看,0.8913522818223246
514,页面为什么异常跳转,0.891252252685019
515,人脸识别失败怎么办,0.8908504020610536
516,新网银行好事贷如何申请,0.8908278340133595
517,好人贷能否人工操作提额,0.8904868752794585
518,申请被拒怎么办,0.8902472862964116
519,为何无法申请好人贷,0.8902325875851105
520,是否需要使用本人手机操作好人贷,0.8895981109019991
521,各还款方式如何进行还款,0.8893769560544097
522,好人贷申请是否可以使用临时身份证,0.8892930432662184
523,好人贷有额度后如何进行贷款,0.8892020976503558
524,好人贷利率为什么高,0.8884113218098756
525,页面为何无法打开,0.8882600466048765
526,自助提额什么时候上线,0.8877435304286232
527,还款后页面显示等待中,0.887124329296399
528,随心存存入限额,0.8870974698244191
529,人脸识别使用的是照片还是视频,0.8870661578032994
530,客户表示有合作意向,0.8864249709101737
531,好人贷-云闪付是什么,0.8862575922884686
532,为何结清证明显示日期与平台不符,0.8860462449688796
533,房产保证金是什么,0.8860277949553174
534,新网银行人工客服服务时间,0.8859768206292806
535,好人贷如何降低利率,0.8855852489627637
536,客服是否是随机分配,0.8853368221814873
537,为什么没有扣款,0.8849712968028924
538,登录密码为何无法重置,0.8847452337083024
539,为什么无法注册,0.8847340850405198
540,好人贷申请身份证可否添加水印,0.8846885429028825
541,新网银行三类户是什么,0.884162575568992
542,征信报告是什么样的,0.8840547603497791
543,银行渠道维护时间一般是多久,0.884029824604673
544,怎样用其他手机登录好人贷,0.8836548004702285
545,令牌无效是什么,0.8835492620166232
546,车贷如何解绑银行卡,0.8833077512913433
547,密码被锁定怎么办,0.8829149036760169
548,好人贷额度为什么变低了,0.8827495728875373
549,什么是分批次扣款,0.8827376096402555
550,如何冻结新网银行账户,0.8819792223440844
551,好人贷如何提前还款,0.8814628162161624
552,如何删除身份证信息,0.8809044457492612
553,五年定期存款是什么,0.8807968147786904
554,为何人脸识别提示光线太足,0.880774461095542
555,存款产品支取通用路径,0.8804789066030966
556,好人贷为何无法还款,0.8803769374703553
557,客户提到投诉,0.8797229549801121
558,如何更换微信号,0.878789461662319
559,车贷平台如何查询,0.8774248050391008
560,如何关注新网银行公众号,0.8773128808411355
561,好人贷个人资料如何修改,0.877096074459116
562,开户是什么意思,0.8770245044633582
563,按期还款是什么,0.8766149565339932
564,如何在新网银行开户,0.8765674174881763
565,退汇是什么意思,0.8762470812254806
566,工新借如何申请,0.8761308972282514
567,忘记密码怎么办,0.874900211413275
568,车贷如何还款？,0.8745034086193095
569,手持身份证拍照的注意事项,0.8743739111128978
570,结清证明开据时间是多久,0.8729174408041137
571,如何换绑银行卡,0.872505480818252
572,系统繁忙是什么原因,0.8707574775191784
573,注册规则是什么,0.8706338238051662
574,车贷如何申请,0.8698494117689524
575,如何绑定银行卡,0.8693190567357465
576,好人贷定位如何开启,0.8692845062016358
577,好人贷与其他平台类似产品的区别是什么,0.8691883620153716
578,好人贷审核时间是多久,0.8690123659816663
579,如何降低/关闭额度,0.8676648813729361
580,企业邮箱格式是什么,0.8667940466197086
581,好人贷贷款期限是多久,0.8658680819244501
582,申请好人贷是否都有额度,0.8657924713770728
583,客户表示知道了,0.8655875839316813
584,如何激活新网二类户,0.8653611112926759
585,新网有哪些产品,0.8642306606733876
586,好人贷电话回访时间,0.8637881658243565
587,好人贷是邀请制吗,0.863610641625659
588,好人贷额度他人能否使用,0.8624407393848375
589,好人贷的办理时间,0.8622063150859897
590,可否对公还款,0.8616639498343033
591,为何提示系统异常,0.8610909510431719
592,好人贷如何主动还款,0.8608357347650765
593,如何注销新网二类户,0.8607492438259702
594,好人贷提额周期是多久,0.8607245613902367
595,贷款证明如何开据,0.8606346481376338
596,优惠券如何使用,0.8602508967476414
597,合作平台如何取消贷款,0.8600219152340726
598,什么是综合评估,0.8594518282960857
599,好人贷还款后多久到账,0.8593558193015576
600,好人贷借款规则,0.8593337344648956
601,好人贷借款多久到账,0.8576121353668948
602,美利车联系电话,0.857551813415936
603,什么情况算逾期,0.8559846825216072
604,好人贷如何实名认证,0.8556713481565464
605,好人贷如何审核,0.8555128842988873
606,如何录制活体检测,0.8550059486763798
607,好人贷消费用途,0.854004692086206
608,什么情况算违约,0.8531240434580106
609,什么是登录密码,0.8530352396960884
610,创客贷额度是多少,0.8520824231382098
611,随心存T+1是什么,0.8517853324223728
612,新网银行APP下载,0.8515722384114567
613,如何注销公众号,0.8505221898334888
614,好人贷为什么无法登录,0.8464387523646983
615,额度冻结是什么意思？,0.8453188618563597
616,如何办理好人卡？,0.8448308184009875
617,客户表示不满,0.8444619902421149
618,如何退出微信公众号,0.8443606408503427
619,好人贷如何自助提额,0.8433173832482135
620,经侦是指什么,0.8430628962494483
621,好人贷额度有效期是多久,0.8428397104140914
622,迁户是什么意思,0.842175199899172
623,什么是当期账单,0.8404153781398611
624,客户表示稍等,0.8386343756497938
625,好人贷是否有临时额度,0.8386315633401287
626,可否延期还款,0.8376857988488539
627,客户称赞服务好,0.8375559417502032
628,什么是活体检测,0.8368823872579628
629,好人贷如何申请,0.8354932799967241
630,季得利如何计息,0.8354019612436935
631,新网银行简介,0.833360122246404
632,什么是还款日,0.8316924304508847
633,批扣时间段是多久,0.830618096073184
634,额度占用问题,0.8304459507507567
635,好人贷额度是多少,0.8303987285879287
636,如何邀请好友申请好人贷,0.8289691309131416
637,公众号如何注册,0.82890322347582
638,客户提出建议,0.828233909256847
639,罚息介绍,0.8276989123804349
640,如何增加银行卡,0.8268786504265103
641,如何解绑银行卡,0.8268258792633638
642,征信是什么,0.8267158549348014
643,季得利是什么,0.8251832820494963
644,有多少人获得好人贷额度,0.8197738335279926
645,好人贷如何提高额度,0.8173550579085949
646,工新借是什么,0.8167741502489893
647,密码如何修改,0.8166726210300012
648,存管是什么,0.8061557658700486
649,好事贷如何还款,0.805238056743738
650,人脸拍摄规范,0.8012817757611118
651,如何登录微信公众号,0.7966589251620331
652,什么是一、二、三类户,0.7962082907983843
653,好人贷为什么额度低,0.7947045508529338
654,合作平台如何还款,0.7905693904797232
655,如何进入好人贷页面,0.7886987227921938
656,任性还款是什么,0.7886577288842583
657,随心存是什么,0.7869705832902081
658,好人贷如何还款,0.7857610508683354
659,额度冻结怎么办,0.776920264792024
660,随心存如何计息,0.7761190023129085
661,如何进入个人中心,0.7728776470414976
662,如何获得优惠券,0.7625213086822679
663,什么平台的贷款,0.7369898832131397
664,随心存如何登录,0.7281850760771573
665,好人贷是什么,0.7044136190925777
666,季得利如何支取,0.6815818732465564
