0,不能准点出补扣结果但是扣款成功了不会影响我征信吧,1.0
1,实际申请金额与放款金额不一致可否取消车贷,0.9690555274480975
2,是否可以取消自动扣款,0.9681477774684407
3,无法提供消费凭证可以取消贷款吗,0.9679142514652794
4,借款合同是否有展示提前还款会收取违约金的情况,0.9670232092408502
5,优信扣款成功后为何显示待还款,0.9665177525150661
6,扣款结果会有短信提示吗,0.9662981725037622
7,为何提示支付平台该客户无默认扣款卡，交易没有发给统一支付,0.9662537870396545
8,收款卡发卡行拒绝放款失败什么意思？,0.9660968373240195
9,提前结清贷款后还会扣款吗,0.966016957789206
10,银行卡挂失会影响自动扣款吗,0.9658255723952519
11,借款成功会有短信等提醒吗,0.9658163617363676
12,更换银行卡会影响自动扣款吗,0.9651406317778777
13,补扣会影响信用吗,0.9647874414499346
14,系统升级会影响扣款吗,0.9647758666130241
15,为何之前绑定的银行卡不支持扣款了,0.9636284084609599
16,提前还款会影响个人征信吗,0.9633893712856746
17,修改手机号码/微信号是否会影响自动扣款,0.9632222122965518
18,好人贷不借款会产生利息或费用吗,0.9630781783639007
19,购买存款页面为何提示“额度不足，无法购买”,0.9626455782795642
20,如何确保还款日当天会扣款成功,0.9620503566836534
21,银行卡是二类户影响扣款吗,0.961749356067019
22,使用优惠券后提前还款利息如何计算,0.9609855525383684
23,如何取消征信查询及使用授权书,0.9605899159929172
24,选择任何还款方式都可以提前还款吗,0.9601896102275673
25,未正常还款我行会进行催收吗,0.9599962359805777
26,存管查询为何提示用户不存在或者信息有误,0.9596391411513058
27,征信上显示的贷款金额是否包含利息,0.9593460025276699
28,为何征信上有新网上报的贷款记录,0.9585746670226982
29,为何征信上有新网银行的贷款审批记录,0.9584950342583918
30,提前还款有次数限制吗,0.957762950918301
31,为何提示支付平台受发卡行资金用途限制拒绝交易,0.9576835531044423
32,线上开据证明为何和征信金额不符,0.9576333967345432
33,页面为何提示“开户失败”、“账户存在异常操作/账户异常”,0.9572775175945941
34,借款时选错收款账户怎么办？,0.9570736863947402
35,借款到账后页面未更新借款状态,0.9570483042243798
36,银行卡开通银联在线支付后是否可正常还款,0.9565869356710661
37,为什么提前还款显示联合贷批次执行中？,0.9564641605864528
38,贷款结清之后能否删除贷款记录,0.9560644354201949
39,季得利提前支取影响已发放利息吗,0.9557342305741481
40,半年得利提前支取影响已发放利息吗,0.9556237524238117
41,为何征信上的放款日期与实际借款日期不一致,0.9556124313541011
42,为何提示支付平台签约关系不存在,0.9555150668481666
43,好人贷支持微信/支付宝扣款吗,0.9554131891336722
44,好人贷只能通过绑定的银行卡还款吗,0.9551537152720494
45,如何查询好人贷申请的授信结果,0.9551344008341054
46,绑卡时页面上的银行卡预留手机号码可以修改吗,0.9547039528519391
47,我行放款的其他平台借款会上报征信吗,0.9545584297873154
48,为何提示还款卡不存在,0.9544429900445095
49,申请好人贷后，可否更改授信结果,0.9542474765602798
50,好人贷提额会查询征信吗,0.9541023983343754
51,转账到新网银行账户是否还款成功,0.9537827987020455
52,为何按期还款只能选择部分贷款期限,0.953454376947742
53,为何提示交易密码验证失败,0.9534429347677859
54,好人贷申请成功会有短信通知吗,0.9534383077115475
55,再次申请好人贷会查询征信吗,0.9534303049802149
56,为什么拍照认证时总是不成功或显示系统崩溃,0.9534039264748777
57,存款产品的资金可以用于好人贷还款吗,0.9526340282657012
58,好人贷借款时还会审核吗,0.9526248586757022
59,好人贷借款后能否修改贷款信息,0.9523892687520567
60,好人卡绑定云闪付/微信等失败怎么办,0.952280555416526
61,是否会发生重复扣款情况,0.9519134867542081
62,京东存款是否支持提前支取/提前部分支取？,0.9518523070761662
63,线上开据证明有次数限制吗,0.9515975210845343
64,平台方提供的客户审批资料能否提供给客户,0.9513566928884839
65,选择任性还款/按期还款利息如何计算,0.9512903063568025
66,自动扣款失败怎么办,0.9512510903652908
67,为何同时收到了还款成功和失败的短信,0.9510647569161478
68,新网账户绑定微信/支付宝后支持提现或充值吗,0.9508264519747909
69,存款需要先开立银行账户吗,0.9506987971294404
70,新网银行账户可以设置为好人贷借/还款账户吗,0.9505558854165402
71,为何提示支付平台不允许持卡人进行的交易,0.9503205407781317
72,为何存管查询提示没有密码,0.9501602777408421
73,车贷合同里的金额是否包含利息,0.9500322871849015
74,提前还款手续费是多少,0.9500227395249435
75,逾期后还款金额是否会增加,0.9498595009388126
76,好人贷申请是否查询芝麻信用,0.9498018808708201
77,哪些渠道可以购买京东存款产品？,0.949769958197491
78,还款银行卡是否需要开通银联在线支付业务,0.9496874581160551
79,销户后为何还能解绑银行卡,0.9494969348817528
80,新网银行发送的短信验证码的有效时长？,0.9493965181740412
81,结清贷款后征信上是否会显示结清,0.9493763779931346
82,注册手机号更换成功后何时可以正常使用,0.9491503306763702
83,好人贷注册手机号与银行卡预留手机号是否需要一致？,0.9490355612916125
84,可否按照征信订单号开据证明,0.9488972120750521
85,新网银行有哪些产品可以提额,0.94866110074248
86,转入新网银行使用的密码是交易密码还是银行卡密码,0.9486514908190596
87,好人贷支持在国外发起借款吗,0.9484348083603391
88,好人贷必须绑定银行卡使用吗,0.9483850077246565
89,可否取消银行卡限额,0.9483771046688537
90,如何查询当期车贷还款金额,0.9482487459721932
91,注册手机号及微信号需要实名制吗,0.9482176862915725
92,为何提示支付平台支取金额超过可用余额,0.9480185371685552
93,修改手机号后是否需要重置登录密码,0.9475732421621573
94,为何提示支付平台银行卡未开通银联无卡认证支付,0.947118309624152
95,好人贷借款金额与到账金额是否一致,0.9469241663631964
96,平台方手机号变更导致我行无法直接开据结清证明问题,0.9468735097175129
97,好人贷支持扣款的银行有哪些,0.9465277590315166
98,京东存款的计息规则及计息公式,0.9464446842033158
99,车贷可以修改还款日吗,0.9462998265085307
100,申请好人贷需要开个人账户吗？,0.9462209914666663
101,开据证明为何显示没有符合要求的订单,0.9460345331157184
102,注销注册用户后是否可恢复？,0.9458002089273383
103,线下转账如何填写新网银行开户信息,0.945509172715203
104,绑定银行卡产生费用吗,0.945195753125434
105,如何查询是否开通银联在线支付,0.9450392923527838
106,好人贷授信首页显示利率是否为固定利率,0.9448360879091366
107,新网银行账户的交易记录如何查看,0.9447229622509177
108,进入随心存为何提示手机号码不一致,0.9445682154267968
109,交易密码无法设置,0.9444715016693707
110,好人贷是否支持提前还当期账单,0.9443223408008095
111,微信号更换成功后何时可以正常使用,0.9441985910226138
112,转账时为何提示未面核,0.9441831426682696
113,如何查询合作平台贷款是否结清,0.9441646181153138
114,申请诺诺发票贷需要什么条件,0.9440571068836098
115,好人贷以什么贷款类型上报人行征信？,0.9439975929768958
116,什么是无卡支付及免密支付,0.9438779326458335
117,查询车贷的注册手机号码是什么,0.9438379291440687
118,销户后是否上征信,0.9438215003662611
119,五年定期存款的利率是多少,0.9436848204958517
120,非绑定银行卡可否与新网二类户转账,0.9435347921791888
121,好人贷借款超时未到账如何处理,0.9434994287226125
122,开据证明时为何提示账户存在异常,0.9434055564705124
123,可以让别人代还款吗？,0.9432869829446334
124,可以查询注册手机号码吗,0.9432555181221531
125,新网银行存款产品为何暂停交易,0.9429966966806425
126,好人贷借款记录如何查询,0.9429753720691108
127,随心存停售后有影响吗,0.9429651139334785
128,五年定期存款支持提前支取吗,0.9427078975975542
129,如何把注册用户与结算用户都注销,0.9424656983830902
130,好人贷扣款账户如何查看,0.9424017457239191
131,微信/支付宝等可否与新网银行账户互相绑定,0.9423559657964047
132,好人贷贷款利息如何计算,0.9421767694873152
133,为何销户后还能看到好人贷信息,0.9420671980538227
134,为什么收到提额短信但额度未提升,0.9420352300742222
135,为何提示支付平台持卡人信息有误,0.9419739134603141
136,车贷扣款支持的银行卡有哪些,0.9417846805288508
137,线上是否可开据征信版结清证明,0.9415712571111359
138,新网银行以何名义查询征信,0.9415659832833652
139,为何征信上有新网银行上报的逾期,0.941468491148741
140,为何图文验证码输入正确却提示错误,0.9414576904392722
141,如何修改存管账户预留手机号码,0.9413226756219657
142,为何无法提交好人贷申请资料,0.9412877744013662
143,新办的手机号可以申请好人贷吗,0.94127727523864
144,车贷合同为何无法查看,0.9411780611983416
145,白骑士认证失败是什么意思,0.941132317823846
146,结清贷款后什么时候可以开据结清证明,0.9410713831911817
147,为何提示还款存在差错,0.9410195129128871
148,为何提示支付平台暂不支持的银行或限额,0.9407098334312852
149,如何查询转账到新网银行的记录,0.9404824734623615
150,电话客服是否可以受理结清证明,0.9404253904812074
151,诺诺发票贷的利率是多少,0.9403525111954247
152,存款产品如何重置交易密码,0.9403308209745039
153,在线咨询是否支持客户发送语音,0.9401259806118055
154,好人贷如何查看所支持的还款方式,0.9401199945145817
155,新网银行扣款通道是什么,0.940091212174707
156,贷款证明开据失败怎么办,0.9399868594565609
157,为何重置密码后仍提示密码错误,0.939822632222353
158,定期存款的利率是多少,0.9398130528928919
159,如何查询存管账户流水,0.9397268425233781
160,贷款证明的电子章是否具有法律效应,0.9396460334078933
161,好人贷审核不通过对个人有什么影响,0.9396338744986289
162,能否开具非恶意逾期证明,0.9395424959832982
163,新网银行存款是否受保障,0.9395278587523275
164,支持绑定的银行卡类型有哪些,0.9392545409205542
165,节假日可以操作各类存款吗,0.9389690908981269
166,新网银行账户可以在哪些地方使用,0.9386715134290197
167,销户后可以再开户吗,0.9385820772209673
168,随心存可以在我行公众号查询/操作吗,0.9384183981178454
169,存款页面是否会显示每日收益,0.9382745315773862
170,可以查询个人信息资料吗？,0.9382346621103155
171,为什么银行还款存在限额？,0.9382165034903963
172,好人贷是否支持提前还款,0.9381979730591236
173,如何查看委托支付协议,0.938109563250248
174,节假日可以借/还款吗,0.9378499892265221
175,查询结清证明申请是否已提交,0.9376292266233888
176,定期存款操作的渠道有哪些,0.9374132478928523
177,身份证更换期间会影响好人贷贷款吗,0.937390483127532
178,好人贷支持周末借款吗？,0.9372041767895238
179,好人贷是否支持归还逾期部分账单,0.9371681174468284
180,新网二类户转入/转出收取手续费吗,0.9370043027621772
181,当期账单支持再分期吗,0.9369806724029476
182,视频认证录制失败的原因是什么,0.9369659080467594
183,新网银行的活期利率是多少,0.9368861831088926
184,申请好人贷后为何页面显示仍可提交申请,0.9368697983108486
185,随心存利率为何会发生变化,0.9367047196340051
186,为何提示用户未实名认证,0.9366777563080062
187,为何提示支付平台交易金额超限,0.9366347455542767
188,结清证明的发送方式有哪些,0.9365096364491108
189,为什么取消了提前部分还款,0.9365094126535926
190,审核电话可更改接听电话吗,0.9364532076767346
191,为何提示支付平台账户余额不足,0.9364493646231588
192,新网银行开户支持的证件有哪些,0.9363956660501627
193,新网银行有企业贷款吗？,0.9363321591387381
194,客服能否看到客户申请好人贷的信息,0.9363225038064463
195,实名认证是否查询征信,0.9360733890716498
196,如何查询其他平台扣款银行卡,0.9360553851058909
197,好人贷自动扣款规则,0.9360113449586493
198,车贷支持手动还款吗,0.9359244738076817
199,为何提示支付平台当日交易次数超限,0.9359043293994056
200,如何查看优惠券的使用情况,0.935732269922754
201,实名认证失败的原因是什么,0.93550351339399
202,好人贷申请需要填写哪些个人信息,0.9354088955468259
203,开据证明时为何需要实名认证,0.9349277480184808
204,京东存款如何修改注册手机号码,0.934895965748879
205,新网二类户上的资金是否计息,0.9348946798114927
206,为何申请好人贷后显示未获取额度,0.9348844147380525
207,为何提示支付平台渠道不支持的银行,0.9348799480663208
208,公众号是否有还款提示,0.9348458097983307
209,新网账户之间能否互相转账,0.934534503330266
210,如何查询好人贷借据收款银行卡,0.9343044481020092
211,什么是单笔借据和多笔借据,0.9342985057590191
212,新网银行存款属于理财产品吗,0.9342638482259134
213,存管查询的余额如何提现,0.9341743238863275
214,如何查看手机号是否实名制,0.9340613103555336
215,新网银行自动扣款时间,0.9340567417852205
216,随心存提前支取到账时间,0.9338767318030755
217,银行渠道维护无法操作怎么办,0.9337674254183844
218,还款日当天支持手动还款吗,0.9337004274454003
219,挖财还款是否为新网银行代扣,0.9336015315191735
220,平台还款信息为何与新网银行不一致,0.9334914633635629
221,还款金额超银行卡限额怎么办,0.9334784310157372
222,结清证明会展示哪些信息,0.9334708202745122
223,好人贷账户是否为新网银行二类户？,0.9334426440192114
224,京东存款为什么显示当日额度为什么已售罄？,0.933361192096147
225,能否人工开据贷款证明,0.9333437186894306
226,存款产品是否存满五年才能支取,0.9332544999947603
227,开具结清证明时为何无法登录,0.9332405992826409
228,车贷收取哪些费用,0.9331058606781064
229,结清证明是否是还款记录证明,0.9329316252390867
230,为何好人贷还款时提示“交易处理中”,0.9328991379085748
231,好人贷部分提前还款规则,0.932845900220928
232,为何无法登录存管查询,0.9328328263018306
233,如何查询申请相关的协议书,0.9326602705031032
234,为何提示不具备开具资格,0.93265888218435
235,好人贷支持随时借款吗,0.9324253507456869
236,申请好人贷必须填写联系人信息吗,0.9322861492924127
237,拨打我行人工客服电话是否收费,0.9322613960559964
238,如何购买新网银行存款产品,0.9321403777196302
239,存管账户如何查询,0.932091155364081
240,好人贷被拒后为何没有下次开放时间,0.9320670403497905
241,如何更换好人贷默认还款账户,0.9320514189898536
242,如何设置存管支付密码,0.9320134479484881
243,新网银行视频认证的QQ号码是多少,0.931928134756369
244,如何查询征信报告,0.9319017171939593
245,好人贷只能使用微信登录吗？,0.9318926411480902
246,客户催促需要加急办理,0.931806060231683
247,什么是银行卡预留手机号？,0.9317178907026109
248,如何查看开户结果,0.9315826560303762
249,借款后如何判定下次还款日期,0.9315080630509283
250,如何更换借款收款银行卡,0.9312488063344322
251,好人贷交易密码如何设置,0.931231042847477
252,为什么好人贷第一期还款金额与之后不一致,0.9311082964951404
253,注销账户的处理时间,0.9309461627383182
254,好人贷手动还款时为何提示批次执行中,0.93091805328106
255,月得利提前支取如何计息,0.93086089468134
256,好人贷注册手机号无法使用,0.9308191758302244
257,通过本人微信找回密码是指什么,0.9307425652815711
258,新网二类户转入/转出有时间限制吗,0.9305629933056125
259,更改银行卡预留手机号的方法,0.9304392133640017
260,如何修改征信上的个人信息,0.9303813713753668
261,好人贷-云闪付如何更换收/还款银行卡,0.9303683081109062
262,车贷还款记录如何查询,0.9303540727290031
263,新网银行能否绑定云闪付,0.9301671762085754
264,定期存款是否有存单,0.9301068214505165
265,申请好人贷需要公积金、社保吗？,0.9301039025875327
266,车贷还款只扣除部分是什么原因,0.9297904597418292
267,新网银行自动扣款次数,0.929789404347849
268,未接到好人贷回访电话会被拒吗,0.929662159898162
269,新网诺诺发票贷如何申请,0.929456835189729
270,银行转账未到账怎么办,0.9294141050795565
271,人工是否可操作扣款,0.9292492599516975
272,可以通过他人银行卡转入到新网银行账户吗,0.9291932016931339
273,好人贷借款如何上报征信,0.9291599779567541
274,如何修改新网随心存注册号码,0.929099883404379
275,存款产品是否保本保息,0.9289222732381546
276,存管账户充值限额,0.9286942078436212
277,接收短信的手机号是否为注册手机号,0.9285990463260433
278,客服能否查看聊天记录,0.9285527510782918
279,银行卡还款限额是多少,0.9282798665588208
280,获取验证码次数超限怎么办,0.9282798296275784
281,新网银行有信用卡吗,0.9281633631529027
282,可绑定银行卡数量上限,0.9281374126554784
283,好人贷为什么提示“账户存在异常操作”,0.9280884024364785
284,为何存管信息与平台显示不一致,0.9280463299591097
285,随心存利率是多少,0.9279985156116558
286,抵押类贷款如何办理,0.9278847913716808
287,自动扣款如何操作,0.9277596500208269
288,好人贷额度必须一次性借完吗,0.927612118870706
289,为何提示支付平台账户状态异常,0.9274277525853191
290,如何查看银行卡管理列表,0.927276202510621
291,名下所有卡被冻结后如何还款,0.9272157505369832
292,申请好人贷需要下载APP吗？,0.9270084893887018
293,他行渠道汇入新网账户的到账时间是多久,0.9269875335012115
294,好人贷为什么无法借款,0.9268903077989966
295,咨询可以发送图片吗？,0.9267891864448372
296,新网二类户可以升级为一类户吗？,0.9266564527887474
297,为何页面出现多个新网银行账户,0.9266164902529073
298,为何还款后额度恢复减少了,0.9263212763794528
299,好人贷上征信吗,0.9262436126106183
300,如何查看好人贷相关协议/合同？,0.926231769413427
301,如何查看随心存购买情况,0.9260535666636079
302,周得利提前支取如何计息,0.9259704297598467
303,随心存存款期限有哪些,0.9257709549581559
304,如何查询账户是否冻结,0.9255173665212165
305,企业邮箱验证码可否重新获取,0.9253791034749002
306,提前支取时为何显示存入,0.9253765422256532
307,为什么点击拍照没有反应,0.9253404529163961
308,核身链接失效的原因,0.9252835887095455
309,新网银行合作的存管平台有哪些,0.92503602403616
310,有额度不使用有什么影响吗,0.9249379731434072
311,车贷如何修改注册手机号码,0.9247950879468652
312,随心存产品停售原因,0.9247790208286869
313,新网银行存款类产品有哪些,0.9246571898579335
314,为何收到新网银行还款短信,0.9246371427759386
315,为何申请好人贷页面显示暂无资格,0.9245459405012622
316,线上转入新网银行账户到账时间是多久,0.9243881184268479
317,如何查询车贷还款日,0.9242303026820061
318,为什么收到美利车金融的短信,0.924091692771781
319,如何修改实名认证手机号码,0.9239849813661754
320,存管账户如何注销,0.9238500097191022
321,登录时的图文验证码是否区分大小写,0.9237560664256698
322,公众号页面的“我的排号”是什么意思,0.9233592035084681
323,借款失败怎么办,0.9233339185007987
324,手机获取验证码失败,0.9232708323964454
325,好人贷账户如何更换手机号码,0.9232277726527366
326,还款日当天是否自动扣款,0.9231257323194391
327,联系新网银行客服有哪几种方式,0.9228789514697688
328,存管提现到账时间是多久,0.9228423389365028
329,客户咨询其他平台催收问题,0.9227451366342597
330,新网二类户为何无法转入/转出,0.9226660482505203
331,好人贷还款记录如何查询,0.9225570910434483
332,还款日可以修改吗,0.9225184016553266
333,如何查看贷款合同,0.9224882847402771
334,罚息能否减免,0.922439082232385
335,按期还款和任性还款的区别是什么,0.9223785824815451
336,还款后为何未更新还款状态,0.9222701604907313
337,好人贷-云闪付如何提前还款,0.9222454455398663
338,新网银行二类户限额是多少,0.9221543049602212
339,好人贷提前还款最低还多少,0.9221223972040851
340,周得利计息规则,0.9219881137036792
341,车贷如何办理解押手续,0.9219702408318328
342,查询各类工单办理进度,0.921829175308015
343,结清证明印章无法查看,0.9218104498958213
344,在线客服是否是人工客服,0.921765061101484
345,好人贷账户如何查询,0.9216489189843877
346,随心存如何修改交易密码,0.9216218285963861
347,好人贷审核时是否给填写的联系人去电,0.9214695315611129
348,如何操作随心存大额存款,0.9213603489544883
349,为何收到新网银行逾期提醒短信,0.9210782794060309
350,黑户/白户是否可以申请好人贷,0.9210422406043004
351,好人贷申请的渠道有哪些,0.9210414722035758
352,银联在线支付如何开通,0.9207377220605115
353,如何查询是否已申请好人贷,0.9206987436193355
354,好人贷可以重新申请吗,0.9205448436435141
355,申请好人贷有区域或者号段等限制吗,0.9203710930723249
356,为什么提示用户不存在,0.9201040847917317
357,客户表示还款成功,0.919914658365643
358,为何提示支付平台发卡行拒绝,0.9198956743563339
359,季得利的操作渠道有哪些,0.9195861452523205
360,什么是我的额度和可借额度,0.9194862344698742
361,车贷利息是多少,0.9194481686396551
362,车贷申请多久可以放款,0.9193327878893889
363,如何查看好人贷还款计划,0.9192977579709917
364,新网银行人工客服电话打不通,0.9192446190711003
365,扣款失败的原因,0.9192057060040125
366,客户表示没有问题了,0.919134912024293
367,提额会有通知吗,0.9186154377360107
368,新网银行有实体卡片吗,0.9185747733697284
369,征信上报周期及更新时间,0.9185536722639589
370,手机号无法使用为什么,0.9184873912624152
371,提前支取有限制吗,0.9184545218010811
372,合同为何无法打开,0.9184303170193976
373,转账到新网银行如何操作,0.9184277153517542
374,申请好人贷需要哪些资料,0.9183057752625183
375,手机号归属地与定位地不一致是否有影响,0.9181354113692953
376,申请创客贷需要什么条件,0.9178596716162644
377,58车金融客服电话是多少,0.9177959058223154
378,车贷能否绑定他人银行卡,0.9177701148363426
379,个人可以在新网开立几个账户,0.9176898811942289
380,获取额度后多久可发起借款,0.9175563958927898
381,申请好人贷使用的邮箱是公司邮箱还是个人邮箱,0.9174903901079682
382,如何查询还款日,0.9171198231128588
383,为何提示支付平台其他错误,0.916975839136224
384,好人贷收取哪些费用,0.9165659124659188
385,关于客户个人信息安全问题,0.916341134262368
386,逾期未还款如何处理,0.9159541653631371
387,好人贷利率为什么调高了,0.9158198111346435
388,好事贷收取哪些费用,0.9157537035856579
389,新网银行人工客服电话是多少,0.9157482937211938
390,新网银行以什么名义放款,0.9157415635000561
391,好人贷账户如何挂失,0.9156657709522303
392,随心存如何查看收益情况,0.9154950886754053
393,如何开立存管账户,0.9153943827431545
394,如何查询新网账户,0.9151340092804919
395,随心存支持提前支取吗,0.91511573691951
396,输入身份证号码时，为何无法输入字母,0.915096746316123
397,好人贷还款后额度何时恢复,0.9150789621328695
398,如何更改其他平台的注册手机号码,0.9149333308791451
399,银行渠道维护是指什么,0.9149146697853586
400,结清证明的印章是否可以用公章,0.9148919972773258
401,存管密码被锁定怎么办,0.9147821434088996
402,企业邮箱为何验证不了,0.9144144029822603
403,好人贷审核电话是多少,0.9143518197511671
404,存款产品如何修改手机号,0.9142871853152298
405,新网银行二类户如何转入/转出,0.9138859424413163
406,新网银行公众号如何取消关注,0.9138659620163708
407,好人贷申请是否支持人工受理,0.9137703665205522
408,绑定银行卡失败,0.9136996720657985
409,好人贷支持随借随还吗,0.9136832165845232
410,为何申请好人贷无结果,0.9136485876067725
411,居住信息如何填写,0.9133946375355044
412,如何注销新网注册用户,0.9133873452305591
413,企业邮箱填写错误怎么办,0.9130354349081033
414,开户失败原因,0.9125587217395291
415,申请好人贷没有公司邮箱怎么办,0.9119300666926128
