0,早上10点忘记存钱进去有影响吗,1.0
1,转账到新网银行如何操作,1.0
2,新网银行有哪些产品可以提额,0.9596154973914602
3,半年得利提前支取影响已发放利息吗,0.9557673066248354
4,更换银行卡会影响自动扣款吗,0.9556424473590251
5,银行卡挂失会影响自动扣款吗,0.9544471306023113
6,收款卡发卡行拒绝放款失败什么意思？,0.9542686381696709
7,提前结清贷款后还会扣款吗,0.954234730348714
8,哪些渠道可以购买京东存款产品？,0.9539603987031606
9,选择任何还款方式都可以提前还款吗,0.9537739542900159
10,为何之前绑定的银行卡不支持扣款了,0.9537559885278253
11,银行卡是二类户影响扣款吗,0.9534669520671673
12,无法提供消费凭证可以取消贷款吗,0.9533396521902263
13,京东存款是否支持提前支取/提前部分支取？,0.9531596127259871
14,系统升级会影响扣款吗,0.9529968368108812
15,为何存管查询提示没有密码,0.9524577035240336
16,提前还款会影响个人征信吗,0.9520846328905649
17,提前还款有次数限制吗,0.9518351667031832
18,季得利提前支取影响已发放利息吗,0.9512433609638858
19,借款合同是否有展示提前还款会收取违约金的情况,0.9510051499564689
20,存管查询为何提示用户不存在或者信息有误,0.9508139242128272
21,线上开据证明有次数限制吗,0.9504968517927082
22,存款需要先开立银行账户吗,0.9504875055204468
23,页面为何提示“开户失败”、“账户存在异常操作/账户异常”,0.9501503932905431
24,使用优惠券后提前还款利息如何计算,0.9501318507067511
25,借款时选错收款账户怎么办？,0.950037434220183
26,为何征信上有新网上报的贷款记录,0.949488545930548
27,节假日可以操作各类存款吗,0.9493293177977148
28,随心存停售后有影响吗,0.9491126059278793
29,好人贷不借款会产生利息或费用吗,0.949107696538637
30,为什么提前还款显示联合贷批次执行中？,0.9490652562971942
31,借款成功会有短信等提醒吗,0.9487998396219331
32,未正常还款我行会进行催收吗,0.9482781472385922
33,申请好人贷需要开个人账户吗？,0.9479849402974954
34,为何征信上有新网银行的贷款审批记录,0.9479326617441506
35,好人贷支持微信/支付宝扣款吗,0.9474722309319799
36,购买存款页面为何提示“额度不足，无法购买”,0.9468913995438272
37,为何提示支付平台该客户无默认扣款卡，交易没有发给统一支付,0.9468338812050542
38,五年定期存款支持提前支取吗,0.9466294500612764
39,提前还款手续费是多少,0.9466020510459352
40,线下转账如何填写新网银行开户信息,0.94622792536221
41,好人贷借款时还会审核吗,0.9461335761546239
42,为何无法登录存管查询,0.9461259533784209
43,为何提示还款卡不存在,0.9457900898999451
44,新网银行账户的交易记录如何查看,0.9457761986262417
45,新网银行存款是否受保障,0.9454179697340758
46,实际申请金额与放款金额不一致可否取消车贷,0.9450103628380434
47,为何提示支付平台签约关系不存在,0.9448946810227032
48,为什么银行还款存在限额？,0.944880694744515
49,如何查询存管账户流水,0.9448550504005189
50,好人贷支持在国外发起借款吗,0.9448166883819907
51,新网账户绑定微信/支付宝后支持提现或充值吗,0.9448007477074717
52,线上开据证明为何和征信金额不符,0.9446658522293999
53,是否可以取消自动扣款,0.9446529972410098
54,为何提示交易密码验证失败,0.9445662846742723
55,新网银行发送的短信验证码的有效时长？,0.9444920857054785
56,如何确保还款日当天会扣款成功,0.9444602584812214
57,补扣会影响信用吗,0.9443288833086717
58,新网银行存款产品为何暂停交易,0.9442165081574673
59,开据证明时为何提示账户存在异常,0.9441040390449904
60,销户后可以再开户吗,0.943676344118357
61,白骑士认证失败是什么意思,0.9435566644476234
62,新网银行存款属于理财产品吗,0.9434172894966382
63,转入新网银行使用的密码是交易密码还是银行卡密码,0.9434125604133591
64,可以让别人代还款吗？,0.9433002055673885
65,好人贷只能通过绑定的银行卡还款吗,0.9432789782943187
66,新网银行开户支持的证件有哪些,0.9432647517125305
67,好人贷支持周末借款吗？,0.9432532633442128
68,好人贷必须绑定银行卡使用吗,0.9430976142552299
69,银行卡开通银联在线支付后是否可正常还款,0.9430738790893102
70,能否开具非恶意逾期证明,0.942722432664245
71,节假日可以借/还款吗,0.9424759489249156
72,扣款结果会有短信提示吗,0.9424273626286955
73,为何征信上有新网银行上报的逾期,0.942377648555015
74,新网银行有企业贷款吗？,0.9422470350517335
75,新网银行扣款通道是什么,0.9420108669095764
76,如何查询转账到新网银行的记录,0.9419852393630831
77,新网银行账户可以在哪些地方使用,0.9413145767495619
78,新网银行有信用卡吗,0.9412820250742664
79,五年定期存款的利率是多少,0.941232118993047
80,为什么拍照认证时总是不成功或显示系统崩溃,0.9411967550816596
81,转账时为何提示未面核,0.941152738663166
82,存款产品的资金可以用于好人贷还款吗,0.9410121622970861
83,我行放款的其他平台借款会上报征信吗,0.9408293194956657
84,存款产品如何重置交易密码,0.9407947753042973
85,是否会发生重复扣款情况,0.9407469385785084
86,好人卡绑定云闪付/微信等失败怎么办,0.9406797305359208
87,为何提示支付平台不允许持卡人进行的交易,0.9398193330440971
88,再次申请好人贷会查询征信吗,0.9396461899710631
89,新网银行的活期利率是多少,0.9396152689319183
90,为何提示支付平台受发卡行资金用途限制拒绝交易,0.9395384467610028
91,好人贷申请成功会有短信通知吗,0.9394787404309117
92,注销注册用户后是否可恢复？,0.939186627012232
93,什么是单笔借据和多笔借据,0.9391408472221875
94,新网银行合作的存管平台有哪些,0.9391303775741591
95,好人贷支持随时借款吗,0.9390054123788325
96,转账到新网银行账户是否还款成功,0.9389575263264185
97,好人贷借款超时未到账如何处理,0.9388960013177233
98,销户后为何还能解绑银行卡,0.9388063699625749
99,逾期后还款金额是否会增加,0.9384322481088239
100,定期存款操作的渠道有哪些,0.9382414886517243
101,为什么取消了提前部分还款,0.9381201394397276
102,车贷可以修改还款日吗,0.9380678567477201
103,借款到账后页面未更新借款状态,0.937987227532407
104,绑卡时页面上的银行卡预留手机号码可以修改吗,0.9379121438884536
105,优信扣款成功后为何显示待还款,0.9378149148215901
106,好人贷支持扣款的银行有哪些,0.9377154672489819
107,贷款结清之后能否删除贷款记录,0.9377032961285139
108,好人贷以什么贷款类型上报人行征信？,0.9376345135084317
109,征信上显示的贷款金额是否包含利息,0.9374813450612778
110,结清贷款后什么时候可以开据结清证明,0.9374641169024204
111,银行转账未到账怎么办,0.9374299488994609
112,新网二类户上的资金是否计息,0.937203813204883
113,月得利提前支取如何计息,0.937193399802268
114,如何购买新网银行存款产品,0.9371802269909791
115,新网银行账户可以设置为好人贷借/还款账户吗,0.9371694448235214
116,为何征信上的放款日期与实际借款日期不一致,0.9371318787270442
117,如何设置存管支付密码,0.9370506141770797
118,注册手机号及微信号需要实名制吗,0.9370213694984869
119,随心存可以在我行公众号查询/操作吗,0.9369470547987052
120,好人贷是否支持提前还当期账单,0.9368793735264841
121,存管提现到账时间是多久,0.936834576701726
122,车贷合同里的金额是否包含利息,0.9366202570484533
123,平台方提供的客户审批资料能否提供给客户,0.9365108436701036
124,申请诺诺发票贷需要什么条件,0.9363278839831544
125,绑定银行卡产生费用吗,0.9362783083448737
126,提前支取时为何显示存入,0.9362145001376757
127,非绑定银行卡可否与新网二类户转账,0.9361172205312178
128,京东存款为什么显示当日额度为什么已售罄？,0.9360576817600748
129,随心存存款期限有哪些,0.9359843234890974
130,好人贷交易密码如何设置,0.9358160187520757
131,随心存利率为何会发生变化,0.9358114281921946
132,如何取消征信查询及使用授权书,0.9357730551683059
133,自动扣款失败怎么办,0.9357392426735329
134,存管查询的余额如何提现,0.9357188013796824
135,线上是否可开据征信版结清证明,0.9356727956779101
136,银行渠道维护无法操作怎么办,0.935622130211067
137,贷款证明开据失败怎么办,0.9353798213304431
138,开据证明为何显示没有符合要求的订单,0.9353719043198341
139,通过本人微信找回密码是指什么,0.9352277791169349
140,存管账户如何查询,0.9350275669149847
141,新网银行存款类产品有哪些,0.9350238317415214
142,可否取消银行卡限额,0.9348922161771424
143,为何无法提交好人贷申请资料,0.9348717897840539
144,交易密码无法设置,0.9348419562542355
145,好人贷提额会查询征信吗,0.9348265128225615
146,为何重置密码后仍提示密码错误,0.9347994356631366
147,申请好人贷后，可否更改授信结果,0.9347640997061586
148,开据证明时为何需要实名认证,0.9346351816598082
149,如何查询是否开通银联在线支付,0.9345327898685797
150,如何操作随心存大额存款,0.9344055843236474
151,可否按照征信订单号开据证明,0.9343366705493684
152,开具结清证明时为何无法登录,0.9341847390890509
153,如何查询好人贷申请的授信结果,0.9341762732077604
154,可以查询个人信息资料吗？,0.9341598440436991
155,当期账单支持再分期吗,0.9341492134123281
156,存款页面是否会显示每日收益,0.9341103747092876
157,为何提示支付平台持卡人信息有误,0.9339457154017535
158,修改手机号后是否需要重置登录密码,0.9337069020529153
159,周得利提前支取如何计息,0.9336647064458734
160,随心存利率是多少,0.9336324748088812
161,新网银行以何名义查询征信,0.9335508810024126
162,进入随心存为何提示手机号码不一致,0.9334849648824544
163,什么是银行卡预留手机号？,0.9334224059475787
164,结清贷款后征信上是否会显示结清,0.9333359360593227
165,结清证明的发送方式有哪些,0.9333133039731205
166,好人贷注册手机号与银行卡预留手机号是否需要一致？,0.9330962480665683
167,好人贷是否支持提前还款,0.9330292676346852
168,如何修改存管账户预留手机号码,0.9329389853624899
169,新网银行视频认证的QQ号码是多少,0.9328550974319638
170,为何图文验证码输入正确却提示错误,0.9328430252091787
171,为何收到新网银行逾期提醒短信,0.9327387894571766
172,什么是无卡支付及免密支付,0.9327183306010115
173,存款产品是否存满五年才能支取,0.9326742746898385
174,好人贷只能使用微信登录吗？,0.9325844421674016
175,为何销户后还能看到好人贷信息,0.9325570757434725
176,为什么收到提额短信但额度未提升,0.9325511494368464
177,为何提示还款存在差错,0.9324462773143561
178,为何提示支付平台当日交易次数超限,0.9324265827143002
179,为何提示支付平台支取金额超过可用余额,0.93235053222562
180,修改手机号码/微信号是否会影响自动扣款,0.9323486907301743
181,随心存提前支取到账时间,0.9322850150775426
182,为何存管信息与平台显示不一致,0.9322291295078731
183,新网银行自动扣款时间,0.9321496361552735
184,为何提示用户未实名认证,0.932052354293758
185,如何把注册用户与结算用户都注销,0.9320012604250028
186,身份证更换期间会影响好人贷贷款吗,0.9319430193707193
187,好人贷申请需要填写哪些个人信息,0.9319428571909968
188,申请好人贷需要下载APP吗？,0.9319276684522924
189,销户后是否上征信,0.9318647896482737
190,京东存款的计息规则及计息公式,0.9317996826671721
191,为何提示支付平台暂不支持的银行或限额,0.9317866002666514
192,新网银行有实体卡片吗,0.9315783946663548
193,申请好人贷后为何页面显示仍可提交申请,0.9313741704896502
194,好人贷借款记录如何查询,0.9312794425950486
195,可以通过他人银行卡转入到新网银行账户吗,0.9311478163616703
196,存管账户如何注销,0.9310872922966701
197,为何页面出现多个新网银行账户,0.9310388579910661
198,为何提示支付平台交易金额超限,0.930989721145983
199,提前支取有限制吗,0.9309241855224869
200,定期存款的利率是多少,0.9305855672478673
201,随心存如何修改交易密码,0.9305391153112035
202,支持绑定的银行卡类型有哪些,0.9304262297388334
203,好人贷可以重新申请吗,0.9303160763391668
204,结清证明会展示哪些信息,0.9302010850265673
205,车贷合同为何无法查看,0.9301697714273209
206,好人贷为什么提示“账户存在异常操作”,0.9301533023471653
207,新办的手机号可以申请好人贷吗,0.9300371911415175
208,好人贷被拒后为何没有下次开放时间,0.9300204240995978
209,选择任性还款/按期还款利息如何计算,0.9299707296133358
210,如何查看银行卡管理列表,0.9297726474174624
211,为何按期还款只能选择部分贷款期限,0.9296462623522788
212,好人贷授信首页显示利率是否为固定利率,0.9296360834924147
213,新网二类户转入/转出有时间限制吗,0.9295711809987988
214,好人贷为什么无法借款,0.9294321542630591
215,如何查询申请相关的协议书,0.9292347464051455
216,好人贷账户是否为新网银行二类户？,0.9288825029154606
217,能否人工开据贷款证明,0.928871415045794
218,为何好人贷还款时提示“交易处理中”,0.9287075587348896
219,注册手机号更换成功后何时可以正常使用,0.9286169460108356
220,为何申请好人贷后显示未获取额度,0.9285781357809708
221,新网账户之间能否互相转账,0.9285660427785359
222,平台方手机号变更导致我行无法直接开据结清证明问题,0.9284372981964578
223,好人贷借款金额与到账金额是否一致,0.9283911018055637
224,为何提示支付平台账户余额不足,0.928290591292859
225,为何提示支付平台渠道不支持的银行,0.9280961868771126
226,新网银行有招聘吗,0.9280822281314098
227,为何提示不具备开具资格,0.9279879179192785
228,为什么提示用户不存在,0.9278163171953852
229,注销账户的处理时间,0.927737797739542
230,存管密码被锁定怎么办,0.9275664784159736
231,如何修改新网随心存注册号码,0.9275314065787047
232,如何开立存管账户,0.9275288174099023
233,好人贷部分提前还款规则,0.9274333531559438
234,定期存款是否有存单,0.9274236518338311
235,如何查看委托支付协议,0.9273450199957973
236,为什么点击拍照没有反应,0.9273218341638696
237,如何查询合作平台贷款是否结清,0.927255287387536
238,好人贷是否支持归还逾期部分账单,0.9272303145176904
239,为何提示支付平台银行卡未开通银联无卡认证支付,0.9271944419363719
240,新网二类户转入/转出收取手续费吗,0.9269502450902387
241,好人贷申请是否查询芝麻信用,0.9268859481556598
242,如何查询当期车贷还款金额,0.9268610331972541
243,还款银行卡是否需要开通银联在线支付业务,0.9267845750102811
244,好人贷借款后能否修改贷款信息,0.9265454119191318
245,查询车贷的注册手机号码是什么,0.9264476886340038
246,为什么好人贷第一期还款金额与之后不一致,0.9262710296343676
247,新网银行二类户限额是多少,0.9262032794825519
248,为何同时收到了还款成功和失败的短信,0.926150704412445
249,有额度不使用有什么影响吗,0.9261102722217206
250,线上转入新网银行账户到账时间是多久,0.9260695463951343
251,新网银行以什么名义放款,0.9259171886187281
252,名下所有卡被冻结后如何还款,0.9258942498562084
253,查询结清证明申请是否已提交,0.9257929339364995
254,新网银行能否绑定云闪付,0.9257882713409357
255,好人贷贷款利息如何计算,0.9257094197495036
256,微信/支付宝等可否与新网银行账户互相绑定,0.9257065236043561
257,登录时的图文验证码是否区分大小写,0.925658453076188
258,还款金额超银行卡限额怎么办,0.9256277821028609
259,获取验证码次数超限怎么办,0.9253548943800302
260,申请好人贷必须填写联系人信息吗,0.9252728072169448
261,好人贷审核不通过对个人有什么影响,0.9251911830744061
262,申请好人贷需要哪些资料,0.9251801362465581
263,新网诺诺发票贷如何申请,0.92508802558564
264,微信号更换成功后何时可以正常使用,0.925000447085213
265,新网银行有哪些活动,0.9248168427717653
266,实名认证失败的原因是什么,0.9248128698975417
267,结清证明是否是还款记录证明,0.924727259408808
268,联系新网银行客服有哪几种方式,0.9244171786258727
269,可以查询注册手机号码吗,0.9242801466495784
270,还款日当天支持手动还款吗,0.9242563971902765
271,好人贷如何查看所支持的还款方式,0.9240919501142757
272,申请创客贷需要什么条件,0.9239432043049932
273,京东存款如何修改注册手机号码,0.9239392654821978
274,客服能否看到客户申请好人贷的信息,0.9239065510442959
275,车贷扣款支持的银行卡有哪些,0.923863768094799
276,他行渠道汇入新网账户的到账时间是多久,0.9238343901376052
277,为什么收到美利车金融的短信,0.9238175984388827
278,申请好人贷需要公积金、社保吗？,0.9237551665146263
279,平台还款信息为何与新网银行不一致,0.923610556534519
280,季得利的操作渠道有哪些,0.9235018305570715
281,客户催促需要加急办理,0.9234290928417694
282,企业邮箱验证码可否重新获取,0.9234213528610496
283,如何查看优惠券的使用情况,0.9234197091135484
284,车贷收取哪些费用,0.9234060892360094
285,抵押类贷款如何办理,0.9232613300888606
286,如何查看随心存购买情况,0.9232482017329109
287,好人贷申请的渠道有哪些,0.9231281284644955
288,新网银行二类户如何转入/转出,0.9230367874867388
289,视频认证录制失败的原因是什么,0.9229919761488135
290,贷款证明的电子章是否具有法律效应,0.9229708996838759
291,咨询可以发送图片吗？,0.922885700267847
292,可以重新注册吗,0.9228600847946747
293,新网二类户为何无法转入/转出,0.9225539400740488
294,好人贷上征信吗,0.9225249222347047
295,挖财还款是否为新网银行代扣,0.9224881175945059
296,如何查看开户结果,0.9223996789711751
297,好人贷扣款账户如何查看,0.9223685956681013
298,如何查询其他平台扣款银行卡,0.9222229244664917
299,新网银行自动扣款次数,0.9222136818518551
300,还款日可以修改吗,0.922146092174663
301,为何收到新网银行还款短信,0.9219744952995337
302,公众号是否有还款提示,0.9217467257519374
303,存款产品是否保本保息,0.92163590338392
304,提额会有通知吗,0.9216240132624286
305,银行卡还款限额是多少,0.9215417189047741
306,电话客服是否可以受理结清证明,0.9213633720542986
307,如何查询好人贷借据收款银行卡,0.921329274813289
308,好人贷-云闪付如何提前还款,0.9213029958140059
309,新网二类户可以升级为一类户吗？,0.9208758705729414
310,审核电话可更改接听电话吗,0.9205229867887561
311,随心存产品停售原因,0.9204369490370516
312,为何提示支付平台账户状态异常,0.9203718894360483
313,客服能否查看聊天记录,0.9203354069686329
314,在线咨询是否支持客户发送语音,0.9203001778254671
315,自动扣款如何操作,0.9202155009545698
316,借款后如何判定下次还款日期,0.920114271422827
317,银行渠道维护是指什么,0.9199877107588614
318,随心存支持提前支取吗,0.9195046251465195
319,存管账户充值限额,0.9194999501326144
320,企业邮箱为何验证不了,0.91940407816533
321,诺诺发票贷的利率是多少,0.9193432927089331
322,好人贷额度必须一次性借完吗,0.9191458583742689
323,企业邮箱填写错误怎么办,0.9191096345529102
324,如何查看手机号是否实名制,0.9188999248884364
325,如何查看好人贷相关协议/合同？,0.9185794719643328
326,新网银行人工客服电话是多少,0.9183801651714375
327,为何提示支付平台其他错误,0.917972073805193
328,新网银行公众号如何取消关注,0.9179698850423953
329,更改银行卡预留手机号的方法,0.917945606119843
330,拨打我行人工客服电话是否收费,0.9178549255428348
331,电脑端可以登录好人贷吗,0.9178368076177853
332,银联在线支付如何开通,0.9176573183057612
333,个人可以在新网开立几个账户,0.9175041619844334
334,好人贷支持随借随还吗,0.917462900490297
335,如何修改征信上的个人信息,0.9173774227439968
336,随心存操作渠道有哪些,0.9171677118026464
337,合同为何无法打开,0.9169767137799701
338,车贷还款只扣除部分是什么原因,0.9166046112868385
339,如何查询是否已申请好人贷,0.9164461746288596
340,存款利率是多少,0.9163926904885218
341,如何注销新网注册用户,0.9163786967390501
342,新网银行有几个网点,0.9159836040133732
343,公众号页面的“我的排号”是什么意思,0.9159688424418992
344,车贷支持手动还款吗,0.9159446500657278
345,58车金融客服电话是多少,0.9158797945907382
346,人工是否可操作扣款,0.9157434700275373
347,上传身份证时需填写的内容是什么,0.9155421892004713
348,申请好人贷没有公司邮箱怎么办,0.9155040595922788
349,好人贷提前还款最低还多少,0.9154383086523271
350,输入身份证号码时，为何无法输入字母,0.9154189413294072
351,逾期未还款如何处理,0.9152570224724227
352,身份证过期可以申请好人贷吗,0.9151677155296897
353,未接到好人贷回访电话会被拒吗,0.915079011101373
354,为何申请好人贷页面显示暂无资格,0.915065634256225
355,可绑定银行卡数量上限,0.9150185042720902
356,车贷还款记录如何查询,0.9150082524299157
357,如何查询征信报告,0.9148981362819703
358,目前支持的银行有哪些,0.914799209589908
359,好人贷还款记录如何查询,0.9147237153785335
360,如何查询账户是否冻结,0.9145566889152994
361,好人贷利率为什么调高了,0.9143165169456892
362,好人贷手动还款时为何提示批次执行中,0.9141125856941591
363,身份证信息变更后如何更新,0.9140811362045401
364,随心存到期后何时到账,0.9140382220430245
365,好人贷-云闪付如何更换收/还款银行卡,0.9138149091062912
366,黑户/白户是否可以申请好人贷,0.9138017277206916
367,为何提示支付平台发卡行拒绝,0.9137899859307446
368,新网银行地址在哪里,0.9136611097839212
369,申请好人贷需要什么条件,0.9135337766961195
370,查询各类工单办理进度,0.9134636897484142
371,什么是注册号码？,0.9133288102972321
372,新网银行是否上市,0.913286922181511
373,接收短信的手机号是否为注册手机号,0.9132781764377881
374,还款后为何未更新还款状态,0.9132600435729611
375,车贷利息是多少,0.9129357689524176
376,逾期造成的影响是什么,0.9129111285839103
377,好人贷注册手机号无法使用,0.9126678100477328
378,如何更换借款收款银行卡,0.9126418701380485
379,一个身份证可以申请好人贷两次吗？,0.9126356012872281
380,客户咨询其他平台催收问题,0.9126335536345385
381,实名认证是否查询征信,0.9125738926233308
382,居住信息如何填写,0.9122844781462741
383,新网银行的官网地址是什么,0.9121389664047309
384,借款失败怎么办,0.9121271315942382
385,随心存如何查看收益情况,0.9120299703676066
386,如何更换好人贷默认还款账户,0.9117743705182891
387,好人贷自动扣款规则,0.9114474153340486
388,核身链接失效的原因,0.9113647377673486
389,如何查询车贷还款日,0.9110886998279089
390,实名认证为什么不符,0.9110219984178989
391,好人贷借款如何上报征信,0.910884528513363
392,好人贷审核时是否给填写的联系人去电,0.9108659677409495
393,按期还款和任性还款的区别是什么,0.9108566643007443
394,好人贷收取哪些费用,0.9108563418907237
395,身份证上传失败怎么办,0.91083686786166
396,关于客户个人信息安全问题,0.9107358424839312
397,如何修改实名认证手机号码,0.9106865643820549
398,结清证明的印章是否可以用公章,0.9104546258930052
399,存在迁户问题怎么处理,0.9104285949671204
400,可以咨询吗,0.9104213748544954
401,新网银行人工客服电话打不通,0.9103686442710275
402,好事贷收取哪些费用,0.9103368707576281
403,周得利计息规则,0.9102888672789354
404,新网银行合作平台有哪些,0.9102131314411317
405,结清证明印章无法查看,0.9102125334670262
406,如何开据存款证明,0.9101324094642498
407,下一次开放时间是什么意思,0.9101305480755445
408,客户表示没有问题了,0.9099475969893648
409,新网银行账户是什么,0.9098508547636867
410,如何查看贷款合同,0.9097335925703972
411,申请好人贷使用的邮箱是公司邮箱还是个人邮箱,0.9094210125109996
412,为何还款后额度恢复减少了,0.9093106320041079
413,新网银行行号是多少,0.909310143849302
414,好人贷账户如何查询,0.909273416816507
415,银联在线支付是什么,0.9085387116504259
416,如何查询还款日,0.9081291502665086
417,如何查询新网账户,0.9080814458603566
418,车贷如何办理解押手续,0.9079971693004745
