419,存款产品如何修改手机号,0.9079797551489478
420,什么是我的额度和可借额度,0.9077404414815927
421,还款日当天是否自动扣款,0.9077140647006692
422,好人贷申请能否撤销,0.9075844092922296
423,车贷申请多久可以放款,0.9073210660218523
424,好人贷账户如何挂失,0.9072624969898416
425,其他贷款怎么办理,0.9070440370520398
426,"好人贷有回访电话吗""",0.9067057777282594
427,手机号无法使用为什么,0.9066110879283
428,为何提示该证件已被使用,0.9065545715158912
429,什么是风控审核中,0.906408085326898
430,为何申请好人贷无结果,0.9063374470174117
431,新网银行业务办理时间,0.9062446847034924
432,能否删除个人信息,0.9062417040152517
433,如何查看好人贷还款计划,0.9061213783825905
434,在线客服是否是人工客服,0.9057211304479529
435,我行对客邮箱是多少,0.9057083133139671
436,申请好人贷有区域或者号段等限制吗,0.9051755475996985
437,他人可以使用本人信息申请好人贷吗,0.9048930542586928
438,车贷能否绑定他人银行卡,0.9048795482265991
439,好人贷需要面签吗,0.9048199442392353
440,新网银行好事贷如何申请,0.9048092109054792
441,好人贷月利率是多少,0.9047908059651258
442,好人贷申请是否支持人工受理,0.9047446450764554
443,申请好人贷工作信息如何填写,0.9046796259980139
444,如何获取线上核身链接,0.9043645198943594
445,好人贷如何试算利息,0.9041530509184752
446,车贷如何修改注册手机号码,0.9041509074806662
447,好人贷有回访电话吗,0.9040847658749759
448,可否补充企业邮箱,0.9040694132528845
449,征信上报周期及更新时间,0.9039377103310862
450,在哪个平台操作提现,0.9038237790100739
451,好人贷账户如何更换手机号码,0.9035606376795959
452,自动扣款时间段是多久,0.9035041287262797
453,自助提额什么时候上线,0.9031806320029316
454,手机获取验证码失败,0.9027456634792602
455,页面为什么异常跳转,0.902611442582937
456,罚息能否减免,0.902459465509431
457,好人贷申请必须使用身份证原件吗,0.902344149054444
458,视频认证的步骤是什么,0.9021743314674832
459,好人贷审核电话是多少,0.9020926590662736
460,车贷合同如何查看,0.9018900295221975
461,验证码发送至什么手机号,0.901592570100413
462,新网银行如何联系客户,0.9014791608681446
463,我们是四川新网银行吗,0.9013748770467664
464,优信客服电话是多少,0.9011375816405686
465,开户是什么意思,0.9009810541618977
466,消费凭证有效期是多久,0.900904018661629
467,获取额度后多久可发起借款,0.9008998150318643
468,新网银行三类户是什么,0.9008947349569065
469,忘记密码怎么办,0.9007653657539952
470,怎样才能成功申请到额度,0.9005188722667374
471,如何办理对公业务,0.8998944545922979
472,如何解约快捷支付？,0.8998049300714753
473,如何签署借款合同,0.8994296224658953
474,申请好人贷后有没有回复,0.8994162811302697
475,好人贷账户如何注销,0.8992529073765689
476,为什么无法注册,0.8989901379169005
477,如何在新网银行开户,0.8988345961500082
478,为何无法销户,0.898810531199862
479,好人贷还款后额度何时恢复,0.8986637251796569
480,如何更改其他平台的注册手机号码,0.8982679417701963
481,实名认证审核时间,0.8980735822943868
482,客户发送截图以及个人信息等,0.8980150548154496
483,好人贷年化利率是多少,0.8979813764090124
484,能否让客服回电,0.8978742748439622
485,为何无法申请好人贷,0.8974696102539005
486,销户与否会产生什么影响,0.8974211058186705
487,好人贷借款合同有效期是多久,0.897371360286943
488,活体检测失败怎么办,0.8965219329879393
489,审核电话内容是什么,0.8963963547149655
490,好人贷通过率多少,0.8963355964662341
491,如何通过线下方式转入新网二类户,0.8962391729983483
492,房产保证金是什么,0.8961725592963651
493,退汇是什么意思,0.8959430886536841
494,修改手机号码的处理时间是多久,0.8957423493386457
495,为何提示缺少必要参数,0.8955336863259191
496,好人贷当期能否最低还款,0.8946498901982434
497,定期存款到期如何支取,0.8945292927236441
498,好人贷-云闪付是什么,0.8942629212381168
499,页面为何无法打开,0.8942272115733638
500,新网银行二类户与好人贷是否为同一个手机号码,0.8939404283334604
501,客户要求发送相关模板,0.8938310320834032
502,如何知晓已注销成功,0.8934544939361219
503,手机号归属地与定位地不一致是否有影响,0.8932797177359816
504,好人贷还款方式有哪些,0.8932649678444324
505,五年定期存款是什么,0.8931392381615193
506,好人贷额度是否循环使用,0.8930138476451068
507,车贷如何提前还款,0.8929383928523129
508,开户失败原因,0.8924359623161378
509,登录密码为何无法重置,0.8919158878722954
510,如何选择按期还款/任性还款,0.8918714651880015
511,关于消费凭证,0.8918421000183365
512,车贷如何更换还款银行卡,0.8915665570469329
513,人脸识别失败怎么办,0.8907259001904784
514,如何关注新网银行公众号,0.8906718731544284
515,好人贷放款至什么账户,0.8906262576979839
516,操作好人贷是否需要开启定位,0.8904194388585478
517,密码被锁定怎么办,0.8903690672259649
518,开通什么业务,0.8900905451251875
519,申请被拒怎么办,0.8898655972894769
520,工新借如何申请,0.8896699798734828
521,好人贷申请身份证可否添加水印,0.8895470927111746
522,好人贷申请是否可以使用临时身份证,0.8894582282788585
523,为何人脸识别提示光线太足,0.8890498835968059
524,如何冻结新网银行账户,0.8889429138225448
525,新网有哪些产品,0.8888504712260995
526,客户表示需要考虑,0.8883962333721289
527,扣款失败的原因,0.8883852448892331
528,绑定银行卡失败,0.8883034290248414
529,好人贷如何提前还款,0.8882193411122167
530,好人贷利率为什么高,0.8881300987517898
531,为什么没有扣款,0.887960632377017
532,银行渠道维护时间一般是多久,0.8879576602119058
533,美团客服热线是多少,0.8879457369208809
534,好人贷能否绑定他人银行卡,0.8879337292894571
535,关闭其他平台额度后，能否恢复好人贷额度,0.8873036838875095
536,客户表示还款成功,0.8872044137303526
537,如何删除身份证信息,0.8869010483874159
538,好人贷利率是多少,0.8867103442366102
539,为何结清证明显示日期与平台不符,0.8864264851158999
540,好人贷能否人工操作提额,0.8863785796295991
541,新网银行人工客服服务时间,0.8862761554451681
542,随心存存入限额,0.8862755600560533
543,滴水贷客服电话是多少,0.8862263661066861
544,还款记录如何查看,0.8857877967660605
545,手持身份证拍照的注意事项,0.8852812840861893
546,车辆信息如何查询,0.8852304451925094
547,结清证明开据时间是多久,0.8849146566039432
548,客户提到投诉,0.8846921836321231
549,是否需要使用本人手机操作好人贷,0.8829723218179717
550,车贷逾期如何还款,0.8816361508099485
551,还款后页面显示等待中,0.88135684229468
552,征信报告是什么样的,0.8809190018602574
553,好人贷额度是否会发生变化,0.8808985868261818
554,好人贷个人资料如何修改,0.8806198642230721
555,怎样用其他手机登录好人贷,0.8804211186556723
556,客户表示有合作意向,0.8795666013263639
557,人脸识别使用的是照片还是视频,0.8795427999626906
558,注册规则是什么,0.8792481659767165
559,好人贷如何降低利率,0.8791707369252133
560,好人贷额度为什么变低了,0.8790399474417412
561,令牌无效是什么,0.8781393298650307
562,好人贷有额度后如何进行贷款,0.8776566712659684
563,什么是分批次扣款,0.8775748582477185
564,系统繁忙是什么原因,0.8773164324588738
565,如何更换微信号,0.8769456037973902
566,按期还款是什么,0.8769135035309535
567,客服是否是随机分配,0.8767291082027341
568,新网银行APP下载,0.8763000889113031
569,各还款方式如何进行还款,0.8761683094711091
570,什么是登录密码,0.8758859155431105
571,企业邮箱格式是什么,0.8757690870691562
572,如何激活新网二类户,0.8742386457719353
573,如何换绑银行卡,0.8735605030497198
574,什么情况算逾期,0.8733961934872363
575,车贷如何申请,0.873098629528613
576,车贷如何解绑银行卡,0.8728487172948184
577,车贷平台如何查询,0.8724119653332899
578,如何注销新网二类户,0.8715824180831404
579,如何绑定银行卡,0.8702633510178424
580,存款产品支取通用路径,0.8690135379938495
581,好人贷为何无法还款,0.868536384831979
582,迁户是什么意思,0.8682496343012448
583,好人贷的办理时间,0.8679108427241051
584,好人贷与其他平台类似产品的区别是什么,0.8677907584248429
585,车贷如何还款？,0.8673244525224403
586,客户表示知道了,0.8668792659437647
587,好人贷审核时间是多久,0.8668104167331672
588,好人贷是邀请制吗,0.8653448103510026
589,为何提示系统异常,0.8650543264775519
590,随心存T+1是什么,0.8649806708229256
591,如何降低/关闭额度,0.8649168841164513
592,贷款证明如何开据,0.8633692532341343
593,什么情况算违约,0.8632519933749173
594,如何办理好人卡？,0.8627028023196431
595,好人贷定位如何开启,0.8626003202971303
596,好人贷电话回访时间,0.8601338734592479
597,好人贷提额周期是多久,0.8598817682898692
598,额度冻结是什么意思？,0.8591132216823941
599,经侦是指什么,0.8588634297625893
600,好人贷贷款期限是多久,0.8588197497380552
601,申请好人贷是否都有额度,0.8579645616090817
602,好人贷如何审核,0.857108123963305
603,如何注销公众号,0.8566282615984445
604,新网银行简介,0.85658826628278
605,好人贷额度他人能否使用,0.8565578012717389
606,好人贷如何主动还款,0.8558656856944323
607,优惠券如何使用,0.8558219946890394
608,如何录制活体检测,0.8556086842993685
609,好人贷为什么无法登录,0.8551357092219393
610,合作平台如何取消贷款,0.8539206192101005
611,好人贷如何实名认证,0.8530031226952061
612,好人贷还款后多久到账,0.8521022705011836
613,创客贷额度是多少,0.8515739033080164
614,什么是综合评估,0.8489925972970214
615,好人贷如何申请,0.848683654547837
616,如何退出微信公众号,0.8486716704893895
617,好人贷借款规则,0.8483692641365166
618,什么是当期账单,0.8469755058383965
619,好人贷借款多久到账,0.8463008549733848
620,好人贷消费用途,0.8459274019500281
621,如何增加银行卡,0.8444880506794912
622,美利车联系电话,0.8441318122199503
623,季得利是什么,0.8407284532628962
624,工新借是什么,0.8406495794542082
625,批扣时间段是多久,0.8397546832472292
626,存管是什么,0.8393748285770952
627,好人贷如何自助提额,0.8392028789051077
628,好人贷是否有临时额度,0.8391978307685003
629,如何解绑银行卡,0.8382112017270648
630,客户表示不满,0.8373053183870972
631,什么是活体检测,0.8368586899101178
632,可否对公还款,0.8367583574845328
633,季得利如何计息,0.83668452846177
634,好人贷额度有效期是多久,0.8362664466845051
635,公众号如何注册,0.8361032953614189
636,罚息介绍,0.8358547901187953
637,如何邀请好友申请好人贷,0.8354714709630565
638,什么是还款日,0.8341974738740259
639,征信是什么,0.8323690558068519
640,客户表示稍等,0.8319843386736394
641,客户提出建议,0.8316085751494902
642,密码如何修改,0.830928398250981
643,好人贷额度是多少,0.8305184154126682
644,客户称赞服务好,0.8239530802385339
645,可否延期还款,0.8211559474292041
646,有多少人获得好人贷额度,0.8209896652175059
647,好人贷如何提高额度,0.8196515037988004
648,额度占用问题,0.8194839644727685
649,如何登录微信公众号,0.8119786579264617
650,随心存是什么,0.8099062417847117
651,什么是一、二、三类户,0.8081867093846532
652,如何进入好人贷页面,0.8055664899538121
653,好事贷如何还款,0.8046299793035073
654,好人贷为什么额度低,0.8022893107379735
655,人脸拍摄规范,0.8012549068364295
656,任性还款是什么,0.798306551653243
657,如何进入个人中心,0.7917363343185797
658,好人贷如何还款,0.7910305305026869
659,合作平台如何还款,0.7907976609228453
660,随心存如何计息,0.7890137055279456
661,额度冻结怎么办,0.780505119643528
662,如何获得优惠券,0.7612148349187521
663,随心存如何登录,0.7557450332771644
664,什么平台的贷款,0.7505980109255783
665,好人贷是什么,0.7313195732497462
666,季得利如何支取,0.692655473837557
