416,申请创客贷需要什么条件,0.9185714098779316
417,关闭其他平台额度后，能否恢复好人贷额度,0.9185262283077754
418,一个身份证可以申请好人贷两次吗？,0.9184721965155415
419,销户后可以再开户吗,0.9184694503941603
420,随心存操作渠道有哪些,0.9184026513751886
421,好人贷审核电话是多少,0.9182877728542767
422,为何提示该证件已被使用,0.9180459756488956
423,人脸识别使用的是照片还是视频,0.9179430595115936
424,定期存款的利率是多少,0.9179139898728697
425,美团客服热线是多少,0.9178549621513965
426,好人贷申请必须使用身份证原件吗,0.9178320799132621
427,存款产品支取通用路径,0.917634846458066
428,为什么点击拍照没有反应,0.9175022857718579
429,身份证上传失败怎么办,0.9174359448835582
430,好人贷支持随时借款吗,0.9173321566377063
431,定期存款操作的渠道有哪些,0.9172670374429951
432,逾期未还款如何处理,0.9171797443682199
433,好人贷还款后额度何时恢复,0.9171788739200456
434,如何通过线下方式转入新网二类户,0.9168551272147902
435,如何更换微信号,0.9168308166075927
436,有额度不使用有什么影响吗,0.9164955723149221
437,新网银行如何联系客户,0.9163951558615326
438,好事贷收取哪些费用,0.9163872100717961
439,如何选择按期还款/任性还款,0.9163782423340958
440,随心存到期后何时到账,0.9162640517344017
441,新网银行合作的存管平台有哪些,0.9158083160861096
442,企业邮箱填写错误怎么办,0.9157354995422256
443,车贷利息是多少,0.9157052841030082
444,新网银行的官网地址是什么,0.915693915682462
445,好人贷需要面签吗,0.9156752605842755
446,新网银行是否上市,0.9154302888359995
447,能否让客服回电,0.9153079241798171
448,"好人贷有回访电话吗""",0.9151790268518984
449,如何解约快捷支付？,0.9147590873599897
450,好人贷额度是否会发生变化,0.9145073661241064
451,随心存存入限额,0.9145027306541851
452,好人贷借款合同有效期是多久,0.9142694145648379
453,存在迁户问题怎么处理,0.9137972724042631
454,好人贷申请的渠道有哪些,0.9137707573469208
455,活体检测失败怎么办,0.913382719774708
456,客户表示需要考虑,0.9133751773066088
457,新网银行有哪些活动,0.9132464011903446
458,申请好人贷工作信息如何填写,0.9132120580848365
459,申请好人贷需要什么条件,0.9130544083761295
460,是否需要使用本人手机操作好人贷,0.9130179629444982
461,为何无法登录存管查询,0.9129866791147215
462,他人可以使用本人信息申请好人贷吗,0.9128709847455854
463,好人贷上征信吗,0.9125658300332089
464,存管提现到账时间是多久,0.9125352721638573
465,为何人脸识别提示光线太足,0.9124663980876078
466,如何开据存款证明,0.9123863127495547
467,好人贷提前还款最低还多少,0.9123693070234665
468,好人贷有回访电话吗,0.9123333011859487
469,银行渠道维护时间一般是多久,0.9122528002412126
470,滴水贷客服电话是多少,0.9122252292755887
471,车辆信息如何查询,0.9119728245391006
472,客服是否是随机分配,0.9118966541047797
473,如何签署借款合同,0.9117549069129142
474,好人贷申请身份证可否添加水印,0.911740820124917
475,新网银行合作平台有哪些,0.9116425582304462
476,新网银行账户是什么,0.911436185210347
477,申请好人贷没有公司邮箱怎么办,0.91143074662643
478,什么是注册号码？,0.9112153808615873
479,为什么提示用户不存在,0.911156027089524
480,关于客户个人信息安全问题,0.9111478923074332
481,能否删除个人信息,0.9109928206109302
482,申请好人贷后有没有回复,0.910890860911037
483,好人贷申请能否撤销,0.9107855266890558
484,如何关注新网银行公众号,0.9106285751634862
485,审核电话内容是什么,0.9105356023432141
486,好人贷当期能否最低还款,0.9104305796842536
487,好人贷申请是否可以使用临时身份证,0.9104242707690784
488,好人贷通过率多少,0.9103268446936844
489,为何申请好人贷无结果,0.9100160791217448
490,好人贷能否绑定他人银行卡,0.909717231288935
491,定期存款到期如何支取,0.9095789168346224
492,怎样才能成功申请到额度,0.909386358895829
493,好人贷为什么无法借款,0.9093591515654761
494,如何删除身份证信息,0.9093061407589286
495,实名认证为什么不符,0.909294983650699
496,各还款方式如何进行还款,0.90898924398642
497,为何提示缺少必要参数,0.9089417436970414
498,好人贷年化利率是多少,0.9087522723364732
499,好人贷定位如何开启,0.9086942857294417
500,车贷如何解绑银行卡,0.9086432959939909
501,人脸识别失败怎么办,0.9084442543370884
502,手持身份证拍照的注意事项,0.9082371039567978
503,如何绑定银行卡,0.9081498558427998
504,还款记录如何查看,0.9077460426574026
505,好人贷-云闪付是什么,0.9074678604863003
506,开户失败原因,0.9074157570834295
507,目前支持的银行有哪些,0.9074104516974573
508,什么是风控审核中,0.9072555735558233
509,好人贷有额度后如何进行贷款,0.9068905977400398
510,如何换绑银行卡,0.9068032974283863
511,好人贷支持随借随还吗,0.9067870728004904
512,借款失败怎么办,0.9066407770521051
513,好人贷如何试算利息,0.9066141663177502
514,如何知晓已注销成功,0.9066046581695958
515,好人贷还款方式有哪些,0.9061448059002838
516,客户表示有合作意向,0.9061339931200688
517,新网银行三类户是什么,0.9060590512841674
518,存管查询的余额如何提现,0.9057281243046682
519,客户表示没有问题了,0.9056798007157929
520,如何冻结新网银行账户,0.9052984160864262
521,登录密码为何无法重置,0.905258365160417
522,存款利率是多少,0.9051633450852413
523,扣款失败的原因,0.9049916444002892
524,好人贷能否人工操作提额,0.9049059161050435
525,新网银行地址在哪里,0.9047654490637848
526,自助提额什么时候上线,0.9045150172479961
527,如何在新网银行开户,0.9041905545187012
528,我们是四川新网银行吗,0.9040068293810707
529,为何结清证明显示日期与平台不符,0.9035786471110698
530,页面为何无法打开,0.9032409975010647
531,什么是分批次扣款,0.9032305147353004
532,可以重新注册吗,0.9032116720556631
533,其他贷款怎么办理,0.9026897695764073
534,开通什么业务,0.9024718701537993
535,如何降低/关闭额度,0.9021715383246628
536,新网银行好事贷如何申请,0.9020476555333112
537,好人贷利率为什么调高了,0.9017098684009236
538,好人贷月利率是多少,0.901398962868073
539,如何激活新网二类户,0.9013929617974625
540,销户与否会产生什么影响,0.9008047961336008
541,好人贷放款至什么账户,0.9007922892689871
542,车贷逾期如何还款,0.9006437582093875
543,车贷如何提前还款,0.9000800930576075
544,密码被锁定怎么办,0.8996719287210994
545,五年定期存款是什么,0.8993467585422698
546,在哪个平台操作提现,0.89913357655195
547,令牌无效是什么,0.8987690658656029
548,新网银行APP下载,0.8984052440435643
549,为何无法销户,0.8981439717200691
550,逾期造成的影响是什么,0.8974161715082005
551,页面为什么异常跳转,0.8966492492313622
552,优惠券如何使用,0.8966471455363108
553,房产保证金是什么,0.8963441188237463
554,好人贷个人资料如何修改,0.8961283844260389
555,下一次开放时间是什么意思,0.8955576616595627
556,好人贷额度为什么变低了,0.8955220530104387
557,结清证明开据时间是多久,0.895464266250056
558,好人贷电话回访时间,0.8953371399444368
559,企业邮箱格式是什么,0.8946535476013312
560,怎样用其他手机登录好人贷,0.8944793954460946
561,如何录制活体检测,0.8935253568320822
562,客户表示知道了,0.8925747999143503
563,如何注销新网二类户,0.892421140176058
564,可以咨询吗,0.892222554448417
565,好人贷是邀请制吗,0.8917280942841164
566,为何无法申请好人贷,0.8913127967429436
567,申请好人贷是否都有额度,0.8911984036659932
568,车贷如何还款？,0.8911848784811294
569,创客贷额度是多少,0.891090368287445
570,好人贷如何提前还款,0.8909948258704651
571,好人贷利率是多少,0.8909014884469032
572,客户提到投诉,0.8903331263223672
573,车贷平台如何查询,0.8892619259156543
574,好人贷为何无法还款,0.88887212067616
575,如何退出微信公众号,0.8888146455257435
576,为何提示系统异常,0.888000264322433
577,美利车联系电话,0.8879994529799997
578,好人贷的办理时间,0.8873562904087383
579,好人贷如何降低利率,0.8865849227874221
580,按期还款是什么,0.8857495331794296
581,车贷如何申请,0.8853803698966987
582,合作平台如何取消贷款,0.8853539299670936
583,忘记密码怎么办,0.8847943202047597
584,如何注销公众号,0.8845648095496337
585,贷款证明如何开据,0.8840660092651341
586,工新借如何申请,0.8840026777942084
587,新网有哪些产品,0.8839651919730458
588,注册规则是什么,0.8836032522870954
589,好人贷提额周期是多久,0.8835940166129537
590,好人贷与其他平台类似产品的区别是什么,0.8834210165172864
591,申请被拒怎么办,0.8832711330878643
592,好人贷如何实名认证,0.8830071365396811
593,好人贷如何主动还款,0.8828888865199774
594,好人贷审核时间是多久,0.8825826096441926
595,如何办理好人卡？,0.8821182201701069
596,好人贷贷款期限是多久,0.8808537859575913
597,好人贷还款后多久到账,0.8808332788834865
598,为什么无法注册,0.880702269428547
599,可否对公还款,0.8801484391313638
600,好人贷消费用途,0.8800747665887836
601,征信报告是什么样的,0.8799006893067994
602,季得利如何计息,0.8789288104451468
603,随心存T+1是什么,0.8785754293630468
604,为什么没有扣款,0.8780076896485155
605,新网银行简介,0.877485184610682
606,好人贷额度他人能否使用,0.877421122828685
607,好人贷借款规则,0.8773955021692748
608,好人贷利率为什么高,0.8772806595338951
609,系统繁忙是什么原因,0.877242655520113
610,额度占用问题,0.8764255006920636
611,什么是登录密码,0.8747654587959681
612,公众号如何注册,0.8747132171923759
613,好人贷额度有效期是多久,0.8745445529633307
614,开户是什么意思,0.8744317928967505
615,好人贷借款多久到账,0.873826718331482
616,如何解绑银行卡,0.8730569857794965
617,什么是综合评估,0.8727603811414016
618,客户表示稍等,0.8725811327737323
619,退汇是什么意思,0.8723296634292959
620,好人贷是否有临时额度,0.8722377290007216
621,批扣时间段是多久,0.8717427654468299
622,如何增加银行卡,0.8715125243977636
623,客户表示不满,0.8714139627365574
624,好人贷如何自助提额,0.8711980439149106
625,好人贷如何审核,0.8685753903111656
626,好人贷额度是多少,0.8682067471247195
627,额度冻结是什么意思？,0.8678632876749487
628,经侦是指什么,0.8671471415247297
629,客户称赞服务好,0.8666805145496004
630,什么是活体检测,0.8652506174405904
631,好人贷为什么无法登录,0.8634344696839915
632,什么是当期账单,0.8632985884257883
633,如何邀请好友申请好人贷,0.8630973662080307
634,罚息介绍,0.8610792236171668
635,什么情况算逾期,0.8603030619561224
636,迁户是什么意思,0.8593126720189146
637,密码如何修改,0.8583824019108662
638,什么情况算违约,0.8570196951448064
639,有多少人获得好人贷额度,0.8565349382427144
640,如何登录微信公众号,0.855786528189374
641,好人贷如何申请,0.8553012151704331
642,季得利是什么,0.8552862763430678
643,客户提出建议,0.8535432802431495
644,可否延期还款,0.8514096165731663
645,人脸拍摄规范,0.8505023087284214
646,什么是还款日,0.8502693258704694
647,好人贷如何提高额度,0.8497428812016256
648,征信是什么,0.8476875965143568
649,工新借是什么,0.841913502761362
650,如何进入好人贷页面,0.8389028407243644
651,如何进入个人中心,0.8373394084303942
652,好事贷如何还款,0.8335532855919365
653,随心存如何计息,0.831962944754639
654,存管是什么,0.8300268805854047
655,好人贷为什么额度低,0.8296833693708255
656,随心存是什么,0.8264057680009175
657,好人贷如何还款,0.8254931387092781
658,如何获得优惠券,0.8241555115275465
659,合作平台如何还款,0.8236766389802215
660,任性还款是什么,0.8231877777134653
661,什么是一、二、三类户,0.8219270656851603
662,额度冻结怎么办,0.8154090756068426
663,随心存如何登录,0.7940100680602177
664,什么平台的贷款,0.7849234605591565
665,季得利如何支取,0.7581209177314826
666,好人贷是什么,0.7535118795672303
