0,点击领取额度需要设置微信定位,1.0
1,优信扣款成功后为何显示待还款,0.9580017263464979
2,还款银行卡是否需要开通银联在线支付业务,0.9574616870687913
3,注册手机号及微信号需要实名制吗,0.9573031520589432
4,实际申请金额与放款金额不一致可否取消车贷,0.9542022180075146
5,微信/支付宝等可否与新网银行账户互相绑定,0.9532732320162185
6,修改手机号码/微信号是否会影响自动扣款,0.9532005065614658
7,为何提示支付平台支取金额超过可用余额,0.9528929321155347
8,好人贷注册手机号与银行卡预留手机号是否需要一致？,0.9520200112491256
9,可否取消银行卡限额,0.9518861193026715
10,绑卡时页面上的银行卡预留手机号码可以修改吗,0.9513312071221159
11,扣款结果会有短信提示吗,0.9505250274369597
12,线上开据证明为何和征信金额不符,0.9504962428249836
13,银行卡开通银联在线支付后是否可正常还款,0.9503381535589428
14,银行卡是二类户影响扣款吗,0.9502996690352512
15,可否按照征信订单号开据证明,0.9502413415030919
16,为何提示支付平台银行卡未开通银联无卡认证支付,0.9501003033330453
17,好人贷支持微信/支付宝扣款吗,0.9500696146478277
18,存款需要先开立银行账户吗,0.949465428663987
19,更换银行卡会影响自动扣款吗,0.9492050239165422
20,为何提示支付平台受发卡行资金用途限制拒绝交易,0.9490275305317508
21,是否可以取消自动扣款,0.9485836673781604
22,新网银行发送的短信验证码的有效时长？,0.9475816225199233
23,京东存款如何修改注册手机号码,0.9474994014337981
24,好人贷只能通过绑定的银行卡还款吗,0.9474483311393211
25,绑定银行卡产生费用吗,0.9473943861206261
26,平台方手机号变更导致我行无法直接开据结清证明问题,0.9473293969344305
27,更改银行卡预留手机号的方法,0.9472253742488354
28,征信上显示的贷款金额是否包含利息,0.9471921754890535
29,新网银行账户可以设置为好人贷借/还款账户吗,0.9471167624280582
30,银行卡挂失会影响自动扣款吗,0.9470770514555102
31,好人贷必须绑定银行卡使用吗,0.9469479390723714
32,系统升级会影响扣款吗,0.9467285381304243
33,在线咨询是否支持客户发送语音,0.9464803538777681
34,为何提示支付平台签约关系不存在,0.9464201846551502
35,车贷可以修改还款日吗,0.9463693338963155
36,好人卡绑定云闪付/微信等失败怎么办,0.9459403600062165
37,如何取消征信查询及使用授权书,0.9456792496499308
38,线上开据证明有次数限制吗,0.9456646695697383
39,为何提示支付平台该客户无默认扣款卡，交易没有发给统一支付,0.9455241270893877
40,拨打我行人工客服电话是否收费,0.9454886604374901
41,为何征信上的放款日期与实际借款日期不一致,0.9451683748562074
42,随心存可以在我行公众号查询/操作吗,0.9450962415374892
43,新网账户绑定微信/支付宝后支持提现或充值吗,0.9450861371694597
44,挖财还款是否为新网银行代扣,0.9450571455489186
45,非绑定银行卡可否与新网二类户转账,0.9449614302458911
46,销户后为何还能解绑银行卡,0.9449391599013834
47,新网银行以何名义查询征信,0.9448836504795625
48,修改手机号后是否需要重置登录密码,0.9448683524144522
49,收款卡发卡行拒绝放款失败什么意思？,0.9448130764070212
50,购买存款页面为何提示“额度不足，无法购买”,0.9447456879294698
51,借款到账后页面未更新借款状态,0.9445309224770574
52,存款页面是否会显示每日收益,0.9442054942641686
53,逾期后还款金额是否会增加,0.944197037825162
54,交易密码无法设置,0.9441106552157814
55,借款成功会有短信等提醒吗,0.9440847383902102
56,再次申请好人贷会查询征信吗,0.9440760970246533
57,为何按期还款只能选择部分贷款期限,0.9440236911958088
58,结清贷款后征信上是否会显示结清,0.943973229073274
59,进入随心存为何提示手机号码不一致,0.9437188561301195
60,可绑定银行卡数量上限,0.9436533793432001
61,如何修改存管账户预留手机号码,0.9435717259686976
62,如何查询是否开通银联在线支付,0.9435681893605775
63,为何之前绑定的银行卡不支持扣款了,0.9434213941907676
64,申请好人贷需要开个人账户吗？,0.9432860739152403
65,新网银行能否绑定云闪付,0.9431838629960803
66,线上是否可开据征信版结清证明,0.9430237076167091
67,如何确保还款日当天会扣款成功,0.9429640797123459
68,车贷合同里的金额是否包含利息,0.9426217400778918
69,申请好人贷后，可否更改授信结果,0.9426027241030296
70,转账时为何提示未面核,0.942601786974026
71,为何收到新网银行还款短信,0.9425362651362824
72,为何提示支付平台当日交易次数超限,0.942503218937129
73,查询各类工单办理进度,0.9424523705328673
74,新网二类户转入/转出收取手续费吗,0.9424102519602787
75,为何提示支付平台持卡人信息有误,0.9423393412037945
76,为何提示支付平台不允许持卡人进行的交易,0.9423058239842736
77,支持绑定的银行卡类型有哪些,0.9422887990274056
78,新网银行存款是否受保障,0.9422780811104727
79,如何查看委托支付协议,0.9422022693883788
80,为何提示支付平台暂不支持的银行或限额,0.9421586360456862
81,新网银行扣款通道是什么,0.942095501882933
82,为何提示支付平台交易金额超限,0.9420712646988708
83,如何设置存管支付密码,0.9420619606399374
84,还款日当天支持手动还款吗,0.9420201202420925
85,存款产品如何重置交易密码,0.9420192822883713
86,好人贷借款金额与到账金额是否一致,0.9420077751781474
87,贷款结清之后能否删除贷款记录,0.9417913892007673
88,如何把注册用户与结算用户都注销,0.9417071039369969
89,当期账单支持再分期吗,0.9415613794297994
90,通过本人微信找回密码是指什么,0.941452351022796
91,申请好人贷必须填写联系人信息吗,0.9413479014884926
92,接收短信的手机号是否为注册手机号,0.9412372245891631
93,补扣会影响信用吗,0.9412174044165892
94,半年得利提前支取影响已发放利息吗,0.9411755558848137
95,什么是无卡支付及免密支付,0.9411542022670983
96,销户后是否上征信,0.9410804842673742
97,查询车贷的注册手机号码是什么,0.9408919510173528
98,转账到新网银行账户是否还款成功,0.9408788600650989
99,新网银行账户的交易记录如何查看,0.940850306014148
100,转入新网银行使用的密码是交易密码还是银行卡密码,0.9408236057654389
101,好人贷申请是否查询芝麻信用,0.940803644437642
102,电话客服是否可以受理结清证明,0.9407613756506669
103,京东存款的计息规则及计息公式,0.9407086385460804
104,存款产品的资金可以用于好人贷还款吗,0.94055682279366
105,季得利提前支取影响已发放利息吗,0.9405427408106385
106,无法提供消费凭证可以取消贷款吗,0.9405208896175291
107,为何提示还款卡不存在,0.9404687222436008
108,为何同时收到了还款成功和失败的短信,0.940386400357821
109,如何查询当期车贷还款金额,0.9402000281612806
110,新网银行视频认证的QQ号码是多少,0.9400980757283826
111,如何查看银行卡管理列表,0.9399319821785402
112,新网银行自动扣款时间,0.9398831398218636
113,如何修改新网随心存注册号码,0.9398823667801923
114,存管查询为何提示用户不存在或者信息有误,0.9398642091306871
115,新网银行账户可以在哪些地方使用,0.9398111222725427
116,如何查询其他平台扣款银行卡,0.9397840659496175
117,为何申请好人贷后显示未获取额度,0.9397705800604045
118,好人贷申请成功会有短信通知吗,0.9397298964853147
119,新网银行自动扣款次数,0.939723040654622
120,公众号是否有还款提示,0.9395872131584762
121,注册手机号更换成功后何时可以正常使用,0.9395323706640167
122,银行卡还款限额是多少,0.9394821024846767
123,为何征信上有新网上报的贷款记录,0.9394414579441328
124,好人贷只能使用微信登录吗？,0.9393054283134973
125,提前结清贷款后还会扣款吗,0.9392668806129313
126,存款产品是否存满五年才能支取,0.9391970710570233
127,如何查询好人贷申请的授信结果,0.9391942756031131
128,为何征信上有新网银行的贷款审批记录,0.9391742244558998
129,选择任性还款/按期还款利息如何计算,0.939167949973069
130,新网二类户上的资金是否计息,0.9391364743320191
131,好人贷如何查看所支持的还款方式,0.9389909099477683
132,如何修改实名认证手机号码,0.9389810044804695
133,好人贷注册手机号无法使用,0.9389255266541182
134,线下转账如何填写新网银行开户信息,0.9388462606043025
135,如何查看手机号是否实名制,0.9387161859085104
136,新网银行开户支持的证件有哪些,0.9386772388909167
137,如何购买新网银行存款产品,0.9386596708143076
138,页面为何提示“开户失败”、“账户存在异常操作/账户异常”,0.9385480094598166
139,车贷如何修改注册手机号码,0.9384857044660536
140,为什么提前还款显示联合贷批次执行中？,0.9384484759522355
141,为何提示支付平台账户余额不足,0.9384462661501637
142,为何提示支付平台渠道不支持的银行,0.9384311545258256
143,新网银行存款产品为何暂停交易,0.9384268484250616
144,新网银行有哪些产品可以提额,0.9384157100688946
145,好人贷提额会查询征信吗,0.9384070088470668
146,为什么收到提额短信但额度未提升,0.938338647021947
147,为何提示用户未实名认证,0.9383113885571863
148,开据证明时为何需要实名认证,0.938274381470607
149,京东存款是否支持提前支取/提前部分支取？,0.9382454176854688
150,哪些渠道可以购买京东存款产品？,0.9382398630374945
151,什么是银行卡预留手机号？,0.938108864001811
152,开据证明时为何提示账户存在异常,0.9379366303955398
153,注销账户的处理时间,0.9378633429093969
154,好人贷授信首页显示利率是否为固定利率,0.9377443055136516
155,开据证明为何显示没有符合要求的订单,0.9376900714963994
156,审核电话可更改接听电话吗,0.9376477590440054
157,为何销户后还能看到好人贷信息,0.9376432430692273
158,人工是否可操作扣款,0.9376022391660562
159,微信号更换成功后何时可以正常使用,0.9375624619983279
160,提前还款有次数限制吗,0.9374373933377911
161,车贷扣款支持的银行卡有哪些,0.9374258446198421
162,平台方提供的客户审批资料能否提供给客户,0.9373798373933676
163,还款金额超银行卡限额怎么办,0.9373736790653423
164,客户催促需要加急办理,0.9373369296608699
165,企业邮箱验证码可否重新获取,0.937249650006373
166,在线客服是否是人工客服,0.937001213439166
167,月得利提前支取如何计息,0.9369929766164923
168,好人贷扣款账户如何查看,0.9369091544962519
169,可以查询注册手机号码吗,0.936859843657434
170,实名认证是否查询征信,0.9368315707938673
171,平台还款信息为何与新网银行不一致,0.936816773304162
172,存管账户充值限额,0.9366637204381997
173,随心存提前支取到账时间,0.9366130177755114
174,为何图文验证码输入正确却提示错误,0.9365877497090773
175,新网银行存款属于理财产品吗,0.9363552688738892
176,存款产品如何修改手机号,0.9362552495913926
177,申请好人贷后为何页面显示仍可提交申请,0.9360394200495695
178,客服能否看到客户申请好人贷的信息,0.93600765456813
179,未正常还款我行会进行催收吗,0.9359079699326252
180,银行渠道维护无法操作怎么办,0.9357985676143239
181,好人贷账户是否为新网银行二类户？,0.9357874422531726
182,车贷合同为何无法查看,0.9357466221258383
183,好人贷-云闪付如何更换收/还款银行卡,0.9357229083135924
184,提前还款手续费是多少,0.9356272007266682
185,五年定期存款支持提前支取吗,0.935610914651454
186,登录时的图文验证码是否区分大小写,0.9355319328203825
187,为何征信上有新网银行上报的逾期,0.9355163494669503
188,银联在线支付如何开通,0.9353823075895539
189,新网银行公众号如何取消关注,0.9351885036085029
190,使用优惠券后提前还款利息如何计算,0.935125205615178
191,新网二类户转入/转出有时间限制吗,0.9350627541096694
192,还款日当天是否自动扣款,0.9349690658732476
193,为什么拍照认证时总是不成功或显示系统崩溃,0.9349586329851324
194,新网银行人工客服电话打不通,0.9349460471294664
195,为何页面出现多个新网银行账户,0.9349124445691253
196,获取验证码次数超限怎么办,0.9348115402826656
197,周得利提前支取如何计息,0.9348035845689678
198,如何查询合作平台贷款是否结清,0.9347025946618358
199,新网账户之间能否互相转账,0.9346230355553028
200,好人贷自动扣款规则,0.9345758807774125
201,为什么收到美利车金融的短信,0.9345380938764658
202,如何查看优惠券的使用情况,0.9344905988043551
203,好人贷是否支持归还逾期部分账单,0.9344658703824984
204,随心存产品停售原因,0.9343408166435597
205,是否会发生重复扣款情况,0.9342741425700625
206,车贷支持手动还款吗,0.9342561887194126
207,借款后如何判定下次还款日期,0.934251215819085
208,新网银行二类户限额是多少,0.9342220523474419
209,好人贷支持扣款的银行有哪些,0.9340675244560726
210,客户要求发送相关模板,0.934064109523495
211,身份证更换期间会影响好人贷贷款吗,0.9339988498941519
212,为何提示支付平台账户状态异常,0.9339078624013618
213,好人贷交易密码如何设置,0.9338130989614987
214,新网二类户可以升级为一类户吗？,0.9337499921648397
215,为什么银行还款存在限额？,0.9336196750801167
216,可以通过他人银行卡转入到新网银行账户吗,0.9335593718355438
217,好人贷以什么贷款类型上报人行征信？,0.9335527159181605
218,好人贷手动还款时为何提示批次执行中,0.9335107230512867
219,如何修改征信上的个人信息,0.9333743848765169
220,申请好人贷有区域或者号段等限制吗,0.933356337302696
221,好人贷借款记录如何查询,0.933343236305212
222,京东存款为什么显示当日额度为什么已售罄？,0.9332795851851089
223,客服能否查看聊天记录,0.9332697399760621
224,如何查询转账到新网银行的记录,0.9332249824639592
225,存管账户如何注销,0.9331562724554961
226,为何提示交易密码验证失败,0.9329963250951185
227,如何查询存管账户流水,0.9329643576038616
228,为何收到新网银行逾期提醒短信,0.9329528874480559
229,我行放款的其他平台借款会上报征信吗,0.9329431450543131
230,诺诺发票贷的利率是多少,0.9328469670235121
231,贷款证明的电子章是否具有法律效应,0.9327806474346012
232,如何更换好人贷默认还款账户,0.9327415722035461
233,申请诺诺发票贷需要什么条件,0.9327233001851767
234,新网银行有企业贷款吗？,0.9326148342135185
235,新网银行存款类产品有哪些,0.9325816474384565
236,客户发送截图以及个人信息等,0.9325185612991156
237,如何查询好人贷借据收款银行卡,0.9324854112496277
238,视频认证录制失败的原因是什么,0.932366549989057
239,新网银行人工客服电话是多少,0.9322975765576922
240,借款时选错收款账户怎么办？,0.9322628054675435
241,结清贷款后什么时候可以开据结清证明,0.9320490966711107
242,选择任何还款方式都可以提前还款吗,0.9320098715021635
243,结清证明是否是还款记录证明,0.9319661017351173
244,手机获取验证码失败,0.9319534639830687
245,联系新网银行客服有哪几种方式,0.9319500002459296
246,如何查询申请相关的协议书,0.9319359302790139
247,自动扣款失败怎么办,0.9319283773505418
248,新办的手机号可以申请好人贷吗,0.9318249276592036
249,如何查看随心存购买情况,0.9317591053147315
250,新网诺诺发票贷如何申请,0.9317320161649206
251,结清证明的发送方式有哪些,0.9316868338744528
252,申请好人贷需要下载APP吗？,0.9316352964006374
253,好人贷申请需要填写哪些个人信息,0.9315733826896319
254,征信上报周期及更新时间,0.9315592280820509
255,好人贷额度必须一次性借完吗,0.9315568229624733
256,注销注册用户后是否可恢复？,0.9315405963438766
257,获取额度后多久可发起借款,0.9314795051717679
258,为何申请好人贷页面显示暂无资格,0.9314187950100077
259,咨询可以发送图片吗？,0.9313609446791112
260,好人贷审核时是否给填写的联系人去电,0.9313385563285895
261,操作好人贷是否需要开启定位,0.9312918003671076
262,为何提示不具备开具资格,0.9312377052852153
263,节假日可以操作各类存款吗,0.9311258011465013
264,好人贷借款超时未到账如何处理,0.9311126793439506
265,输入身份证号码时，为何无法输入字母,0.9310685423383247
266,手机号归属地与定位地不一致是否有影响,0.9310286768228053
267,还款日可以修改吗,0.9309599286358938
268,如何查询车贷还款日,0.9308479976224858
269,为何还款后额度恢复减少了,0.9306036313391379
270,好人贷支持在国外发起借款吗,0.9304277476427198
271,借款合同是否有展示提前还款会收取违约金的情况,0.9304203548682856
272,新网银行二类户如何转入/转出,0.9304157848662817
273,存管账户如何查询,0.9304015505767006
274,为何存管信息与平台显示不一致,0.9303029956787535
275,如何操作随心存大额存款,0.9302546266925116
276,好人贷借款时还会审核吗,0.9302243422554732
277,好人贷贷款利息如何计算,0.9300178856278419
278,白骑士认证失败是什么意思,0.9299277683568334
279,为何提示还款存在差错,0.9298121081583552
280,新网银行以什么名义放款,0.9297654436809539
281,能否人工开据贷款证明,0.9297029351784273
282,为何提示支付平台发卡行拒绝,0.9296991276257817
283,新网二类户为何无法转入/转出,0.9295978171688957
284,新网银行有信用卡吗,0.9295439230990854
285,如何更换借款收款银行卡,0.929302449437932
286,如何注销新网注册用户,0.9292924345210072
287,开具结清证明时为何无法登录,0.9291877434256144
288,车贷收取哪些费用,0.9291447278055437
289,好人贷是否支持提前还当期账单,0.929099341854303
290,58车金融客服电话是多少,0.9290182555134899
291,车贷如何办理解押手续,0.9288956360325382
292,为何重置密码后仍提示密码错误,0.9288523339767476
293,贷款证明开据失败怎么办,0.9288106190721208
294,周得利计息规则,0.9286006338249483
295,如何查看好人贷还款计划,0.928425878605549
296,抵押类贷款如何办理,0.9283744912783405
297,查询结清证明申请是否已提交,0.928208759967411
298,转账到新网银行如何操作,0.9281315878291193
299,车贷能否绑定他人银行卡,0.9280444092920852
300,随心存停售后有影响吗,0.9279150754826789
301,车贷还款记录如何查询,0.9278637262808306
302,好人贷不借款会产生利息或费用吗,0.9278339675129926
303,提前还款会影响个人征信吗,0.9277862177846221
304,为何无法提交好人贷申请资料,0.927662815001227
305,好人贷账户如何查询,0.9276168437783121
306,车贷还款只扣除部分是什么原因,0.9275573990365306
307,实名认证失败的原因是什么,0.9275410632701476
308,新网银行有几个网点,0.9274955261737895
309,验证码发送至什么手机号,0.9274561763301244
310,什么是我的额度和可借额度,0.9274378306671154
311,黑户/白户是否可以申请好人贷,0.9273720996225039
312,还款后为何未更新还款状态,0.9273148050767652
313,客户咨询其他平台催收问题,0.9271256699817229
314,好人贷账户如何更换手机号码,0.9271242594644132
315,如何查看好人贷相关协议/合同？,0.9271063715629115
316,为何好人贷还款时提示“交易处理中”,0.9270820996943461
317,结清证明印章无法查看,0.926985576098242
318,申请好人贷需要公积金、社保吗？,0.9269380291209157
319,银行渠道维护是指什么,0.9269331836095906
320,好人贷申请是否支持人工受理,0.9269112628979788
321,五年定期存款的利率是多少,0.9268622407468877
322,好人贷部分提前还款规则,0.9268434693362264
323,如何更改其他平台的注册手机号码,0.9267596004476457
324,好人贷借款后能否修改贷款信息,0.9266262714543937
325,好人贷是否支持提前还款,0.9265893819902924
326,优信客服电话是多少,0.9264575747759363
327,什么是单笔借据和多笔借据,0.9264289571962262
328,随心存如何修改交易密码,0.9263550604685967
329,如何查看开户结果,0.9263208501967252
330,结清证明会展示哪些信息,0.9262453852914679
331,他行渠道汇入新网账户的到账时间是多久,0.926180012903965
332,新网银行有实体卡片吗,0.9257895262102186
333,存款产品是否保本保息,0.9257884792725061
334,如何开立存管账户,0.9256972891832564
335,如何获取线上核身链接,0.9256324140164651
336,个人可以在新网开立几个账户,0.9256245499690595
337,提前支取时为何显示存入,0.9255606986493339
338,好人贷额度是否循环使用,0.9254933376671124
339,好人贷借款如何上报征信,0.9254910601032189
340,线上转入新网银行账户到账时间是多久,0.9254178543377211
341,随心存利率为何会发生变化,0.9253978332839903
342,名下所有卡被冻结后如何还款,0.9252331868279234
343,随心存利率是多少,0.9252080734961405
344,定期存款是否有存单,0.9251845685010087
345,公众号页面的“我的排号”是什么意思,0.9249575418004778
346,车贷申请多久可以放款,0.92479869868547
347,为什么好人贷第一期还款金额与之后不一致,0.9245838190883118
348,好人贷还款记录如何查询,0.9245101118159613
349,为何存管查询提示没有密码,0.9244593509930817
350,核身链接失效的原因,0.9243907162371885
351,如何办理对公业务,0.9243185771274949
352,好人贷-云闪付如何提前还款,0.92431589315848
353,新网银行的活期利率是多少,0.9242414758376832
354,自动扣款如何操作,0.92420327340866
355,如何查看贷款合同,0.9241577036465624
356,身份证信息变更后如何更新,0.9241282355425621
357,上传身份证时需填写的内容是什么,0.9240893314428887
358,能否开具非恶意逾期证明,0.9240855679945011
359,好人贷支持周末借款吗？,0.923712304368714
360,好人贷被拒后为何没有下次开放时间,0.923509915484167
361,未接到好人贷回访电话会被拒吗,0.923317097752512
362,车贷如何更换还款银行卡,0.923192693598994
363,可否补充企业邮箱,0.9231864132429451
364,为何提示支付平台其他错误,0.9231171061782145
365,居住信息如何填写,0.9229443661625385
366,如何查询新网账户,0.9227743480082922
367,申请好人贷使用的邮箱是公司邮箱还是个人邮箱,0.9226694398781468
368,好人贷账户如何挂失,0.9226216769290639
369,还款后页面显示等待中,0.9225738559425092
370,如何查询账户是否冻结,0.9224985983106637
371,随心存如何查看收益情况,0.9224543626180206
372,如何查询还款日,0.9222685089655194
373,视频认证的步骤是什么,0.9221772170685837
374,为什么取消了提前部分还款,0.9221299557282047
375,随心存支持提前支取吗,0.9220847662468847
376,银联在线支付是什么,0.9220302321183951
377,消费凭证有效期是多久,0.9219292554378632
378,实名认证审核时间,0.92183041828845
379,罚息能否减免,0.9217538025921009
380,季得利的操作渠道有哪些,0.921661462956492
381,关于消费凭证,0.9215126788473352
382,随心存存款期限有哪些,0.921465213143479
383,修改手机号码的处理时间是多久,0.9213194447332791
384,提额会有通知吗,0.9212295571832628
385,节假日可以借/还款吗,0.9211553130538989
386,好人贷为什么提示“账户存在异常操作”,0.9211272939362958
387,新网银行二类户与好人贷是否为同一个手机号码,0.9210384676080765
388,按期还款和任性还款的区别是什么,0.9210074835416739
389,身份证过期可以申请好人贷吗,0.9209947869705134
390,可以查询个人信息资料吗？,0.9206915101614225
391,新网银行行号是多少,0.9205414080936731
392,手机号无法使用为什么,0.9204395321177944
393,存管密码被锁定怎么办,0.9203615194314365
394,企业邮箱为何验证不了,0.9202823531238923
395,我行对客邮箱是多少,0.9202645028517857
396,新网银行有招聘吗,0.9202088419366258
397,好人贷审核不通过对个人有什么影响,0.9201973516017147
398,新网银行业务办理时间,0.9200622084050436
399,提前支取有限制吗,0.9199133239526054
400,客户表示还款成功,0.919851309666658
401,自动扣款时间段是多久,0.9197813654290086
402,可以让别人代还款吗？,0.9197773827855519
403,车贷合同如何查看,0.9197632930405689
404,银行转账未到账怎么办,0.9196661775258259
405,绑定银行卡失败,0.919305055333858
406,好人贷收取哪些费用,0.9192607668384932
407,合同为何无法打开,0.9192211203042149
408,电脑端可以登录好人贷吗,0.9191730421603077
409,如何查询征信报告,0.919146695570823
410,好人贷账户如何注销,0.9190045553401072
411,新网银行人工客服服务时间,0.9189832193360501
412,结清证明的印章是否可以用公章,0.9189250160002218
413,申请好人贷需要哪些资料,0.9188496508696161
414,好人贷可以重新申请吗,0.9187389561643408
415,如何查询是否已申请好人贷,0.9186820686460732
