0,白骑士认证失败是什么意思呢,1.0
1,白骑士认证失败是什么意思,0.9971804577890836
2,实名认证失败的原因是什么,0.9702669630088503
3,结清证明会展示哪些信息,0.9604331926121248
4,视频认证录制失败的原因是什么,0.9569586577264085
5,开据证明时为何需要实名认证,0.9568297365500235
6,申请诺诺发票贷需要什么条件,0.9568260904130448
7,开据证明时为何提示账户存在异常,0.9564035470806613
8,页面为何提示“开户失败”、“账户存在异常操作/账户异常”,0.9547839689324958
9,结清证明的发送方式有哪些,0.9539969267302502
10,哪些渠道可以购买京东存款产品？,0.9537788069436232
11,新网银行有哪些产品可以提额,0.9534409224937211
12,存管查询为何提示用户不存在或者信息有误,0.952046665768258
13,实名认证为什么不符,0.9516337821504844
14,为什么拍照认证时总是不成功或显示系统崩溃,0.9504423353445465
15,开据证明为何显示没有符合要求的订单,0.949715234579415
16,线上开据证明有次数限制吗,0.94946901491282
17,贷款证明开据失败怎么办,0.9484601853858559
18,收款卡发卡行拒绝放款失败什么意思？,0.9483457770211284
19,申请好人贷需要开个人账户吗？,0.947937775731464
20,京东存款为什么显示当日额度为什么已售罄？,0.9477464600213206
21,线上开据证明为何和征信金额不符,0.9476329332429918
22,系统升级会影响扣款吗,0.9475992615431482
23,为何提示用户未实名认证,0.9472950459701843
24,新网银行扣款通道是什么,0.9471516613022294
25,为何提示交易密码验证失败,0.9470692485772751
26,结清贷款后什么时候可以开据结清证明,0.9470293270065717
27,注销注册用户后是否可恢复？,0.9469264733755798
28,扣款结果会有短信提示吗,0.9467845229408524
29,为何存管查询提示没有密码,0.9466588541138694
30,通过本人微信找回密码是指什么,0.946493464082143
31,如何查询申请相关的协议书,0.9456808645518567
32,开具结清证明时为何无法登录,0.9452686593657745
33,存款产品如何重置交易密码,0.9451225315384626
34,季得利的操作渠道有哪些,0.9451098874259737
35,借款成功会有短信等提醒吗,0.9449092362737143
36,补扣会影响信用吗,0.9448915464270997
37,为什么银行还款存在限额？,0.9447605993973222
38,如何取消征信查询及使用授权书,0.9447419956901774
39,是否可以取消自动扣款,0.9445087480002061
40,银行卡是二类户影响扣款吗,0.9444737133560152
41,借款时选错收款账户怎么办？,0.9443053106678663
42,为何提示不具备开具资格,0.9438297247821386
43,申请创客贷需要什么条件,0.943759882313603
44,月得利提前支取如何计息,0.9436670648188946
45,随心存停售后有影响吗,0.9435333579343251
46,无法提供消费凭证可以取消贷款吗,0.9435220308821163
47,新网银行开户支持的证件有哪些,0.943449935741693
48,注册手机号及微信号需要实名制吗,0.9433460740401539
49,公众号页面的“我的排号”是什么意思,0.9433038737836266
50,为何提示支付平台签约关系不存在,0.9431999299923425
51,企业邮箱为何验证不了,0.9431618458246201
52,新网银行发送的短信验证码的有效时长？,0.9431011882494461
53,开户是什么意思,0.9427950489655814
54,视频认证的步骤是什么,0.9426526809902831
55,好人贷申请成功会有短信通知吗,0.9426283547799159
56,可以查询个人信息资料吗？,0.9425327433319057
57,查询结清证明申请是否已提交,0.9424744816106789
58,销户后为何还能解绑银行卡,0.9424615208580028
59,为何提示还款卡不存在,0.9419782275443671
60,节假日可以操作各类存款吗,0.9419743250929485
61,获取验证码次数超限怎么办,0.9418811555719923
62,好人卡绑定云闪付/微信等失败怎么办,0.941874555744749
63,定期存款操作的渠道有哪些,0.9418345831702691
64,提前还款手续费是多少,0.9417349912675714
65,为何存管信息与平台显示不一致,0.9417007338214275
66,平台方提供的客户审批资料能否提供给客户,0.9416935245898784
67,优信扣款成功后为何显示待还款,0.9416326133927455
68,存款需要先开立银行账户吗,0.941626373024761
69,更换银行卡会影响自动扣款吗,0.9416234226029647
70,可否按照征信订单号开据证明,0.9415878713117362
71,转账时为何提示未面核,0.9413233179421728
72,为何图文验证码输入正确却提示错误,0.9411927951717927
73,如何查询好人贷申请的授信结果,0.9411324461234156
74,如何查看优惠券的使用情况,0.9411284065887363
75,周得利提前支取如何计息,0.9409994861718041
76,实名认证是否查询征信,0.9409905945510408
77,为什么提前还款显示联合贷批次执行中？,0.9409743428359146
78,随心存可以在我行公众号查询/操作吗,0.940954052422442
79,京东存款是否支持提前支取/提前部分支取？,0.9406780449647287
80,登录时的图文验证码是否区分大小写,0.9403700375980244
81,车贷可以修改还款日吗,0.9403641870411669
82,销户后可以再开户吗,0.9401771868066752
83,银行卡挂失会影响自动扣款吗,0.940059006156833
84,未正常还款我行会进行催收吗,0.939950801834379
85,自动扣款失败怎么办,0.9398808827960927
86,企业邮箱验证码可否重新获取,0.9398546336507496
87,上传身份证时需填写的内容是什么,0.9397578325053473
88,购买存款页面为何提示“额度不足，无法购买”,0.9396872220452874
89,存管账户如何查询,0.9396770944228707
90,如何查询存管账户流水,0.9396048696904374
91,贷款证明的电子章是否具有法律效应,0.9392831418237844
92,提前结清贷款后还会扣款吗,0.9391781033508094
93,是否会发生重复扣款情况,0.93915180793531
94,新网银行账户的交易记录如何查看,0.9391366125610844
95,为何无法登录存管查询,0.9390234146156534
96,申请好人贷后，可否更改授信结果,0.9388312337537785
97,随心存利率是多少,0.9388128803276086
98,实际申请金额与放款金额不一致可否取消车贷,0.938767352688356
99,退汇是什么意思,0.9386706642327011
100,结清贷款后征信上是否会显示结清,0.9385199347898691
101,为什么取消了提前部分还款,0.9383436063319431
102,银行渠道维护无法操作怎么办,0.9382559701602288
103,好人贷为什么提示“账户存在异常操作”,0.9382064657245275
104,线上是否可开据征信版结清证明,0.9380421788681182
105,为什么点击拍照没有反应,0.9380410437144142
106,提额会有通知吗,0.9380234577816082
107,新网银行视频认证的QQ号码是多少,0.9380056020007064
108,随心存利率为何会发生变化,0.9379436746101786
109,存管账户如何注销,0.9379114529021344
110,为何征信上有新网上报的贷款记录,0.9378609963090738
111,车贷合同为何无法查看,0.9378433752532906
112,电话客服是否可以受理结清证明,0.9377434734149723
113,为什么提示用户不存在,0.9377007925179408
114,新网银行存款类产品有哪些,0.9376200283799339
115,可以让别人代还款吗？,0.9376022450424952
116,新网银行有企业贷款吗？,0.9375932515392288
117,咨询可以发送图片吗？,0.9375880914575719
118,好人贷审核不通过对个人有什么影响,0.9375695747236819
119,征信上显示的贷款金额是否包含利息,0.9375661528038874
120,提前还款会影响个人征信吗,0.9373601361394549
121,好人贷申请需要填写哪些个人信息,0.9372024405768115
122,为什么收到美利车金融的短信,0.9371760932724603
123,半年得利提前支取影响已发放利息吗,0.9369137237010039
124,逾期后还款金额是否会增加,0.9369010518427223
125,如何把注册用户与结算用户都注销,0.9368973291623642
126,使用优惠券后提前还款利息如何计算,0.9368474682979245
127,新网银行账户可以在哪些地方使用,0.9367627878554082
128,支持绑定的银行卡类型有哪些,0.9366789333783171
129,销户后是否上征信,0.9366010165270394
130,能否开具非恶意逾期证明,0.9365792359767801
131,车贷合同里的金额是否包含利息,0.9364812190919954
132,提前还款有次数限制吗,0.9364705866633021
133,京东存款的计息规则及计息公式,0.9364567677256482
134,新网银行存款属于理财产品吗,0.9364294803409768
135,居住信息如何填写,0.9363132975099908
136,结清证明是否是还款记录证明,0.9362177175483944
137,什么是银行卡预留手机号？,0.9362119330254887
138,季得利提前支取影响已发放利息吗,0.9361820075050216
139,下一次开放时间是什么意思,0.9358776494979089
140,注销账户的处理时间,0.9357264910289015
141,为何征信上有新网银行的贷款审批记录,0.9356840455705582
142,房产保证金是什么,0.9356035113902355
143,再次申请好人贷会查询征信吗,0.9355212988411544
144,抵押类贷款如何办理,0.9355094266124305
145,银行渠道维护是指什么,0.9355058701268452
146,逾期造成的影响是什么,0.9354832596971717
147,车贷还款只扣除部分是什么原因,0.9353438980802575
148,好人贷借款时还会审核吗,0.9353015865056882
149,好人贷支持扣款的银行有哪些,0.9352667497755355
150,为何提示支付平台不允许持卡人进行的交易,0.9350849437438887
151,好人贷支持微信/支付宝扣款吗,0.9350420584143027
152,为何无法提交好人贷申请资料,0.9350347177551218
153,借款合同是否有展示提前还款会收取违约金的情况,0.9349223363256627
154,如何查询征信报告,0.934894121303497
155,新网账户绑定微信/支付宝后支持提现或充值吗,0.9347590721874666
156,随心存产品停售原因,0.9347213300546372
157,什么是风控审核中,0.9345532639991504
158,交易密码无法设置,0.934512762451199
159,绑定银行卡产生费用吗,0.9344177707242841
160,为何之前绑定的银行卡不支持扣款了,0.9344120202193748
161,为何提示支付平台该客户无默认扣款卡，交易没有发给统一支付,0.9343342454881216
162,有额度不使用有什么影响吗,0.9341866293529072
163,如何查看委托支付协议,0.9341672086894043
164,新网银行以何名义查询征信,0.9341196606634173
165,随心存如何修改交易密码,0.9341105330751702
166,随心存存款期限有哪些,0.9340409094515203
167,修改手机号后是否需要重置登录密码,0.9340385382642742
168,申请好人贷必须填写联系人信息吗,0.9339943579530193
169,新网诺诺发票贷如何申请,0.933762121457926
170,如何查看手机号是否实名制,0.9337549556165845
171,选择任何还款方式都可以提前还款吗,0.9336624335210643
172,存款页面是否会显示每日收益,0.9336283103989307
173,新网银行合作的存管平台有哪些,0.9336022693115752
174,为何提示还款存在差错,0.9335074113107719
175,五年定期存款的利率是多少,0.9334615177957685
176,新网银行存款产品为何暂停交易,0.933423907730378
177,还款日可以修改吗,0.9333627458283141
178,如何设置存管支付密码,0.9332755704682234
179,存款产品的资金可以用于好人贷还款吗,0.9332632538267182
180,身份证信息变更后如何更新,0.9332012621035651
181,好人贷申请是否查询芝麻信用,0.9331851299173262
182,为什么收到提额短信但额度未提升,0.9331836440432164
183,线下转账如何填写新网银行开户信息,0.933042808251862
184,什么是单笔借据和多笔借据,0.932985009791324
185,好人贷以什么贷款类型上报人行征信？,0.9329353384008574
186,征信报告是什么样的,0.932882406222532
187,随心存操作渠道有哪些,0.932876970309098
188,为何提示支付平台持卡人信息有误,0.9328658918503806
189,五年定期存款支持提前支取吗,0.9325111865905642
190,身份证上传失败怎么办,0.9325094393692225
191,如何查看银行卡管理列表,0.9325048898590894
192,好人贷交易密码如何设置,0.932301984820456
193,提前支取时为何显示存入,0.9322905168473187
194,为何提示支付平台受发卡行资金用途限制拒绝交易,0.9321549366393898
195,诺诺发票贷的利率是多少,0.9321384609350254
196,车贷收取哪些费用,0.9321091274032482
197,新网银行存款是否受保障,0.9320438271836177
198,查询车贷的注册手机号码是什么,0.9320329868113244
199,核身链接失效的原因,0.931926895138632
200,新网银行有信用卡吗,0.931775418696143
201,贷款结清之后能否删除贷款记录,0.9317286338183067
202,企业邮箱填写错误怎么办,0.931724206753688
203,公众号是否有还款提示,0.9316476271801035
204,转入新网银行使用的密码是交易密码还是银行卡密码,0.9316199368120126
205,存管查询的余额如何提现,0.9315376491685937
206,结清证明的印章是否可以用公章,0.9315321894187761
207,好人贷必须绑定银行卡使用吗,0.9314513195118226
208,存款产品是否保本保息,0.9312570472088582
209,存款产品是否存满五年才能支取,0.9311320659922666
210,存管密码被锁定怎么办,0.9309800563873484
211,好人贷提额会查询征信吗,0.9309715535365792
212,如何查看开户结果,0.930832442505913
213,什么是无卡支付及免密支付,0.930760086389996
214,实名认证审核时间,0.9307083959603861
215,存在迁户问题怎么处理,0.9306658675421532
216,为何征信上有新网银行上报的逾期,0.9306518343089456
217,如何购买新网银行存款产品,0.9306481122655619
218,申请好人贷后为何页面显示仍可提交申请,0.9305913658702037
219,好人贷借款超时未到账如何处理,0.9304536813580457
220,好人贷只能使用微信登录吗？,0.9304273570153879
221,好人贷申请的渠道有哪些,0.9304021912742519
222,如何确保还款日当天会扣款成功,0.9303657248372007
223,如何开立存管账户,0.9303541046306673
224,当期账单支持再分期吗,0.9303360635358544
225,为何重置密码后仍提示密码错误,0.9303207247349174
226,在线咨询是否支持客户发送语音,0.9302929111106412
227,好人贷不借款会产生利息或费用吗,0.9302738254591142
228,如何操作随心存大额存款,0.9302496926269824
229,申请好人贷需要公积金、社保吗？,0.9300896889102767
230,什么是注册号码？,0.9300549675566943
231,审核电话内容是什么,0.92984582421623
232,车贷扣款支持的银行卡有哪些,0.9297233498561474
233,新网银行的活期利率是多少,0.9296687642929757
234,进入随心存为何提示手机号码不一致,0.9295544201255675
235,好人贷为什么无法借款,0.9294764993394293
236,人工是否可操作扣款,0.9294661360032213
237,如何查询是否开通银联在线支付,0.9293395860953587
238,新网二类户上的资金是否计息,0.9293370635342253
239,为何销户后还能看到好人贷信息,0.9292972808574307
240,如何查询合作平台贷款是否结清,0.9290935266778195
241,修改手机号码/微信号是否会影响自动扣款,0.929086323343516
242,如何查看随心存购买情况,0.9290485042083839
243,定期存款是否有存单,0.9289314693537386
244,在线客服是否是人工客服,0.9287964195760773
245,能否人工开据贷款证明,0.9286876806086756
246,新网银行有哪些活动,0.9284818044657345
247,申请好人贷需要哪些资料,0.9284748069684456
248,如何查询转账到新网银行的记录,0.9283285193340536
249,银行卡开通银联在线支付后是否可正常还款,0.9282509805852337
250,如何修改实名认证手机号码,0.9282081690741559
251,我行放款的其他平台借款会上报征信吗,0.9281975236283653
252,合同为何无法打开,0.9281931209503781
253,新网二类户可以升级为一类户吗？,0.9281598062999801
254,好人贷支持周末借款吗？,0.9280524843149845
255,可否取消银行卡限额,0.9279979799630463
256,如何修改新网随心存注册号码,0.9279325922245126
257,平台方手机号变更导致我行无法直接开据结清证明问题,0.9276284813227472
258,好人贷借款记录如何查询,0.9275776897063573
259,活体检测失败怎么办,0.9273242410647281
260,身份证更换期间会影响好人贷贷款吗,0.9273139228300735
261,客户表示没有问题了,0.9273083286581235
262,为何提示支付平台账户状态异常,0.9272965091588043
263,还款金额超银行卡限额怎么办,0.9272904849906877
264,为何征信上的放款日期与实际借款日期不一致,0.9270541248914896
265,京东存款如何修改注册手机号码,0.9268735363162962
266,为何提示支付平台暂不支持的银行或限额,0.9268711810743632
267,如何修改存管账户预留手机号码,0.9268452541855113
268,定期存款的利率是多少,0.9268169222762693
269,如何查询账户是否冻结,0.9267736988482206
270,为何提示支付平台交易金额超限,0.9267721152256111
271,好人贷支持在国外发起借款吗,0.9266976714524665
272,如何查询是否已申请好人贷,0.926676228942999
273,为何提示支付平台当日交易次数超限,0.926662824425195
274,新网银行人工客服电话是多少,0.9266228504135947
275,为何提示支付平台其他错误,0.9265038580513699
276,新网银行以什么名义放款,0.9263486477789459
277,微信号更换成功后何时可以正常使用,0.9263425914886931
278,转账到新网银行账户是否还款成功,0.9262928563386162
279,借款到账后页面未更新借款状态,0.926168317754234
280,提前支取有限制吗,0.9261454327818781
281,好人贷只能通过绑定的银行卡还款吗,0.9261151736155125
282,还款银行卡是否需要开通银联在线支付业务,0.9261022574332982
283,为何提示支付平台渠道不支持的银行,0.9261005916581599
284,验证码发送至什么手机号,0.9260603473554584
285,存管提现到账时间是多久,0.9260549516124548
286,为何页面出现多个新网银行账户,0.9260210580131983
287,如何查询其他平台扣款银行卡,0.925958114555297
288,好人贷可以重新申请吗,0.9259278277408058
289,节假日可以借/还款吗,0.9259203568496392
290,为何好人贷还款时提示“交易处理中”,0.9258828006007311
291,身份证过期可以申请好人贷吗,0.9258120602621079
292,人脸识别失败怎么办,0.9258044427601424
293,转账到新网银行如何操作,0.9257928261212741
294,客服能否看到客户申请好人贷的信息,0.9257815677523981
295,好人贷注册手机号与银行卡预留手机号是否需要一致？,0.9257324834687534
296,绑卡时页面上的银行卡预留手机号码可以修改吗,0.9256467757365053
297,如何修改征信上的个人信息,0.9254744793515162
298,优信客服电话是多少,0.9253877001239285
299,自动扣款如何操作,0.9253554514263773
300,新网银行有实体卡片吗,0.9253401163047573
301,黑户/白户是否可以申请好人贷,0.9253339881354685
302,为何提示支付平台账户余额不足,0.9253204918847003
303,注册手机号更换成功后何时可以正常使用,0.9253187301433664
304,为何申请好人贷后显示未获取额度,0.9250727756222158
305,58车金融客服电话是多少,0.9250303850181006
306,客户催促需要加急办理,0.9249548937285389
307,平台还款信息为何与新网银行不一致,0.9248433412748458
308,名下所有卡被冻结后如何还款,0.9248306310243297
309,微信/支付宝等可否与新网银行账户互相绑定,0.9247974157497559
310,联系新网银行客服有哪几种方式,0.9246558551214354
311,输入身份证号码时，为何无法输入字母,0.924560613173561
312,挖财还款是否为新网银行代扣,0.9245401740915942
313,客服能否查看聊天记录,0.9244896551066103
314,新网银行账户可以设置为好人贷借/还款账户吗,0.9244809400557357
315,好人贷授信首页显示利率是否为固定利率,0.9243471107088614
316,为何申请好人贷页面显示暂无资格,0.9242958272486538
317,审核电话可更改接听电话吗,0.9242509026001958
318,为何同时收到了还款成功和失败的短信,0.9241394222051835
319,申请好人贷需要下载APP吗？,0.9238589903584404
320,为何提示支付平台支取金额超过可用余额,0.9238251602072944
321,如何注销新网注册用户,0.9237888605218733
322,为何提示该证件已被使用,0.9237332920615056
323,为何提示支付平台银行卡未开通银联无卡认证支付,0.9236583374278124
324,客户咨询其他平台催收问题,0.923654270636367
325,销户与否会产生什么影响,0.9236374097957927
326,好人贷贷款利息如何计算,0.9233865598720388
327,银行转账未到账怎么办,0.9233435474926507
328,如何查看好人贷相关协议/合同？,0.9232853637222639
329,新网银行有招聘吗,0.923079540035185
330,新网银行二类户限额是多少,0.9230391672347088
331,非绑定银行卡可否与新网二类户转账,0.9229247094302874
332,结清证明印章无法查看,0.922817441983348
333,周得利计息规则,0.9227080049211938
334,申请好人贷需要什么条件,0.9226002743170567
335,新办的手机号可以申请好人贷吗,0.9224888114038446
336,拨打我行人工客服电话是否收费,0.9224344670771393
337,好人贷账户是否为新网银行二类户？,0.9223377568832914
338,可以查询注册手机号码吗,0.9222387718078374
339,为何按期还款只能选择部分贷款期限,0.922021876324336
340,如何查询当期车贷还款金额,0.921839134039773
341,存款产品如何修改手机号,0.9215111381728524
342,新网银行能否绑定云闪付,0.9214631530908751
343,更改银行卡预留手机号的方法,0.9211203216302136
344,借款失败怎么办,0.9211001513626612
345,好人贷借款金额与到账金额是否一致,0.9210484759126301
346,新网银行的官网地址是什么,0.9208110847307699
347,逾期未还款如何处理,0.920802351353584
348,为何收到新网银行逾期提醒短信,0.9207732603131759
349,关于客户个人信息安全问题,0.9206342236518487
350,好人贷扣款账户如何查看,0.9205910416065718
351,查询各类工单办理进度,0.9204581971502918
352,手机号无法使用为什么,0.9204315097683041
353,新网账户之间能否互相转账,0.9203633158037566
354,新网银行公众号如何取消关注,0.9202511511848516
355,车贷还款记录如何查询,0.9200914149028812
356,可以重新注册吗,0.9200208332161596
357,我行对客邮箱是多少,0.9198983692126792
358,其他贷款怎么办理,0.9197973901656019
359,好人贷被拒后为何没有下次开放时间,0.9197293187962986
360,新网银行地址在哪里,0.9196092048150151
361,新网银行自动扣款时间,0.9196023098058346
362,车贷利息是多少,0.9195103735792843
363,目前支持的银行有哪些,0.9194254928053176
364,一个身份证可以申请好人贷两次吗？,0.9192801395005651
365,随心存如何查看收益情况,0.9192768155844937
366,手机获取验证码失败,0.9192261474134757
367,好人贷是否支持提前还款,0.9190594621589769
368,好人贷如何查看所支持的还款方式,0.9189913157291459
369,页面为什么异常跳转,0.9188409040289481
370,迁户是什么意思,0.9187911796171646
371,银联在线支付是什么,0.9187030972504369
372,客户表示需要考虑,0.9186601054651599
373,还款日当天支持手动还款吗,0.918587936756533
374,存款利率是多少,0.918541499359242
375,车贷如何办理解押手续,0.9184951892772435
376,银行卡还款限额是多少,0.9184454206522328
377,罚息能否减免,0.9184441191306199
378,银联在线支付如何开通,0.9183597507731046
379,如何办理对公业务,0.9183462024869188
380,为什么好人贷第一期还款金额与之后不一致,0.9181849990234615
381,好人贷申请必须使用身份证原件吗,0.9181483973988199
382,申请好人贷没有公司邮箱怎么办,0.9180852986077156
383,可以咨询吗,0.917935574068891
384,新网二类户转入/转出收取手续费吗,0.9175381641492658
385,什么是我的额度和可借额度,0.9173885939061199
386,可以通过他人银行卡转入到新网银行账户吗,0.9173607472256983
387,如何获取线上核身链接,0.9173472591506688
388,好人贷支持随时借款吗,0.9173125119203719
389,存管账户充值限额,0.9171871362742107
390,为何收到新网银行还款短信,0.9171724331900168
391,令牌无效是什么,0.9171460772195928
392,如何开据存款证明,0.9169833486836151
393,新网二类户转入/转出有时间限制吗,0.9168408645715344
394,如何查询车贷还款日,0.9168058123330523
395,好人贷是否支持提前还当期账单,0.9168015999711613
396,如何知晓已注销成功,0.9166903854340248
397,好人贷-云闪付如何提前还款,0.9162209433381303
398,在哪个平台操作提现,0.9161407215676
399,为何提示缺少必要参数,0.9161001670627015
400,好人贷自动扣款规则,0.9160596671695134
401,随心存提前支取到账时间,0.9160392617579463
402,好人贷借款如何上报征信,0.915886550026723
403,选择任性还款/按期还款利息如何计算,0.915868664677472
404,为何提示支付平台发卡行拒绝,0.9157560452360989
405,按期还款和任性还款的区别是什么,0.9156793370266338
406,关于消费凭证,0.9156427504394634
407,注册规则是什么,0.9154035405680303
408,车贷支持手动还款吗,0.9153910094294812
409,开户失败原因,0.9153319666586456
410,为何申请好人贷无结果,0.9152834770706278
411,还款后为何未更新还款状态,0.9152661879644647
412,好人贷利率为什么调高了,0.9151698992131201
413,五年定期存款是什么,0.9151393348602509
414,好人贷需要面签吗,0.9150362814670325
415,新网银行有几个网点,0.9149165365436004
416,新网银行合作平台有哪些,0.914866827947036
417,新网银行账户是什么,0.9148018422268844
418,申请好人贷工作信息如何填写,0.9147733129194147
419,好事贷收取哪些费用,0.9147700470167566
420,新网银行三类户是什么,0.9147188444143617
421,新网银行行号是多少,0.9146597598050168
422,个人可以在新网开立几个账户,0.9146480921678473
423,好人贷是否支持归还逾期部分账单,0.9146224713342395
424,可否补充企业邮箱,0.9144898478018373
