425,借款后如何判定下次还款日期,0.9144332978701607
426,怎样才能成功申请到额度,0.9144096824838165
427,好人贷借款后能否修改贷款信息,0.914398177721004
428,好人贷-云闪付如何更换收/还款银行卡,0.9143301618420261
429,征信上报周期及更新时间,0.9142703303401919
430,好人贷申请是否支持人工受理,0.9142561750807644
431,如何查询好人贷借据收款银行卡,0.9142069986864494
432,好人贷收取哪些费用,0.9141953846290691
433,随心存支持提前支取吗,0.9140861664507567
434,好人贷-云闪付是什么,0.9140860296400003
435,新网银行自动扣款次数,0.9140819035890522
436,好人贷上征信吗,0.9140081862102882
437,申请被拒怎么办,0.9139508759188028
438,好人贷审核时是否给填写的联系人去电,0.9138811044580807
439,好人贷部分提前还款规则,0.9138147005557439
440,如何查看贷款合同,0.913646178109591
441,新网二类户为何无法转入/转出,0.913598085308435
442,消费凭证有效期是多久,0.9135314038964751
443,好人贷申请能否撤销,0.9134521225431615
444,好人贷额度必须一次性借完吗,0.9134380228480893
445,如何查询新网账户,0.9131061272911889
446,好人贷还款记录如何查询,0.9130007101502942
447,新网有哪些产品,0.9128943537805344
448,如何查询还款日,0.9128872792645077
449,车贷合同如何查看,0.9128113142305255
450,能否删除个人信息,0.912205659109343
451,接收短信的手机号是否为注册手机号,0.9121592433339787
452,好人贷手动还款时为何提示批次执行中,0.9120596699995394
453,为什么无法注册,0.9119639000191508
454,好人贷审核电话是多少,0.9118761852192863
455,新网银行二类户如何转入/转出,0.9117163874175198
456,为何无法销户,0.9113925757625858
457,为何还款后额度恢复减少了,0.9113064722693874
458,客户发送截图以及个人信息等,0.9109533382486061
459,系统繁忙是什么原因,0.9107986197682596
460,"好人贷有回访电话吗""",0.9106163004699388
461,如何更换好人贷默认还款账户,0.9102547935655536
462,扣款失败的原因,0.9099838697216707
463,美团客服热线是多少,0.9099388965950184
464,额度冻结是什么意思？,0.9099113561454415
465,新网银行人工客服电话打不通,0.9097416729312757
466,他行渠道汇入新网账户的到账时间是多久,0.9095571618586545
467,电脑端可以登录好人贷吗,0.9094100502835575
468,好人贷账户如何查询,0.9093898699270331
469,还款日当天是否自动扣款,0.909211150734173
470,好人贷账户如何挂失,0.9088982384834027
471,我们是四川新网银行吗,0.9088094099810926
472,可绑定银行卡数量上限,0.908801720185238
473,如何查看好人贷还款计划,0.9087144566591119
474,企业邮箱格式是什么,0.9083392553995101
475,登录密码为何无法重置,0.9083258047489207
476,车贷能否绑定他人银行卡,0.908230037943579
477,申请好人贷使用的邮箱是公司邮箱还是个人邮箱,0.9081502095002594
478,如何更换借款收款银行卡,0.9081343605193686
479,随心存到期后何时到账,0.9075399342057856
480,如何删除身份证信息,0.9074823047557886
481,能否让客服回电,0.9073942650307152
482,新网银行是否上市,0.907237860397754
483,密码被锁定怎么办,0.9069841800803832
484,如何更改其他平台的注册手机号码,0.9069270117708724
485,车贷如何修改注册手机号码,0.9064957061096094
486,忘记密码怎么办,0.9055638064428719
487,手持身份证拍照的注意事项,0.9055609355610887
488,好人贷注册手机号无法使用,0.905225399190876
489,自助提额什么时候上线,0.9051910743899252
490,客户要求发送相关模板,0.9051183749474147
491,为何人脸识别提示光线太足,0.9048360507707844
492,申请好人贷有区域或者号段等限制吗,0.9048249163496421
493,为何无法申请好人贷,0.9046614647000674
494,为何结清证明显示日期与平台不符,0.9044002834060055
495,好人贷申请身份证可否添加水印,0.9043460982857715
496,申请好人贷后有没有回复,0.9041326083900285
497,未接到好人贷回访电话会被拒吗,0.9039923390990364
498,客户表示还款成功,0.903825634258162
499,好人贷有回访电话吗,0.9038077890100048
500,人脸识别使用的是照片还是视频,0.903408540796873
501,好人贷提前还款最低还多少,0.9031695060588941
502,好人贷支持随借随还吗,0.9031549133928037
503,好人贷账户如何注销,0.9030989999590461
504,车辆信息如何查询,0.9030257388220055
505,好人贷申请是否可以使用临时身份证,0.9027769402473362
506,好人贷还款方式有哪些,0.9027540365253329
507,自动扣款时间段是多久,0.9027307291489726
508,新网银行业务办理时间,0.902580319087932
509,线上转入新网银行账户到账时间是多久,0.9025656642392852
510,开通什么业务,0.9022876450071748
511,车贷申请多久可以放款,0.9019576815331113
512,新网银行如何联系客户,0.9016892869324411
513,他人可以使用本人信息申请好人贷吗,0.9016827217931265
514,如何解约快捷支付？,0.9014841938823903
515,如何签署借款合同,0.9013246714638884
516,好人贷如何试算利息,0.900739606964911
517,为什么没有扣款,0.9005539424625026
518,经侦是指什么,0.900417714540324
519,新网银行好事贷如何申请,0.9001471942654505
520,客服是否是随机分配,0.9001245508507013
521,滴水贷客服电话是多少,0.9000388895845164
522,页面为何无法打开,0.9000115462895161
523,手机号归属地与定位地不一致是否有影响,0.899714397674458
524,结清证明开据时间是多久,0.8994429578338609
525,新网银行人工客服服务时间,0.8993350180849623
526,好人贷额度是否会发生变化,0.89902648904807
527,车贷如何更换还款银行卡,0.8989758456808822
528,车贷逾期如何还款,0.8989640788281662
529,好人贷年化利率是多少,0.8989097383373894
530,定期存款到期如何支取,0.8988520950854271
531,好人贷账户如何更换手机号码,0.8986857719284949
532,好人贷额度为什么变低了,0.8986374749849697
533,修改手机号码的处理时间是多久,0.8984904003696639
534,好人贷月利率是多少,0.8982021143516237
535,什么是分批次扣款,0.897984725181009
536,好人贷借款合同有效期是多久,0.8979635153092301
537,关闭其他平台额度后，能否恢复好人贷额度,0.8973212287419219
538,如何在新网银行开户,0.8971367649135372
539,客户表示知道了,0.8967711881134085
540,好人贷通过率多少,0.8965752378001508
541,客户表示有合作意向,0.8958622918578216
542,什么是综合评估,0.8957760207859821
543,好人贷个人资料如何修改,0.895735324421625
544,什么是登录密码,0.8953889512282763
545,按期还款是什么,0.8946913393026465
546,好人贷额度是否循环使用,0.8946118414240859
547,如何更换微信号,0.8945141398246411
548,客户提到投诉,0.8944764216784222
549,如何关注新网银行公众号,0.8944130502383612
550,还款记录如何查看,0.8942126067326981
551,好人贷利率为什么高,0.8941246078870565
552,工新借如何申请,0.8937125586090217
553,车贷如何还款？,0.8931418147217025
554,随心存T+1是什么,0.8931262219988106
555,银行渠道维护时间一般是多久,0.8930262725311567
556,车贷如何提前还款,0.8928495065039156
557,如何通过线下方式转入新网二类户,0.8926146176175644
558,什么情况算逾期,0.8924593667664544
559,操作好人贷是否需要开启定位,0.8920899367415301
560,车贷如何申请,0.8913283481324793
561,获取额度后多久可发起借款,0.8912386667073895
562,季得利是什么,0.8907955862432604
563,是否需要使用本人手机操作好人贷,0.8903849776775372
564,为何提示系统异常,0.890252376292007
565,贷款证明如何开据,0.8901563136505105
566,绑定银行卡失败,0.8899775400954544
567,好人贷当期能否最低还款,0.8899324972351665
568,各还款方式如何进行还款,0.8898417578193865
569,好人贷能否人工操作提额,0.8895344226395949
570,好人贷与其他平台类似产品的区别是什么,0.8893037217626024
571,随心存存入限额,0.8892064494356333
572,车贷平台如何查询,0.8891738152024914
573,优惠券如何使用,0.8889143040501981
574,什么情况算违约,0.8886205196005554
575,如何冻结新网银行账户,0.8880980622771342
576,好人贷放款至什么账户,0.8880822702636052
577,好人贷能否绑定他人银行卡,0.8880247172414764
578,如何绑定银行卡,0.8876563265104952
579,如何选择按期还款/任性还款,0.8875687569427307
580,如何换绑银行卡,0.8875501960735576
581,还款后页面显示等待中,0.8872841379970016
582,好人贷还款后额度何时恢复,0.8863221263007299
583,好人贷利率是多少,0.8861364997935851
584,新网银行二类户与好人贷是否为同一个手机号码,0.8860291224194421
585,如何办理好人卡？,0.8848348611655678
586,如何录制活体检测,0.8844227305190564
587,怎样用其他手机登录好人贷,0.8840040466088309
588,征信是什么,0.8835791486539993
589,好人贷如何提前还款,0.8831604709797778
590,车贷如何解绑银行卡,0.8829805845407916
591,如何激活新网二类户,0.882574109248974
592,如何注销公众号,0.8825595509058615
593,好人贷如何实名认证,0.8823661088491555
594,存款产品支取通用路径,0.8812878017694747
595,好人贷有额度后如何进行贷款,0.8808694761590593
596,如何注销新网二类户,0.8802290655146774
597,好人贷是邀请制吗,0.8798893829906628
598,什么是活体检测,0.8783225427739123
599,如何降低/关闭额度,0.8774078577013096
600,存管是什么,0.8759503227979106
601,好人贷定位如何开启,0.8756356816629087
602,合作平台如何取消贷款,0.8750052734119657
603,好人贷为何无法还款,0.8745942036867709
604,好人贷为什么无法登录,0.8736321179193758
605,季得利如何计息,0.872985592291132
606,好人贷审核时间是多久,0.8728372416288992
607,如何退出微信公众号,0.8715890254789033
608,好人贷如何降低利率,0.8714874867407595
609,好人贷的办理时间,0.8698247043293318
610,好人贷如何审核,0.8695203796707462
611,创客贷额度是多少,0.8684109516372733
612,好人贷如何主动还款,0.8683814912666742
613,公众号如何注册,0.8669500563732692
614,什么是当期账单,0.8661389872843505
615,新网银行APP下载,0.8650450002589661
616,罚息介绍,0.8648914809633346
617,工新借是什么,0.8633114196044902
618,新网银行简介,0.8619617360872397
619,申请好人贷是否都有额度,0.8613376776575922
620,好人贷电话回访时间,0.8598697351962661
621,美利车联系电话,0.8598619512477038
622,密码如何修改,0.8597220529124201
623,好人贷提额周期是多久,0.8592488310914624
624,好人贷如何申请,0.8576388017760228
625,客户表示不满,0.8575207626689358
626,如何解绑银行卡,0.8565677938240607
627,客户提出建议,0.856536979949604
628,什么是还款日,0.8562024502318177
629,好人贷贷款期限是多久,0.8561808387108543
630,好人贷额度他人能否使用,0.855794805703782
631,好人贷借款规则,0.8555553420991294
632,可否对公还款,0.8552360734186789
633,如何增加银行卡,0.8540806019239546
634,好人贷如何自助提额,0.8532251382298903
635,如何邀请好友申请好人贷,0.8531230013475277
636,好人贷消费用途,0.8505662303282675
637,随心存是什么,0.8504608643829601
638,客户表示稍等,0.8490331411718957
639,客户称赞服务好,0.8488591208628481
640,批扣时间段是多久,0.8476818215267181
641,好人贷额度是多少,0.8469462214808494
642,好人贷还款后多久到账,0.8459638941644583
643,好人贷借款多久到账,0.8433947101864033
644,好人贷额度有效期是多久,0.8427342695338281
645,好人贷是否有临时额度,0.8418856198757474
646,人脸拍摄规范,0.8418455188962802
647,额度占用问题,0.8410007793030042
648,如何登录微信公众号,0.8369664514667309
649,好事贷如何还款,0.8294141736910307
650,有多少人获得好人贷额度,0.8253792666454781
651,什么是一、二、三类户,0.8252568397341469
652,任性还款是什么,0.8250739529176642
653,随心存如何计息,0.8246359801488405
654,好人贷如何提高额度,0.8244339055449389
655,如何进入个人中心,0.8231053672844768
656,可否延期还款,0.8219680265153282
657,好人贷为什么额度低,0.8209026152919241
658,好人贷如何还款,0.8147441204928244
659,合作平台如何还款,0.8105142127019196
660,如何进入好人贷页面,0.8102128031696135
661,额度冻结怎么办,0.8041203973323996
662,如何获得优惠券,0.8031150567090368
663,随心存如何登录,0.7886582612341996
664,什么平台的贷款,0.7815786381956099
665,好人贷是什么,0.7601532467152964
666,季得利如何支取,0.7409030040983144
