415,修改手机号码的处理时间是多久,0.913582497734718
416,转账到新网银行如何操作,0.913487580341869
417,如何查看开户结果,0.9133645424046306
418,车贷申请多久可以放款,0.9133108518844254
419,线上转入新网银行账户到账时间是多久,0.9132199799398263
420,申请好人贷需要下载APP吗？,0.9129876376350664
421,如何开立存管账户,0.9129706894569126
422,一个身份证可以申请好人贷两次吗？,0.9129674491691802
423,好人贷为什么无法借款,0.9129529846355917
424,借款失败怎么办,0.9129183979553952
425,"好人贷有回访电话吗""",0.9128595375540756
426,随心存支持提前支取吗,0.9128394582939205
427,好人贷支持随时借款吗,0.9127171518763834
428,好人贷额度是否会发生变化,0.9126565726163458
429,银行转账未到账怎么办,0.9124664227126459
430,新网银行有几个网点,0.912455838589602
431,为什么取消了提前部分还款,0.912379540570733
432,消费凭证有效期是多久,0.9123724468559181
433,好人贷如何试算利息,0.9123148894613955
434,好人贷申请的渠道有哪些,0.9121515891107739
435,车贷合同如何查看,0.9121425512692475
436,车贷如何解绑银行卡,0.9119897493124203
437,如何查询还款日,0.911919811353754
438,好人贷支持周末借款吗？,0.9118455034566665
439,密码被锁定怎么办,0.9112891284193236
440,申请好人贷需要什么条件,0.9112261719612573
441,为何无法登录存管查询,0.9110312142423013
442,如何知晓已注销成功,0.9109617868508462
443,令牌无效是什么,0.910851269338631
444,好人贷有回访电话吗,0.9107793489498626
445,银联在线支付如何开通,0.9106189190266686
446,节假日可以操作各类存款吗,0.910468761990099
447,好人贷能否人工操作提额,0.9102364624424198
448,好人贷有额度后如何进行贷款,0.9102231460317965
449,如何通过线下方式转入新网二类户,0.9101569291232458
450,随心存到期后何时到账,0.9101439652815793
451,好人贷需要面签吗,0.9099888216938625
452,好人贷个人资料如何修改,0.9099066875402135
453,为什么点击拍照没有反应,0.9098680927724191
454,为何结清证明显示日期与平台不符,0.9096675419453885
455,好人贷可以重新申请吗,0.9096527743713669
456,优信客服电话是多少,0.9094416941927076
457,登录密码为何无法重置,0.9093119979911878
458,客户表示有合作意向,0.9091430642752433
459,如何办理对公业务,0.9088453034518447
460,什么是注册号码？,0.9087461824403819
461,好人贷年化利率是多少,0.9084154733188536
462,新网银行账户是什么,0.9084001599962876
463,季得利的操作渠道有哪些,0.9081420228864904
464,新网银行的活期利率是多少,0.9081403982432077
465,申请创客贷需要什么条件,0.9080038583702859
466,车贷利息是多少,0.9078380079572553
467,随心存操作渠道有哪些,0.9077627281014883
468,好人贷支持随借随还吗,0.9076379942597351
469,操作好人贷是否需要开启定位,0.9075580688103679
470,提前支取有限制吗,0.9073213211774014
471,新网银行三类户是什么,0.9072974625108874
472,滴水贷客服电话是多少,0.9072492279100981
473,随心存存款期限有哪些,0.9071924039180659
474,随心存存入限额,0.9070849621334944
475,如何获取线上核身链接,0.9069022161990044
476,新网银行是否上市,0.9065673466113797
477,如何选择按期还款/任性还款,0.9060041161512625
478,销户后可以再开户吗,0.9059057435711402
479,如何开据存款证明,0.9058858527660583
480,节假日可以借/还款吗,0.9058317684164602
481,自动扣款时间段是多久,0.9056695363779258
482,新网银行好事贷如何申请,0.9056621862148121
483,新网银行有招聘吗,0.9056129684373774
484,如何绑定银行卡,0.9055617210730348
485,还款记录如何查看,0.9054450215873477
486,新网银行人工客服服务时间,0.9054069673402262
487,新网银行如何联系客户,0.9053561879373277
488,好人贷利率为什么调高了,0.905335165183608
489,新网银行的官网地址是什么,0.9051931125850846
490,为何提示缺少必要参数,0.9049560018004948
491,怎样才能成功申请到额度,0.9048597229254903
492,销户与否会产生什么影响,0.9045433294353723
493,人脸识别失败怎么办,0.9043427723226987
494,其他贷款怎么办理,0.9041280800631974
495,定期存款的利率是多少,0.904013349028225
496,如何签署借款合同,0.9037394751823351
497,好人贷还款方式有哪些,0.90371477507342
498,如何冻结新网银行账户,0.9034359612697117
499,新网银行合作平台有哪些,0.9033447245372197
500,客服是否是随机分配,0.9025695123739296
501,车辆信息如何查询,0.9025147801344805
502,好人贷月利率是多少,0.9023362405000058
503,电脑端可以登录好人贷吗,0.9022693576928765
504,关于消费凭证,0.9019737283898536
505,人脸识别使用的是照片还是视频,0.9016493294383862
506,审核电话内容是什么,0.901371859589822
507,银行渠道维护时间一般是多久,0.9013413952407078
508,客户表示需要考虑,0.9012069002938
509,新网银行合作的存管平台有哪些,0.9011097480388411
510,好人贷额度为什么变低了,0.9009724047380014
511,可以让别人代还款吗？,0.9008599951313478
512,自动扣款如何操作,0.9008380126797634
513,为何无法销户,0.900677833234359
514,如何关注新网银行公众号,0.9006462419473483
515,手持身份证拍照的注意事项,0.9006155296121447
516,美团客服热线是多少,0.9003982481930047
517,能否让客服回电,0.8998866264749935
518,我们是四川新网银行吗,0.8995780431315024
519,各还款方式如何进行还款,0.8994099240989827
520,如何解约快捷支付？,0.8992764450276377
521,什么是风控审核中,0.8990675285761038
522,新网银行业务办理时间,0.8988030746965745
523,新网银行有哪些活动,0.8987709706902346
524,如何换绑银行卡,0.8987093417313137
525,为何人脸识别提示光线太足,0.8986186725601234
526,好人贷为何无法还款,0.8984700369718989
527,忘记密码怎么办,0.8980475928883292
528,页面为什么异常跳转,0.8979958281463267
529,视频认证的步骤是什么,0.8978924055402535
530,怎样用其他手机登录好人贷,0.8974048833733987
531,定期存款操作的渠道有哪些,0.8973575045778651
532,如何更换微信号,0.8973327618152415
533,好人贷利率是多少,0.8972572891743884
534,什么是分批次扣款,0.8971573929786129
535,目前支持的银行有哪些,0.8967784260053663
536,好人贷定位如何开启,0.896539868136865
537,如何激活新网二类户,0.8961227831937186
538,如何降低/关闭额度,0.8956319981911985
539,银联在线支付是什么,0.8955179262408077
540,好人贷-云闪付是什么,0.895354096203357
541,车贷逾期如何还款,0.8953423025573373
542,逾期造成的影响是什么,0.8952786938667587
543,申请好人贷是否都有额度,0.8944854624755334
544,是否需要使用本人手机操作好人贷,0.8942636049025283
545,页面为何无法打开,0.8942540203528834
546,好人贷如何提前还款,0.8940204414160986
547,存款利率是多少,0.8940162549671486
548,好人贷如何实名认证,0.8938935441795599
549,如何注销新网二类户,0.8935095620593018
550,好人贷与其他平台类似产品的区别是什么,0.8934755944593387
551,定期存款到期如何支取,0.8934666354292076
552,结清证明开据时间是多久,0.8931116011135994
553,存管提现到账时间是多久,0.8924200537916641
554,好人贷如何降低利率,0.8920218369217295
555,企业邮箱格式是什么,0.891591782783441
556,为何无法申请好人贷,0.8915497485397041
557,好人贷还款后多久到账,0.8915173796566991
558,好人贷消费用途,0.8912501338423342
559,房产保证金是什么,0.8910863693332837
560,申请被拒怎么办,0.8907932132952179
561,可以重新注册吗,0.8907426521122311
562,好人贷是邀请制吗,0.8903250958019963
563,好人贷借款规则,0.8902204080324566
564,好人贷提额周期是多久,0.8896099218232906
565,开通什么业务,0.8894410213826451
566,车贷如何提前还款,0.8893584572844931
567,好人贷电话回访时间,0.8886353962695909
568,新网银行地址在哪里,0.8883989641784129
569,存管查询的余额如何提现,0.8879346429135322
570,好人贷额度他人能否使用,0.8877254533241276
571,贷款证明如何开据,0.8873397398654715
572,下一次开放时间是什么意思,0.8872262999778029
573,好人贷贷款期限是多久,0.8870348736039316
574,车贷如何还款？,0.8869209866969738
575,五年定期存款是什么,0.8867859962838769
576,工新借如何申请,0.8865419177525294
577,好人贷额度有效期是多久,0.8864705319434136
578,好人贷的办理时间,0.8855551050552822
579,好人贷利率为什么高,0.8852828143968993
580,如何在新网银行开户,0.8849521521030428
581,好人贷借款多久到账,0.8848781048646063
582,征信报告是什么样的,0.8846673931559901
583,好人贷审核时间是多久,0.8846153312738254
584,自助提额什么时候上线,0.8840429201016607
585,好人贷如何主动还款,0.8839610543611908
586,创客贷额度是多少,0.8836775110246952
587,系统繁忙是什么原因,0.8835841663210775
588,美利车联系电话,0.883342714812269
589,在哪个平台操作提现,0.882740705728096
590,为什么无法注册,0.8818490061252877
591,为什么没有扣款,0.881251301766733
592,客户提到投诉,0.8812465007603112
593,什么是登录密码,0.8811262684004322
594,好人贷是否有临时额度,0.8806544539826964
595,客户表示知道了,0.879511499078918
596,合作平台如何取消贷款,0.8788516104504761
597,按期还款是什么,0.8784758519927566
598,车贷如何申请,0.8773152315626629
599,随心存T+1是什么,0.877067559592333
600,可否对公还款,0.8766059362559875
601,新网有哪些产品,0.876287860089106
602,如何注销公众号,0.876188668918969
603,车贷平台如何查询,0.8759220241429273
604,如何办理好人卡？,0.8749534732140277
605,如何录制活体检测,0.8745634047820391
606,客户表示不满,0.87316086328207
607,好人贷额度是多少,0.8728225700167302
608,优惠券如何使用,0.8726897753808451
609,好人贷如何自助提额,0.8726751022903355
610,退汇是什么意思,0.8725498811442067
611,注册规则是什么,0.872493949516565
612,好人贷如何审核,0.8723912458600253
613,好人贷为什么无法登录,0.8723123776256607
614,什么是综合评估,0.8720398670569227
615,为何提示系统异常,0.8716219094207859
616,额度占用问题,0.8712167633804121
617,开户是什么意思,0.8709340245162956
618,可以咨询吗,0.8703289203457518
619,如何退出微信公众号,0.8700182902872589
620,新网银行APP下载,0.8699443126900919
621,如何邀请好友申请好人贷,0.8697002163835815
622,什么是当期账单,0.8682447783196525
623,什么情况算违约,0.8654496790134839
624,如何解绑银行卡,0.8633377325570892
625,公众号如何注册,0.863255646565885
626,批扣时间段是多久,0.8627583654188783
627,额度冻结是什么意思？,0.862214674740848
628,客户称赞服务好,0.8617723036818058
629,客户表示稍等,0.8613227707016905
630,好人贷如何申请,0.8597757520062294
631,迁户是什么意思,0.8591442426577439
632,什么情况算逾期,0.8585068230432465
633,好人贷如何提高额度,0.8583990488718933
634,有多少人获得好人贷额度,0.8574909955749087
635,季得利如何计息,0.8567027458490988
636,新网银行简介,0.8556151617035278
637,经侦是指什么,0.8547722641641504
638,密码如何修改,0.8543735096679371
639,什么是活体检测,0.853574088462657
640,如何增加银行卡,0.8525893866872998
641,可否延期还款,0.8491191625911801
642,罚息介绍,0.8486901940734636
643,季得利是什么,0.8482935639501445
644,工新借是什么,0.8446714159716109
645,征信是什么,0.8424424037072156
646,客户提出建议,0.8421014435237391
647,什么是还款日,0.8419815816327453
648,如何登录微信公众号,0.8370430797664059
649,好人贷为什么额度低,0.8360141603023261
650,人脸拍摄规范,0.8352283440305803
651,好事贷如何还款,0.8330967500225944
652,什么是一、二、三类户,0.8308419459853974
653,如何进入好人贷页面,0.8255824781064954
654,存管是什么,0.8248640530094301
655,随心存是什么,0.8224765814184386
656,好人贷如何还款,0.8209349651781322
657,额度冻结怎么办,0.8208274068947108
658,合作平台如何还款,0.8186190805281792
659,如何进入个人中心,0.8101913814035537
660,任性还款是什么,0.8094939772885126
661,随心存如何计息,0.8091819753477667
662,如何获得优惠券,0.7941196188354807
663,随心存如何登录,0.7766986203861259
664,什么平台的贷款,0.7650347227330088
665,好人贷是什么,0.7529051957752486
666,季得利如何支取,0.7326856284310665
