0,绑卡不成功姓名与卡号不符合,1.0
1,线上开据证明为何和征信金额不符,0.9605779539554878
2,好人贷注册手机号与银行卡预留手机号是否需要一致？,0.9581392650114656
3,实际申请金额与放款金额不一致可否取消车贷,0.9555966267742867
4,绑卡时页面上的银行卡预留手机号码可以修改吗,0.9525740648735556
5,优信扣款成功后为何显示待还款,0.9509627828901637
6,销户后为何还能解绑银行卡,0.9508803548516753
7,注册手机号及微信号需要实名制吗,0.9505487293250058
8,贷款结清之后能否删除贷款记录,0.9503196903458473
9,可否按照征信订单号开据证明,0.9499658178162301
10,平台方手机号变更导致我行无法直接开据结清证明问题,0.949917710047555
11,绑定银行卡产生费用吗,0.9495409602176961
12,可否取消银行卡限额,0.9493968657134159
13,好人卡绑定云闪付/微信等失败怎么办,0.949120522128434
14,好人贷借款金额与到账金额是否一致,0.9489422686981251
15,还款金额超银行卡限额怎么办,0.948870623448976
16,收款卡发卡行拒绝放款失败什么意思？,0.9487392113739526
17,征信上显示的贷款金额是否包含利息,0.9484580021098893
18,新网银行以何名义查询征信,0.9482694035645262
19,好人贷必须绑定银行卡使用吗,0.9482349930740761
20,结清贷款后征信上是否会显示结清,0.9481901153145827
21,好人贷申请是否查询芝麻信用,0.9477396230743828
22,银行卡是二类户影响扣款吗,0.9467578825536468
23,车贷合同里的金额是否包含利息,0.9460580405525496
24,好人贷注册手机号无法使用,0.945930472217381
25,为何提示支付平台持卡人信息有误,0.9458919421168224
26,可绑定银行卡数量上限,0.9457330370774973
27,为何征信上有新网上报的贷款记录,0.9456731765534208
28,好人贷只能通过绑定的银行卡还款吗,0.9451864006375609
29,修改手机号码/微信号是否会影响自动扣款,0.9449858166191973
30,为何提示还款卡不存在,0.9447549414033402
31,好人贷扣款账户如何查看,0.9445207763905974
32,修改手机号后是否需要重置登录密码,0.9441655007122919
33,线上是否可开据征信版结清证明,0.9435863345852822
34,销户后是否上征信,0.9435652058841926
35,如何取消征信查询及使用授权书,0.9434959610729005
36,进入随心存为何提示手机号码不一致,0.9434798837290098
37,为何同时收到了还款成功和失败的短信,0.9434479381562485
38,为何提示支付平台签约关系不存在,0.9433053062109497
39,非绑定银行卡可否与新网二类户转账,0.9432582696611979
40,为何征信上的放款日期与实际借款日期不一致,0.9431139221540276
41,为何提示支付平台受发卡行资金用途限制拒绝交易,0.9430918661056142
42,支持绑定的银行卡类型有哪些,0.942889022863854
43,申请好人贷后，可否更改授信结果,0.9425369294130842
44,挖财还款是否为新网银行代扣,0.941895376295769
45,为何征信上有新网银行的贷款审批记录,0.9416494761579739
46,存管查询为何提示用户不存在或者信息有误,0.941640112466509
47,开据证明时为何提示账户存在异常,0.9413110234866965
48,好人贷以什么贷款类型上报人行征信？,0.9413015267552978
49,如何查看手机号是否实名制,0.9412857329969883
50,为何申请好人贷后显示未获取额度,0.9412335587567201
51,转入新网银行使用的密码是交易密码还是银行卡密码,0.9411912899411364
52,如何查询其他平台扣款银行卡,0.9410918886208289
53,借款到账后页面未更新借款状态,0.9409823008792503
54,扣款结果会有短信提示吗,0.9407920053368278
55,为何提示支付平台支取金额超过可用余额,0.9407468303131667
56,贷款证明的电子章是否具有法律效应,0.9406594750634527
57,京东存款如何修改注册手机号码,0.9405167352660855
58,如何查询好人贷申请的授信结果,0.9404393264357935
59,页面为何提示“开户失败”、“账户存在异常操作/账户异常”,0.9404325065973025
60,好人贷申请成功会有短信通知吗,0.9404178975710579
61,为何提示不具备开具资格,0.9401475943320664
62,好人贷授信首页显示利率是否为固定利率,0.940123277011376
63,申请好人贷有区域或者号段等限制吗,0.9400917549184834
64,为何提示支付平台银行卡未开通银联无卡认证支付,0.9400353370719475
65,逾期后还款金额是否会增加,0.9400177037700793
66,如何查询合作平台贷款是否结清,0.9399703263623046
67,好人贷如何查看所支持的还款方式,0.9397708478192764
68,好人贷账户是否为新网银行二类户？,0.9397636532622621
69,申请好人贷必须填写联系人信息吗,0.939584150678141
70,名下所有卡被冻结后如何还款,0.9393971885391994
71,结清证明印章无法查看,0.9393822555315945
72,平台还款信息为何与新网银行不一致,0.9393058222950018
73,开据证明为何显示没有符合要求的订单,0.939257196060043
74,车贷扣款支持的银行卡有哪些,0.9389809493635441
75,为何提示支付平台该客户无默认扣款卡，交易没有发给统一支付,0.9389404200643207
76,更改银行卡预留手机号的方法,0.9387959200076449
77,再次申请好人贷会查询征信吗,0.9386120588417838
78,微信/支付宝等可否与新网银行账户互相绑定,0.9385812222363001
79,存款产品如何重置交易密码,0.9385216480226396
80,为何之前绑定的银行卡不支持扣款了,0.9384412428253383
81,为何图文验证码输入正确却提示错误,0.938373317776369
82,如何修改存管账户预留手机号码,0.93821565897777
83,绑定银行卡失败,0.938198183983675
84,开具结清证明时为何无法登录,0.9381770344398901
85,如何修改新网随心存注册号码,0.9381287983065001
86,购买存款页面为何提示“额度不足，无法购买”,0.938024076662683
87,好人贷提额会查询征信吗,0.9379906993242977
88,为何提示支付平台暂不支持的银行或限额,0.9375733597538839
89,转账到新网银行账户是否还款成功,0.9375391332310423
90,结清证明是否是还款记录证明,0.93750842771414
91,好人贷贷款利息如何计算,0.9374567136601352
92,新网银行账户可以设置为好人贷借/还款账户吗,0.937455759865836
93,贷款证明开据失败怎么办,0.9372910196296653
94,为何重置密码后仍提示密码错误,0.937285949358632
95,查询车贷的注册手机号码是什么,0.9372650784282062
96,为何提示还款存在差错,0.9372289846919221
97,为何销户后还能看到好人贷信息,0.9370332637561803
98,什么是银行卡预留手机号？,0.9369938042326579
99,如何确保还款日当天会扣款成功,0.9369272319948201
100,为何提示支付平台账户余额不足,0.9365992627597385
101,新网银行扣款通道是什么,0.9363688081051703
102,银行卡挂失会影响自动扣款吗,0.9363460082499853
103,新网二类户上的资金是否计息,0.9362921463443074
104,身份证更换期间会影响好人贷贷款吗,0.9362671549018701
105,好人贷自动扣款规则,0.9362261378472252
106,为何申请好人贷页面显示暂无资格,0.9362165875754381
107,交易密码无法设置,0.9360805012531993
108,如何查询好人贷借据收款银行卡,0.9359832845555631
109,为何按期还款只能选择部分贷款期限,0.9358925893276971
110,为什么收到提额短信但额度未提升,0.9358402704434383
111,车贷能否绑定他人银行卡,0.935814150139061
112,好人贷借款记录如何查询,0.9357972603482466
113,存款需要先开立银行账户吗,0.9356968969217624
114,存款页面是否会显示每日收益,0.9355759197003135
115,新网银行账户的交易记录如何查看,0.9355457169873926
116,如何更换好人贷默认还款账户,0.9355159800964038
117,为何征信上有新网银行上报的逾期,0.9355100730656127
118,好人贷是否支持归还逾期部分账单,0.9353962099816785
119,好人贷借款超时未到账如何处理,0.9353880050581636
120,新网银行视频认证的QQ号码是多少,0.9353487332461511
121,借款成功会有短信等提醒吗,0.9353415089862173
122,提前结清贷款后还会扣款吗,0.9353340883376509
123,为何提示交易密码验证失败,0.9352931299123103
124,为何无法提交好人贷申请资料,0.9352879155812325
125,为什么拍照认证时总是不成功或显示系统崩溃,0.9352828279369888
126,好人贷支持微信/支付宝扣款吗,0.9352795042369283
127,实名认证是否查询征信,0.9352390234601525
128,为何提示支付平台渠道不支持的银行,0.9352138103951803
129,车贷还款只扣除部分是什么原因,0.9351816540329959
130,好人贷审核不通过对个人有什么影响,0.9351191878379495
131,好人贷申请需要填写哪些个人信息,0.9349707752579637
132,好人贷支持扣款的银行有哪些,0.9349470584923034
133,车贷可以修改还款日吗,0.9348759674223802
134,转账时为何提示未面核,0.9348395132299606
135,银行卡还款限额是多少,0.9346945623898653
136,如何查询当期车贷还款金额,0.934424443819887
137,车贷合同为何无法查看,0.934299987765608
138,还款后为何未更新还款状态,0.9342178281685978
139,好人贷交易密码如何设置,0.9341141529128297
140,注册手机号更换成功后何时可以正常使用,0.9340630050727464
141,新网二类户转入/转出收取手续费吗,0.9340415886428727
142,银行卡开通银联在线支付后是否可正常还款,0.9339737220882873
143,如何查看好人贷相关协议/合同？,0.9339458323305316
144,申请好人贷需要开个人账户吗？,0.9339220558940707
145,获取验证码次数超限怎么办,0.9338998042710741
146,随心存产品停售原因,0.9337656805097801
147,为什么提前还款显示联合贷批次执行中？,0.933713702348795
148,申请好人贷后为何页面显示仍可提交申请,0.9336993258948685
149,存款产品的资金可以用于好人贷还款吗,0.9336913777328811
150,线上开据证明有次数限制吗,0.9336603480735909
151,登录时的图文验证码是否区分大小写,0.9332425158560236
152,结清贷款后什么时候可以开据结清证明,0.9331923919216023
153,输入身份证号码时，为何无法输入字母,0.9331835511623009
154,通过本人微信找回密码是指什么,0.9331778194039099
155,存款产品是否存满五年才能支取,0.9330563709307813
156,好人贷-云闪付如何更换收/还款银行卡,0.9328259218583649
157,实名认证失败的原因是什么,0.9328200244816861
158,补扣会影响信用吗,0.9327529584386063
159,未正常还款我行会进行催收吗,0.9327482196879812
160,能否人工开据贷款证明,0.9325823542400452
161,车贷如何修改注册手机号码,0.9323845975123886
162,查询各类工单办理进度,0.9323718288227405
163,好人贷手动还款时为何提示批次执行中,0.93235021767023
164,好人贷借款后能否修改贷款信息,0.9322396129438009
165,如何修改实名认证手机号码,0.9321672734235255
166,好人贷账户如何挂失,0.9321435953332586
167,为什么好人贷第一期还款金额与之后不一致,0.9321340879708305
168,如何修改征信上的个人信息,0.9321160323212557
169,接收短信的手机号是否为注册手机号,0.9321041552794981
170,存款产品如何修改手机号,0.9320989751018011
171,新网银行发送的短信验证码的有效时长？,0.9319928248891551
172,如何把注册用户与结算用户都注销,0.9317622152175663
173,手机号归属地与定位地不一致是否有影响,0.9313479705477745
174,好人贷借款如何上报征信,0.9312442494835326
175,为何还款后额度恢复减少了,0.9312132245689336
176,新网银行存款是否受保障,0.9312032820595917
177,公众号页面的“我的排号”是什么意思,0.9311680102778004
178,是否可以取消自动扣款,0.9310989157048816
179,查询结清证明申请是否已提交,0.9310766844436429
180,好人贷还款记录如何查询,0.9310455722812371
181,好人贷部分提前还款规则,0.9308980449984642
182,银行渠道维护无法操作怎么办,0.9308626039804331
183,好人贷被拒后为何没有下次开放时间,0.9308539260440184
184,公众号是否有还款提示,0.9307423350893386
185,更换银行卡会影响自动扣款吗,0.9307422741961936
186,拨打我行人工客服电话是否收费,0.9306450129189567
187,为何页面出现多个新网银行账户,0.9305714678063963
188,为何提示支付平台发卡行拒绝,0.9305209199686156
189,是否会发生重复扣款情况,0.9304901264216501
190,新网二类户转入/转出有时间限制吗,0.9304809736766501
191,好人贷额度是否循环使用,0.9303445095086861
192,核身链接失效的原因,0.9301852531735014
193,为何提示用户未实名认证,0.9301544942862434
194,好人贷账户如何查询,0.9301103350003592
195,新网二类户为何无法转入/转出,0.9300966864893147
196,结清证明的印章是否可以用公章,0.9300945059265945
197,企业邮箱验证码可否重新获取,0.9300213097955626
198,客服能否看到客户申请好人贷的信息,0.9299949719568341
199,随心存可以在我行公众号查询/操作吗,0.9299794438355807
200,系统升级会影响扣款吗,0.9299153630991116
201,新网银行有企业贷款吗？,0.9298509926675047
202,无法提供消费凭证可以取消贷款吗,0.9298220037655051
203,新网银行二类户限额是多少,0.9298182995655362
204,当期账单支持再分期吗,0.9297521854460657
205,如何查询存管账户流水,0.9296992995881876
206,新网银行存款产品为何暂停交易,0.9295691879278912
207,如何查看银行卡管理列表,0.9295357946794796
208,借款后如何判定下次还款日期,0.9294676763838455
209,如何查询申请相关的协议书,0.9294362408962256
210,好人贷账户如何更换手机号码,0.9293522194364637
211,为何收到新网银行还款短信,0.9292392917030886
212,平台方提供的客户审批资料能否提供给客户,0.9291277166978971
213,京东存款的计息规则及计息公式,0.9290672738808223
214,新网银行二类户与好人贷是否为同一个手机号码,0.9290324021853429
215,还款银行卡是否需要开通银联在线支付业务,0.9289544655510558
216,为何好人贷还款时提示“交易处理中”,0.9289446858023892
217,什么是无卡支付及免密支付,0.9289009865410938
218,还款日当天是否自动扣款,0.9288560894274017
219,好人贷不借款会产生利息或费用吗,0.9288390978715325
220,好人贷借款时还会审核吗,0.9288344397579669
221,自动扣款失败怎么办,0.928826366350049
222,存管密码被锁定怎么办,0.9287337118763015
223,还款日当天支持手动还款吗,0.9287214686516551
224,新网银行能否绑定云闪付,0.9285962832322592
225,客服能否查看聊天记录,0.9285694651562421
226,借款时选错收款账户怎么办？,0.9285286122337734
227,好人贷能否绑定他人银行卡,0.9284850764164471
228,为何存管信息与平台显示不一致,0.9284819044900195
229,为何提示支付平台交易金额超限,0.9284379012972062
230,为何存管查询提示没有密码,0.9282197771222568
231,身份证信息变更后如何更新,0.928044968794047
232,好人贷账户如何注销,0.9280020519069792
233,结清证明会展示哪些信息,0.9279897935465097
234,身份证上传失败怎么办,0.9279506535690872
235,新网二类户可以升级为一类户吗？,0.9279317863452484
236,注销账户的处理时间,0.9278862076328227
237,好人贷为什么提示“账户存在异常操作”,0.9277011071903942
238,我行放款的其他平台借款会上报征信吗,0.927580240410313
239,手机获取验证码失败,0.9275675353160868
240,好人贷审核时是否给填写的联系人去电,0.9274935407412558
241,京东存款为什么显示当日额度为什么已售罄？,0.927488344512655
242,半年得利提前支取影响已发放利息吗,0.9274395801102224
243,新网银行公众号如何取消关注,0.9273857479617587
244,好人贷是否支持提前还当期账单,0.9272991401634697
245,好人贷额度必须一次性借完吗,0.9272966328776232
246,新网银行人工客服电话打不通,0.9272878750634528
247,客户表示还款成功,0.9272351725692938
248,视频认证录制失败的原因是什么,0.9271036848018248
249,新网银行以什么名义放款,0.9271021792030189
250,为何提示支付平台账户状态异常,0.9270665939071043
251,季得利提前支取影响已发放利息吗,0.9270424248706125
252,人工是否可操作扣款,0.9269189506414806
253,新办的手机号可以申请好人贷吗,0.926822526674722
254,车贷还款记录如何查询,0.9266915340808783
255,存管账户如何注销,0.9265758663430401
256,抵押类贷款如何办理,0.9265596748719046
257,好人贷还款后额度何时恢复,0.9265406118785907
258,开据证明时为何需要实名认证,0.9264682914430634
259,为何提示支付平台不允许持卡人进行的交易,0.9264111513428438
260,新网诺诺发票贷如何申请,0.9263745435335738
261,新网银行自动扣款次数,0.9262586883652497
262,如何更换借款收款银行卡,0.926077566299784
263,新网账户之间能否互相转账,0.9260073875866413
264,如何注销新网注册用户,0.9259954736681387
265,为什么银行还款存在限额？,0.925821897283155
266,随心存提前支取到账时间,0.9257809642618461
267,新网银行开户支持的证件有哪些,0.9256705176227238
268,微信号更换成功后何时可以正常使用,0.9256593551753248
269,随心存停售后有影响吗,0.9256468153477353
270,如何查询转账到新网银行的记录,0.9256149442061353
271,什么是我的额度和可借额度,0.9254774176680425
272,电话客服是否可以受理结清证明,0.925417726473074
273,新网银行账户可以在哪些地方使用,0.9253980442572693
274,关闭其他平台额度后，能否恢复好人贷额度,0.9252691443086166
275,如何设置存管支付密码,0.9252059999227702
276,存管账户充值限额,0.9251918855388351
277,还款日可以修改吗,0.9250245585452014
278,客户要求发送相关模板,0.9250122428337335
279,申请好人贷使用的邮箱是公司邮箱还是个人邮箱,0.9250032499747876
280,诺诺发票贷的利率是多少,0.9249387327193193
281,如何购买新网银行存款产品,0.924781653028012
282,客户发送截图以及个人信息等,0.9247275364908829
283,存款产品是否保本保息,0.9246755063118824
284,注销注册用户后是否可恢复？,0.924512947861615
285,好人贷只能使用微信登录吗？,0.9243077009840822
286,提前还款有次数限制吗,0.9242692178776489
287,黑户/白户是否可以申请好人贷,0.9242420237130707
288,为何提示支付平台当日交易次数超限,0.9241798625802108
289,新网银行存款属于理财产品吗,0.9240768471945578
290,征信上报周期及更新时间,0.9240531077852344
291,合同为何无法打开,0.9240347139025075
292,借款合同是否有展示提前还款会收取违约金的情况,0.923974145885985
293,企业邮箱填写错误怎么办,0.9237895345345488
294,随心存如何修改交易密码,0.9237596649720711
295,新网银行二类户如何转入/转出,0.92368188095577
296,上传身份证时需填写的内容是什么,0.9236318609092325
297,如何查询账户是否冻结,0.9234970359224716
298,好人贷申请是否支持人工受理,0.9233739806178474
299,新网银行自动扣款时间,0.9233133238537684
300,提前还款手续费是多少,0.9230766054254554
301,选择任性还款/按期还款利息如何计算,0.9230718902812788
302,好人贷借款合同有效期是多久,0.9229605584481619
303,结清证明的发送方式有哪些,0.9229522290874167
304,实名认证为什么不符,0.9229483821136629
305,申请好人贷工作信息如何填写,0.9229090511024224
306,客户催促需要加急办理,0.9227855028743904
307,扣款失败的原因,0.9227676322455686
308,申请好人贷没有公司邮箱怎么办,0.9224939620898974
309,申请好人贷需要公积金、社保吗？,0.922469275916008
310,存管账户如何查询,0.922453760944946
311,在线客服是否是人工客服,0.9223702146518235
312,车贷如何更换还款银行卡,0.9222652258158524
313,新网银行有哪些产品可以提额,0.9221990600116361
314,新网银行存款类产品有哪些,0.9221035413418146
315,好人贷是否支持提前还款,0.9220891908168092
316,好人贷申请身份证可否添加水印,0.9220741712414363
317,新网银行有实体卡片吗,0.9219938111238988
318,如何更改其他平台的注册手机号码,0.9218482245533333
319,手机号无法使用为什么,0.9218318502133358
320,如何查看随心存购买情况,0.9217712076780767
321,月得利提前支取如何计息,0.9216650741620873
322,好人贷-云闪付如何提前还款,0.921629053581515
323,如何查看好人贷还款计划,0.9215206199295619
324,好人贷收取哪些费用,0.921488992386882
325,可以通过他人银行卡转入到新网银行账户吗,0.9214738359647994
326,周得利提前支取如何计息,0.9214255490060739
327,为什么收到美利车金融的短信,0.9212940929253758
328,如何查看委托支付协议,0.9212145498004959
329,为何提示支付平台其他错误,0.9210093239624839
330,白骑士认证失败是什么意思,0.9209222670778391
331,在线咨询是否支持客户发送语音,0.9208351117586291
332,未接到好人贷回访电话会被拒吗,0.9208319704296228
333,可以查询注册手机号码吗,0.9208150152927056
334,车贷如何办理解押手续,0.9207397885219013
335,线下转账如何填写新网银行开户信息,0.920734634256926
336,定期存款是否有存单,0.9204827471643992
337,为何提示该证件已被使用,0.9204145898290378
338,申请好人贷需要哪些资料,0.9203936627119025
339,好人贷申请能否撤销,0.9202743160552542
340,车贷支持手动还款吗,0.9202644226618917
341,哪些渠道可以购买京东存款产品？,0.9201927851517941
342,好人贷申请必须使用身份证原件吗,0.9201386858495941
343,如何查询征信报告,0.9200136272635088
344,好人贷通过率多少,0.9199455342780426
345,如何操作随心存大额存款,0.9197062377154588
346,提前支取时为何显示存入,0.9196435616384752
347,能否开具非恶意逾期证明,0.9196068776896301
348,获取额度后多久可发起借款,0.9194798605739104
349,申请诺诺发票贷需要什么条件,0.9194542124297549
350,好人贷提前还款最低还多少,0.9194507240738111
351,新网账户绑定微信/支付宝后支持提现或充值吗,0.9193762703853322
352,新网银行人工客服电话是多少,0.9192627872336607
353,能否删除个人信息,0.9192309830547103
354,好人贷当期能否最低还款,0.919192089301583
355,好事贷收取哪些费用,0.9189265614312174
356,如何查询车贷还款日,0.9187766948295645
357,使用优惠券后提前还款利息如何计算,0.9185631161784819
358,新网银行有信用卡吗,0.9184887155545227
359,他人可以使用本人信息申请好人贷吗,0.9184538199615454
360,随心存如何查看收益情况,0.9184225383642647
361,居住信息如何填写,0.9183558647216423
362,验证码发送至什么手机号,0.9183478139224356
363,车贷收取哪些费用,0.9182176821223764
364,京东存款是否支持提前支取/提前部分支取？,0.9182072313392112
365,为什么提示用户不存在,0.9181854388046636
366,身份证过期可以申请好人贷吗,0.9181508679603566
367,好人贷申请是否可以使用临时身份证,0.9181300133282144
368,罚息能否减免,0.9181018534890596
369,个人可以在新网开立几个账户,0.91797509143586
370,如何查询新网账户,0.9177511825138194
371,选择任何还款方式都可以提前还款吗,0.9177157716364974
372,好人贷支持在国外发起借款吗,0.9176957684603516
373,新网银行行号是多少,0.9176890168522451
374,如何查看优惠券的使用情况,0.9175999423222642
375,审核电话可更改接听电话吗,0.9175312947508261
376,为何申请好人贷无结果,0.9173972381517005
377,好人贷上征信吗,0.9173405732524854
378,开户失败原因,0.9171876131993735
379,为何收到新网银行逾期提醒短信,0.9170804252086682
380,他行渠道汇入新网账户的到账时间是多久,0.9170130480110786
381,好人贷审核电话是多少,0.9167174295022843
382,什么是单笔借据和多笔借据,0.9166823025404266
383,如何查看贷款合同,0.9166296183783061
384,可否补充企业邮箱,0.9166071783528319
385,好人贷放款至什么账户,0.9165482917647207
386,如何查询是否开通银联在线支付,0.916498249061436
387,存款产品支取通用路径,0.9164363761393484
388,客户咨询其他平台催收问题,0.9162788611172865
389,联系新网银行客服有哪几种方式,0.9161293444192433
390,如何查询是否已申请好人贷,0.9161293032339674
391,提前还款会影响个人征信吗,0.9160854211758998
392,申请好人贷后有没有回复,0.9159091640915273
393,我行对客邮箱是多少,0.9158626242205977
394,如何删除身份证信息,0.9158610560880842
395,58车金融客服电话是多少,0.9157494867126567
396,可以查询个人信息资料吗？,0.9156083803991747
397,企业邮箱为何验证不了,0.9152036789925342
398,按期还款和任性还款的区别是什么,0.9151763803591448
399,关于客户个人信息安全问题,0.9151190720668941
400,五年定期存款支持提前支取吗,0.9150540383721039
401,有额度不使用有什么影响吗,0.9149598880050159
402,活体检测失败怎么办,0.9149142146955759
403,银行渠道维护是指什么,0.9147754370721183
404,存在迁户问题怎么处理,0.9146976454283144
405,提额会有通知吗,0.9145087702987915
406,客户表示没有问题了,0.9144999841082386
407,周得利计息规则,0.9144028302466057
408,随心存利率为何会发生变化,0.9143689515612068
409,实名认证审核时间,0.914048380311998
410,逾期未还款如何处理,0.9139969759750043
411,五年定期存款的利率是多少,0.9138988364423809
412,随心存利率是多少,0.9138389066225713
413,咨询可以发送图片吗？,0.9138368592015326
414,还款后页面显示等待中,0.9137328590091534
