0,必须开GPS吗,1.0
1,好人贷必须绑定银行卡使用吗,0.9407131991156497
2,申请创客贷需要什么条件,0.9354402165970463
3,什么是银行卡预留手机号？,0.935141082244913
4,销户后可以再开户吗,0.9326864177508285
5,操作好人贷是否需要开启定位,0.932594127634856
6,为何提示缺少必要参数,0.9324322468234725
7,申请诺诺发票贷需要什么条件,0.9313134660890483
8,可以查询注册手机号码吗,0.930754266573456
9,好人贷需要面签吗,0.9305612463561884
10,销户后为何还能解绑银行卡,0.9294916775508172
11,申请好人贷需要下载APP吗？,0.9288610688078396
12,为何提示不具备开具资格,0.9282650978794965
13,销户后是否上征信,0.9271004392961539
14,是否可以取消自动扣款,0.9265363947809989
15,为什么提示用户不存在,0.9263221985668825
16,申请好人贷需要什么条件,0.9261384645582759
17,修改手机号后是否需要重置登录密码,0.9254658815575286
18,车贷可以修改还款日吗,0.9253601019377969
19,注册手机号及微信号需要实名制吗,0.9250982095558513
20,好人贷额度必须一次性借完吗,0.9241611401753967
21,可以重新注册吗,0.9240433633188894
22,为什么银行还款存在限额？,0.9240320835638226
23,注销注册用户后是否可恢复？,0.9226845335584795
24,新网银行有招聘吗,0.9225140958165593
25,还款日可以修改吗,0.9221977095850126
26,开户是什么意思,0.9220473987020005
27,为什么取消了提前部分还款,0.9218152391584344
28,车贷支持手动还款吗,0.9217561503440063
29,通过本人微信找回密码是指什么,0.9216460756673397
30,可以让别人代还款吗？,0.9214838762916487
31,新网银行有实体卡片吗,0.9214648760127864
32,新网银行能否绑定云闪付,0.9213965020781638
33,为何提示用户未实名认证,0.9213667442426996
34,选择任何还款方式都可以提前还款吗,0.9211928769536645
35,申请好人贷必须填写联系人信息吗,0.921100194566621
36,银行渠道维护是指什么,0.9209859963460029
37,为何销户后还能看到好人贷信息,0.9208226105801719
38,密码被锁定怎么办,0.9207396654394321
39,开据证明时为何需要实名认证,0.9205732787175878
40,存款需要先开立银行账户吗,0.9204366202412111
41,绑定银行卡产生费用吗,0.9204095929931069
42,为何存管查询提示没有密码,0.9202721376080054
43,合同为何无法打开,0.9201470972896324
44,优信扣款成功后为何显示待还款,0.9200953872807147
45,企业邮箱为何验证不了,0.9199249327448648
46,当期账单支持再分期吗,0.9198560494865505
47,为什么没有扣款,0.9197072820101503
48,如何解约快捷支付？,0.919402654698444
49,为何之前绑定的银行卡不支持扣款了,0.9193640044100764
50,页面为何无法打开,0.9191308461491138
51,线上开据证明有次数限制吗,0.9190045750937295
52,系统升级会影响扣款吗,0.9188798595395651
53,审核电话内容是什么,0.9186574661484318
54,如何查看手机号是否实名制,0.9186390566817253
55,存管密码被锁定怎么办,0.9186034789849837
56,线上是否可开据征信版结清证明,0.918367918652575
57,提前支取有限制吗,0.9183232844359333
58,新网二类户转入/转出有时间限制吗,0.9182356420206512
59,获取验证码次数超限怎么办,0.9181899714438302
60,可否取消银行卡限额,0.9177941594083955
61,新网银行扣款通道是什么,0.9177356000224804
62,银行转账未到账怎么办,0.9176301862507815
63,补扣会影响信用吗,0.9176068864873352
64,转账时为何提示未面核,0.9174280610403442
65,进入随心存为何提示手机号码不一致,0.9173642251994808
66,如何修改实名认证手机号码,0.9172674472814524
67,新网银行有信用卡吗,0.9172192276034414
68,可以查询个人信息资料吗？,0.9171530692505747
69,手机号无法使用为什么,0.9170861905007296
70,好人贷注册手机号与银行卡预留手机号是否需要一致？,0.9168297583086031
71,新网二类户可以升级为一类户吗？,0.9168236507453333
72,线上开据证明为何和征信金额不符,0.9167214409104296
73,未正常还款我行会进行催收吗,0.9166451447967771
74,好人贷只能通过绑定的银行卡还款吗,0.916309788787593
75,申请好人贷需要开个人账户吗？,0.916238839233706
76,查询车贷的注册手机号码是什么,0.9162231953067401
77,下一次开放时间是什么意思,0.9161835362811416
78,有额度不使用有什么影响吗,0.9161307240560936
79,为什么无法注册,0.9159898717055498
80,可否按照征信订单号开据证明,0.9159857417871818
81,随心存操作渠道有哪些,0.9159109939517242
82,实名认证为什么不符,0.915899483265387
83,为何人脸识别提示光线太足,0.9157885495273685
84,好人卡绑定云闪付/微信等失败怎么办,0.9157819897557384
85,车贷能否绑定他人银行卡,0.9155861150179735
86,为何征信上有新网银行上报的逾期,0.9155686334515799
87,随心存可以在我行公众号查询/操作吗,0.9155405333252142
88,征信报告是什么样的,0.9154977174361246
89,更换银行卡会影响自动扣款吗,0.9153963627602086
90,自助提额什么时候上线,0.9153764080703682
91,人工是否可操作扣款,0.9153390444567926
92,结清证明会展示哪些信息,0.915294397807645
93,如何查询是否开通银联在线支付,0.9151304848155564
94,为何收到新网银行逾期提醒短信,0.9149984936185116
95,提额会有通知吗,0.9149718599141778
96,验证码发送至什么手机号,0.9148751381792065
97,申请好人贷没有公司邮箱怎么办,0.9146786849294017
98,非绑定银行卡可否与新网二类户转账,0.9146383286262271
99,好人贷被拒后为何没有下次开放时间,0.9145175353643865
100,可否补充企业邮箱,0.9144873586108314
101,随心存T+1是什么,0.9144335117430767
102,修改手机号码/微信号是否会影响自动扣款,0.9143722289083013
103,银联在线支付是什么,0.9143557490353993
104,好人贷只能使用微信登录吗？,0.9143438014372084
105,可以咨询吗,0.9142877074933611
106,公众号是否有还款提示,0.9142516130159813
107,房产保证金是什么,0.9141789910450453
108,为什么点击拍照没有反应,0.9140433678030578
109,为何重置密码后仍提示密码错误,0.9138465118132879
110,企业邮箱验证码可否重新获取,0.9138252656740306
111,车贷如何修改注册手机号码,0.913799568583833
112,挖财还款是否为新网银行代扣,0.913747696714735
113,什么是无卡支付及免密支付,0.9136973509996017
114,新网银行公众号如何取消关注,0.9136748735263764
115,企业邮箱格式是什么,0.9135355210227848
116,新网二类户为何无法转入/转出,0.9134417457663446
117,结清贷款后征信上是否会显示结清,0.9134201451364459
118,好人贷可以重新申请吗,0.9131538409491916
119,好人贷支持微信/支付宝扣款吗,0.9130967001460937
120,新网银行账户可以设置为好人贷借/还款账户吗,0.9130177147342238
121,再次申请好人贷会查询征信吗,0.912888648831054
122,为何收到新网银行还款短信,0.9128453107062178
123,为何提示交易密码验证失败,0.9127920505981449
124,额度冻结是什么意思？,0.9127822744321028
125,好人贷账户是否为新网银行二类户？,0.9124166544969862
126,视频认证的步骤是什么,0.9123884595340612
127,滴水贷客服电话是多少,0.9122555643876525
128,咨询可以发送图片吗？,0.9120941498544687
129,58车金融客服电话是多少,0.9119034545261214
130,如何退出微信公众号,0.9117817122090115
131,为何图文验证码输入正确却提示错误,0.911694165764511
132,能否让客服回电,0.9114305816136865
133,提前结清贷款后还会扣款吗,0.9114130100923769
134,随心存停售后有影响吗,0.9112591858490008
135,是否需要使用本人手机操作好人贷,0.9110725033810233
136,新办的手机号可以申请好人贷吗,0.9110163603212521
137,新网银行的官网地址是什么,0.9109926548865805
138,为什么提前还款显示联合贷批次执行中？,0.9109820954579404
139,好人贷利率为什么调高了,0.9109690155515202
140,新网银行有企业贷款吗？,0.9109653490511138
141,为何提示还款卡不存在,0.9108975240249129
142,如何更换微信号,0.9107930634439901
143,迁户是什么意思,0.9106063833685859
144,车贷合同为何无法查看,0.9105364634171089
145,银行渠道维护无法操作怎么办,0.9105181943389067
146,车贷申请多久可以放款,0.9105177187421442
147,审核电话可更改接听电话吗,0.9103808524723382
148,还款日当天支持手动还款吗,0.9103500806721728
149,为何无法销户,0.9102615658776969
150,为什么收到美利车金融的短信,0.910212513309612
151,车贷还款只扣除部分是什么原因,0.9101691132842196
152,提前还款会影响个人征信吗,0.9100210618886129
153,结清贷款后什么时候可以开据结清证明,0.9100192271302895
154,银行卡开通银联在线支付后是否可正常还款,0.9099744699811871
155,为什么收到提额短信但额度未提升,0.9098035517731978
156,好人贷为什么提示“账户存在异常操作”,0.909470417498154
157,美利车联系电话,0.909378102864779
158,为何提示支付平台持卡人信息有误,0.9093731117897407
159,节假日可以借/还款吗,0.9093115430941036
160,实名认证是否查询征信,0.9092963230684665
161,还款银行卡是否需要开通银联在线支付业务,0.9092600876766868
162,银行卡是二类户影响扣款吗,0.9092588689968104
163,还款金额超银行卡限额怎么办,0.9091852780316896
164,经侦是指什么,0.9091034444999679
165,新网银行三类户是什么,0.9090280563452698
166,新网银行以什么名义放款,0.9090198543173658
167,新网二类户转入/转出收取手续费吗,0.9089687522871863
168,白骑士认证失败是什么意思,0.9089158562286336
169,随心存支持提前支取吗,0.9088935007804728
170,贷款证明开据失败怎么办,0.9088581304893592
171,还款日当天是否自动扣款,0.908754805359851
172,季得利提前支取影响已发放利息吗,0.9085751544184834
173,季得利的操作渠道有哪些,0.9085310638859031
174,借款成功会有短信等提醒吗,0.9085159505802854
175,好人贷是否支持提前还当期账单,0.9084883806150912
176,能否开具非恶意逾期证明,0.9084210025297641
177,优信客服电话是多少,0.9083194209332934
178,新网银行账户是什么,0.9083001276715584
179,可绑定银行卡数量上限,0.9082607157472747
180,提前还款有次数限制吗,0.9082496182550805
181,线下转账如何填写新网银行开户信息,0.9080250679783439
182,为何提示支付平台发卡行拒绝,0.9080114635414178
183,如何获取线上核身链接,0.9079614652949385
184,新网银行视频认证的QQ号码是多少,0.9079365910305062
185,公众号页面的“我的排号”是什么意思,0.9079035937081911
186,好人贷授信首页显示利率是否为固定利率,0.9078931767425553
187,销户与否会产生什么影响,0.9078565945250126
188,为何好人贷还款时提示“交易处理中”,0.9078297614455085
189,如何绑定银行卡,0.9075142138605063
190,新网账户绑定微信/支付宝后支持提现或充值吗,0.9074497550395283
191,无法提供消费凭证可以取消贷款吗,0.9074171797749515
192,车贷如何解绑银行卡,0.9073683272639862
193,好人贷定位如何开启,0.907325306615004
194,好人贷申请需要填写哪些个人信息,0.9073085993511698
195,关闭其他平台额度后，能否恢复好人贷额度,0.9071933126161202
196,为何申请好人贷后显示未获取额度,0.9071711738492285
197,为何提示支付平台签约关系不存在,0.9070981465832352
198,忘记密码怎么办,0.9070769020641851
199,未接到好人贷回访电话会被拒吗,0.90689554067098
200,"好人贷有回访电话吗""",0.9068774020824584
201,能否删除个人信息,0.9066523259658966
202,好人贷申请是否查询芝麻信用,0.9065992550043234
203,客户要求发送相关模板,0.9064687260637564
204,好人贷有回访电话吗,0.9063602085769428
205,京东存款如何修改注册手机号码,0.9063487483181704
206,如何修改存管账户预留手机号码,0.9063300215112666
207,我行对客邮箱是多少,0.9063028649165484
208,如何修改新网随心存注册号码,0.9062852847749815
209,为什么好人贷第一期还款金额与之后不一致,0.90626825937948
210,收款卡发卡行拒绝放款失败什么意思？,0.9062368853790109
211,可否对公还款,0.9062363608311303
212,为何申请好人贷页面显示暂无资格,0.9061212724573114
213,如何关注新网银行公众号,0.9060113652562645
214,手机获取验证码失败,0.9059869335341207
215,我们是四川新网银行吗,0.9059716659083653
216,为何提示支付平台交易金额超限,0.9059569588693162
217,页面为什么异常跳转,0.9059508752673464
218,新网银行存款是否受保障,0.9059261747029481
219,好人贷借款时还会审核吗,0.9058686856316506
220,如何查看开户结果,0.905791562382592
221,新网银行开户支持的证件有哪些,0.9056543232547909
222,为何提示支付平台账户状态异常,0.9055424338413676
223,接收短信的手机号是否为注册手机号,0.9054822717316546
224,新网银行以何名义查询征信,0.9054821555241729
225,如何知晓已注销成功,0.905354798736008
226,好人贷能否绑定他人银行卡,0.9053322077883997
227,存在迁户问题怎么处理,0.905277062119489
228,半年得利提前支取影响已发放利息吗,0.9052047346417776
229,为何提示支付平台支取金额超过可用余额,0.9051668876948074
230,平台还款信息为何与新网银行不一致,0.9051131435010775
231,好人贷申请成功会有短信通知吗,0.9050998581967444
232,自动扣款失败怎么办,0.9050752161858668
233,银行卡挂失会影响自动扣款吗,0.9049578599531362
234,结清证明的发送方式有哪些,0.9049282893445955
235,为何还款后额度恢复减少了,0.9048464481065158
236,存管查询为何提示用户不存在或者信息有误,0.9047333072240169
237,随心存是什么,0.9046692366510778
238,新网银行二类户与好人贷是否为同一个手机号码,0.9046587196501198
239,申请好人贷有区域或者号段等限制吗,0.9045905207336301
240,为何存管信息与平台显示不一致,0.9045604753984662
241,开据证明时为何提示账户存在异常,0.9045311979132374
242,居住信息如何填写,0.9045214505812345
243,如何激活新网二类户,0.904450317613432
244,如何查询账户是否冻结,0.9044194430438742
245,开据证明为何显示没有符合要求的订单,0.9044104844941593
246,借款时选错收款账户怎么办？,0.9043281741902711
247,更改银行卡预留手机号的方法,0.9043140154463878
248,提前还款手续费是多少,0.9042959978652804
249,退汇是什么意思,0.9040645570856171
250,好人贷以什么贷款类型上报人行征信？,0.903944254147391
251,新网银行存款属于理财产品吗,0.9037795369322847
252,为何申请好人贷无结果,0.9037752910464234
253,新网银行是否上市,0.9035923561270547
254,上传身份证时需填写的内容是什么,0.9035270950820056
255,征信是什么,0.9034777406066657
256,美团客服热线是多少,0.9034678137537864
257,注册规则是什么,0.9034284325187416
258,好人贷额度为什么变低了,0.903391321698943
259,如何换绑银行卡,0.9033649582007999
260,平台方手机号变更导致我行无法直接开据结清证明问题,0.9033489583265742
261,转账到新网银行账户是否还款成功,0.9033272296990238
262,开通什么业务,0.9032939523804276
263,好人贷提额会查询征信吗,0.9032760075108947
264,好人贷是否支持归还逾期部分账单,0.9032562842092321
265,车贷扣款支持的银行卡有哪些,0.9032242108605959
266,系统繁忙是什么原因,0.9031992538006273
267,存管账户充值限额,0.903191626625199
268,好人贷申请必须使用身份证原件吗,0.9031829403206018
269,新网银行二类户限额是多少,0.90317014279432
270,注册手机号更换成功后何时可以正常使用,0.9029029395439901
271,我行放款的其他平台借款会上报征信吗,0.9028350644436721
272,拨打我行人工客服电话是否收费,0.902805426344458
273,为何提示支付平台其他错误,0.9027789749146341
274,申请好人贷后有没有回复,0.9026880194600095
275,微信/支付宝等可否与新网银行账户互相绑定,0.9026827623709283
276,如何解绑银行卡,0.9026472245066965
277,为何提示支付平台当日交易次数超限,0.9026300981300086
278,新网诺诺发票贷如何申请,0.902477830903545
279,如何设置存管支付密码,0.9023023950875436
280,客服能否查看聊天记录,0.9023012265883102
281,为何提示系统异常,0.9022759139889203
282,扣款结果会有短信提示吗,0.9022620373196348
283,什么是综合评估,0.9022560094602524
284,输入身份证号码时，为何无法输入字母,0.9021391877318401
285,绑定银行卡失败,0.9021229301778568
286,京东存款为什么显示当日额度为什么已售罄？,0.9021018390612344
287,好人贷为何无法还款,0.9020756886976692
288,使用优惠券后提前还款利息如何计算,0.9020163198308974
289,如何选择按期还款/任性还款,0.9020015583150103
290,令牌无效是什么,0.9019261876225253
291,一个身份证可以申请好人贷两次吗？,0.9018741794285666
292,支持绑定的银行卡类型有哪些,0.9018518351531971
293,如何更改其他平台的注册手机号码,0.9016368229204814
294,随心存如何修改交易密码,0.9015951410928856
295,在线咨询是否支持客户发送语音,0.9015609945197907
296,为何提示该证件已被使用,0.901536198014955
297,为何提示支付平台银行卡未开通银联无卡认证支付,0.9015292029810301
298,什么是活体检测,0.9013407683979322
299,定期存款操作的渠道有哪些,0.9012478566303064
300,绑卡时页面上的银行卡预留手机号码可以修改吗,0.9011158455366342
301,如何注销公众号,0.9010902033747294
302,为何提示支付平台账户余额不足,0.9009895805880339
303,为何提示支付平台暂不支持的银行或限额,0.9009317948965418
304,结清证明印章无法查看,0.9009316792516033
305,好人贷支持在国外发起借款吗,0.9009075707319607
306,什么是风控审核中,0.9009007761117368
307,登录时的图文验证码是否区分大小写,0.900777601799714
308,银行卡还款限额是多少,0.9005591962374008
309,获取额度后多久可发起借款,0.9004124243053557
310,车辆信息如何查询,0.9004009810827326
311,新网银行存款产品为何暂停交易,0.9003706150611471
312,为何征信上有新网上报的贷款记录,0.9002291135818988
313,关于消费凭证,0.9001871169463347
314,客服能否看到客户申请好人贷的信息,0.9001039013757329
315,车贷收取哪些费用,0.9000353586235113
316,好人贷-云闪付如何更换收/还款银行卡,0.9000121641050863
317,申请好人贷需要公积金、社保吗？,0.8998802190260979
318,哪些渠道可以购买京东存款产品？,0.8998097938049261
319,好人贷审核时是否给填写的联系人去电,0.8997672270123778
320,为何结清证明显示日期与平台不符,0.8996688460297021
321,银联在线支付如何开通,0.8995769197179554
322,如何取消征信查询及使用授权书,0.8994974152625226
323,如何查询是否已申请好人贷,0.899481023140221
324,好人贷为什么额度低,0.8994700551924474
325,贷款证明的电子章是否具有法律效应,0.8993756366475923
326,好人贷为什么无法借款,0.8993158067466619
327,为何无法申请好人贷,0.8992086420964404
328,诺诺发票贷的利率是多少,0.8992048653180322
329,好人贷支持随借随还吗,0.8991826848281237
330,如何查看随心存购买情况,0.8987262048301731
331,申请好人贷是否都有额度,0.8986921088611601
332,还款后为何未更新还款状态,0.8986201226027473
333,节假日可以操作各类存款吗,0.898584883979634
334,好人贷不借款会产生利息或费用吗,0.8984988269834159
335,为什么拍照认证时总是不成功或显示系统崩溃,0.8984458000543337
336,交易密码无法设置,0.8983831962174962
337,随心存产品停售原因,0.8983637352848199
338,新网账户之间能否互相转账,0.8982842992082312
339,好人贷账户如何更换手机号码,0.8982506445894454
340,为何无法登录存管查询,0.8981868608285929
341,好人贷审核不通过对个人有什么影响,0.8981431475096673
342,存款产品如何重置交易密码,0.8980239598370064
343,电话客服是否可以受理结清证明,0.8979277859253098
344,好人贷-云闪付是什么,0.8978701569808529
345,罚息能否减免,0.8978405593279174
346,为何提示支付平台该客户无默认扣款卡，交易没有发给统一支付,0.8977802248238693
347,可以通过他人银行卡转入到新网银行账户吗,0.8977570275840356
348,人脸识别失败怎么办,0.8976995037519667
349,手机号归属地与定位地不一致是否有影响,0.8976305925489715
350,黑户/白户是否可以申请好人贷,0.897625617678974
351,为何提示支付平台受发卡行资金用途限制拒绝交易,0.897607548186979
352,他人可以使用本人信息申请好人贷吗,0.8975731985365285
353,如何降低/关闭额度,0.8975624340757559
354,如何把注册用户与结算用户都注销,0.8975003683592658
355,好人贷手动还款时为何提示批次执行中,0.8974356872335183
356,新网二类户上的资金是否计息,0.897071305879677
357,新网银行发送的短信验证码的有效时长？,0.8967244160015797
358,好人贷为什么无法登录,0.8967125015674399
359,如何修改征信上的个人信息,0.8966573249593011
360,为何无法提交好人贷申请资料,0.8965128125022834
361,名下所有卡被冻结后如何还款,0.8964696445295776
362,开具结清证明时为何无法登录,0.8963848142763913
363,车贷如何更换还款银行卡,0.8963360380212997
364,为何页面出现多个新网银行账户,0.8961630572174492
365,好人贷申请的渠道有哪些,0.8960026250441805
366,选择任性还款/按期还款利息如何计算,0.8959699570076756
367,新网银行人工客服电话是多少,0.895910064622765
368,如何查看银行卡管理列表,0.8958565157167169
369,转入新网银行使用的密码是交易密码还是银行卡密码,0.8958539607621582
370,为何提示支付平台渠道不支持的银行,0.8958531375278944
371,贷款结清之后能否删除贷款记录,0.8957469903670151
372,新网银行有几个网点,0.8957433266367418
373,购买存款页面为何提示“额度不足，无法购买”,0.8954826037384327
374,什么是分批次扣款,0.8954480450912419
375,什么是我的额度和可借额度,0.8953820570342351
376,好人贷注册手机号无法使用,0.8953498811847805
377,视频认证录制失败的原因是什么,0.8953177477061472
378,借款到账后页面未更新借款状态,0.8952806290896322
379,实名认证失败的原因是什么,0.8952179119814175
380,周得利提前支取如何计息,0.8949528318539764
381,微信号更换成功后何时可以正常使用,0.8949364786485496
382,京东存款是否支持提前支取/提前部分支取？,0.8949355522197253
383,好人贷申请是否可以使用临时身份证,0.8949254485551454
384,如何确保还款日当天会扣款成功,0.8948639802246754
385,新网银行账户可以在哪些地方使用,0.8948497648343949
386,如何查看委托支付协议,0.8948386411253327
387,身份证过期可以申请好人贷吗,0.8947067305169212
388,如何查看好人贷相关协议/合同？,0.8944630055341772
389,企业邮箱填写错误怎么办,0.8944510511426703
390,新网银行人工客服电话打不通,0.8943893403515895
391,联系新网银行客服有哪几种方式,0.8942796361709439
392,活体检测失败怎么办,0.8941554828649801
393,新网银行账户的交易记录如何查看,0.8941116662361517
394,可否延期还款,0.8940789459144325
395,申请好人贷后为何页面显示仍可提交申请,0.8940089105563379
396,新网银行有哪些活动,0.8939772143799675
397,新网银行存款类产品有哪些,0.8939635157149466
398,新网银行地址在哪里,0.8938511942706316
399,创客贷额度是多少,0.8937143197881624
400,线上转入新网银行账户到账时间是多久,0.893671162590657
401,好人贷利率为什么高,0.8936598956298604
402,好人贷额度是否循环使用,0.8935960909897126
403,好人贷-云闪付如何提前还款,0.8934785712314411
404,存款产品是否保本保息,0.8934499317938634
405,结清证明的印章是否可以用公章,0.8933501742158106
406,借款失败怎么办,0.8932275896982311
407,申请好人贷工作信息如何填写,0.8931907695667015
408,目前支持的银行有哪些,0.8931345496952259
409,为何征信上有新网银行的贷款审批记录,0.8928412386321288
410,随心存到期后何时到账,0.8928304419748785
411,什么是单笔借据和多笔借据,0.8928050035024568
412,新网银行自动扣款次数,0.8928047374610892
413,为何按期还款只能选择部分贷款期限,0.8927590357449803
414,客服是否是随机分配,0.8927206315181501
415,存管是什么,0.8926111231368609
416,新网银行二类户如何转入/转出,0.8925309044712119
417,提前支取时为何显示存入,0.8923455785912005
418,人脸识别使用的是照片还是视频,0.8923157249010208
419,在哪个平台操作提现,0.8922970839304806
420,好人贷借款超时未到账如何处理,0.8922437008955783
421,客户表示还款成功,0.8921607273391488
422,如何查询好人贷申请的授信结果,0.8921584643476602
423,月得利提前支取如何计息,0.8920970025247518
424,客户催促需要加急办理,0.8918586665542645
425,客户称赞服务好,0.8917630838658248
426,工新借是什么,0.8914947017089616
427,好人贷还款后额度何时恢复,0.8914849397443578
428,车贷如何提前还款,0.8914225129718609
429,如何更换好人贷默认还款账户,0.8913853170345832
430,转账到新网银行如何操作,0.8912776513030727
431,申请好人贷后，可否更改授信结果,0.8911155905421965
