0,必须开GPS吗,1.0
432,按期还款和任性还款的区别是什么,0.8911086134014129
433,车贷合同如何查看,0.891028736673549
434,好人贷审核电话是多少,0.8909434063132947
435,为何提示还款存在差错,0.8908621930741905
436,如何获得优惠券,0.8905087404210614
437,申请好人贷需要哪些资料,0.890245179698839
438,个人可以在新网开立几个账户,0.8902074447437144
439,申请好人贷使用的邮箱是公司邮箱还是个人邮箱,0.8900979240562916
440,新网银行有哪些产品可以提额,0.8900858674536399
441,自动扣款如何操作,0.8900764161344505
442,消费凭证有效期是多久,0.8900647840156126
443,在线客服是否是人工客服,0.8898928411629273
444,查询结清证明申请是否已提交,0.8898508423248301
445,按期还款是什么,0.8897803186194556
446,什么是注册号码？,0.889621739783088
447,车贷合同里的金额是否包含利息,0.8896199743505218
448,好人贷是否支持提前还款,0.8895886274992204
449,如何登录微信公众号,0.8895221672047424
450,新网银行自动扣款时间,0.8895194328633182
451,什么情况算违约,0.8895080800065521
452,好人贷交易密码如何设置,0.8894771530893636
453,手持身份证拍照的注意事项,0.8894473208018874
454,如何查询其他平台扣款银行卡,0.8893672222838199
455,什么是当期账单,0.8893351613578988
456,如何查询征信报告,0.8893305907131942
457,为何征信上的放款日期与实际借款日期不一致,0.8891806386027853
458,为何提示支付平台不允许持卡人进行的交易,0.8890572228945529
459,开户失败原因,0.8889379035157505
460,如何增加银行卡,0.8888997021726689
461,如何注销新网注册用户,0.8888260947858405
462,如何查询转账到新网银行的记录,0.8885956976118063
463,还款后页面显示等待中,0.8884670226216098
464,好人贷借款金额与到账金额是否一致,0.8884165518911936
465,实际申请金额与放款金额不一致可否取消车贷,0.8882785070405486
466,罚息介绍,0.8882131927311665
467,季得利是什么,0.8881931515812305
468,申请被拒怎么办,0.8881883311745071
469,如何查询合作平台贷款是否结清,0.8881495274582706
470,公众号如何注册,0.8880136402730139
471,结清证明开据时间是多久,0.8879634227812602
472,存管提现到账时间是多久,0.8879002703216528
473,好人贷借款合同有效期是多久,0.8878528646782825
474,为何同时收到了还款成功和失败的短信,0.8878315018313869
475,逾期未还款如何处理,0.8876397215487206
476,征信上显示的贷款金额是否包含利息,0.8875975535108714
477,随心存提前支取到账时间,0.8875048459712169
478,客户表示需要考虑,0.8874722123598751
479,任性还款是什么,0.8873458953610464
480,如何查询申请相关的协议书,0.8872071764292445
481,车贷如何办理解押手续,0.8871122038530338
482,额度冻结怎么办,0.886932579337248
483,存款产品如何修改手机号,0.8869303187976246
484,关于客户个人信息安全问题,0.8867415809784239
485,如何查询新网账户,0.8867286992172317
486,如何更换借款收款银行卡,0.8866822609622365
487,修改手机号码的处理时间是多久,0.8862746092147322
488,如何查询存管账户流水,0.88624675599121
489,新网银行行号是多少,0.8859476538714036
490,他行渠道汇入新网账户的到账时间是多久,0.8858494506133953
491,还款记录如何查看,0.8856914988081093
492,五年定期存款是什么,0.8855786497288156
493,存款产品的资金可以用于好人贷还款吗,0.8855644728228541
494,电脑端可以登录好人贷吗,0.8855263424299438
495,新网银行好事贷如何申请,0.8853753172652247
496,好人贷如何查看所支持的还款方式,0.8852175579244036
497,如何购买新网银行存款产品,0.8852086824514331
498,如何查询当期车贷还款金额,0.8851819884327069
499,如何查询车贷还款日,0.8849400990710105
500,车贷还款记录如何查询,0.884891729884271
501,如何办理好人卡？,0.8848587499827177
502,什么是还款日,0.8846974073926267
503,结清证明是否是还款记录证明,0.8846809913565965
504,周得利计息规则,0.8845863933936433
505,好人贷支持周末借款吗？,0.8845699436408767
506,页面为何提示“开户失败”、“账户存在异常操作/账户异常”,0.8843906564476611
507,如何注销新网二类户,0.8843165751230313
508,好人贷还款方式有哪些,0.8842880156633854
509,存款页面是否会显示每日收益,0.8840534497537549
510,借款合同是否有展示提前还款会收取违约金的情况,0.883690493127337
511,逾期造成的影响是什么,0.8836297832336446
512,随心存如何查看收益情况,0.8835163165801453
513,好人贷借款如何上报征信,0.8832540732090821
514,客户提到投诉,0.883053712307911
515,好人贷申请是否支持人工受理,0.8830090981982716
516,车贷如何还款？,0.8827896642340001
517,客户表示没有问题了,0.8827110374310767
518,车贷利息是多少,0.882604277209016
519,客户表示有合作意向,0.8825709887303745
520,客户咨询其他平台催收问题,0.88256966777984
521,如何通过线下方式转入新网二类户,0.8823338511908789
522,五年定期存款支持提前支取吗,0.8818203317825353
523,新网银行合作平台有哪些,0.8815125012761865
524,定期存款是否有存单,0.8814490015624529
525,存款产品支取通用路径,0.8807093017139728
526,如何查看优惠券的使用情况,0.8806862075308467
527,如何冻结新网银行账户,0.8803936369568608
528,存款产品是否存满五年才能支取,0.8802671721553372
529,随心存利率是多少,0.8799338254245461
530,逾期后还款金额是否会增加,0.8796125150774031
531,随心存存款期限有哪些,0.8795147433965089
532,身份证更换期间会影响好人贷贷款吗,0.8794343485135461
533,车贷逾期如何还款,0.8793916965058364
534,如何操作随心存大额存款,0.8791865449696865
535,好人贷借款后能否修改贷款信息,0.8785551219372555
536,好人贷额度他人能否使用,0.8783092238067329
537,随心存利率为何会发生变化,0.8781763374355336
538,什么情况算逾期,0.878123766650035
539,是否会发生重复扣款情况,0.8780322530869128
540,客户表示稍等,0.8778865570989535
541,如何查看好人贷还款计划,0.8774232679639001
542,如何签署借款合同,0.8773487844345361
543,银行渠道维护时间一般是多久,0.8772669769278291
544,好人贷额度是否会发生变化,0.8769815595261249
545,好人贷申请身份证可否添加水印,0.8763385937238447
546,如何开立存管账户,0.8763087617611417
547,如何录制活体检测,0.8758877901610934
548,借款后如何判定下次还款日期,0.8756873233934594
549,客户表示知道了,0.8756498828748168
550,如何在新网银行开户,0.8755794041038839
551,能否人工开据贷款证明,0.8754911404437312
552,人脸拍摄规范,0.8753351233558208
553,好人贷与其他平台类似产品的区别是什么,0.8752257452328652
554,新网银行的活期利率是多少,0.8746568746576979
555,新网银行合作的存管平台有哪些,0.8744480700826143
556,客户发送截图以及个人信息等,0.8743296021543264
557,车贷平台如何查询,0.8741954533955995
558,随心存存入限额,0.8741881906320107
559,好人贷当期能否最低还款,0.8733871935169782
560,各还款方式如何进行还款,0.8732912457046532
561,存管查询的余额如何提现,0.873093493650947
562,京东存款的计息规则及计息公式,0.873024175900821
563,身份证上传失败怎么办,0.8729429686642675
564,合作平台如何取消贷款,0.8726570471245738
565,怎样才能成功申请到额度,0.8723231427902436
566,新网有哪些产品,0.8722642531893284
567,新网银行如何联系客户,0.8721361670553659
568,核身链接失效的原因,0.8721117151574966
569,如何查询还款日,0.8719774797260913
570,密码如何修改,0.8718611801327528
571,客户表示不满,0.8716859754580737
572,如何邀请好友申请好人贷,0.871664678933309
573,注销账户的处理时间,0.8712534798165986
574,好人贷如何提前还款,0.8709290321306467
575,好人贷如何实名认证,0.8705307381638143
576,好人贷电话回访时间,0.8704809324619364
577,好人贷自动扣款规则,0.8704802210372556
578,自动扣款时间段是多久,0.8704711073419701
579,存管账户如何注销,0.8703750533874941
580,好人贷账户如何挂失,0.870357935456955
581,其他贷款怎么办理,0.8703412887978523
582,合作平台如何还款,0.8701789921823837
583,好人贷还款记录如何查询,0.8692407513359011
584,实名认证审核时间,0.8689546608927925
585,好人贷是否有临时额度,0.8681803361693083
586,征信上报周期及更新时间,0.8679847614284733
587,新网银行简介,0.8678125879942624
588,存管账户如何查询,0.8675654909175886
589,新网银行人工客服服务时间,0.8674672794947761
590,好人贷申请能否撤销,0.8674569643957198
591,好人贷是什么,0.8674521746114241
592,好人贷提前还款最低还多少,0.8666297354689765
593,扣款失败的原因,0.8665967923781701
594,好人贷如何主动还款,0.8664863830072307
595,好人贷是邀请制吗,0.865954988267019
596,工新借如何申请,0.8657648281684782
597,什么平台的贷款,0.8649406691977803
598,如何查询好人贷借据收款银行卡,0.8648226293418132
599,新网银行APP下载,0.8647269794268687
600,车贷如何申请,0.8638278532311459
601,平台方提供的客户审批资料能否提供给客户,0.8636371554670385
602,定期存款的利率是多少,0.8632878615289904
603,什么是一、二、三类户,0.862727796849055
604,五年定期存款的利率是多少,0.8625085304735027
605,好人贷支持随时借款吗,0.8623583904355681
606,好人贷借款记录如何查询,0.8621513791429786
607,额度占用问题,0.8616861280999665
608,好人贷放款至什么账户,0.8612874248882797
609,好人贷个人资料如何修改,0.8612256571163827
610,好人贷扣款账户如何查看,0.8598678379148411
611,抵押类贷款如何办理,0.8596886773103091
612,好人贷能否人工操作提额,0.8595969025056603
613,怎样用其他手机登录好人贷,0.8593691338668866
614,随心存如何计息,0.8588538400757545
615,季得利如何支取,0.8577890950739648
616,好人贷如何自助提额,0.8570046013968721
617,批扣时间段是多久,0.85663409435447
618,好人贷部分提前还款规则,0.8563729155072458
619,存款利率是多少,0.8563076034966945
620,贷款证明如何开据,0.8558120452538437
621,有多少人获得好人贷额度,0.8557869829347244
622,如何查看贷款合同,0.8555077105309867
623,好人贷如何试算利息,0.8542192467087056
624,好人贷借款多久到账,0.8542033994628442
625,好人贷如何降低利率,0.8538874850401598
626,好人贷账户如何查询,0.8538687690383217
627,季得利如何计息,0.8535096508548897
628,好事贷收取哪些费用,0.8534580646849259
629,如何进入个人中心,0.8525978246287207
630,好人贷审核时间是多久,0.8524703457533596
631,如何开据存款证明,0.8515036693343891
632,好人贷如何提高额度,0.8502851686588887
633,优惠券如何使用,0.8501180912106662
634,好事贷如何还款,0.8499135672348359
635,随心存如何登录,0.8494655209497874
636,好人贷如何审核,0.8481810404441311
637,好人贷上征信吗,0.8479689174558479
638,好人贷账户如何注销,0.8476175888079467
639,好人贷还款后多久到账,0.8470177925859853
640,好人贷额度有效期是多久,0.8465222258038892
641,如何进入好人贷页面,0.8462237049099988
642,好人贷利率是多少,0.8459547662984556
643,客户提出建议,0.8437074050718066
644,如何办理对公业务,0.8436500552288551
645,定期存款到期如何支取,0.842406906149259
646,好人贷如何申请,0.8420534333601597
647,新网银行业务办理时间,0.8404185128264408
648,登录密码为何无法重置,0.8389482000115248
649,好人贷收取哪些费用,0.8389423048810637
650,查询各类工单办理进度,0.8389078993637331
651,好人贷月利率是多少,0.8388807045942054
652,好人贷支持扣款的银行有哪些,0.8388512192907329
653,好人贷年化利率是多少,0.8362209852081717
654,好人贷消费用途,0.8359512914468724
655,好人贷有额度后如何进行贷款,0.8346202073618149
656,什么是登录密码,0.8320943121054519
657,好人贷贷款利息如何计算,0.8269063360251494
658,如何删除身份证信息,0.8257841549404265
659,好人贷如何还款,0.8237498698409655
660,好人贷的办理时间,0.8237433891020345
661,好人贷贷款期限是多久,0.823710825985668
662,好人贷借款规则,0.8236181022791247
663,好人贷额度是多少,0.8170492806758971
664,好人贷通过率多少,0.806403355985478
665,身份证信息变更后如何更新,0.8036688508786264
666,好人贷提额周期是多久,0.8030281876842223
