0,按期还款和任性还款的区别是什么,1.0
1,按期还款和任性还款的区别是什么,1.0
2,如何选择按期还款/任性还款,0.9699731517667239
3,选择任性还款/按期还款利息如何计算,0.9679465414907924
4,按期还款是什么,0.9663186300219859
5,为何按期还款只能选择部分贷款期限,0.9629685290805591
6,为什么好人贷第一期还款金额与之后不一致,0.9621662567174951
7,为什么银行还款存在限额？,0.9582072060136732
8,为何好人贷还款时提示“交易处理中”,0.9570218679977186
9,借款后如何判定下次还款日期,0.9568348363473874
10,挖财还款是否为新网银行代扣,0.9559754306761133
11,车贷如何更换还款银行卡,0.9553681381151639
12,好人贷手动还款时为何提示批次执行中,0.9552582008582365
13,名下所有卡被冻结后如何还款,0.9543678290108094
14,如何查询当期车贷还款金额,0.9537259574390246
15,还款后为何未更新还款状态,0.9531167764728209
16,选择任何还款方式都可以提前还款吗,0.9523246196291361
17,好人贷如何查看所支持的还款方式,0.9522820968929699
18,为什么取消了提前部分还款,0.9518145334581953
19,如何更换好人贷默认还款账户,0.9517740972721862
20,银行卡还款限额是多少,0.9515172596199304
21,随心存T+1是什么,0.9511915872074528
22,好人贷为何无法还款,0.9509932844835887
23,使用优惠券后提前还款利息如何计算,0.9509140813872242
24,好人贷-云闪付如何更换收/还款银行卡,0.9505562940625447
25,好人贷额度为什么变低了,0.9502651234679069
26,新网银行扣款通道是什么,0.9497956457592924
27,还款日当天支持手动还款吗,0.9497878929844864
28,车贷还款只扣除部分是什么原因,0.9496870919382153
29,好人贷-云闪付如何提前还款,0.9495685784827184
30,提前还款手续费是多少,0.9495502352620808
31,为何征信上的放款日期与实际借款日期不一致,0.9492369601045036
32,为何提示还款卡不存在,0.9491541431042161
33,随心存到期后何时到账,0.9491372481157396
34,逾期未还款如何处理,0.9490653184283836
35,如何确保还款日当天会扣款成功,0.9488019640479062
36,优信扣款成功后为何显示待还款,0.9484990407034966
37,为什么提前还款显示联合贷批次执行中？,0.9484500264971052
38,如何查询车贷还款日,0.9482636705645503
39,车贷支持手动还款吗,0.9481465720252897
40,好人贷为什么无法借款,0.9479685733940819
41,五年定期存款是什么,0.9477526451731799
42,结清贷款后什么时候可以开据结清证明,0.9474354197893534
43,好人贷还款方式有哪些,0.947130684102858
44,新网银行存款产品为何暂停交易,0.9470876714235078
45,好人贷借款合同有效期是多久,0.9465976868198689
46,销户后为何还能解绑银行卡,0.9460949585856578
47,房产保证金是什么,0.9460058800508465
48,什么是分批次扣款,0.9459986347638134
49,随心存存款期限有哪些,0.9459580772876264
50,好人贷利率为什么调高了,0.9458181596472928
51,车贷扣款支持的银行卡有哪些,0.9457197887745621
52,好人贷是否支持提前还当期账单,0.9456821522777459
53,任性还款是什么,0.9456367186621106
54,车贷逾期如何还款,0.9453375835632166
55,还款金额超银行卡限额怎么办,0.9452814145592138
56,车贷还款记录如何查询,0.945132463093017
57,银行卡是二类户影响扣款吗,0.9449467292002048
58,还款记录如何查看,0.9449326424308718
59,好人贷为什么提示“账户存在异常操作”,0.9449147763537465
60,如何操作随心存大额存款,0.9446575719549775
61,好人贷-云闪付是什么,0.9444740934680289
62,当期账单支持再分期吗,0.944343477341307
63,还款日当天是否自动扣款,0.943879914003033
64,提前结清贷款后还会扣款吗,0.9438762080689049
65,定期存款操作的渠道有哪些,0.9438132170860432
66,工新借是什么,0.9437527811959121
67,新网银行三类户是什么,0.9437080655438378
68,节假日可以借/还款吗,0.9433873138984558
69,提前支取时为何显示存入,0.9432224216016241
70,各还款方式如何进行还款,0.943202217363592
71,为何还款后额度恢复减少了,0.9431187284472079
72,结清证明是否是还款记录证明,0.9430626821889824
73,如何更换借款收款银行卡,0.9430551051602959
74,如何查询还款日,0.9427878525008845
75,为何提示还款存在差错,0.9425003706085848
76,定期存款是否有存单,0.9423246508453363
77,好人贷还款后额度何时恢复,0.9422602403136412
78,新网银行二类户限额是多少,0.9421842227739115
79,转账到新网银行账户是否还款成功,0.941946501016035
80,好人贷为什么额度低,0.9417925774725376
81,如何查看随心存购买情况,0.9413242851501392
82,为何结清证明显示日期与平台不符,0.9412940673949254
83,如何把注册用户与结算用户都注销,0.9412910876679389
84,为何征信上有新网上报的贷款记录,0.9412902592446113
85,为何申请好人贷无结果,0.9412770972547128
86,车贷如何提前还款,0.9412421049069009
87,为何人脸识别提示光线太足,0.9410023414925603
88,好人贷以什么贷款类型上报人行征信？,0.9409470612887271
89,随心存是什么,0.9408222367503909
90,如何查看手机号是否实名制,0.9408163640401543
91,存款产品的资金可以用于好人贷还款吗,0.9407284740429422
92,车贷如何解绑银行卡,0.9407282441679458
93,什么是还款日,0.9406751827252456
94,查询车贷的注册手机号码是什么,0.9406020087266075
95,平台还款信息为何与新网银行不一致,0.9403765639113292
96,如何查询账户是否冻结,0.9403022990709541
97,新网二类户为何无法转入/转出,0.9401353261305018
98,结清证明的发送方式有哪些,0.9401251758541618
99,好人贷只能通过绑定的银行卡还款吗,0.9400986935210817
100,五年定期存款支持提前支取吗,0.940055538584689
101,好人贷是否支持归还逾期部分账单,0.9399793172698356
102,未正常还款我行会进行催收吗,0.9396890973281884
103,车贷可以修改还款日吗,0.9396859678065987
104,为何征信上有新网银行上报的逾期,0.9396732148617173
105,银联在线支付是什么,0.9396169851852822
106,为什么没有扣款,0.9395463858824649
107,好人贷借款超时未到账如何处理,0.9395194864591743
108,借款到账后页面未更新借款状态,0.9392230595754547
109,存管查询的余额如何提现,0.9390728101412164
110,贷款结清之后能否删除贷款记录,0.9389538329316107
111,京东存款为什么显示当日额度为什么已售罄？,0.9389075724091531
112,提前还款有次数限制吗,0.9387842528246857
113,好人贷与其他平台类似产品的区别是什么,0.9387760924790048
114,节假日可以操作各类存款吗,0.938733258433137
115,系统升级会影响扣款吗,0.9386661298110347
116,新网二类户上的资金是否计息,0.9384127897440923
117,注册规则是什么,0.9383676956070388
118,为何提示用户未实名认证,0.9383459342654862
119,为什么提示用户不存在,0.9382863179493532
120,新网银行存款是否受保障,0.9382400554743945
121,如何查看好人贷还款计划,0.9382357599848117
122,如何修改新网随心存注册号码,0.9381426842519776
123,新网银行账户是什么,0.9381050823690383
124,什么是无卡支付及免密支付,0.9380176832854451
125,新网二类户转入/转出有时间限制吗,0.9379557557886646
126,公众号是否有还款提示,0.9379106434204273
127,结清贷款后征信上是否会显示结清,0.9378689557853124
128,存款产品是否保本保息,0.937786676411469
129,新网银行以什么名义放款,0.9376602719845107
130,审核电话内容是什么,0.9375771147644605
131,存管提现到账时间是多久,0.9374774638404098
132,如何查询合作平台贷款是否结清,0.9373633718391964
133,新网银行二类户如何转入/转出,0.9372499759547427
134,借款时选错收款账户怎么办？,0.93716099181166
135,存款产品如何重置交易密码,0.9371480372790457
136,什么是银行卡预留手机号？,0.9371411521378286
137,随心存提前支取到账时间,0.9371184838815196
138,车贷合同如何查看,0.9370787910231791
139,如何查看好人贷相关协议/合同？,0.9370320575171932
140,随心存支持提前支取吗,0.9370245584499333
141,非绑定银行卡可否与新网二类户转账,0.9369127096806558
142,为何存管查询提示没有密码,0.9368021092776853
143,存管查询为何提示用户不存在或者信息有误,0.9367226004074926
144,什么是单笔借据和多笔借据,0.9367080972016096
145,好人贷借款时还会审核吗,0.936582759194916
146,如何查看委托支付协议,0.9365723869241576
147,银行渠道维护是指什么,0.9364359877899242
148,随心存操作渠道有哪些,0.936195134375282
149,页面为什么异常跳转,0.9361354772864504
150,视频认证的步骤是什么,0.936132359385963
151,京东存款如何修改注册手机号码,0.9357382954674861
152,车贷如何修改注册手机号码,0.9356960028132597
153,我行放款的其他平台借款会上报征信吗,0.935661425197928
154,月得利提前支取如何计息,0.9355359730032918
155,好人贷还款记录如何查询,0.9355093497671094
156,好人贷被拒后为何没有下次开放时间,0.9355072523459209
157,如何解约快捷支付？,0.9355010990357441
158,58车金融客服电话是多少,0.9351920669210126
159,退汇是什么意思,0.9351019290791739
160,滴水贷客服电话是多少,0.935100495255361
161,为何申请好人贷后显示未获取额度,0.9350610413590935
162,什么是我的额度和可借额度,0.9350407353948068
163,好人贷额度必须一次性借完吗,0.9350303765339429
164,实名认证为什么不符,0.9349658113183226
165,手机号无法使用为什么,0.9349085998392885
166,新网银行存款属于理财产品吗,0.9348169885322556
167,新网银行存款类产品有哪些,0.9347840599011406
168,销户与否会产生什么影响,0.9345300867095848
169,银行卡开通银联在线支付后是否可正常还款,0.9343313695958809
170,新网银行二类户与好人贷是否为同一个手机号码,0.9341958128016441
171,好人贷账户是否为新网银行二类户？,0.9341628662871396
172,还款后页面显示等待中,0.9340839791384499
173,可以让别人代还款吗？,0.9340037024406354
174,平台方手机号变更导致我行无法直接开据结清证明问题,0.9339713823288257
175,新网二类户转入/转出收取手续费吗,0.9338292413664986
176,诺诺发票贷的利率是多少,0.9338040221211784
177,如何激活新网二类户,0.9335777662713965
178,新网银行的官网地址是什么,0.9334796305071339
179,随心存产品停售原因,0.9333988715566272
180,新网银行账户可以设置为好人贷借/还款账户吗,0.9333663465029919
181,可否对公还款,0.933334313964889
182,车贷如何还款？,0.9333300855137928
183,新网诺诺发票贷如何申请,0.9332739286974504
184,借款合同是否有展示提前还款会收取违约金的情况,0.9332594549289839
185,线上是否可开据征信版结清证明,0.9332448955680707
186,逾期后还款金额是否会增加,0.9332385477978615
187,如何修改存管账户预留手机号码,0.9331575825316608
188,自助提额什么时候上线,0.9330951466879239
189,为何征信上有新网银行的贷款审批记录,0.9330456559779113
190,存管账户充值限额,0.9330147314336842
191,如何获取线上核身链接,0.933001665646734
192,如何查询其他平台扣款银行卡,0.9329988572592951
193,随心存如何查看收益情况,0.9327994086478842
194,好人贷不借款会产生利息或费用吗,0.9327143783601951
195,提前支取有限制吗,0.9326880933457189
196,绑定银行卡产生费用吗,0.932613950498437
197,好人贷如何提前还款,0.9325573213716094
198,为何收到新网银行还款短信,0.932481407348491
199,新网银行账户的交易记录如何查看,0.9324274521221699
200,好人贷借款金额与到账金额是否一致,0.9323797134725721
201,车贷能否绑定他人银行卡,0.9323773515018373
202,季得利是什么,0.9323723354681362
203,人工是否可操作扣款,0.9323428631368677
204,存款产品是否存满五年才能支取,0.9323420667637656
205,好人贷授信首页显示利率是否为固定利率,0.93229081185188
206,他行渠道汇入新网账户的到账时间是多久,0.9318818255085799
207,登录时的图文验证码是否区分大小写,0.9318023035980174
208,存在迁户问题怎么处理,0.9317218947011411
209,进入随心存为何提示手机号码不一致,0.9317068025730892
210,存款产品如何修改手机号,0.9316302249889612
211,迁户是什么意思,0.9315591420357487
212,如何查看优惠券的使用情况,0.931536596606966
213,京东存款的计息规则及计息公式,0.931513886217363
214,获取额度后多久可发起借款,0.9314850888943474
215,客户表示还款成功,0.9313953167881145
216,好人贷支持在国外发起借款吗,0.931338754036409
217,消费凭证有效期是多久,0.9313192980134608
218,周得利提前支取如何计息,0.9312207623006259
219,什么是活体检测,0.9311926624164306
220,车贷申请多久可以放款,0.9311922351924763
221,为何之前绑定的银行卡不支持扣款了,0.9311603991147802
222,好人贷额度是否循环使用,0.9311383607373522
223,更改银行卡预留手机号的方法,0.9310832103010692
224,结清证明开据时间是多久,0.9310565835699623
225,存管是什么,0.9309229875689807
226,更换银行卡会影响自动扣款吗,0.9308413328817385
227,额度冻结是什么意思？,0.9304645343027359
228,如何查看开户结果,0.9304360566966814
229,为何提示系统异常,0.9304252009960305
230,可否延期还款,0.9304111210439623
231,为什么收到提额短信但额度未提升,0.9303579268777226
232,为何提示该证件已被使用,0.9303421324990523
233,经侦是指什么,0.9302310198101004
234,车贷合同里的金额是否包含利息,0.9302169790263135
235,如何查看银行卡管理列表,0.9301879981183263
236,季得利的操作渠道有哪些,0.9301799456387363
237,好人贷支持微信/支付宝扣款吗,0.9300749611691747
238,转账时为何提示未面核,0.9298283416521833
239,好人贷注册手机号与银行卡预留手机号是否需要一致？,0.9296433734050942
240,银行转账未到账怎么办,0.9296187650989265
241,为何提示支付平台当日交易次数超限,0.9296033327679499
242,好人贷提额会查询征信吗,0.9295651517350816
243,如何设置存管支付密码,0.9295297742212648
244,五年定期存款的利率是多少,0.9295010334948326
245,开据证明时为何需要实名认证,0.9294247321260793
246,再次申请好人贷会查询征信吗,0.929374950272082
247,为何销户后还能看到好人贷信息,0.9293073774906034
248,如何查询转账到新网银行的记录,0.9291984998959552
249,自动扣款如何操作,0.9291848748290686
250,如何查询新网账户,0.9291260716712479
251,如何查询好人贷申请的授信结果,0.9289777021694833
252,好人贷必须绑定银行卡使用吗,0.9288931599247141
253,支持绑定的银行卡类型有哪些,0.9288730920630174
254,线上开据证明有次数限制吗,0.9288557695134017
255,我行对客邮箱是多少,0.9288177835835413
256,如何签署借款合同,0.9286434664284623
257,申请好人贷有区域或者号段等限制吗,0.9285885035677325
258,线上转入新网银行账户到账时间是多久,0.9284676747063793
259,车贷如何办理解押手续,0.9284456251232676
260,什么是综合评估,0.9283758803999218
261,通过本人微信找回密码是指什么,0.9282309253083243
262,什么是当期账单,0.928207418782857
263,为何提示支付平台账户余额不足,0.9282015829113848
264,贷款证明的电子章是否具有法律效应,0.9281137388635418
265,好人贷为什么无法登录,0.928043876403509
266,新网银行的活期利率是多少,0.9279506051827116
267,借款成功会有短信等提醒吗,0.9279305279175203
268,企业邮箱格式是什么,0.9279200436600515
269,随心存可以在我行公众号查询/操作吗,0.9279030351798562
270,额度冻结怎么办,0.9278891662676467
271,为什么收到美利车金融的短信,0.9278706776894141
272,为何提示缺少必要参数,0.9278469927850312
273,京东存款是否支持提前支取/提前部分支取？,0.9278365787396362
274,"好人贷有回访电话吗""",0.9277434561557318
275,好人贷账户如何更换手机号码,0.9276909167727164
276,如何查询存管账户流水,0.927655845084184
277,注销注册用户后是否可恢复？,0.9276342465646652
278,好人贷支持随借随还吗,0.9276181873593693
279,贷款证明开据失败怎么办,0.9275473747677291
280,好人贷借款如何上报征信,0.9275110830971525
281,车贷收取哪些费用,0.9274898917939869
282,转账到新网银行如何操作,0.927270607680049
283,系统繁忙是什么原因,0.9272418541133423
284,征信报告是什么样的,0.9272039823067083
285,如何查询是否已申请好人贷,0.9271932890387612
286,线上开据证明为何和征信金额不符,0.9270997998972594
287,随心存利率是多少,0.9269960218883109
288,好人贷申请是否查询芝麻信用,0.9268182712972642
289,如何查询是否开通银联在线支付,0.9268105948539215
290,什么是风控审核中,0.9267079937405607
291,还款日可以修改吗,0.9266987533533485
292,随心存如何修改交易密码,0.926646662755649
293,公众号页面的“我的排号”是什么意思,0.9265910979778982
294,令牌无效是什么,0.9265641537275375
295,新网银行人工客服电话是多少,0.9265269404472882
296,新网银行自动扣款次数,0.9264657579419264
297,新网银行有企业贷款吗？,0.9263358149930424
298,为什么点击拍照没有反应,0.9263181255422696
299,为何提示支付平台签约关系不存在,0.9263037572142544
300,如何冻结新网银行账户,0.926269689034735
301,如何修改实名认证手机号码,0.9262470346028538
302,新网银行有实体卡片吗,0.9261842712285265
303,什么情况算逾期,0.9261548105421725
304,随心存存入限额,0.9261381364416066
305,为何页面出现多个新网银行账户,0.9261273126281363
306,为什么无法注册,0.9261060261100471
307,为何申请好人贷页面显示暂无资格,0.9260427159500728
308,定期存款的利率是多少,0.9259580161203886
309,为何提示支付平台支取金额超过可用余额,0.9259472785859508
310,如何绑定银行卡,0.925860991665685
311,如何购买新网银行存款产品,0.9257343779023243
312,如何注销新网二类户,0.9256591049006752
313,定期存款到期如何支取,0.9256233764154321
314,为何提示支付平台受发卡行资金用途限制拒绝交易,0.9256152631250756
315,存管密码被锁定怎么办,0.9255922555571359
316,好人贷利率为什么高,0.9255824321103048
317,季得利提前支取影响已发放利息吗,0.9255577863712791
318,好人贷如何主动还款,0.9255288335450552
319,开据证明时为何提示账户存在异常,0.9254509185267861
320,在哪个平台操作提现,0.9254134452781434
321,联系新网银行客服有哪几种方式,0.9253428518756602
322,下一次开放时间是什么意思,0.9253419039667616
323,申请好人贷是否都有额度,0.9253347722465018
324,上传身份证时需填写的内容是什么,0.9253323053484046
325,购买存款页面为何提示“额度不足，无法购买”,0.9252940716501563
326,车辆信息如何查询,0.9252672367511169
327,新网账户之间能否互相转账,0.9251307060349407
328,新网银行公众号如何取消关注,0.925129806577827
329,自动扣款时间段是多久,0.9250565000915371
330,为何无法申请好人贷,0.9250459700509701
331,新网银行能否绑定云闪付,0.9250054573318648
332,合作平台如何取消贷款,0.9249280837726731
333,为何提示支付平台交易金额超限,0.924910219015352
334,如何更改其他平台的注册手机号码,0.9248725768898768
335,为何提示支付平台暂不支持的银行或限额,0.9248591201698364
336,为何提示支付平台该客户无默认扣款卡，交易没有发给统一支付,0.9245962178452848
337,新网银行自动扣款时间,0.9245682876724793
338,销户后是否上征信,0.9244929472261566
339,如何关注新网银行公众号,0.9244361239199117
340,存款产品支取通用路径,0.9244159832641028
341,为何提示支付平台账户状态异常,0.9243915431402707
342,什么情况算违约,0.9243495943359363
343,随心存利率为何会发生变化,0.9242246642642881
344,人脸识别使用的是照片还是视频,0.9242021789269197
345,为何收到新网银行逾期提醒短信,0.9241882279692303
346,车贷利息是多少,0.9240209571219233
347,注销账户的处理时间,0.9238738344901208
348,实际申请金额与放款金额不一致可否取消车贷,0.9238514767534369
349,好人贷能否绑定他人银行卡,0.9238070076631912
350,征信是什么,0.9236213002590341
351,车贷合同为何无法查看,0.9235742665158776
352,线下转账如何填写新网银行开户信息,0.9235440747572274
353,如何换绑银行卡,0.9233791061952343
354,合作平台如何还款,0.9231615997714394
355,还款银行卡是否需要开通银联在线支付业务,0.9230936647026668
356,提前还款会影响个人征信吗,0.9230668608894543
357,结清证明会展示哪些信息,0.9230234422843393
358,为何存管信息与平台显示不一致,0.9229569696065595
359,开户是什么意思,0.9229089087777296
360,新网银行开户支持的证件有哪些,0.9229082264400464
361,好人贷定位如何开启,0.9227704454033298
362,为何提示支付平台发卡行拒绝,0.9227656017577112
363,好人贷是否支持提前还款,0.9227138809183195
364,为何无法销户,0.9225605225620558
365,新网银行有几个网点,0.9223524813071095
366,为何无法登录存管查询,0.9223158907378587
367,好人贷有回访电话吗,0.9222462853180349
368,获取验证码次数超限怎么办,0.9221877974290505
369,新网银行有信用卡吗,0.9221733476170734
370,修改手机号后是否需要重置登录密码,0.9221654344571225
371,注册手机号更换成功后何时可以正常使用,0.9221222940604462
372,哪些渠道可以购买京东存款产品？,0.9220927237672535
373,半年得利提前支取影响已发放利息吗,0.9219293792791071
374,好人贷借款记录如何查询,0.9218912821388845
375,为何提示不具备开具资格,0.9215402997363744
376,存款需要先开立银行账户吗,0.9215250030769647
377,可绑定银行卡数量上限,0.9215158202255387
378,手机号归属地与定位地不一致是否有影响,0.9213995514234272
379,如何查询好人贷借据收款银行卡,0.9213262447050994
380,开具结清证明时为何无法登录,0.9213054081423862
381,如何查看贷款合同,0.9211987153593684
382,如何取消征信查询及使用授权书,0.9211958754854885
383,收款卡发卡行拒绝放款失败什么意思？,0.9211121316398428
384,如何录制活体检测,0.9209607252843539
385,申请好人贷后为何页面显示仍可提交申请,0.9208393482445701
386,新网银行账户可以在哪些地方使用,0.9208162222562765
387,好人贷交易密码如何设置,0.9207128834299663
388,如何解绑银行卡,0.9206675011144362
389,为何同时收到了还款成功和失败的短信,0.9206665260255125
390,创客贷额度是多少,0.9204703477852972
391,新网银行以何名义查询征信,0.9203971402989591
392,如何注销公众号,0.9203755291757171
393,合同为何无法打开,0.9203404514788502
394,车贷平台如何查询,0.920310330645712
395,拨打我行人工客服电话是否收费,0.92025421584058
396,随心存停售后有影响吗,0.9202280667293927
397,为何无法提交好人贷申请资料,0.9202124960786281
398,申请好人贷后，可否更改授信结果,0.920197387681026
399,为何提示支付平台其他错误,0.9200276829614114
400,好人贷审核时是否给填写的联系人去电,0.9199585663996686
401,好人卡绑定云闪付/微信等失败怎么办,0.9199155543548981
402,申请好人贷需要什么条件,0.9198598671732373
403,好人贷如何实名认证,0.9198154146364385
404,抵押类贷款如何办理,0.9197694261426419
405,申请好人贷后有没有回复,0.9197468265883237
406,新网银行地址在哪里,0.919678237417286
407,周得利计息规则,0.9193489544117333
408,如何注销新网注册用户,0.9193280643935225
409,开通什么业务,0.9192723623076978
410,申请好人贷工作信息如何填写,0.9192091969854204
411,银联在线支付如何开通,0.9191801174990977
412,如何知晓已注销成功,0.9191524543823711
413,好人贷注册手机号无法使用,0.9190556282261251
414,密码被锁定怎么办,0.9190116170307263
415,好人贷需要面签吗,0.91872869492961
416,修改手机号码/微信号是否会影响自动扣款,0.9187270473181882
417,如何更换微信号,0.9185818623134804
418,可否取消银行卡限额,0.9185074532843152
419,是否可以取消自动扣款,0.9184118123965186
420,好人贷审核不通过对个人有什么影响,0.9180224986040988
421,如何查询征信报告,0.9179272831455005
422,好人贷账户如何挂失,0.9177937415154604
423,为何提示支付平台持卡人信息有误,0.9177691687086849
424,新网银行有招聘吗,0.9177534908024187
425,新网银行视频认证的QQ号码是多少,0.9177390257779373
426,转入新网银行使用的密码是交易密码还是银行卡密码,0.9176985740258654
427,新网银行行号是多少,0.9176715119167932
428,申请诺诺发票贷需要什么条件,0.9176569117538732
429,实名认证是否查询征信,0.9173943547140277
430,白骑士认证失败是什么意思,0.9173575249497363
431,注册手机号及微信号需要实名制吗,0.9171950849257864
432,为什么拍照认证时总是不成功或显示系统崩溃,0.9171731827643331
433,如何查询申请相关的协议书,0.9171435334402654
434,补扣会影响信用吗,0.9171027232663232
435,是否需要使用本人手机操作好人贷,0.9170647379722153
436,存款页面是否会显示每日收益,0.9169939176917785
437,好人贷扣款账户如何查看,0.9168914196608957
