438,为何重置密码后仍提示密码错误,0.9168617812645191
439,操作好人贷是否需要开启定位,0.9168542055058897
440,好人贷申请的渠道有哪些,0.9168521655922176
441,未接到好人贷回访电话会被拒吗,0.9168053051922225
442,好人贷部分提前还款规则,0.9167509730964174
443,存管账户如何查询,0.916735261194017
444,申请好人贷没有公司邮箱怎么办,0.9167259268178184
445,如何通过线下方式转入新网二类户,0.9167241717610708
446,黑户/白户是否可以申请好人贷,0.9165698354115589
447,新网银行好事贷如何申请,0.9164966587181913
448,美利车联系电话,0.9161998838598702
449,征信上报周期及更新时间,0.9161372424888058
450,扣款结果会有短信提示吗,0.9161233266004934
451,美团客服热线是多少,0.9160082719622121
452,好人贷申请是否可以使用临时身份证,0.9159379719466421
453,公众号如何注册,0.915814755547069
454,居住信息如何填写,0.9158006611847175
455,新网银行有哪些活动,0.9157910177538919
456,关闭其他平台额度后，能否恢复好人贷额度,0.9157694367208215
457,为何图文验证码输入正确却提示错误,0.9156658707613343
458,借款失败怎么办,0.9156607824861677
459,客户咨询其他平台催收问题,0.9155285334381543
460,手持身份证拍照的注意事项,0.9154617352213221
461,他人可以使用本人信息申请好人贷吗,0.9154528907668356
462,目前支持的银行有哪些,0.9154131439839072
463,无法提供消费凭证可以取消贷款吗,0.9154005811570365
464,新网银行如何联系客户,0.9152867049760942
465,结清证明的印章是否可以用公章,0.9152503415389814
466,如何增加银行卡,0.9151457629471985
467,客户催促需要加急办理,0.9148902218216465
468,查询结清证明申请是否已提交,0.9148569219894082
469,验证码发送至什么手机号,0.9148265588832405
470,新网账户绑定微信/支付宝后支持提现或充值吗,0.9148071426848252
471,关于消费凭证,0.9147681784284346
472,好人贷只能使用微信登录吗？,0.9146850506258563
473,修改手机号码的处理时间是多久,0.9145826217354956
474,征信上显示的贷款金额是否包含利息,0.9145550943881606
475,身份证更换期间会影响好人贷贷款吗,0.9145321899170185
476,好人贷额度是否会发生变化,0.9144315475941487
477,可否按照征信订单号开据证明,0.9143728816967737
478,如何邀请好友申请好人贷,0.9143093181522246
479,如何降低/关闭额度,0.9141723931508987
480,新网银行是否上市,0.9140485835362915
481,存管账户如何注销,0.9138477203936494
482,是否会发生重复扣款情况,0.9138171202149632
483,页面为何提示“开户失败”、“账户存在异常操作/账户异常”,0.9138164077418488
484,新网银行有哪些产品可以提额,0.9138101531717463
485,申请创客贷需要什么条件,0.913796546339546
486,申请好人贷使用的邮箱是公司邮箱还是个人邮箱,0.9137515739081853
487,客户提到投诉,0.9136734733266965
488,如何退出微信公众号,0.9135384171984973
489,好人贷审核电话是多少,0.9134522880899208
490,好人贷借款多久到账,0.9133239653027031
491,如何修改征信上的个人信息,0.9131987319116525
492,银行卡挂失会影响自动扣款吗,0.9131823890090347
493,结清证明印章无法查看,0.9130452815901717
494,身份证过期可以申请好人贷吗,0.9129594107879382
495,客户称赞服务好,0.9128820434576707
496,能否开具非恶意逾期证明,0.9128213853273026
497,新网银行发送的短信验证码的有效时长？,0.9127858217311272
498,新办的手机号可以申请好人贷吗,0.9127179101836156
499,好人贷提前还款最低还多少,0.91262112439714
500,新网银行合作的存管平台有哪些,0.9124680098934738
501,优信客服电话是多少,0.9124011388257055
502,逾期造成的影响是什么,0.9124007141697439
503,好人贷如何自助提额,0.9122598166928783
504,微信/支付宝等可否与新网银行账户互相绑定,0.9122330815072712
505,新网二类户可以升级为一类户吗？,0.9122290585224916
506,季得利如何支取,0.9121627506481365
507,好人贷申请必须使用身份证原件吗,0.9120680997864951
508,为何提示交易密码验证失败,0.911813125406913
509,为何提示支付平台银行卡未开通银联无卡认证支付,0.9117769301622258
510,新网银行合作平台有哪些,0.911603112261847
511,可以查询注册手机号码吗,0.9113625949452947
512,好人贷额度他人能否使用,0.9111515175506003
513,提额会有通知吗,0.9111038286094209
514,实名认证失败的原因是什么,0.9110243708376771
515,视频认证录制失败的原因是什么,0.9108894312389337
516,好人贷可以重新申请吗,0.9105293870811959
517,如何开据存款证明,0.9104894181936207
518,一个身份证可以申请好人贷两次吗？,0.9103280704696481
519,为何提示支付平台不允许持卡人进行的交易,0.9102862959216234
520,客服能否查看聊天记录,0.9102163652842643
521,好人贷申请是否支持人工受理,0.9099009114199941
522,为何提示支付平台渠道不支持的银行,0.9098394402068269
523,申请好人贷必须填写联系人信息吗,0.9098067763983249
524,好人贷账户如何查询,0.9095154002984902
525,什么是一、二、三类户,0.9094840420693597
526,如何开立存管账户,0.9094709068039409
527,工新借如何申请,0.9093905777394973
528,绑卡时页面上的银行卡预留手机号码可以修改吗,0.9093214728798324
529,客服是否是随机分配,0.90922913119809
530,客服能否看到客户申请好人贷的信息,0.9092005288432529
531,有额度不使用有什么影响吗,0.9091149282407072
532,好人贷自动扣款规则,0.9088477801631
533,开据证明为何显示没有符合要求的订单,0.9085397532095132
534,客户表示有合作意向,0.908228334966086
535,存款利率是多少,0.9082197122791413
536,好人贷是否有临时额度,0.9080593640848241
537,我们是四川新网银行吗,0.9080564175882392
538,新网有哪些产品,0.9080393402476059
539,好人贷申请需要填写哪些个人信息,0.9079546473051672
540,自动扣款失败怎么办,0.9079537893794516
541,在线咨询是否支持客户发送语音,0.9076325767724949
542,银行渠道维护时间一般是多久,0.907626101614861
543,忘记密码怎么办,0.9074951377767725
544,能否让客服回电,0.9073852548394047
545,可否补充企业邮箱,0.9073224134308655
546,好人贷借款后能否修改贷款信息,0.9072663538955333
547,什么平台的贷款,0.9071554253671491
548,好人贷个人资料如何修改,0.9071501444539484
549,输入身份证号码时，为何无法输入字母,0.9071471473357141
550,好事贷如何还款,0.9071460527406788
551,申请好人贷需要公积金、社保吗？,0.9070867935234038
552,微信号更换成功后何时可以正常使用,0.9070179934109309
553,车贷如何申请,0.9067703306281041
554,好人贷如何降低利率,0.9065355375554092
555,客户要求发送相关模板,0.9065297532772136
556,随心存如何计息,0.9064271051131639
557,在线客服是否是人工客服,0.9063894473374188
558,新网银行人工客服电话打不通,0.9061510185561845
559,好人贷申请成功会有短信通知吗,0.9059096944620839
560,好人贷申请身份证可否添加水印,0.9058888895214445
561,好人贷如何试算利息,0.9056487975875375
562,新网银行人工客服服务时间,0.9053749535238439
563,好人贷还款后多久到账,0.9053703186628363
564,审核电话可更改接听电话吗,0.9053156905467814
565,好人贷电话回访时间,0.9050132771326735
566,可以通过他人银行卡转入到新网银行账户吗,0.9050105303014566
567,如何办理好人卡？,0.9049795076166587
568,银行渠道维护无法操作怎么办,0.9047310805542959
569,罚息能否减免,0.9046629794077821
570,季得利如何计息,0.9045918638506272
571,申请好人贷需要下载APP吗？,0.9043681314512269
572,如何获得优惠券,0.9041439411082988
573,能否人工开据贷款证明,0.9040205283056026
574,申请好人贷需要开个人账户吗？,0.9033725715686536
575,如何在新网银行开户,0.903196514995686
576,人脸识别失败怎么办,0.9029442758331864
577,好人贷是什么,0.9025585285465392
578,好人贷如何审核,0.9024514455581084
579,页面为何无法打开,0.9020012389440324
580,接收短信的手机号是否为注册手机号,0.9019394151396842
581,批扣时间段是多久,0.9016760850423515
582,什么是注册号码？,0.90164929824134
583,能否删除个人信息,0.9014680129357023
584,客户表示稍等,0.9014670037970941
585,其他贷款怎么办理,0.90128391384754
586,贷款证明如何开据,0.9009862206020778
587,罚息介绍,0.9009617118954727
588,企业邮箱为何验证不了,0.900675256682961
589,申请好人贷需要哪些资料,0.9004414747414687
590,实名认证审核时间,0.9003965015193763
591,如何登录微信公众号,0.9003648833662549
592,绑定银行卡失败,0.8998803900047322
593,怎样用其他手机登录好人贷,0.8996428805508094
594,客户发送截图以及个人信息等,0.899576700673935
595,个人可以在新网开立几个账户,0.8994360751386564
596,电话客服是否可以受理结清证明,0.8993250858373952
597,扣款失败的原因,0.8992013720613079
598,优惠券如何使用,0.8991313696353209
599,销户后可以再开户吗,0.898954105008767
600,好人贷如何提高额度,0.8986918108900657
601,企业邮箱验证码可否重新获取,0.8978482703440253
602,关于客户个人信息安全问题,0.8972417629692955
603,好人贷当期能否最低还款,0.8969404993956462
604,随心存如何登录,0.8968848713554439
605,人脸拍摄规范,0.8960819947630029
606,电脑端可以登录好人贷吗,0.8955588915280593
607,身份证上传失败怎么办,0.8953739342498681
608,可以重新注册吗,0.8953677583380713
609,好人贷放款至什么账户,0.8951447524459887
610,核身链接失效的原因,0.8938652395129119
611,好人贷支持周末借款吗？,0.8937734522479556
612,好人贷账户如何注销,0.893630402610387
613,有多少人获得好人贷额度,0.8933365255211687
614,活体检测失败怎么办,0.8933143988805671
615,企业邮箱填写错误怎么办,0.8929681634587637
616,好人贷是邀请制吗,0.8927983917158486
617,好人贷有额度后如何进行贷款,0.8927359554751868
618,额度占用问题,0.892594179637412
619,咨询可以发送图片吗？,0.8925682839786557
620,平台方提供的客户审批资料能否提供给客户,0.8925208359127703
621,好人贷审核时间是多久,0.8923602732001765
622,申请被拒怎么办,0.8919605163102379
623,客户表示不满,0.8913912308046288
624,新网银行简介,0.8913680172213468
625,密码如何修改,0.8908316303740497
626,如何办理对公业务,0.8905161926229016
627,可以查询个人信息资料吗？,0.889777941335393
628,好人贷支持随时借款吗,0.888896302930126
629,客户表示需要考虑,0.8884146250338775
630,好人贷如何申请,0.8873243647194299
631,好人贷贷款利息如何计算,0.8864174576575773
632,新网银行APP下载,0.8859670974813372
633,如何进入个人中心,0.885848030378159
634,好人贷如何还款,0.8852385644844174
635,好人贷能否人工操作提额,0.8845491170713198
636,客户表示知道了,0.8844624457562699
637,交易密码无法设置,0.8833296694603197
638,好人贷额度有效期是多久,0.8829634415197152
639,新网银行业务办理时间,0.8824877245084375
640,查询各类工单办理进度,0.8812594546315767
641,客户表示没有问题了,0.880924334096935
642,可以咨询吗,0.8772488735597503
643,好人贷支持扣款的银行有哪些,0.8768134164421472
644,好人贷年化利率是多少,0.8765168093970123
645,好人贷上征信吗,0.8764157151196801
646,怎样才能成功申请到额度,0.8761242124312333
647,好人贷的办理时间,0.8754445398544719
648,如何进入好人贷页面,0.8751422310781206
649,手机获取验证码失败,0.874864697532036
650,好人贷申请能否撤销,0.8729066323364423
651,好人贷月利率是多少,0.8714781194026477
652,好人贷借款规则,0.8714086530468308
653,好人贷利率是多少,0.8705810829903854
654,开户失败原因,0.8687341650845096
655,客户提出建议,0.8669020022959515
656,好事贷收取哪些费用,0.8656888180435073
657,好人贷贷款期限是多久,0.8603114792413811
658,好人贷消费用途,0.8595947647499995
659,好人贷收取哪些费用,0.8577365842161109
660,登录密码为何无法重置,0.852279629504518
661,好人贷额度是多少,0.8518086220607494
662,如何删除身份证信息,0.8466613592695279
663,什么是登录密码,0.8453761813091558
664,身份证信息变更后如何更新,0.8411230614141054
665,好人贷提额周期是多久,0.8402526003115385
666,好人贷通过率多少,0.8378247282668515
