415,为何提示该证件已被使用,0.8938674890045113
416,迁户是什么意思,0.8938163819724615
417,新网银行合作的存管平台有哪些,0.8937897682686834
418,京东存款的计息规则及计息公式,0.8937485727223912
419,为何无法申请好人贷,0.8932260570133201
420,居住信息如何填写,0.893193691691186
421,目前支持的银行有哪些,0.893170431283011
422,申请被拒怎么办,0.8929235881191762
423,如何选择按期还款/任性还款,0.8927552168526622
424,客户催促需要加急办理,0.89273406889227
425,可否补充企业邮箱,0.8926788628437902
426,新网银行以什么名义放款,0.8924299023376441
427,申请好人贷是否都有额度,0.8923146533673042
428,如何设置存管支付密码,0.892214238173529
429,新网银行账户是什么,0.8916542487516835
430,定期存款是否有存单,0.890614929160813
431,如何查询当期车贷还款金额,0.8904645804971124
432,如何知晓已注销成功,0.8903834903364868
433,转账到新网银行如何操作,0.8902883382330073
434,退汇是什么意思,0.8901038632785824
435,借款失败怎么办,0.889915988268922
436,逾期未还款如何处理,0.8897459206681694
437,好人贷为什么无法借款,0.8896155172706991
438,如何激活新网二类户,0.8893627042616831
439,客户表示不满,0.8893038087358693
440,如何更换好人贷默认还款账户,0.8892291704052796
441,新网银行有哪些产品可以提额,0.888808714968621
442,存管账户充值限额,0.8885591123623409
443,如何通过线下方式转入新网二类户,0.888461600965978
444,房产保证金是什么,0.888269494041446
445,好人贷额度是否循环使用,0.8882452287588201
446,客户称赞服务好,0.887893171777152
447,车贷如何解绑银行卡,0.8877167779902881
448,好人贷为什么无法登录,0.8876957990422374
449,身份证上传失败怎么办,0.8872903115183095
450,银联在线支付如何开通,0.8871342877826633
451,如何更换微信号,0.8870226978012762
452,随心存如何查看收益情况,0.8870140407423609
453,什么情况算违约,0.8869168409424991
454,好人贷申请身份证可否添加水印,0.886693906772479
455,可以咨询吗,0.8866850210451227
456,新网银行有哪些活动,0.8865469854735469
457,如何更换借款收款银行卡,0.8864447064041208
458,好人贷为何无法还款,0.8862565506606812
459,征信上报周期及更新时间,0.8859932371599625
460,新网银行地址在哪里,0.8859411188741487
461,为什么没有扣款,0.8858351638875208
462,车贷如何更换还款银行卡,0.8856617951784377
463,新网银行二类户如何转入/转出,0.8856199483921803
464,好人贷还款后额度何时恢复,0.885611023151668
465,如何查询存管账户流水,0.8854926154872331
466,为何无法销户,0.8854308312842902
467,好人贷审核电话是多少,0.8853678749349402
468,好人贷额度是否会发生变化,0.8851597007765657
469,客户表示还款成功,0.885027480501317
470,车贷还款记录如何查询,0.8849650667613438
471,存款产品是否存满五年才能支取,0.8839060274550523
472,如何操作随心存大额存款,0.8838255282080956
473,如何降低/关闭额度,0.8837825158010152
474,新网银行是否上市,0.8835756464305514
475,新网银行合作平台有哪些,0.8835007842872145
476,申请好人贷需要哪些资料,0.8829681613428502
477,注册规则是什么,0.8827267943618817
478,车贷合同如何查看,0.8827152190208043
479,车贷如何办理解押手续,0.8823231027256572
480,月得利提前支取如何计息,0.8821539956227841
481,我们是四川新网银行吗,0.8819401301680774
482,好人贷借款后能否修改贷款信息,0.8816694161207995
483,银行渠道维护时间一般是多久,0.8816608787019103
484,车贷收取哪些费用,0.8815316985380501
485,好人贷定位如何开启,0.8814176499703759
486,好人贷为什么额度低,0.8814040534843456
487,存款产品如何修改手机号,0.8812456609425534
488,周得利提前支取如何计息,0.8805646846629771
489,实名认证审核时间,0.880515321818843
490,如何注销新网注册用户,0.8804314343055311
491,关于消费凭证,0.8799421571437224
492,好人贷交易密码如何设置,0.8797479465760333
493,存款产品是否保本保息,0.8796967182877045
494,如何绑定银行卡,0.879120849940747
495,什么是风控审核中,0.8786440767089351
496,如何查询好人贷借据收款银行卡,0.8785518552825797
497,结清证明开据时间是多久,0.878219870154277
498,罚息能否减免,0.8780212827352447
499,什么是我的额度和可借额度,0.8761249892782326
500,好人贷-云闪付是什么,0.8757814977024495
501,如何查询新网账户,0.8757460134024377
502,新网银行人工客服服务时间,0.875686505488556
503,如何查询车贷还款日,0.8755040659056018
504,自动扣款如何操作,0.875171421162241
505,好人贷支持随借随还吗,0.8751515099424615
506,好人贷-云闪付如何提前还款,0.8750739925500208
507,好人贷借款如何上报征信,0.8748810780761825
508,随心存是什么,0.8746703476977451
509,新网银行的活期利率是多少,0.8744329963218777
510,随心存存款期限有哪些,0.8741714715413987
511,创客贷额度是多少,0.8740697630780679
512,怎样才能成功申请到额度,0.8738931337010016
513,如何购买新网银行存款产品,0.8737399329704048
514,如何查看好人贷还款计划,0.8731164108738084
515,如何换绑银行卡,0.8729714015226412
516,如何录制活体检测,0.8727445613024052
517,如何解绑银行卡,0.8727261610343316
518,什么是综合评估,0.8724323709149512
519,好人贷还款方式有哪些,0.8724099694473826
520,如何注销公众号,0.8722776520334623
521,如何邀请好友申请好人贷,0.8722462600432915
522,好人贷电话回访时间,0.8718741797149862
523,如何冻结新网银行账户,0.8709662247763101
524,电脑端可以登录好人贷吗,0.8708938247961528
525,什么是分批次扣款,0.8705972368798058
526,存款产品支取通用路径,0.8701464618905038
527,还款记录如何查看,0.8701005621343294
528,车贷平台如何查询,0.8698925492065275
529,好人贷支持周末借款吗？,0.8697406195264414
530,什么是活体检测,0.8696662561513493
531,合作平台如何取消贷款,0.86959934846593
532,客户表示需要考虑,0.8695154035710366
533,好人贷额度他人能否使用,0.8692484947154525
534,自动扣款时间段是多久,0.8688665678506706
535,好人贷利率为什么高,0.8686253934366397
536,好人贷是否支持提前还款,0.8676863274545907
537,客户表示稍等,0.867321961521283
538,如何获得优惠券,0.8672974327371835
539,客户表示知道了,0.867174543258761
540,五年定期存款是什么,0.86664553757645
541,新网银行行号是多少,0.8665711842640862
542,新网银行好事贷如何申请,0.8663390925421478
543,什么情况算逾期,0.8654672319060761
544,如何注销新网二类户,0.865034180612784
545,好人贷还款记录如何查询,0.8647494103647064
546,如何办理好人卡？,0.8634840552884155
547,好人贷申请能否撤销,0.8632608497862384
548,车贷利息是多少,0.8631382222154439
549,好人贷账户如何挂失,0.862996996033746
550,额度冻结怎么办,0.8625624189253195
551,随心存利率是多少,0.8624907590931274
552,如何登录微信公众号,0.8623688024768343
553,公众号如何注册,0.8622158689991057
554,新网银行如何联系客户,0.8615644185166154
555,能否人工开据贷款证明,0.8615164898326503
556,按期还款是什么,0.8614995583061945
557,如何签署借款合同,0.8614213084291656
558,周得利计息规则,0.8607831090050708
559,好人贷借款记录如何查询,0.8602524522152981
560,额度占用问题,0.8596777818558016
561,什么是注册号码？,0.8595312889846335
562,五年定期存款的利率是多少,0.859472937467783
563,如何查询还款日,0.8590928568204879
564,经侦是指什么,0.8578059391238668
565,征信是什么,0.857600196398997
566,好人贷提前还款最低还多少,0.857350903283023
567,好人贷个人资料如何修改,0.8568843528154934
568,工新借是什么,0.8568709927904378
569,车贷如何提前还款,0.8564870773940185
570,开通什么业务,0.8564788476851318
571,可否对公还款,0.856179911547964
572,查询各类工单办理进度,0.8560885592714093
573,随心存存入限额,0.8557365406593608
574,好人贷扣款账户如何查看,0.8533282039555105
575,好人贷当期能否最低还款,0.8533141404908416
576,有多少人获得好人贷额度,0.8526841848639446
577,什么是当期账单,0.8526489921812681
578,好人贷自动扣款规则,0.852311730943723
579,定期存款的利率是多少,0.851835002960851
580,可否延期还款,0.8511547133281242
581,各还款方式如何进行还款,0.8503900539527615
582,存管账户如何查询,0.8502632882452266
583,好人贷是否有临时额度,0.8501223709906978
584,如何增加银行卡,0.848875481875692
585,好人贷支持随时借款吗,0.8477939147914293
586,存管账户如何注销,0.8473798254520315
587,好人贷如何实名认证,0.8468267326420768
588,好人贷是邀请制吗,0.8464024046241994
589,怎样用其他手机登录好人贷,0.8461570264961108
590,车贷如何还款？,0.844677160431008
591,好人贷审核时间是多久,0.844533920980437
592,好人贷账户如何查询,0.843713082490795
593,好人贷能否人工操作提额,0.843573240519483
594,季得利是什么,0.8435354862162568
595,车贷逾期如何还款,0.8435332634688067
596,新网银行业务办理时间,0.8435094969309538
597,好人贷如何提前还款,0.8432420526725702
598,抵押类贷款如何办理,0.8431828351989387
599,什么是一、二、三类户,0.8430209097060114
600,新网有哪些产品,0.8429667476766544
601,如何查看贷款合同,0.8425891679370661
602,存管是什么,0.8424014185375615
603,批扣时间段是多久,0.8411308053242623
604,如何开立存管账户,0.8407610879725455
605,如何在新网银行开户,0.8406063385365664
606,客户提出建议,0.8404346250883337
607,好人贷部分提前还款规则,0.8394347183795329
608,罚息介绍,0.8389402086984752
609,好人贷如何主动还款,0.838292824352421
610,好人贷放款至什么账户,0.8379681022690246
611,新网银行APP下载,0.8379385411382876
612,登录密码为何无法重置,0.8372122935946535
613,合作平台如何还款,0.8366330981147844
614,好人贷借款多久到账,0.8363304938696065
615,密码如何修改,0.8343077173751462
616,任性还款是什么,0.8337648864119267
617,新网银行简介,0.8335151506225075
618,人脸拍摄规范,0.8334329618586199
619,好人贷如何自助提额,0.8330837358471005
620,好人贷支持扣款的银行有哪些,0.8325493337916579
621,什么是还款日,0.8314158243863012
622,工新借如何申请,0.8308866342638711
623,如何开据存款证明,0.8306075236265037
624,其他贷款怎么办理,0.8291915919163203
625,什么平台的贷款,0.8278950041498743
626,好人贷如何试算利息,0.8270756106230022
627,好人贷如何降低利率,0.8268624279981431
628,好事贷收取哪些费用,0.8265200773551892
629,好人贷还款后多久到账,0.8263103302397292
630,随心存如何计息,0.8250874141274653
631,定期存款到期如何支取,0.8234365884097419
632,如何进入个人中心,0.8230203972707028
633,如何办理对公业务,0.8227447841825736
634,好人贷账户如何注销,0.8222679670958517
635,好人贷上征信吗,0.8222002748091914
636,好人贷额度有效期是多久,0.8221225935122422
637,好人贷如何审核,0.8213570557920438
638,好人贷的办理时间,0.8206640382804598
639,存款利率是多少,0.8203905209735157
640,车贷如何申请,0.8198730646509802
641,好人贷是什么,0.8169968518103308
642,如何进入好人贷页面,0.8158712116193113
643,好人贷如何提高额度,0.8156656469489846
644,优惠券如何使用,0.8154923638858722
645,贷款证明如何开据,0.8143737244405136
646,如何删除身份证信息,0.8136179627781406
647,好人贷利率是多少,0.8133623812689839
648,好人贷贷款利息如何计算,0.8132593712872181
649,好人贷月利率是多少,0.8117436652785605
650,季得利如何支取,0.8115733012473646
651,好人贷有额度后如何进行贷款,0.8102693653279369
652,好人贷年化利率是多少,0.8087055493162773
653,好人贷收取哪些费用,0.8086224739467144
654,好人贷如何申请,0.8082422663889288
655,季得利如何计息,0.8072052854365487
656,随心存如何登录,0.8061442316810618
657,好人贷消费用途,0.8030901724313637
658,什么是登录密码,0.7998460890001062
659,好事贷如何还款,0.7987854947855773
660,身份证信息变更后如何更新,0.7981198063079267
661,好人贷贷款期限是多久,0.7901776731873342
662,好人贷借款规则,0.785157716790897
663,好人贷额度是多少,0.7841440834032528
664,好人贷通过率多少,0.7791167350781728
665,好人贷提额周期是多久,0.7730985909477041
666,好人贷如何还款,0.7730486531161921
