0,查询的手机号码根注册的不一致查不了的吗？,1.0
1,修改手机号码/微信号是否会影响自动扣款,0.9632792314414269
2,进入随心存为何提示手机号码不一致,0.9620708863234242
3,好人贷注册手机号与银行卡预留手机号是否需要一致？,0.9594238529314332
4,手机号归属地与定位地不一致是否有影响,0.95765062099519
5,为何之前绑定的银行卡不支持扣款了,0.9572006262175959
6,可以查询注册手机号码吗,0.9557028578474788
7,查询车贷的注册手机号码是什么,0.9553761398254568
8,接收短信的手机号是否为注册手机号,0.9553067524637643
9,好人卡绑定云闪付/微信等失败怎么办,0.9544576866279767
10,收款卡发卡行拒绝放款失败什么意思？,0.954196154643474
11,绑卡时页面上的银行卡预留手机号码可以修改吗,0.9541866558750838
12,存管查询为何提示用户不存在或者信息有误,0.9530632697763284
13,银行卡挂失会影响自动扣款吗,0.9525665933382321
14,未接到好人贷回访电话会被拒吗,0.9514350179454558
15,更换银行卡会影响自动扣款吗,0.9508149444501014
16,平台方手机号变更导致我行无法直接开据结清证明问题,0.950264156656737
17,为何图文验证码输入正确却提示错误,0.949792058133869
18,无法提供消费凭证可以取消贷款吗,0.9495554442605322
19,为什么拍照认证时总是不成功或显示系统崩溃,0.9490218696009576
20,为何提示支付平台该客户无默认扣款卡，交易没有发给统一支付,0.9488105022307761
21,为何存管信息与平台显示不一致,0.9475635802855098
22,线上开据证明为何和征信金额不符,0.9470768016111922
23,视频认证录制失败的原因是什么,0.9469366876560393
24,为何重置密码后仍提示密码错误,0.9468549160243442
25,注销注册用户后是否可恢复？,0.9468036051020612
26,新网银行发送的短信验证码的有效时长？,0.946317587472687
27,注册手机号更换成功后何时可以正常使用,0.946193860621465
28,好人贷审核不通过对个人有什么影响,0.9461463254556783
29,好人贷被拒后为何没有下次开放时间,0.9455870926077523
30,平台还款信息为何与新网银行不一致,0.9454404319476902
31,公众号页面的“我的排号”是什么意思,0.9453821220460216
32,结清贷款后征信上是否会显示结清,0.9453304390372516
33,修改手机号后是否需要重置登录密码,0.9452763906904381
34,为何提示支付平台持卡人信息有误,0.9452430239228193
35,有额度不使用有什么影响吗,0.9447628275492369
36,注册手机号及微信号需要实名制吗,0.9445844656272111
37,好人贷为什么提示“账户存在异常操作”,0.9441952263155377
38,扣款结果会有短信提示吗,0.9441772692752416
39,为何存管查询提示没有密码,0.9441490372223805
40,通过本人微信找回密码是指什么,0.9440540918396464
41,实名认证失败的原因是什么,0.9438063097206725
42,为何征信上有新网银行上报的逾期,0.9436993990159671
43,为什么收到提额短信但额度未提升,0.9435558386164525
44,白骑士认证失败是什么意思,0.9428077806096374
45,为何提示支付平台受发卡行资金用途限制拒绝交易,0.9427707074999123
46,页面为何提示“开户失败”、“账户存在异常操作/账户异常”,0.9426753681617316
47,再次申请好人贷会查询征信吗,0.9426546302875879
48,车贷还款只扣除部分是什么原因,0.9421997029246417
49,好人贷审核时是否给填写的联系人去电,0.9419638912320772
50,为何提示支付平台暂不支持的银行或限额,0.9418647198937988
51,开据证明为何显示没有符合要求的订单,0.9415864227301534
52,提前还款会影响个人征信吗,0.9414215752024303
53,购买存款页面为何提示“额度不足，无法购买”,0.9413815821830214
54,好人贷申请成功会有短信通知吗,0.9411771876430236
55,借款成功会有短信等提醒吗,0.9407085512880105
56,随心存可以在我行公众号查询/操作吗,0.9406055652261586
57,为什么提前还款显示联合贷批次执行中？,0.9404509465817998
58,非绑定银行卡可否与新网二类户转账,0.940292485693231
59,新网银行二类户与好人贷是否为同一个手机号码,0.9398833443685994
60,借款合同是否有展示提前还款会收取违约金的情况,0.9395811309965135
61,什么是银行卡预留手机号？,0.939366718560226
62,为何提示交易密码验证失败,0.9385198355299296
63,随心存停售后有影响吗,0.938435066583966
64,可以查询个人信息资料吗？,0.938369814144321
65,申请好人贷没有公司邮箱怎么办,0.9382130105063202
66,为何提示支付平台渠道不支持的银行,0.9380859976129224
67,转账时为何提示未面核,0.9379337186454182
68,新网账户绑定微信/支付宝后支持提现或充值吗,0.9377625301796793
69,为何同时收到了还款成功和失败的短信,0.9375075424026686
70,车贷合同为何无法查看,0.9374329616895991
71,为何提示支付平台签约关系不存在,0.9374292619079819
72,实际申请金额与放款金额不一致可否取消车贷,0.9373812994271435
73,输入身份证号码时，为何无法输入字母,0.9368706624063033
74,为何征信上的放款日期与实际借款日期不一致,0.9368313569816356
75,为何收到新网银行逾期提醒短信,0.9367178534423353
76,系统升级会影响扣款吗,0.9366158896305509
77,开据证明时为何提示账户存在异常,0.9365460102360739
78,未正常还款我行会进行催收吗,0.9362865657818069
79,更改银行卡预留手机号的方法,0.935945606519949
80,优信扣款成功后为何显示待还款,0.9358645125520589
81,我行放款的其他平台借款会上报征信吗,0.9357692249110868
82,实名认证是否查询征信,0.9356428294480871
83,好人贷只能通过绑定的银行卡还款吗,0.9356229210291102
84,销户与否会产生什么影响,0.93555342948957
85,线上开据证明有次数限制吗,0.9354029117237344
86,绑定银行卡产生费用吗,0.935346318685805
87,在线咨询是否支持客户发送语音,0.9351977653446025
88,申请好人贷使用的邮箱是公司邮箱还是个人邮箱,0.9351388155393358
89,为什么点击拍照没有反应,0.9349822844698776
90,手机获取验证码失败,0.9347080154871477
91,审核电话可更改接听电话吗,0.9346575670056031
92,季得利提前支取影响已发放利息吗,0.9344863263902236
93,登录时的图文验证码是否区分大小写,0.9342133540373374
94,为何销户后还能看到好人贷信息,0.9341645033549396
95,银行卡是二类户影响扣款吗,0.9339608295511522
96,企业邮箱为何验证不了,0.9337719735526376
97,咨询可以发送图片吗？,0.933734820711468
98,客服能否看到客户申请好人贷的信息,0.9336805679356661
99,借款到账后页面未更新借款状态,0.9335079574208848
100,好人贷手动还款时为何提示批次执行中,0.9334969390758363
101,半年得利提前支取影响已发放利息吗,0.932966618471621
102,为何好人贷还款时提示“交易处理中”,0.9327902854999698
103,为何提示支付平台银行卡未开通银联无卡认证支付,0.9325411265965063
104,公众号是否有还款提示,0.9325088996611224
105,为什么好人贷第一期还款金额与之后不一致,0.9324050655962234
106,银行卡开通银联在线支付后是否可正常还款,0.9322180531041098
107,新网二类户转入/转出有时间限制吗,0.9320833881900393
108,京东存款为什么显示当日额度为什么已售罄？,0.9319952846638042
109,转入新网银行使用的密码是交易密码还是银行卡密码,0.9319772130851963
110,实名认证为什么不符,0.9319017745991933
111,获取验证码次数超限怎么办,0.9318789793186822
112,新办的手机号可以申请好人贷吗,0.9315408369324047
113,新网银行账户可以设置为好人贷借/还款账户吗,0.9314766071625586
114,如何修改实名认证手机号码,0.9314683050769407
115,企业邮箱验证码可否重新获取,0.9313436011706676
116,新网银行人工客服电话打不通,0.9310503877633731
117,申请诺诺发票贷需要什么条件,0.9307294049682306
118,补扣会影响信用吗,0.9305408472141572
119,为何提示还款卡不存在,0.930261971886635
120,手机号无法使用为什么,0.9301386313918996
121,结清贷款后什么时候可以开据结清证明,0.9300892923655787
122,好人贷必须绑定银行卡使用吗,0.9300530282680226
123,是否可以取消自动扣款,0.9297476383138559
124,如何修改存管账户预留手机号码,0.9295272934090494
125,微信/支付宝等可否与新网银行账户互相绑定,0.9291704645326417
126,如何更改其他平台的注册手机号码,0.9290771907089029
127,为何申请好人贷页面显示暂无资格,0.9290763475816097
128,为何提示支付平台发卡行拒绝,0.9290207062236597
129,提额会有通知吗,0.9290148081905494
130,客服能否查看聊天记录,0.9289667717584337
131,征信报告是什么样的,0.9289613177814333
132,贷款证明的电子章是否具有法律效应,0.9289489279604323
133,为何结清证明显示日期与平台不符,0.9288962443211738
134,借款时选错收款账户怎么办？,0.9288341466612842
135,申请好人贷后为何页面显示仍可提交申请,0.92878627349574
136,拨打我行人工客服电话是否收费,0.9287652016888538
137,一个身份证可以申请好人贷两次吗？,0.9286885054195124
138,结清证明的发送方式有哪些,0.9285446584112477
139,为何提示缺少必要参数,0.9285395016145032
140,存管密码被锁定怎么办,0.9282894434058105
141,银行转账未到账怎么办,0.9280257965060953
142,为何提示支付平台账户状态异常,0.9279643849427576
143,为何征信上有新网上报的贷款记录,0.9278322238970963
144,结清证明印章无法查看,0.9277681030093369
145,验证码发送至什么手机号,0.9277679123699022
146,微信号更换成功后何时可以正常使用,0.9277141367738195
147,电话客服是否可以受理结清证明,0.9276883115194077
148,线上是否可开据征信版结清证明,0.9272336807667494
149,如何取消征信查询及使用授权书,0.9272261766622201
150,下一次开放时间是什么意思,0.9272192138429579
151,车贷扣款支持的银行卡有哪些,0.9272146578324866
152,好人贷申请是否查询芝麻信用,0.9271098517423947
153,页面为何无法打开,0.9269008103844043
154,为何提示不具备开具资格,0.9265589832795362
155,为何申请好人贷后显示未获取额度,0.9264785794063012
156,申请好人贷必须填写联系人信息吗,0.9264622546939851
157,为何收到新网银行还款短信,0.9264508220404267
158,为什么提示用户不存在,0.9263571400387347
159,银行渠道维护无法操作怎么办,0.9263292605950207
160,为何提示支付平台其他错误,0.92606350025092
161,申请好人贷需要下载APP吗？,0.9258956474185583
162,好人贷账户是否为新网银行二类户？,0.9258210129711857
163,为何征信上有新网银行的贷款审批记录,0.9258025216674609
164,如何查看手机号是否实名制,0.9257448968649192
165,销户后为何还能解绑银行卡,0.9256489488387418
166,选择任何还款方式都可以提前还款吗,0.9255358309444851
167,新网银行账户的交易记录如何查看,0.9254379888112889
168,上传身份证时需填写的内容是什么,0.9253893857787435
169,支持绑定的银行卡类型有哪些,0.9253013930309772
170,新网银行公众号如何取消关注,0.9252000494580296
171,新网二类户为何无法转入/转出,0.9251357583143223
172,结清证明会展示哪些信息,0.9251314687123278
173,使用优惠券后提前还款利息如何计算,0.9247096939638997
174,贷款证明开据失败怎么办,0.9246914412698132
175,客户表示没有问题了,0.9246866256548354
176,关闭其他平台额度后，能否恢复好人贷额度,0.924369961469965
177,合同为何无法打开,0.9243612838612771
178,是否会发生重复扣款情况,0.9242861715810646
179,车贷如何修改注册手机号码,0.9241921144862404
180,自助提额什么时候上线,0.9239674313796045
181,操作好人贷是否需要开启定位,0.9239067865390157
182,为何提示用户未实名认证,0.9239004847196778
183,查询结清证明申请是否已提交,0.9237285830197504
184,为何提示支付平台支取金额超过可用余额,0.923494932356814
185,为什么取消了提前部分还款,0.9234389435635597
186,为何无法提交好人贷申请资料,0.9233889097397904
187,好人贷不借款会产生利息或费用吗,0.9230454074742849
188,还款日当天支持手动还款吗,0.9229253394654128
189,转账到新网银行账户是否还款成功,0.9227628087376664
190,滴水贷客服电话是多少,0.9227411682516508
191,核身链接失效的原因,0.9227023027370503
192,如何查询是否开通银联在线支付,0.9224998403021233
193,还款银行卡是否需要开通银联在线支付业务,0.9223518750965792
194,可否按照征信订单号开据证明,0.9223507497982456
195,自动扣款失败怎么办,0.9222347087546658
196,为何提示还款存在差错,0.9222323168809029
197,系统繁忙是什么原因,0.9221878471076481
198,人脸识别使用的是照片还是视频,0.9221031351339618
199,车贷能否绑定他人银行卡,0.9220596421593555
200,为何提示支付平台账户余额不足,0.9220096014650349
201,新网银行视频认证的QQ号码是多少,0.9219072950159534
202,新网二类户可以升级为一类户吗？,0.9218513683621745
203,为什么银行还款存在限额？,0.9218258592469744
204,好人贷只能使用微信登录吗？,0.9217041442175871
205,如何查询转账到新网银行的记录,0.9215941584058776
206,审核电话内容是什么,0.9215207350596418
207,当期账单支持再分期吗,0.9214185944876115
208,为何提示支付平台不允许持卡人进行的交易,0.921391915301477
209,如何查询好人贷申请的授信结果,0.9213272208142781
210,客户咨询其他平台催收问题,0.9212836485130642
211,新网银行有实体卡片吗,0.9211983005861647
212,京东存款是否支持提前支取/提前部分支取？,0.9211868122083219
213,好人贷借款超时未到账如何处理,0.9208822174528456
214,修改手机号码的处理时间是多久,0.9208202597890873
215,密码被锁定怎么办,0.9207876541718345
216,好人贷注册手机号无法使用,0.9206193834301312
217,好人贷借款金额与到账金额是否一致,0.920500700015792
218,线下转账如何填写新网银行开户信息,0.9204391095224566
219,申请好人贷有区域或者号段等限制吗,0.920382539591592
220,申请好人贷后有没有回复,0.9203765572909818
221,平台方提供的客户审批资料能否提供给客户,0.9202747587255152
222,销户后是否上征信,0.9200856435448583
223,提前还款有次数限制吗,0.9200402902302716
224,贷款结清之后能否删除贷款记录,0.9198058970771973
225,新网银行的官网地址是什么,0.9197494701536046
226,存在迁户问题怎么处理,0.9196233876132104
227,什么是无卡支付及免密支付,0.9194595699043434
228,企业邮箱填写错误怎么办,0.9193895255390497
229,好人贷申请是否可以使用临时身份证,0.9193370552777245
230,还款金额超银行卡限额怎么办,0.9192840162279058
231,京东存款如何修改注册手机号码,0.9192649836603112
232,好人贷提额会查询征信吗,0.9191524450886728
233,58车金融客服电话是多少,0.9191005916955282
234,客户要求发送相关模板,0.9187213167151598
235,为何提示支付平台当日交易次数超限,0.918719772678874
236,优信客服电话是多少,0.9186592115580964
237,提前支取有限制吗,0.9185632262097603
238,如何修改征信上的个人信息,0.9185027755703886
239,结清证明的印章是否可以用公章,0.9182638618980239
240,征信上显示的贷款金额是否包含利息,0.9180016481962933
241,申请创客贷需要什么条件,0.9179819193455876
242,新网银行扣款通道是什么,0.9179498099983139
243,如何查询申请相关的协议书,0.9179120998611634
244,可以通过他人银行卡转入到新网银行账户吗,0.9177176887977935
245,额度冻结是什么意思？,0.9176219686717435
246,车贷可以修改还款日吗,0.9175610674225839
247,为什么收到美利车金融的短信,0.9175458847209689
248,线上转入新网银行账户到账时间是多久,0.9175240060260078
249,在线客服是否是人工客服,0.9174676379944556
250,提前结清贷款后还会扣款吗,0.9174141191323263
251,新网银行开户支持的证件有哪些,0.9172995145526076
252,申请好人贷需要开个人账户吗？,0.9172393700680237
253,开据证明时为何需要实名认证,0.9171981508293986
254,关于客户个人信息安全问题,0.9171857739991833
255,令牌无效是什么,0.9171776871170257
256,是否需要使用本人手机操作好人贷,0.9170979663157226
257,开具结清证明时为何无法登录,0.9169568635476989
258,销户后可以再开户吗,0.9164720690956737
259,新网银行有信用卡吗,0.9162380588208598
260,绑定银行卡失败,0.9161387258452164
261,为何提示支付平台交易金额超限,0.9161095583316021
262,新网银行以何名义查询征信,0.9159975408480981
263,好人贷是否支持提前还当期账单,0.9157326917562645
264,新网银行能否绑定云闪付,0.9157113437010055
265,人脸识别失败怎么办,0.9156684749545211
266,客户发送截图以及个人信息等,0.9155686873037436
267,如何查看好人贷相关协议/合同？,0.9155529532762766
268,如何修改新网随心存注册号码,0.9153856538843624
269,好人贷申请需要填写哪些个人信息,0.9150283854482157
270,新网二类户转入/转出收取手续费吗,0.91501773739336
271,挖财还款是否为新网银行代扣,0.9150095753090309
272,为何人脸识别提示光线太足,0.914974828383592
273,车贷支持手动还款吗,0.9146816396691861
274,能否开具非恶意逾期证明,0.9144876062073459
275,定期存款操作的渠道有哪些,0.9143960249021497
276,好人贷授信首页显示利率是否为固定利率,0.9141551832776542
277,随心存操作渠道有哪些,0.9131572922567991
278,他人可以使用本人信息申请好人贷吗,0.9131058689672328
279,为何还款后额度恢复减少了,0.9129867186178547
280,黑户/白户是否可以申请好人贷,0.9128829162462215
281,为何页面出现多个新网银行账户,0.9127302669077391
282,好人贷申请必须使用身份证原件吗,0.9126622342846121
283,好人贷如何查看所支持的还款方式,0.9124613924442689
284,好人贷支持微信/支付宝扣款吗,0.9123304298293834
285,车辆信息如何查询,0.9122396549476716
286,"好人贷有回访电话吗""",0.9122373182605183
287,结清证明是否是还款记录证明,0.91215910017813
288,新网银行人工客服电话是多少,0.9117607727510191
289,随心存支持提前支取吗,0.9116768019888474
290,好人贷额度为什么变低了,0.9115605711607979
291,客户提到投诉,0.911414742129401
292,如何把注册用户与结算用户都注销,0.9113209261607218
293,好人贷以什么贷款类型上报人行征信？,0.9112211178293887
294,如何查询其他平台扣款银行卡,0.9111133579973947
295,页面为什么异常跳转,0.9109669995052734
296,他行渠道汇入新网账户的到账时间是多久,0.9107742239606413
297,季得利的操作渠道有哪些,0.9107548546293739
298,名下所有卡被冻结后如何还款,0.9104691688280795
299,手持身份证拍照的注意事项,0.9103815418527652
300,银行渠道维护是指什么,0.9103511771523318
301,新网账户之间能否互相转账,0.9102905683340922
302,新网二类户上的资金是否计息,0.9101813555497961
303,还款日可以修改吗,0.9101790927612782
304,好人贷额度必须一次性借完吗,0.9100649206656917
305,可以让别人代还款吗？,0.9098061952329616
306,新网银行三类户是什么,0.909802362931835
307,还款日当天是否自动扣款,0.9096500345648568
308,可否取消银行卡限额,0.9096397997750171
309,如何查询合作平台贷款是否结清,0.9095692495988861
310,选择任性还款/按期还款利息如何计算,0.909256079408692
311,车贷合同里的金额是否包含利息,0.9088537323023254
312,申请好人贷需要什么条件,0.9088195456539033
313,好人贷利率为什么调高了,0.9087754104368793
314,能否删除个人信息,0.9087574778966427
315,人工是否可操作扣款,0.9085031884602203
316,新网银行存款产品为何暂停交易,0.9084095679334635
317,哪些渠道可以购买京东存款产品？,0.9083702512326545
318,如何查询账户是否冻结,0.9083541671667636
319,车贷申请多久可以放款,0.9083366777855968
320,交易密码无法设置,0.908240006389277
321,身份证过期可以申请好人贷吗,0.9081432875463572
322,逾期造成的影响是什么,0.9081148584293206
323,好人贷借款时还会审核吗,0.9080602724617657
324,好人贷能否绑定他人银行卡,0.9079963137763251
325,开户失败原因,0.9079595050822913
326,如何查看随心存购买情况,0.9077491572745089
327,如何确保还款日当天会扣款成功,0.9075055639836572
328,活体检测失败怎么办,0.9074911352944631
329,提前还款手续费是多少,0.9074446515649927
330,在哪个平台操作提现,0.907396713137273
331,按期还款和任性还款的区别是什么,0.9073518861785826
332,节假日可以操作各类存款吗,0.9071756228026266
333,还款后为何未更新还款状态,0.9070071761087996
334,为何无法登录存管查询,0.9068550759175347
335,随心存产品停售原因,0.9066918296336871
336,获取额度后多久可发起借款,0.9065756785156287
337,节假日可以借/还款吗,0.9061294516395014
338,好人贷是否支持归还逾期部分账单,0.9060643331880759
339,存管查询的余额如何提现,0.9060103239832633
340,如何查询征信报告,0.9060094578098
341,可绑定银行卡数量上限,0.9059105265129046
342,随心存到期后何时到账,0.9058404750071176
343,好人贷有回访电话吗,0.9057785806628176
344,扣款失败的原因,0.9055789572860877
345,美利车联系电话,0.905362362369633
346,申请好人贷工作信息如何填写,0.9052405194661277
347,如何查询是否已申请好人贷,0.9049969084935058
348,如何解约快捷支付？,0.9046396735727261
349,为何申请好人贷无结果,0.9042400085977313
350,申请好人贷需要公积金、社保吗？,0.9041788744871821
351,新网银行有企业贷款吗？,0.904178469009083
352,好人贷支持在国外发起借款吗,0.9040436468821327
353,新网银行存款属于理财产品吗,0.9039027367837694
354,如何获取线上核身链接,0.9037154875578677
355,还款后页面显示等待中,0.9036321665141963
356,新网银行有招聘吗,0.9034344155022308
357,诺诺发票贷的利率是多少,0.903431325151715
358,如何查看银行卡管理列表,0.9033563307596321
359,新网银行存款是否受保障,0.9032631925682698
360,如何查看优惠券的使用情况,0.9031034228022669
361,为何提示系统异常,0.9031017998306545
362,提前支取时为何显示存入,0.9026840736366359
363,企业邮箱格式是什么,0.9025474885135113
364,什么是单笔借据和多笔借据,0.9025329380210086
365,新网银行有几个网点,0.9024909241702626
366,银联在线支付是什么,0.9023709224811807
367,好人贷-云闪付如何更换收/还款银行卡,0.902367271002967
368,好人贷需要面签吗,0.9023575121297739
369,客户表示有合作意向,0.9022612089045514
370,为什么无法注册,0.902089523582931
371,客服是否是随机分配,0.9020851114500746
372,可以重新注册吗,0.9018518052416726
373,申请好人贷后，可否更改授信结果,0.9017617230140468
374,好人贷申请是否支持人工受理,0.9016112051732387
375,如何退出微信公众号,0.9014634504582129
376,好人贷账户如何更换手机号码,0.9013639583944251
377,存管提现到账时间是多久,0.901289152854801
378,新网银行自动扣款次数,0.9009872998708687
379,视频认证的步骤是什么,0.9006494731312013
380,联系新网银行客服有哪几种方式,0.9006200967464378
381,随心存T+1是什么,0.9005344703939843
382,消费凭证有效期是多久,0.9002280133118447
383,随心存利率为何会发生变化,0.9001388612464359
384,新网银行二类户限额是多少,0.9000464865122091
385,美团客服热线是多少,0.899955375659975
386,好人贷可以重新申请吗,0.8994878306956147
387,能否让客服回电,0.8992576022237926
388,为何按期还款只能选择部分贷款期限,0.8991921859472467
389,存款页面是否会显示每日收益,0.899160465106782
390,新网银行账户可以在哪些地方使用,0.8990084633810438
391,我行对客邮箱是多少,0.8985555459879021
392,身份证更换期间会影响好人贷贷款吗,0.8984228138689555
393,好人贷借款合同有效期是多久,0.8981893162760338
394,忘记密码怎么办,0.8980548273466616
395,随心存提前支取到账时间,0.8979284780859279
396,个人可以在新网开立几个账户,0.8976951171866009
397,存款产品的资金可以用于好人贷还款吗,0.8973408135313838
398,新网诺诺发票贷如何申请,0.897305505396792
399,如何关注新网银行公众号,0.897132830202253
400,开户是什么意思,0.8965008493268339
401,新网银行自动扣款时间,0.8961954119591264
402,逾期后还款金额是否会增加,0.896013573520216
403,好人贷与其他平台类似产品的区别是什么,0.8959828411529742
404,如何查看开户结果,0.895747719305881
405,五年定期存款支持提前支取吗,0.8953680131768259
406,银行卡还款限额是多少,0.8951763652186645
407,随心存如何修改交易密码,0.8951118707572899
408,借款后如何判定下次还款日期,0.8948213387216633
409,好人贷申请的渠道有哪些,0.8948102874161111
410,如何查看委托支付协议,0.8944931165732309
411,存款产品如何重置交易密码,0.8944351414399684
412,存款需要先开立银行账户吗,0.894275609256777
413,注销账户的处理时间,0.894101949824115
414,新网银行存款类产品有哪些,0.8939752757700793
