0,绑卡成功了，再进去又显示要绑卡,1.0
1,为何之前绑定的银行卡不支持扣款了,0.9574656884491285
2,借款成功会有短信等提醒吗,0.9559125203986198
3,结清贷款后征信上是否会显示结清,0.9557331003281687
4,绑卡时页面上的银行卡预留手机号码可以修改吗,0.9554112791501469
5,好人贷申请成功会有短信通知吗,0.9529474549647691
6,为何提示支付平台该客户无默认扣款卡，交易没有发给统一支付,0.9520499366109697
7,为何同时收到了还款成功和失败的短信,0.9517712479607959
8,好人贷只能通过绑定的银行卡还款吗,0.9508092903806444
9,为何销户后还能看到好人贷信息,0.9505693434918945
10,好人贷被拒后为何没有下次开放时间,0.948826985625114
11,客服能否看到客户申请好人贷的信息,0.948820359203377
12,为什么拍照认证时总是不成功或显示系统崩溃,0.9484102151246869
13,非绑定银行卡可否与新网二类户转账,0.9481727933743982
14,借款合同是否有展示提前还款会收取违约金的情况,0.9479142064942989
15,为何征信上有新网银行上报的逾期,0.9475691998530485
16,新网二类户转入/转出有时间限制吗,0.9474977039805752
17,购买存款页面为何提示“额度不足，无法购买”,0.9474829368204637
18,为何提示支付平台不允许持卡人进行的交易,0.9474436961488703
19,好人贷注册手机号与银行卡预留手机号是否需要一致？,0.9472262747232955
20,修改手机号码/微信号是否会影响自动扣款,0.9472169888707535
21,为何提示支付平台受发卡行资金用途限制拒绝交易,0.9471599808827093
22,关闭其他平台额度后，能否恢复好人贷额度,0.947099385516307
23,线上开据证明为何和征信金额不符,0.9470273596891475
24,好人卡绑定云闪付/微信等失败怎么办,0.9470077831360169
25,平台方手机号变更导致我行无法直接开据结清证明问题,0.9470001256693463
26,为何申请好人贷页面显示暂无资格,0.9469426268712187
27,车贷能否绑定他人银行卡,0.9467386769272429
28,注册手机号更换成功后何时可以正常使用,0.9466259520392841
29,再次申请好人贷会查询征信吗,0.946319469292622
30,新网账户绑定微信/支付宝后支持提现或充值吗,0.9462522875740313
31,修改手机号后是否需要重置登录密码,0.9460523361815408
32,好人贷授信首页显示利率是否为固定利率,0.9459450615855104
33,银行卡开通银联在线支付后是否可正常还款,0.9458577844112649
34,一个身份证可以申请好人贷两次吗？,0.9456859909876361
35,输入身份证号码时，为何无法输入字母,0.9456419246475669
36,好人贷审核时是否给填写的联系人去电,0.9456200164618925
37,还款银行卡是否需要开通银联在线支付业务,0.9453260432776294
38,为何提示支付平台持卡人信息有误,0.9450571510975694
39,为何征信上有新网上报的贷款记录,0.9449403841417273
40,为何提示支付平台支取金额超过可用余额,0.9445660006239109
41,申请好人贷需要下载APP吗？,0.9442291368335152
42,存管查询为何提示用户不存在或者信息有误,0.9441323167492057
43,为何征信上有新网银行的贷款审批记录,0.9440662355443425
44,为何申请好人贷后显示未获取额度,0.9440357260834101
45,转账到新网银行账户是否还款成功,0.9439476308853809
46,好人贷为什么提示“账户存在异常操作”,0.9439234919497872
47,好人贷只能使用微信登录吗？,0.94380171835916
48,随心存可以在我行公众号查询/操作吗,0.9436950174096442
49,微信/支付宝等可否与新网银行账户互相绑定,0.9436080534670809
50,征信上显示的贷款金额是否包含利息,0.9435616859153471
51,微信号更换成功后何时可以正常使用,0.9434562647878273
52,通过本人微信找回密码是指什么,0.9434112641987533
53,操作好人贷是否需要开启定位,0.943360821940291
54,新网银行发送的短信验证码的有效时长？,0.9433217840410354
55,可以通过他人银行卡转入到新网银行账户吗,0.9433204280070737
56,借款到账后页面未更新借款状态,0.9432539293641742
57,未接到好人贷回访电话会被拒吗,0.9431908363444267
58,转入新网银行使用的密码是交易密码还是银行卡密码,0.9431518507161873
59,新网银行账户可以设置为好人贷借/还款账户吗,0.9428868574451713
60,实际申请金额与放款金额不一致可否取消车贷,0.9428003956719742
61,申请好人贷必须填写联系人信息吗,0.942582352508029
62,支持绑定的银行卡类型有哪些,0.9424832277389348
63,为什么收到提额短信但额度未提升,0.9421710203014008
64,申请好人贷后为何页面显示仍可提交申请,0.9421529523842386
65,为何提示支付平台银行卡未开通银联无卡认证支付,0.9420172016120404
66,为何提示支付平台暂不支持的银行或限额,0.9417446793145414
67,登录时的图文验证码是否区分大小写,0.9411577308835247
68,进入随心存为何提示手机号码不一致,0.9411251003964832
69,好人贷审核不通过对个人有什么影响,0.9409892686826694
70,新网银行开户支持的证件有哪些,0.9409802458119564
71,为何好人贷还款时提示“交易处理中”,0.9408603429818037
72,绑定银行卡产生费用吗,0.940822422849625
73,新办的手机号可以申请好人贷吗,0.9407149821037858
74,新网银行二类户与好人贷是否为同一个手机号码,0.940569367807427
75,好人贷必须绑定银行卡使用吗,0.9405652508412525
76,车贷扣款支持的银行卡有哪些,0.9405650566134905
77,销户后为何还能解绑银行卡,0.9405167888149032
78,为何提示支付平台发卡行拒绝,0.9403957812014166
79,贷款结清之后能否删除贷款记录,0.9403657663870486
80,优信扣款成功后为何显示待还款,0.9403227045927588
81,手机号归属地与定位地不一致是否有影响,0.9403101578133175
82,新网二类户可以升级为一类户吗？,0.9402286174528393
83,申请好人贷需要开个人账户吗？,0.9400720151663328
84,页面为何提示“开户失败”、“账户存在异常操作/账户异常”,0.9400017676178158
85,如何查询是否开通银联在线支付,0.9399647578440887
86,好人贷申请是否可以使用临时身份证,0.9397864981080124
87,申请好人贷有区域或者号段等限制吗,0.939662392795321
88,我行放款的其他平台借款会上报征信吗,0.9396019012207896
89,为何无法提交好人贷申请资料,0.9393546802721383
90,黑户/白户是否可以申请好人贷,0.9392476667580867
91,无法提供消费凭证可以取消贷款吗,0.9392453558222071
92,为什么好人贷第一期还款金额与之后不一致,0.9392338679515464
93,新网二类户为何无法转入/转出,0.9392273692011275
94,新网二类户转入/转出收取手续费吗,0.9390024803226023
95,更换银行卡会影响自动扣款吗,0.9389953591345817
96,为何图文验证码输入正确却提示错误,0.9386955781310647
97,新网银行视频认证的QQ号码是多少,0.9385783995153602
98,为何征信上的放款日期与实际借款日期不一致,0.9384436186230625
99,哪些渠道可以购买京东存款产品？,0.9383890871732798
100,系统升级会影响扣款吗,0.9383395211049889
101,线上是否可开据征信版结清证明,0.9380456564213252
102,为何收到新网银行逾期提醒短信,0.9380069889212994
103,企业邮箱验证码可否重新获取,0.9380060796245673
104,为何提示支付平台渠道不支持的银行,0.9379697839341152
105,收款卡发卡行拒绝放款失败什么意思？,0.9378705858457989
106,车贷申请多久可以放款,0.9378199677975358
107,线上开据证明有次数限制吗,0.9375606538625646
108,申请好人贷使用的邮箱是公司邮箱还是个人邮箱,0.9375546259364228
109,申请好人贷后，可否更改授信结果,0.9374436789009246
110,结清证明的发送方式有哪些,0.9373939216597325
111,为何提示交易密码验证失败,0.9372191713067606
112,为何提示支付平台账户余额不足,0.9371608217633078
113,扣款结果会有短信提示吗,0.937146131469282
114,新网银行能否绑定云闪付,0.9371081494027204
115,转账时为何提示未面核,0.9370898870866746
116,好人贷申请是否查询芝麻信用,0.937072460131875
117,开据证明时为何提示账户存在异常,0.9368304156481745
118,为什么收到美利车金融的短信,0.9366741273044864
119,好人贷申请需要填写哪些个人信息,0.9366310003422929
120,为何提示支付平台签约关系不存在,0.9366066157161123
121,好人贷申请必须使用身份证原件吗,0.9365879861731984
122,结清证明的印章是否可以用公章,0.93656773757099
123,好人贷账户是否为新网银行二类户？,0.9365114221726489
124,是否需要使用本人手机操作好人贷,0.936175634918497
125,开据证明为何显示没有符合要求的订单,0.9361714514084309
126,好人贷借款金额与到账金额是否一致,0.9361504015382216
127,更改银行卡预留手机号的方法,0.9361413793118408
128,贷款证明的电子章是否具有法律效应,0.9361239441881662
129,为何重置密码后仍提示密码错误,0.936123819158146
130,为什么提前还款显示联合贷批次执行中？,0.9361228590193891
131,销户后可以再开户吗,0.9360293791183498
132,为何存管查询提示没有密码,0.9359845625099649
133,好人贷不借款会产生利息或费用吗,0.9359717779667374
134,申请好人贷需要公积金、社保吗？,0.9359655983437357
135,什么是无卡支付及免密支付,0.9358012857105448
136,为何页面出现多个新网银行账户,0.9356883169709531
137,为何存管信息与平台显示不一致,0.9356663273303664
138,未正常还款我行会进行催收吗,0.935586238386915
139,上传身份证时需填写的内容是什么,0.9355321913499132
140,存款页面是否会显示每日收益,0.9355308195350659
141,为何提示支付平台当日交易次数超限,0.9355061335736972
142,什么是银行卡预留手机号？,0.9353401044475225
143,是否可以取消自动扣款,0.9351569934405394
144,好人贷支持在国外发起借款吗,0.9351465106698693
145,新网银行有信用卡吗,0.9351127660075694
146,线上转入新网银行账户到账时间是多久,0.9349875810096879
147,如何查询转账到新网银行的记录,0.93489794310054
148,新网账户之间能否互相转账,0.9348364990568488
149,京东存款是否支持提前支取/提前部分支取？,0.9348313679993645
150,新网银行账户的交易记录如何查看,0.934760623035645
151,车贷合同里的金额是否包含利息,0.9347380827830972
152,客服能否查看聊天记录,0.934515432127043
153,贷款证明开据失败怎么办,0.9344006051235829
154,半年得利提前支取影响已发放利息吗,0.9343775235727264
155,为何提示支付平台交易金额超限,0.9343676137500057
156,好人贷能否绑定他人银行卡,0.9342459613747105
157,公众号页面的“我的排号”是什么意思,0.9341575214274026
158,提前还款会影响个人征信吗,0.9341562093655005
159,如何查询好人贷申请的授信结果,0.9341369387421319
160,好人贷可以重新申请吗,0.9341329867694959
161,为何提示不具备开具资格,0.9341291813947626
162,季得利提前支取影响已发放利息吗,0.9339828015552663
163,平台还款信息为何与新网银行不一致,0.933900061150477
164,好人贷是否支持归还逾期部分账单,0.9338384251066238
165,在线咨询是否支持客户发送语音,0.9338081918677597
166,注册手机号及微信号需要实名制吗,0.9337845280722272
167,获取验证码次数超限怎么办,0.9337620978157883
168,还款后页面显示等待中,0.933694361929905
169,好人贷手动还款时为何提示批次执行中,0.9336654230885045
170,为何提示支付平台账户状态异常,0.9336534278669032
171,新网银行有哪些产品可以提额,0.9333666224321322
172,好人贷额度必须一次性借完吗,0.9331487452549299
173,新网银行账户可以在哪些地方使用,0.9330203716551005
174,销户与否会产生什么影响,0.9328288806295536
175,新网银行存款是否受保障,0.9328200660692828
176,绑定银行卡失败,0.9326674201785422
177,结清贷款后什么时候可以开据结清证明,0.9325759187507656
178,获取额度后多久可发起借款,0.9325489801726422
179,银行卡是二类户影响扣款吗,0.9325155996226547
180,个人可以在新网开立几个账户,0.9322851862474314
181,新网银行有实体卡片吗,0.9321815832582826
182,好人贷是否支持提前还当期账单,0.9321466562685276
183,如何查看手机号是否实名制,0.9320099806111161
184,结清证明会展示哪些信息,0.9319603665138814
185,存款需要先开立银行账户吗,0.9319236878215279
186,咨询可以发送图片吗？,0.9318447919209059
187,销户后是否上征信,0.9318004922744683
188,开据证明时为何需要实名认证,0.9316227041804358
189,如何确保还款日当天会扣款成功,0.9316100351970347
190,补扣会影响信用吗,0.9313705780838157
191,他行渠道汇入新网账户的到账时间是多久,0.9313318700669203
192,如何修改实名认证手机号码,0.9312888065830169
193,为何提示用户未实名认证,0.9312765696794484
194,好人贷支持微信/支付宝扣款吗,0.9312574721576325
195,如何更改其他平台的注册手机号码,0.9312573470213793
196,当期账单支持再分期吗,0.9311647594662786
197,选择任何还款方式都可以提前还款吗,0.9310519377594154
198,公众号是否有还款提示,0.931034027498924
199,结清证明印章无法查看,0.9308842632915687
200,注销注册用户后是否可恢复？,0.9308793303830165
201,客户表示有合作意向,0.9308608747129853
202,为何结清证明显示日期与平台不符,0.930815038566191
203,身份证过期可以申请好人贷吗,0.9307368524629814
204,线下转账如何填写新网银行开户信息,0.9306331971473876
205,节假日可以操作各类存款吗,0.9306145343817033
206,可否取消银行卡限额,0.9306142843437497
207,他人可以使用本人信息申请好人贷吗,0.9305892733279292
208,银行卡挂失会影响自动扣款吗,0.9305746091939954
209,为何人脸识别提示光线太足,0.9303968153161435
210,新网银行以何名义查询征信,0.9303821218019986
211,接收短信的手机号是否为注册手机号,0.9302972605424944
212,申请好人贷没有公司邮箱怎么办,0.930230383238182
213,季得利的操作渠道有哪些,0.9299413798103054
214,视频认证录制失败的原因是什么,0.9299051451098044
215,客户表示还款成功,0.9298836097269376
216,可以查询个人信息资料吗？,0.9298679511897903
217,为何提示还款卡不存在,0.9298120534226216
218,白骑士认证失败是什么意思,0.929807022103907
219,能否开具非恶意逾期证明,0.9296713368127156
220,联系新网银行客服有哪几种方式,0.9296619275451798
221,平台方提供的客户审批资料能否提供给客户,0.929465797167835
222,合同为何无法打开,0.9290313486445387
223,借款时选错收款账户怎么办？,0.9289363103835218
224,诺诺发票贷的利率是多少,0.9287439826416789
225,银行转账未到账怎么办,0.9286322627241828
226,如何修改征信上的个人信息,0.9285508098548141
227,可绑定银行卡数量上限,0.9285295926469114
228,存款产品的资金可以用于好人贷还款吗,0.9285186840966254
229,定期存款操作的渠道有哪些,0.9284777183005943
230,手机获取验证码失败,0.9284218687082021
231,新网银行公众号如何取消关注,0.928412580470442
232,如何取消征信查询及使用授权书,0.9281925777558385
233,提前支取有限制吗,0.928033171323973
234,为什么提示用户不存在,0.9280093210653962
235,好人贷需要面签吗,0.9279104884346204
236,新网银行合作的存管平台有哪些,0.9278912939664925
237,如何查询其他平台扣款银行卡,0.927811354317707
238,存管密码被锁定怎么办,0.9277916751283074
239,客户要求发送相关模板,0.9277562704840369
240,58车金融客服电话是多少,0.9277451838047107
241,使用优惠券后提前还款利息如何计算,0.9277281507780258
242,为何收到新网银行还款短信,0.9276964237046982
243,可否按照征信订单号开据证明,0.9276920549740256
244,实名认证是否查询征信,0.9273807206042776
245,如何通过线下方式转入新网二类户,0.9273672896375074
246,客户发送截图以及个人信息等,0.9273201072866556
247,新网银行存款属于理财产品吗,0.9271962881784692
248,提前还款有次数限制吗,0.9271837102067102
249,拨打我行人工客服电话是否收费,0.9271733879861705
250,新网二类户上的资金是否计息,0.9271695776788169
251,为什么取消了提前部分还款,0.9271642603051619
252,可以让别人代还款吗？,0.9270632820677223
253,目前支持的银行有哪些,0.9270293231134761
254,电话客服是否可以受理结清证明,0.927027875391072
255,随心存停售后有影响吗,0.9269296306157004
256,车贷合同为何无法查看,0.9268198922812392
257,逾期后还款金额是否会增加,0.926772388776791
258,人工是否可操作扣款,0.9266078523961683
259,人脸识别使用的是照片还是视频,0.9265272307957423
260,提前支取时为何显示存入,0.9264420785480316
261,新网银行有企业贷款吗？,0.9264046313229388
262,修改手机号码的处理时间是多久,0.9263317336543797
263,征信报告是什么样的,0.9262392718924274
264,好人贷借款合同有效期是多久,0.9261109920433235
265,为何提示缺少必要参数,0.9261014114998993
266,好人贷利率为什么调高了,0.9260383817039475
267,为何提示支付平台其他错误,0.9260362220908877
268,提额会有通知吗,0.925975211957002
269,申请好人贷后有没有回复,0.9259467903627259
270,页面为何无法打开,0.925835215950703
271,如何查看好人贷相关协议/合同？,0.9257773690643099
272,客户咨询其他平台催收问题,0.9257126235925695
273,验证码发送至什么手机号,0.9256274503346238
274,下一次开放时间是什么意思,0.9255941566218275
275,查询结清证明申请是否已提交,0.9255433549770865
276,申请好人贷是否都有额度,0.9255154179071071
277,如何查询合作平台贷款是否结清,0.925413147506015
278,随心存操作渠道有哪些,0.9253717271286354
279,车贷可以修改还款日吗,0.925364423056341
280,好人贷提额会查询征信吗,0.9251097097266067
281,挖财还款是否为新网银行代扣,0.9250607192318251
282,新网银行存款产品为何暂停交易,0.9249782218669718
283,如何查看优惠券的使用情况,0.9249028328373614
284,滴水贷客服电话是多少,0.924898790925442
285,如何修改存管账户预留手机号码,0.9248610908031043
286,开具结清证明时为何无法登录,0.9248548048709663
287,好人贷如何查看所支持的还款方式,0.9248390807533161
288,名下所有卡被冻结后如何还款,0.9248335707225874
289,申请诺诺发票贷需要什么条件,0.9247067530912461
290,查询车贷的注册手机号码是什么,0.924454158786615
291,好人贷申请的渠道有哪些,0.9244443584482972
292,新网银行的官网地址是什么,0.9243873058567178
293,随心存产品停售原因,0.9243733142017452
294,好人贷额度为什么变低了,0.9242047362211306
295,怎样才能成功申请到额度,0.92401108748606
296,为何提示该证件已被使用,0.9239385169928589
297,"好人贷有回访电话吗""",0.9239309619217974
298,可以查询注册手机号码吗,0.9239163224581017
299,车贷还款只扣除部分是什么原因,0.9238205859741865
300,银行渠道维护是指什么,0.923566963894356
301,新网银行有招聘吗,0.9234982959158858
302,实名认证失败的原因是什么,0.9233699159325796
303,好人贷申请身份证可否添加水印,0.9233466927598595
304,京东存款为什么显示当日额度为什么已售罄？,0.9232774359801476
305,如何查看随心存购买情况,0.9231951466474866
306,如何解约快捷支付？,0.9231314194461032
307,身份证更换期间会影响好人贷贷款吗,0.9231281263374258
308,在线客服是否是人工客服,0.9230075700070087
309,好人贷以什么贷款类型上报人行征信？,0.9230063148619551
310,如何查看银行卡管理列表,0.9229919220270904
311,客户催促需要加急办理,0.922982155583027
312,还款金额超银行卡限额怎么办,0.9229523076052933
313,新网银行存款类产品有哪些,0.9228930215252518
314,好人贷借款时还会审核吗,0.9225422337860975
315,密码被锁定怎么办,0.9225275557624314
316,存款产品是否存满五年才能支取,0.9222198829588243
317,存管提现到账时间是多久,0.9221728390573042
318,审核电话可更改接听电话吗,0.9221408647849303
319,在哪个平台操作提现,0.922016529938293
320,为何申请好人贷无结果,0.9220147250615204
321,好人贷借款超时未到账如何处理,0.9220105987808065
322,好人贷申请是否支持人工受理,0.9218787653958379
323,提前结清贷款后还会扣款吗,0.9217458452875826
324,为什么银行还款存在限额？,0.9215744626464004
325,如何退出微信公众号,0.9214854821974704
326,好人贷与其他平台类似产品的区别是什么,0.9214771053268215
327,新网银行二类户限额是多少,0.9214484719079133
328,如何查询是否已申请好人贷,0.9212774475717495
329,如何修改新网随心存注册号码,0.9211352674413695
330,好人贷注册手机号无法使用,0.9210334848760909
331,申请好人贷工作信息如何填写,0.920770393483845
332,还款日可以修改吗,0.9207031360722542
333,手机号无法使用为什么,0.9206878776969843
334,新网银行有几个网点,0.9206084944177089
335,手持身份证拍照的注意事项,0.9205629280073301
336,新网银行人工客服电话是多少,0.9205446149919966
337,为什么点击拍照没有反应,0.9204038254082655
338,客服是否是随机分配,0.9203786169518553
339,关于客户个人信息安全问题,0.9201889130490166
340,如何知晓已注销成功,0.9201875898430675
341,申请好人贷需要什么条件,0.9200833289666099
342,为何按期还款只能选择部分贷款期限,0.9199609171339668
343,如何获取线上核身链接,0.9199085247149491
344,好人贷有回访电话吗,0.919805187589034
345,好人贷额度是否会发生变化,0.9197680137592595
346,随心存支持提前支取吗,0.9195844121361109
347,车贷支持手动还款吗,0.9195401127752523
348,转账到新网银行如何操作,0.9195078709068122
349,还款日当天是否自动扣款,0.9194778879376553
350,为何提示还款存在差错,0.919475080489494
351,为何无法申请好人贷,0.9193608142812906
352,新网银行人工客服电话打不通,0.9191508766497231
353,随心存如何修改交易密码,0.9188656207127552
354,新网银行有哪些活动,0.9188049168365398
355,什么是单笔借据和多笔借据,0.9186844560402248
356,客户表示需要考虑,0.9185159868015529
357,如何查看开户结果,0.9185113985390987
358,消费凭证有效期是多久,0.9183780602844944
359,随心存提前支取到账时间,0.918303869897138
360,提前还款手续费是多少,0.918283769076656
361,新网银行合作平台有哪些,0.9180281974094786
362,交易密码无法设置,0.9178776545594374
363,新网银行扣款通道是什么,0.9178255399197587
364,能否删除个人信息,0.9177557268579268
365,视频认证的步骤是什么,0.9177169390254281
366,如何设置存管支付密码,0.9176854825592455
367,优信客服电话是多少,0.9176729008920059
368,还款日当天支持手动还款吗,0.9176300725970241
369,申请创客贷需要什么条件,0.9175915976619726
370,银联在线支付如何开通,0.9175336149426657
371,新网银行二类户如何转入/转出,0.9174616671707163
372,银联在线支付是什么,0.9174289688719622
373,客户表示没有问题了,0.91713976769072
374,节假日可以借/还款吗,0.9169597344963002
375,如何关注新网银行公众号,0.9169092974647057
376,随心存利率为何会发生变化,0.9168231642959719
377,申请好人贷需要哪些资料,0.9167271674497133
378,好人贷借款后能否修改贷款信息,0.9164815824171673
379,如何查询申请相关的协议书,0.916478487727983
380,能否让客服回电,0.9164782460269824
381,好人贷-云闪付如何更换收/还款银行卡,0.9162597268165854
382,自助提额什么时候上线,0.9161720444671774
383,新网银行地址在哪里,0.9160612662070782
384,审核电话内容是什么,0.9158888508479907
385,企业邮箱为何验证不了,0.9158690833195544
386,车贷如何修改注册手机号码,0.9158441347567787
387,我行对客邮箱是多少,0.9155690485294725
388,银行渠道维护无法操作怎么办,0.9154179574306059
389,美团客服热线是多少,0.9152291764298908
390,是否会发生重复扣款情况,0.9151346704642316
391,好人贷额度是否循环使用,0.9149953032907193
392,新网银行的活期利率是多少,0.9149422757914593
393,如何查看委托支付协议,0.9149309569887071
394,京东存款如何修改注册手机号码,0.9147681402946232
395,车贷如何解绑银行卡,0.9147494184573712
396,为何还款后额度恢复减少了,0.9146825001862035
397,新网银行以什么名义放款,0.9146580798373837
398,自动扣款失败怎么办,0.9145869574236783
399,新网银行自动扣款次数,0.9145218632326864
400,银行渠道维护时间一般是多久,0.9142942847942619
401,为何提示系统异常,0.9141399364226026
402,随心存如何查看收益情况,0.9140033604198489
403,新网银行是否上市,0.913388084684073
404,好人贷审核电话是多少,0.9132125931294447
405,新网诺诺发票贷如何申请,0.9131471723118333
406,如何激活新网二类户,0.9131336657813646
407,存款产品如何重置交易密码,0.9131236612153378
408,如何绑定银行卡,0.9130619783032606
409,好人贷为什么无法登录,0.9129795060849683
410,如何查询账户是否冻结,0.9129240203177709
411,随心存到期后何时到账,0.9128131385286598
412,可否补充企业邮箱,0.9119318968969757
