413,有额度不使用有什么影响吗,0.911920748530217
414,客户表示稍等,0.911898191865867
415,我们是四川新网银行吗,0.9118587557179678
416,如何购买新网银行存款产品,0.9116591410063861
417,存在迁户问题怎么处理,0.9113032930021152
418,可以重新注册吗,0.9111636939462124
419,定期存款是否有存单,0.9110034440434873
420,系统繁忙是什么原因,0.9108134749805384
421,结清证明开据时间是多久,0.9107162530973775
422,银行卡还款限额是多少,0.9105709557448463
423,客户提到投诉,0.9102411222205076
424,周得利提前支取如何计息,0.9100225545032984
425,存款产品是否保本保息,0.910018564610088
426,新网银行自动扣款时间,0.9099898687797345
427,额度冻结是什么意思？,0.9099364141000434
428,存管查询的余额如何提现,0.9098892584017638
429,好人贷账户如何更换手机号码,0.9094967482334345
430,如何把注册用户与结算用户都注销,0.9094100144438217
431,按期还款和任性还款的区别是什么,0.909271170886598
432,随心存T+1是什么,0.9091841064366215
433,好人贷是否支持提前还款,0.9091805861039517
434,选择任性还款/按期还款利息如何计算,0.9088455966245303
435,实名认证为什么不符,0.9085069592949554
436,结清证明是否是还款记录证明,0.9084815226983725
437,如何解绑银行卡,0.9083398417232331
438,罚息能否减免,0.9081228214301502
439,好人贷支持周末借款吗？,0.9080526946795437
440,如何换绑银行卡,0.9080180119317581
441,企业邮箱格式是什么,0.9078506054550005
442,客户称赞服务好,0.9077623128425393
443,什么是风控审核中,0.9076881436280893
444,好人贷为什么无法借款,0.9074227769388802
445,存管账户充值限额,0.907242297911598
446,如何更换好人贷默认还款账户,0.9072016034155805
447,好人贷定位如何开启,0.9071230972847735
448,好人贷交易密码如何设置,0.9070924484000273
449,好人贷还款后额度何时恢复,0.9070887646306649
450,客户表示知道了,0.9070484944245278
451,如何获得优惠券,0.9068509719074851
452,五年定期存款支持提前支取吗,0.9068027980651506
453,为何无法登录存管查询,0.9067903827744203
454,什么是我的额度和可借额度,0.9066815332794592
455,活体检测失败怎么办,0.9065443763466067
456,房产保证金是什么,0.9063890465474039
457,企业邮箱填写错误怎么办,0.9063765708149698
458,页面为什么异常跳转,0.906371634840483
459,人脸识别失败怎么办,0.9060052669584557
460,车贷合同如何查看,0.9059015465617493
461,借款后如何判定下次还款日期,0.9056882667092689
462,月得利提前支取如何计息,0.905489621721368
463,还款后为何未更新还款状态,0.905488621962459
464,身份证上传失败怎么办,0.9054480983386373
465,如何查询当期车贷还款金额,0.9052077662271649
466,创客贷额度是多少,0.9050978451977912
467,车贷收取哪些费用,0.9050457739613433
468,为什么无法注册,0.9048992192491117
469,好人贷为何无法还款,0.9048089937446543
470,电脑端可以登录好人贷吗,0.9046979173164327
471,客户表示不满,0.9046914030893813
472,开户失败原因,0.9046126482511425
473,如何更换借款收款银行卡,0.904568368957585
474,居住信息如何填写,0.9045141998339313
475,好人贷额度他人能否使用,0.9038777976646875
476,好人贷支持随借随还吗,0.90383202609278
477,开户是什么意思,0.903662881786332
478,如何更换微信号,0.9033508164330882
479,征信上报周期及更新时间,0.9032995514152117
480,存款产品如何修改手机号,0.9030553375988711
481,如何查询征信报告,0.9028923750732916
482,新网银行三类户是什么,0.9028144870257324
483,如何邀请好友申请好人贷,0.9023143308356403
484,借款失败怎么办,0.9020932323486325
485,车贷如何更换还款银行卡,0.901951055803491
486,如何操作随心存大额存款,0.9019437459701478
487,车贷如何办理解押手续,0.9018899277189288
488,如何降低/关闭额度,0.9013507982463147
489,京东存款的计息规则及计息公式,0.9007297845056444
490,新网银行行号是多少,0.9007217342490194
491,如何增加银行卡,0.9007124912586978
492,新网银行账户是什么,0.9004012419275172
493,逾期造成的影响是什么,0.9003358428696332
494,核身链接失效的原因,0.9003280203719459
495,好人贷还款方式有哪些,0.9002454190039859
496,合作平台如何取消贷款,0.9002060912929463
497,逾期未还款如何处理,0.9001390719909172
498,好人贷为什么额度低,0.9000074677712983
499,有多少人获得好人贷额度,0.899957549269048
500,好人贷-云闪付如何提前还款,0.8997386188890912
501,如何选择按期还款/任性还款,0.8996267334910646
502,新网银行人工客服服务时间,0.8995890102323221
503,美利车联系电话,0.899588902592827
504,忘记密码怎么办,0.8994868390189907
505,如何查询存管账户流水,0.8990209044963725
506,好人贷借款如何上报征信,0.8989538316200206
507,车辆信息如何查询,0.8988932391932737
508,扣款失败的原因,0.898536957455156
509,迁户是什么意思,0.8981636355897772
510,新网银行好事贷如何申请,0.8979557314707701
511,关于消费凭证,0.8979147483084962
512,如何查看好人贷还款计划,0.8979137562593184
513,实名认证审核时间,0.8973418863702242
514,好人贷-云闪付是什么,0.8969444164594194
515,什么是活体检测,0.8969161340433656
516,存款产品支取通用路径,0.8967678322173466
517,五年定期存款的利率是多少,0.8967539792483379
518,随心存利率是多少,0.8966756495391904
519,注销账户的处理时间,0.8964963096724347
520,随心存存款期限有哪些,0.8964381544932825
521,好人贷利率为什么高,0.896374681104904
522,如何查询好人贷借据收款银行卡,0.8961569246006026
523,如何办理好人卡？,0.8959488281248293
524,好人贷申请能否撤销,0.895814213059523
525,为何无法销户,0.8957079066571029
526,什么情况算违约,0.8956470184772144
527,申请被拒怎么办,0.8951426292600732
528,车贷还款记录如何查询,0.8949745285408177
529,车贷利息是多少,0.8947904084897075
530,令牌无效是什么,0.8945757923835723
531,新网银行如何联系客户,0.8945430791313661
532,退汇是什么意思,0.8944436876343794
533,如何冻结新网银行账户,0.894374531967102
534,如何录制活体检测,0.8942389068348823
535,自动扣款时间段是多久,0.8941614912026917
536,周得利计息规则,0.8938760920933204
537,好人贷当期能否最低还款,0.8934827935721174
538,定期存款的利率是多少,0.8931321700701289
539,如何登录微信公众号,0.8920815483292894
540,好人贷支持随时借款吗,0.8919068929135792
541,如何在新网银行开户,0.8916228262313517
542,好人贷电话回访时间,0.8913101126440797
543,如何签署借款合同,0.8910867003726022
544,新网有哪些产品,0.8910276851030305
545,什么是分批次扣款,0.8905695160280469
546,什么是综合评估,0.8905216760932827
547,还款记录如何查看,0.8904441457750395
548,能否人工开据贷款证明,0.8902165827446562
549,好人贷是否有临时额度,0.8902020539250012
550,如何查询新网账户,0.8901563349888952
551,好人贷个人资料如何修改,0.8900207027437842
552,好人贷审核时间是多久,0.8898855101003573
553,好人贷提前还款最低还多少,0.8897091737256282
554,好人贷还款记录如何查询,0.8891701720479089
555,经侦是指什么,0.8881826005771236
556,好人贷自动扣款规则,0.8878429916918299
557,为什么没有扣款,0.8878275074843265
558,各还款方式如何进行还款,0.8876715362846123
559,可否延期还款,0.8876378524141103
560,什么情况算逾期,0.887594914522786
561,好人贷借款记录如何查询,0.8873396548827671
562,如何注销公众号,0.887173538479061
563,车贷平台如何查询,0.8870700687759425
564,好人贷是邀请制吗,0.8866755170880365
565,可否对公还款,0.8866130091616399
566,自动扣款如何操作,0.8865460683298821
567,好人贷能否人工操作提额,0.8856164879425422
568,额度冻结怎么办,0.8855602928399061
569,注册规则是什么,0.8855425594532808
570,好人贷支持扣款的银行有哪些,0.884633574907893
571,五年定期存款是什么,0.8844986420862904
572,好人贷如何实名认证,0.8841429146528896
573,可以咨询吗,0.8841299919885738
574,随心存是什么,0.8839027396238548
575,怎样用其他手机登录好人贷,0.8837860246185907
576,开通什么业务,0.8837768992166722
577,什么是当期账单,0.8835449511586038
578,如何查询车贷还款日,0.8833983633691901
579,新网银行APP下载,0.883008199483423
580,如何注销新网二类户,0.8826112901134144
581,好人贷部分提前还款规则,0.8817619949662474
582,客户提出建议,0.8816589824285869
583,车贷如何提前还款,0.8816077613726916
584,随心存存入限额,0.8810694507078924
585,查询各类工单办理进度,0.8806491703668694
586,好人贷借款多久到账,0.8805063682976048
587,如何进入个人中心,0.880487423376573
588,好人贷扣款账户如何查看,0.8793626346926964
589,如何注销新网注册用户,0.8792401099310189
590,如何进入好人贷页面,0.8791021976226203
591,好人贷账户如何挂失,0.8782222124694711
592,新网银行简介,0.8779129271835532
593,公众号如何注册,0.8768207925181626
594,好事贷收取哪些费用,0.876495378616759
595,征信是什么,0.8762537384871409
596,如何开立存管账户,0.8761852126046186
597,抵押类贷款如何办理,0.8760118013608326
598,好人贷如何提前还款,0.8759959932273449
599,批扣时间段是多久,0.8750957072540293
600,如何查看贷款合同,0.8750518605261111
601,工新借是什么,0.8749472918754162
602,什么是注册号码？,0.8745242281687596
603,额度占用问题,0.8740347418931885
604,好人贷额度有效期是多久,0.8725372953855622
605,按期还款是什么,0.8723769384009831
606,罚息介绍,0.8723253687104076
607,存管账户如何查询,0.8722918097485954
608,好人贷如何降低利率,0.8721246495274865
609,季得利是什么,0.8720989345188347
610,其他贷款怎么办理,0.8717151626595548
611,好人贷如何主动还款,0.8714895505756185
612,合作平台如何还款,0.8707369922329041
613,车贷逾期如何还款,0.8705543343891406
614,人脸拍摄规范,0.8700680916696774
615,密码如何修改,0.8700336902855578
616,什么平台的贷款,0.8696925606616518
617,新网银行业务办理时间,0.8694457844663941
618,好人贷放款至什么账户,0.8692364273814666
619,存款利率是多少,0.8688385506071618
620,好人贷如何自助提额,0.8684859226345798
621,存管是什么,0.8681625934786671
622,如何查询还款日,0.8681405503823177
623,存管账户如何注销,0.8670622276073582
624,好人贷账户如何查询,0.8670046913861325
625,好人贷还款后多久到账,0.8669440495278
626,工新借如何申请,0.8669249275132795
627,车贷如何申请,0.8667205594022238
628,什么是一、二、三类户,0.8663861407282236
629,好人贷如何提高额度,0.866209598664729
630,好人贷年化利率是多少,0.8659137036460731
631,车贷如何还款？,0.8656014896109969
632,好人贷如何试算利息,0.8655518837902395
633,好人贷月利率是多少,0.8652944048091366
634,好人贷有额度后如何进行贷款,0.8652331903918005
635,好人贷的办理时间,0.8647509290838011
636,好人贷利率是多少,0.8646921815224818
637,好人贷收取哪些费用,0.8645116868642548
638,如何办理对公业务,0.8639630621629627
639,好人贷上征信吗,0.8633418979053652
640,登录密码为何无法重置,0.8616551370373777
641,贷款证明如何开据,0.86124427046439
642,好人贷如何审核,0.8588684991891432
643,如何开据存款证明,0.8580149637788974
644,定期存款到期如何支取,0.857456022753509
645,好人贷贷款利息如何计算,0.8559446791299374
646,任性还款是什么,0.8554829015161716
647,什么是还款日,0.8554309466156585
648,好人贷是什么,0.8551577360670257
649,优惠券如何使用,0.8547230754100282
650,好人贷贷款期限是多久,0.8546174329555483
651,好人贷消费用途,0.8545367024894996
652,随心存如何计息,0.8540461651729531
653,季得利如何支取,0.8538325074777686
654,好人贷账户如何注销,0.8529270812771403
655,随心存如何登录,0.8513744770398276
656,好人贷如何申请,0.8509442928498728
657,如何删除身份证信息,0.8494998573953613
658,季得利如何计息,0.8484449928489574
659,好人贷额度是多少,0.8453266117884335
660,好人贷提额周期是多久,0.842935052393345
661,好人贷借款规则,0.8387795001692018
662,好人贷通过率多少,0.8375208632849411
663,好事贷如何还款,0.8372465881909545
664,身份证信息变更后如何更新,0.8316445842507586
665,什么是登录密码,0.8314047823388186
666,好人贷如何还款,0.816575076262482
