416,好人贷与其他平台类似产品的区别是什么,0.8995275786119823
417,好人贷额度是否会发生变化,0.899410245175634
418,好人贷可以重新申请吗,0.8992362816837809
419,存款产品是否存满五年才能支取,0.8992324530662609
420,房产保证金是什么,0.8992012453756473
421,申请好人贷是否都有额度,0.8991869561786974
422,如何查看优惠券的使用情况,0.8989526636187124
423,美利车联系电话,0.8989323244904226
424,申请被拒怎么办,0.8987418546719907
425,客户催促需要加急办理,0.8986229277916756
426,退汇是什么意思,0.8985161434702613
427,罚息能否减免,0.8982664849094382
428,可否补充企业邮箱,0.8982651012524331
429,如何查看委托支付协议,0.8981926609262717
430,征信上报周期及更新时间,0.8981221625323417
431,新网银行合作平台有哪些,0.897928771415077
432,新网银行是否上市,0.8978107907406557
433,如何查询是否已申请好人贷,0.8977473497131595
434,存款产品如何重置交易密码,0.8977415178664859
435,车辆信息如何查询,0.8977155711111189
436,新网银行有哪些活动,0.897367383615488
437,好人贷为什么无法借款,0.8972679436443718
438,居住信息如何填写,0.8971539436058651
439,逾期未还款如何处理,0.8971016128777962
440,好人贷申请的渠道有哪些,0.8968700783610971
441,如何关注新网银行公众号,0.8968248531805378
442,好人贷为什么无法登录,0.8966539233605757
443,借款后如何判定下次还款日期,0.8963598708721928
444,如何更换借款收款银行卡,0.896328438599206
445,什么情况算违约,0.8960437657699717
446,注销账户的处理时间,0.8960243654618099
447,银行渠道维护时间一般是多久,0.8959708700345548
448,实名认证审核时间,0.895551392261764
449,身份证上传失败怎么办,0.8954914302170517
450,好人贷账户如何更换手机号码,0.895355063518666
451,如何查询征信报告,0.8953185859198414
452,如何绑定银行卡,0.8951663836587629
453,如何选择按期还款/任性还款,0.8946118434513628
454,存管查询的余额如何提现,0.8944156534642532
455,关于消费凭证,0.8941756981263618
456,车贷如何更换还款银行卡,0.8940891223205232
457,如何通过线下方式转入新网二类户,0.8940528396874307
458,新网银行二类户如何转入/转出,0.8940264222955434
459,新网银行账户是什么,0.8938643710714845
460,新网诺诺发票贷如何申请,0.8937934750150429
461,如何查看开户结果,0.8933810051213787
462,银联在线支付如何开通,0.8928857540391013
463,怎样才能成功申请到额度,0.8928271296612061
464,如何解绑银行卡,0.8926431646641351
465,好人贷申请身份证可否添加水印,0.8925151561632633
466,存款产品是否保本保息,0.8919101093684757
467,新网银行地址在哪里,0.891828996980209
468,如何换绑银行卡,0.8910247777055977
469,如何更换好人贷默认还款账户,0.8909093135967945
470,随心存如何查看收益情况,0.8906968463188353
471,好人贷审核电话是多少,0.890581261534779
472,能否让客服回电,0.890521865939141
473,如何操作随心存大额存款,0.8904940420937106
474,如何激活新网二类户,0.8903598775046448
475,好人贷为何无法还款,0.8900865071921866
476,可以重新注册吗,0.8894788093821868
477,什么是我的额度和可借额度,0.8894336385531312
478,结清证明开据时间是多久,0.8893325106743607
479,存款产品支取通用路径,0.8891741442611217
480,新网银行人工客服服务时间,0.8890323843806068
481,注册规则是什么,0.888732673128479
482,我们是四川新网银行吗,0.8884568801582374
483,为什么没有扣款,0.888293189313757
484,新网银行的活期利率是多少,0.8882783122116329
485,什么是风控审核中,0.8881699531926452
486,好人贷交易密码如何设置,0.8878497318317706
487,如何查询当期车贷还款金额,0.8878486494044219
488,如何降低/关闭额度,0.8878000957500309
489,好人贷为什么额度低,0.8874187886158055
490,车贷收取哪些费用,0.8873274913420391
491,车贷如何办理解押手续,0.8867220396137918
492,如何购买新网银行存款产品,0.88671246585944
493,创客贷额度是多少,0.8857866846312306
494,月得利提前支取如何计息,0.88566514900401
495,周得利计息规则,0.8849573758848976
496,周得利提前支取如何计息,0.8849295563062112
497,车贷合同如何查看,0.8847212319333154
498,如何更换微信号,0.8846535073225351
499,申请好人贷需要哪些资料,0.8845732905766965
500,好人贷还款后额度何时恢复,0.8834890943213807
501,存款产品如何修改手机号,0.8829827854913055
502,新网银行行号是多少,0.8823116620868499
503,好人贷借款后能否修改贷款信息,0.8823066064280531
504,随心存存款期限有哪些,0.8810615304594323
505,好人贷定位如何开启,0.8809680191173778
506,如何冻结新网银行账户,0.8803656343083365
507,好人贷额度他人能否使用,0.8802239727163496
508,好人贷支持随借随还吗,0.8799688097876636
509,随心存是什么,0.8796044568777326
510,自动扣款时间段是多久,0.8794964085773054
511,好人贷还款方式有哪些,0.8791082403637813
512,客户表示稍等,0.8790471793883219
513,额度冻结怎么办,0.8776892446000161
514,如何查询存管账户流水,0.8776403182141247
515,随心存利率是多少,0.8772408415906099
516,如何录制活体检测,0.8771667822077162
517,如何邀请好友申请好人贷,0.8769538997905142
518,如何办理好人卡？,0.8768124513966151
519,什么是综合评估,0.8767673622007424
520,好人贷利率为什么高,0.8767106201729894
521,什么是活体检测,0.8764968886088601
522,车贷还款记录如何查询,0.876381096549707
523,好人贷-云闪付是什么,0.8761156828486892
524,好人贷是否支持提前还款,0.8760699249500425
525,合作平台如何取消贷款,0.8754976535127633
526,额度占用问题,0.8754055564483977
527,好人贷支持周末借款吗？,0.8753815107665834
528,客户表示需要考虑,0.8752891059229576
529,客户表示知道了,0.8750811643045889
530,五年定期存款的利率是多少,0.8748604686988243
531,车贷利息是多少,0.874763561896217
532,什么是分批次扣款,0.8744495435354066
533,自动扣款如何操作,0.8743421963058332
534,五年定期存款是什么,0.8739893664209218
535,如何增加银行卡,0.8737659143458217
536,如何获得优惠券,0.8737582089675715
537,好人贷借款如何上报征信,0.8736378101498462
538,如何签署借款合同,0.8730438355008939
539,好人贷-云闪付如何提前还款,0.8730218479190456
540,如何查询好人贷借据收款银行卡,0.8729145807884293
541,如何查询新网账户,0.8717168481212485
542,新网银行好事贷如何申请,0.8716968260190702
543,可以咨询吗,0.8711115862567046
544,有多少人获得好人贷额度,0.8707225678439481
545,电脑端可以登录好人贷吗,0.8707104045026056
546,如何注销新网注册用户,0.8703291060052646
547,如何查看好人贷还款计划,0.870046910186132
548,如何注销公众号,0.869762125721779
549,新网银行如何联系客户,0.8697366062821021
550,随心存存入限额,0.869089649258017
551,人脸拍摄规范,0.8687251038588553
552,开通什么业务,0.8682446839008431
553,什么情况算逾期,0.8676683861868333
554,经侦是指什么,0.8673810823411873
555,按期还款是什么,0.8670308680214707
556,定期存款的利率是多少,0.8667730940523728
557,好人贷电话回访时间,0.8667046732416996
558,查询各类工单办理进度,0.8662802562713637
559,如何登录微信公众号,0.8662086534394013
560,车贷平台如何查询,0.8657955179333771
561,还款记录如何查看,0.8657403722882363
562,好人贷申请能否撤销,0.865597355860528
563,如何查询车贷还款日,0.8654179184643219
564,可否对公还款,0.8646962287706726
565,征信是什么,0.8645569192768519
566,好人贷审核时间是多久,0.8638074166580261
567,什么是当期账单,0.8636407169905251
568,公众号如何注册,0.86322505561539
569,如何注销新网二类户,0.8624207971757049
570,工新借是什么,0.8619527937257367
571,可否延期还款,0.8619024601350662
572,能否人工开据贷款证明,0.8617927151733861
573,好人贷当期能否最低还款,0.8610635583304713
574,各还款方式如何进行还款,0.8607379552982751
575,好人贷个人资料如何修改,0.8604723316327887
576,好人贷账户如何挂失,0.8603656407685504
577,新网银行业务办理时间,0.8594657586163306
578,好人贷还款记录如何查询,0.8594641146352904
579,好人贷自动扣款规则,0.8592656109763565
580,批扣时间段是多久,0.8589417200095862
581,新网银行简介,0.8586799668903848
582,好人贷如何实名认证,0.8586584404373442
583,季得利是什么,0.858198431251608
584,好人贷提前还款最低还多少,0.8578849874400777
585,好人贷是否有临时额度,0.8577199006728844
586,新网银行APP下载,0.857547224106327
587,车贷如何提前还款,0.8573053010494118
588,如何在新网银行开户,0.8571118684532484
589,新网有哪些产品,0.8570877017068964
590,好人贷部分提前还款规则,0.8563121219871864
591,好人贷借款记录如何查询,0.8558427355662156
592,罚息介绍,0.8553819255745934
593,客户提出建议,0.8541170650754895
594,抵押类贷款如何办理,0.853998112042421
595,好人贷支持随时借款吗,0.8531502963917984
596,好人贷是邀请制吗,0.8530814421505188
597,如何查询还款日,0.85204398660589
598,存管是什么,0.8519619238560947
599,如何开立存管账户,0.849535096176905
600,如何查看贷款合同,0.8495204955709701
601,存管账户如何查询,0.8493526691971324
602,什么是注册号码？,0.8491306542144449
603,怎样用其他手机登录好人贷,0.8485097793846627
604,车贷逾期如何还款,0.8475785329495996
605,好人贷扣款账户如何查看,0.8474571614434458
606,好人贷能否人工操作提额,0.8473055724492844
607,好人贷支持扣款的银行有哪些,0.8466019313620239
608,存管账户如何注销,0.8458703823479855
609,其他贷款怎么办理,0.8453530857056258
610,好人贷如何提前还款,0.8449016272272086
611,合作平台如何还款,0.8441292740826518
612,好人贷额度有效期是多久,0.8436352420547741
613,什么是一、二、三类户,0.8429336909883767
614,密码如何修改,0.8421882213152017
615,好人贷借款多久到账,0.8421462045910645
616,好人贷如何主动还款,0.8414672085262981
617,任性还款是什么,0.8413871046540465
618,存款利率是多少,0.8413013962013274
619,车贷如何还款？,0.8403590745137066
620,好事贷收取哪些费用,0.838760703285385
621,好人贷如何降低利率,0.8386100574086549
622,什么是还款日,0.8377365941338376
623,如何办理对公业务,0.8375766408523151
624,好人贷放款至什么账户,0.8372264143535153
625,好人贷账户如何查询,0.8367238199679013
626,如何进入个人中心,0.8364903500614996
627,什么平台的贷款,0.8357040839001385
628,登录密码为何无法重置,0.8354459119662673
629,工新借如何申请,0.8340432859103452
630,好人贷上征信吗,0.8339729597706744
631,好人贷的办理时间,0.8328753361780904
632,如何开据存款证明,0.8323716646207656
633,定期存款到期如何支取,0.8317488941197668
634,车贷如何申请,0.8316482163184103
635,好人贷如何试算利息,0.831217759691741
636,好人贷如何自助提额,0.8308291390889232
637,好人贷月利率是多少,0.8306712261040906
638,好人贷利率是多少,0.8292913797927072
639,如何进入好人贷页面,0.8292717249346162
640,好人贷年化利率是多少,0.8290055059490311
641,好人贷如何提高额度,0.827788406229154
642,随心存如何计息,0.8274391178219638
643,季得利如何支取,0.8269688677646283
644,好人贷如何审核,0.8261861996208159
645,好人贷还款后多久到账,0.8260756526436119
646,好人贷是什么,0.8257957845663378
647,优惠券如何使用,0.8255845351494525
648,好人贷有额度后如何进行贷款,0.8216547940154619
649,贷款证明如何开据,0.8213752631533825
650,好人贷收取哪些费用,0.8206472102412943
651,好人贷账户如何注销,0.8205286943422194
652,如何删除身份证信息,0.8204606134178087
653,好人贷贷款利息如何计算,0.8190026815955745
654,好人贷贷款期限是多久,0.8174903149707177
655,好人贷消费用途,0.8174455370989632
656,季得利如何计息,0.8151456579491251
657,随心存如何登录,0.8145599583733527
658,好人贷如何申请,0.8115881344699064
659,好人贷借款规则,0.8087894553307363
660,好人贷额度是多少,0.8070096777362724
661,好人贷提额周期是多久,0.8022060030071398
662,好事贷如何还款,0.8015018081973728
663,身份证信息变更后如何更新,0.7997859410544059
664,什么是登录密码,0.7979889949024987
665,好人贷通过率多少,0.7960098001378435
666,好人贷如何还款,0.7756865972042962
