424,黑户/白户是否可以申请好人贷,0.9348695918181914
425,新网银行如何联系客户,0.9346036119703923
426,申请好人贷后为何页面显示仍可提交申请,0.9345048486840625
427,"好人贷有回访电话吗""",0.9344954614916847
428,好人贷-云闪付如何提前还款,0.9342253476108593
429,节假日可以借/还款吗,0.933988669748771
430,定期存款是否有存单,0.9339572197622478
431,好人贷账户是否为新网银行二类户？,0.9339178758200556
432,如何签署借款合同,0.9334627046224186
433,定期存款的利率是多少,0.9334480146351466
434,好人贷还款方式有哪些,0.933001450588683
435,客户表示没有问题了,0.9329617757375731
436,如何激活新网二类户,0.9327659131929148
437,存管是什么,0.9325194810705967
438,好人贷借款记录如何查询,0.9325126514846047
439,好人贷支持周末借款吗？,0.9325042410809162
440,好人贷还款记录如何查询,0.9324485090695263
441,五年定期存款的利率是多少,0.9323267713451896
442,按期还款是什么,0.9321841175274063
443,新网银行是否上市,0.9318691961018193
444,好人贷部分提前还款规则,0.9317800834018141
445,好人贷利率为什么高,0.9317680735639187
446,任性还款是什么,0.9316261198135783
447,新网银行有企业贷款吗？,0.9315927084921738
448,征信上报周期及更新时间,0.9314347453994964
449,新网银行三类户是什么,0.9311174986235186
450,修改手机号码的处理时间是多久,0.9306587113514102
451,人脸拍摄规范,0.9305685263501531
452,一个身份证可以申请好人贷两次吗？,0.9304737493184461
453,新网银行二类户限额是多少,0.930455251009762
454,如何获得优惠券,0.93033577903322
455,好人贷申请必须使用身份证原件吗,0.9302050616132236
456,如何登录微信公众号,0.9301997937126079
457,好人贷申请是否支持人工受理,0.9300171163907898
458,新网银行账户可以设置为好人贷借/还款账户吗,0.9297238124355456
459,好人贷支持随时借款吗,0.9296876500459258
460,销户后是否上征信,0.9296874309574406
461,好人贷扣款账户如何查看,0.9295932979087831
462,能否让客服回电,0.9294430504560468
463,随心存产品停售原因,0.9291900549940588
464,罚息能否减免,0.929007911294839
465,什么是活体检测,0.9288435145176106
466,申请好人贷使用的邮箱是公司邮箱还是个人邮箱,0.9286141083353057
467,为何销户后还能看到好人贷信息,0.9283568007039846
468,如何关注新网银行公众号,0.9281144997792448
469,迁户是什么意思,0.9281124273912529
470,好事贷收取哪些费用,0.9276217201373648
471,车贷合同为何无法查看,0.9274879904185529
472,查询各类工单办理进度,0.9271521011174613
473,好人贷支持在国外发起借款吗,0.9270547268530287
474,好人贷支持随借随还吗,0.9269299204584799
475,好人贷有回访电话吗,0.926921925325786
476,好人贷账户如何更换手机号码,0.9268505241225352
477,如何查询账户是否冻结,0.9267795700027633
478,身份证上传失败怎么办,0.9266775924186844
479,退汇是什么意思,0.9265926483729741
480,如何查询征信报告,0.9265855019703243
481,密码如何修改,0.926558829595455
482,优惠券如何使用,0.9259785386252424
483,如何购买新网银行存款产品,0.9256115756089315
484,转账到新网银行账户是否还款成功,0.925582834201074
485,如何查询存管账户流水,0.9254988147515978
486,其他贷款怎么办理,0.9251388411615573
487,好人贷收取哪些费用,0.9251109843898874
488,申请好人贷是否都有额度,0.9249933304883919
489,新网银行有信用卡吗,0.9248800981284692
490,好人贷上征信吗,0.9247234338036883
491,新网诺诺发票贷如何申请,0.9246816612075056
492,如何选择按期还款/任性还款,0.9246203668685564
493,公众号如何注册,0.9243227289834152
494,车贷扣款支持的银行卡有哪些,0.9242785819574402
495,客户提到投诉,0.9242609468761785
496,存管账户充值限额,0.9241890950145792
497,如何查询还款日,0.9240997937805148
498,随心存如何计息,0.9240925751919598
499,如何查询是否已申请好人贷,0.9240471558077911
500,存管账户如何查询,0.9238352887127317
501,什么是综合评估,0.9235773004705311
502,季得利如何计息,0.9233628194971126
503,好人贷-云闪付如何更换收/还款银行卡,0.9232927477600245
504,如何办理好人卡？,0.9231608279752607
505,好人贷是否支持提前还款,0.9231159854162282
506,如何注销公众号,0.9227868044431538
507,上传身份证时需填写的内容是什么,0.9227138360767891
508,车贷合同里的金额是否包含利息,0.9224357892117768
509,客户要求发送相关模板,0.9220472129851
510,新网有哪些产品,0.9217554447642293
511,客户表示需要考虑,0.9213147284742441
512,五年定期存款是什么,0.9212319517057564
513,额度冻结是什么意思？,0.9211760401213912
514,输入身份证号码时，为何无法输入字母,0.9210308544730039
515,好人贷能否人工操作提额,0.9208888707601558
516,如何办理对公业务,0.92064174414139
517,新网银行好事贷如何申请,0.9205234177182385
518,随心存存入限额,0.9204429064100238
519,新网账户之间能否互相转账,0.9200174043791319
520,好人贷申请能否撤销,0.9197466276136809
521,结清证明开据时间是多久,0.9197402502435232
522,季得利是什么,0.9196482452954167
523,自动扣款时间段是多久,0.9196063645357709
524,如何注销新网注册用户,0.9192899599231086
525,好人贷能否绑定他人银行卡,0.9191642647264298
526,各还款方式如何进行还款,0.9191249588962618
527,好人贷如何降低利率,0.9190098516942198
528,周得利计息规则,0.9188970709212771
529,定期存款到期如何支取,0.918715918810776
530,好人贷当期能否最低还款,0.9186905723623092
531,客户表示知道了,0.9183969309216093
532,如何录制活体检测,0.9179036558551433
533,什么是当期账单,0.9175267642195276
534,车贷还款只扣除部分是什么原因,0.917311564072579
535,如何查询当期车贷还款金额,0.9170142326603826
536,身份证信息变更后如何更新,0.9169570805503152
537,新网银行行号是多少,0.9169366181663572
538,好人贷通过率多少,0.9167582824396031
539,好人贷为何无法还款,0.9167555385409522
540,好人贷如何实名认证,0.9164873529910326
541,合作平台如何还款,0.9164379921031157
542,是否需要使用本人手机操作好人贷,0.916406294591574
543,存款利率是多少,0.9159733007724281
544,新网银行有招聘吗,0.9157677912930684
545,客户表示不满,0.9156315340908582
546,好人贷有额度后如何进行贷款,0.9155279495206534
547,好人贷额度是否循环使用,0.9153057443413851
548,我们是四川新网银行吗,0.9152413427380074
549,存款产品支取通用路径,0.9149549372777628
550,经侦是指什么,0.9146214078225873
551,如何降低/关闭额度,0.914555545416059
552,新网银行有几个网点,0.9145399235583864
553,好人贷为什么额度低,0.9145117575046234
554,新网银行业务办理时间,0.9132837451632023
555,车贷还款记录如何查询,0.9128108219132045
556,如何开立存管账户,0.9125984867665319
557,好人贷账户如何挂失,0.9119823101576887
558,存款产品是否保本保息,0.9113407816138274
559,创客贷额度是多少,0.911310253538862
560,如何进入好人贷页面,0.9109689271314497
561,如何更换好人贷默认还款账户,0.9095839687616448
562,好人贷如何试算利息,0.9090600669250236
563,身份证过期可以申请好人贷吗,0.9089938922302235
564,他行渠道汇入新网账户的到账时间是多久,0.9088714082798831
565,车辆信息如何查询,0.9088112203799101
566,好人贷如何提高额度,0.9083036206699583
567,好人贷申请身份证可否添加水印,0.9081793740588587
568,58车金融客服电话是多少,0.9080829193093702
569,如何查询好人贷借据收款银行卡,0.9074973686321708
570,为何页面出现多个新网银行账户,0.907456249004326
571,好人贷是邀请制吗,0.9071711689936145
572,房产保证金是什么,0.9069632503929129
573,获取额度后多久可发起借款,0.9061432285930473
574,银行渠道维护时间一般是多久,0.9058716446093491
575,什么是一、二、三类户,0.9055976192363837
576,好人贷额度是否会发生变化,0.9053726846802791
577,罚息介绍,0.9044979460118194
578,怎样用其他手机登录好人贷,0.9036082522928349
579,额度占用问题,0.9035930771147602
580,车贷合同如何查看,0.903390882927279
581,车贷能否绑定他人银行卡,0.9026846089635923
582,好人贷电话回访时间,0.9024524948809644
583,如何更换借款收款银行卡,0.9024427980313235
584,如何查询车贷还款日,0.9024122766867796
585,如何绑定银行卡,0.9021556676682492
586,如何邀请好友申请好人贷,0.902005723075841
587,车贷如何修改注册手机号码,0.9011503392281114
588,车贷可以修改还款日吗,0.9010231446113638
589,新网银行人工客服服务时间,0.9005767020101562
590,如何进入个人中心,0.9001231030112774
591,客户称赞服务好,0.9001226585448331
592,消费凭证有效期是多久,0.8999358577239868
593,有多少人获得好人贷额度,0.8998388292604361
594,如何注销新网二类户,0.8997317770742774
595,好人贷额度他人能否使用,0.8990818485197761
596,工新借是什么,0.8986064143750702
597,什么是还款日,0.8980857764075714
598,什么是登录密码,0.8978926925237483
599,新网银行账户是什么,0.8975768625686833
600,客户表示稍等,0.8957116771039767
601,好人贷是否有临时额度,0.8957097094685161
602,线上转入新网银行账户到账时间是多久,0.8953537519017528
603,为何无法销户,0.8949324108237998
604,随心存如何登录,0.8940715946364286
605,存管账户如何注销,0.8934362573532927
606,好人贷年化利率是多少,0.893050360509432
607,为何无法申请好人贷,0.8927895895174764
608,好人贷借款合同有效期是多久,0.8920604516905886
609,额度冻结怎么办,0.8917191172650857
610,客户表示有合作意向,0.8912878579879497
611,手持身份证拍照的注意事项,0.8904257770687779
612,美利车联系电话,0.8903636298341102
613,好人贷如何审核,0.8892064997816918
614,如何换绑银行卡,0.8889871792463575
615,好人贷月利率是多少,0.8889045692203612
616,车贷如何办理解押手续,0.8889028137933497
617,好人贷放款至什么账户,0.8883864289088288
618,季得利如何支取,0.8864709702002169
619,关于消费凭证,0.8861925201887572
620,好人贷账户如何查询,0.8855519036383419
621,车贷申请多久可以放款,0.8852709207104398
622,车贷收取哪些费用,0.885035568718546
623,车贷平台如何查询,0.8843082171391698
624,车贷支持手动还款吗,0.8839735841274337
625,好人贷还款后多久到账,0.8838955818030884
626,如何在新网银行开户,0.8838637629085865
627,如何解绑银行卡,0.883438866786366
628,好人贷如何自助提额,0.8828814182017103
629,个人可以在新网开立几个账户,0.8827328026036412
630,如何查询新网账户,0.8816374220378385
631,新网银行APP下载,0.8798585816353587
632,好人贷利率是多少,0.8793689568660561
633,工新借如何申请,0.8787588222780999
634,批扣时间段是多久,0.8781206027540406
635,车贷如何还款？,0.8778974250328133
636,车贷如何解绑银行卡,0.8771038697016653
637,如何冻结新网银行账户,0.8761633203249694
638,车贷逾期如何还款,0.8752393219320437
639,车贷利息是多少,0.8750587566042144
640,可否延期还款,0.8743226144988469
641,好人贷如何提前还款,0.8741781456141985
642,可否对公还款,0.8723732989638833
643,好人贷是什么,0.8703992938430894
644,好人贷审核时间是多久,0.8697053234757735
645,新网银行简介,0.8693952168768967
646,好人贷的办理时间,0.8646157119213471
647,好人贷如何主动还款,0.8638564471023017
648,客户提出建议,0.8637714448108668
649,好人贷借款规则,0.861411061682289
650,车贷如何更换还款银行卡,0.8610285587218749
651,注销账户的处理时间,0.8604987244624493
652,好人贷额度是多少,0.8596257179829062
653,好人贷消费用途,0.8593983515854249
654,车贷如何提前还款,0.8565374896015724
655,什么平台的贷款,0.8552733130874817
656,好人贷提额周期是多久,0.8495261959567952
657,好人贷贷款期限是多久,0.8494511409970527
658,好人贷额度有效期是多久,0.8474895901114881
659,如何删除身份证信息,0.847302485540636
660,如何增加银行卡,0.8464874924684175
661,好人贷如何申请,0.8453492229839109
662,好事贷如何还款,0.8441589759480166
663,车贷如何申请,0.8366730504097857
664,好人贷账户如何注销,0.8042449464127823
665,好人贷借款多久到账,0.8038222975942416
666,好人贷如何还款,0.7957290049111496
