0,按期还款和任性还款的区别是什么,1.0
1,按期还款和任性还款的区别是什么,1.0
2,选择任性还款/按期还款利息如何计算,0.9850308066826958
3,为何按期还款只能选择部分贷款期限,0.9833579215354806
4,借款后如何判定下次还款日期,0.9826117250028031
5,逾期未还款如何处理,0.9787557660391011
6,如何确保还款日当天会扣款成功,0.9778855325619856
7,选择任何还款方式都可以提前还款吗,0.9770251372981738
8,借款合同是否有展示提前还款会收取违约金的情况,0.9766945962796855
9,为什么好人贷第一期还款金额与之后不一致,0.9766557569943952
10,逾期后还款金额是否会增加,0.9765503774870447
11,为何好人贷还款时提示“交易处理中”,0.9757075394876839
12,提前还款手续费是多少,0.9756483013188065
13,五年定期存款支持提前支取吗,0.9754660345328323
14,还款后为何未更新还款状态,0.9754279966573608
15,节假日可以借/还款吗,0.9752757920993231
16,结清证明是否是还款记录证明,0.9748908352727437
17,平台还款信息为何与新网银行不一致,0.9741529320974401
18,五年定期存款的利率是多少,0.9741278787674577
19,随心存存款期限有哪些,0.9740299273623894
20,为何提示还款卡不存在,0.9738916230918575
21,为何征信上的放款日期与实际借款日期不一致,0.9736191156719872
22,定期存款操作的渠道有哪些,0.9734786666346665
23,客户表示还款成功,0.9734175468019785
24,好人贷手动还款时为何提示批次执行中,0.9730747144020737
25,还款日当天支持手动还款吗,0.9729651016017978
26,优信扣款成功后为何显示待还款,0.9726675452802843
27,好人贷如何查看所支持的还款方式,0.97240705720367
28,任性还款是什么,0.9722876124333825
29,周得利提前支取如何计息,0.9722377921183388
30,为何还款后额度恢复减少了,0.9721609115587901
31,定期存款的利率是多少,0.9719530285260353
32,月得利提前支取如何计息,0.9718805979361826
33,为什么取消了提前部分还款,0.9718285669727496
34,提前还款有次数限制吗,0.9716915966739135
35,好人贷部分提前还款规则,0.9711055766353879
36,按期还款是什么,0.9709875053473006
37,结清贷款后什么时候可以开据结清证明,0.9707429564934436
38,还款后页面显示等待中,0.9705131460705841
39,提前结清贷款后还会扣款吗,0.9704920053268251
40,为什么提前还款显示联合贷批次执行中？,0.9704329628348257
41,为何提示还款存在差错,0.9704066124844016
42,好人贷提前还款最低还多少,0.9701966855690417
43,未正常还款我行会进行催收吗,0.9701894140070302
44,下一次开放时间是什么意思,0.9701758926529529
45,存款产品的资金可以用于好人贷还款吗,0.9701626560969454
46,可以让别人代还款吗？,0.970128871640293
47,使用优惠券后提前还款利息如何计算,0.9700546255349073
48,名下所有卡被冻结后如何还款,0.9700302693661657
49,如何选择按期还款/任性还款,0.9699895116302175
50,节假日可以操作各类存款吗,0.96963642317655
51,季得利提前支取影响已发放利息吗,0.9693405731472172
52,滴水贷客服电话是多少,0.9693273024009728
53,半年得利提前支取影响已发放利息吗,0.9689804301740355
54,随心存利率为何会发生变化,0.9689486236176319
55,提前支取时为何显示存入,0.9687085627782384
56,好人贷还款后额度何时恢复,0.9686996324922728
57,提前还款会影响个人征信吗,0.9686280148787223
58,结清证明的发送方式有哪些,0.9686123121816449
59,好人贷是否支持提前还当期账单,0.968549912424963
60,为什么银行还款存在限额？,0.9684837064494402
61,定期存款是否有存单,0.9683561306374345
62,随心存利率是多少,0.9681605859095108
63,好人贷不借款会产生利息或费用吗,0.9679324597385736
64,五年定期存款是什么,0.9678721886623932
65,无法提供消费凭证可以取消贷款吗,0.9675353670227452
66,如何查看好人贷还款计划,0.967189691420114
67,好人贷借款超时未到账如何处理,0.9667013078218158
68,我行放款的其他平台借款会上报征信吗,0.9667001941073194
69,季得利的操作渠道有哪些,0.9665420000610125
70,还款日当天是否自动扣款,0.9665281057736882
71,为何提示支付平台该客户无默认扣款卡，交易没有发给统一支付,0.9664313451355313
72,挖财还款是否为新网银行代扣,0.9663617181070892
73,为何提示不具备开具资格,0.9658693230953276
74,为何提示支付平台签约关系不存在,0.9658638140441854
75,结清证明会展示哪些信息,0.9656727879357747
76,购买存款页面为何提示“额度不足，无法购买”,0.9656415783370988
77,电话客服是否可以受理结清证明,0.9654991551419767
78,为何提示支付平台不允许持卡人进行的交易,0.9654952267954049
79,随心存如何查看收益情况,0.9653332296273067
80,随心存支持提前支取吗,0.9652557275690463
81,结清贷款后征信上是否会显示结清,0.9649373360988373
82,存款页面是否会显示每日收益,0.9649175920137845
83,新网银行存款产品为何暂停交易,0.9648944014570748
84,公众号是否有还款提示,0.9646941060435712
85,京东存款是否支持提前支取/提前部分支取？,0.9646570958403988
86,还款日可以修改吗,0.9645522949798252
87,新网二类户转入/转出收取手续费吗,0.9645161034388708
88,为何同时收到了还款成功和失败的短信,0.9643735246771208
89,还款记录如何查看,0.964351316316131
90,存款产品是否存满五年才能支取,0.9642744088851114
91,诺诺发票贷的利率是多少,0.9642411595502441
92,随心存提前支取到账时间,0.96404577171923
93,新网银行扣款通道是什么,0.9639488594799772
94,贷款结清之后能否删除贷款记录,0.9639341890241301
95,为何征信上有新网上报的贷款记录,0.96373897481142
96,为何提示支付平台受发卡行资金用途限制拒绝交易,0.9636669084226275
97,新网二类户转入/转出有时间限制吗,0.963526719460141
98,为何提示支付平台当日交易次数超限,0.9634641217956714
99,申请诺诺发票贷需要什么条件,0.9634278360370808
100,好人贷只能通过绑定的银行卡还款吗,0.9633368853312858
101,银行卡还款限额是多少,0.9631371014970967
102,如何查看随心存购买情况,0.9627422850461467
103,随心存操作渠道有哪些,0.9627409553754042
104,新网二类户可以升级为一类户吗？,0.9627286429690588
105,扣款结果会有短信提示吗,0.9626874789341227
106,好人贷还款方式有哪些,0.9624373220133325
107,当期账单支持再分期吗,0.9623870729335444
108,如何查看委托支付协议,0.9623714573445924
109,为何申请好人贷页面显示暂无资格,0.9623394278512055
110,线上开据证明为何和征信金额不符,0.9623328931889382
111,为何结清证明显示日期与平台不符,0.9622714277688812
112,好人贷被拒后为何没有下次开放时间,0.9622450027056391
113,是否会发生重复扣款情况,0.962091474492444
114,好人贷支持扣款的银行有哪些,0.9619980240522411
115,新网二类户为何无法转入/转出,0.9619857599345975
116,什么是单笔借据和多笔借据,0.9617563832505668
117,还款银行卡是否需要开通银联在线支付业务,0.9617189433675186
118,公众号页面的“我的排号”是什么意思,0.9617174229306066
119,好人贷利率为什么调高了,0.9616485350497036
120,银行卡开通银联在线支付后是否可正常还款,0.9615781264038807
121,如何查询合作平台贷款是否结清,0.9615420097575135
122,借款到账后页面未更新借款状态,0.9614748078976839
123,好人贷交易密码如何设置,0.9613979022994554
124,拨打我行人工客服电话是否收费,0.9613139515112956
125,京东存款为什么显示当日额度为什么已售罄？,0.961254600040179
126,随心存T+1是什么,0.9612103188406647
127,好人贷借款金额与到账金额是否一致,0.9609341134375783
128,优信客服电话是多少,0.9609128832078863
129,随心存到期后何时到账,0.9609038413495735
130,联系新网银行客服有哪几种方式,0.9608314864520183
131,好人贷借款时还会审核吗,0.9607847701315451
132,页面为何提示“开户失败”、“账户存在异常操作/账户异常”,0.960714710992625
133,好人贷是否支持归还逾期部分账单,0.9606817277511094
134,转账时为何提示未面核,0.9605355872076167
135,还款金额超银行卡限额怎么办,0.9604516394501191
136,京东存款的计息规则及计息公式,0.9604443324609208
137,借款时选错收款账户怎么办？,0.9603377089195732
138,结清证明的印章是否可以用公章,0.9603265555319703
139,能否人工开据贷款证明,0.9601840419964741
140,好人贷定位如何开启,0.960063411665882
141,是否可以取消自动扣款,0.9600464260946138
142,如何查看好人贷相关协议/合同？,0.9600404022103386
143,开据证明为何显示没有符合要求的订单,0.9600152704292003
144,好人贷额度必须一次性借完吗,0.9600092918203204
145,为何提示支付平台持卡人信息有误,0.9598973087512017
146,咨询可以发送图片吗？,0.9597621038404226
147,申请创客贷需要什么条件,0.959622907586846
148,提前支取有限制吗,0.9596154986039817
149,登录时的图文验证码是否区分大小写,0.9595219225699599
150,身份证更换期间会影响好人贷贷款吗,0.9595063056341899
151,好人贷审核电话是多少,0.9594767137086351
152,为什么点击拍照没有反应,0.95932303295646
153,各还款方式如何进行还款,0.959317809064113
154,定期存款到期如何支取,0.9593099608113822
155,为何收到新网银行还款短信,0.9593061397281941
156,好人贷额度为什么变低了,0.9593042630150693
157,征信上报周期及更新时间,0.9592849523386382
158,好人贷以什么贷款类型上报人行征信？,0.9590476802515356
159,银行卡是二类户影响扣款吗,0.9590141160046799
160,好人贷为什么提示“账户存在异常操作”,0.9590097940348882
161,借款成功会有短信等提醒吗,0.9589776488196236
162,存管查询为何提示用户不存在或者信息有误,0.9589201598572776
163,自助提额什么时候上线,0.9588938665853164
164,注销注册用户后是否可恢复？,0.9588565781158479
165,好人贷与其他平台类似产品的区别是什么,0.9588017877767897
166,收款卡发卡行拒绝放款失败什么意思？,0.9587976764469084
167,客户催促需要加急办理,0.9587776042488602
168,在线客服是否是人工客服,0.958757216830578
169,线上是否可开据征信版结清证明,0.9587083478075205
170,为何之前绑定的银行卡不支持扣款了,0.9586849528994688
171,好人贷贷款利息如何计算,0.9586731855996371
172,注册手机号更换成功后何时可以正常使用,0.9586231542057592
173,为何存管信息与平台显示不一致,0.9585126402082977
174,好人贷注册手机号与银行卡预留手机号是否需要一致？,0.9581283021979348
175,为何提示缺少必要参数,0.9581209696909303
176,如何查询还款日,0.9580207367273813
177,再次申请好人贷会查询征信吗,0.9579901075576822
178,新网银行人工客服电话是多少,0.9578309441394115
179,新网二类户上的资金是否计息,0.9576879276852872
180,平台方手机号变更导致我行无法直接开据结清证明问题,0.9576759793444594
181,平台方提供的客户审批资料能否提供给客户,0.9576645545019246
182,好人贷授信首页显示利率是否为固定利率,0.9576174205907021
183,进入随心存为何提示手机号码不一致,0.9576148122035772
184,为何提示支付平台交易金额超限,0.9575660435853571
185,申请好人贷工作信息如何填写,0.9574418842661796
186,为何提示支付平台暂不支持的银行或限额,0.9573457661636666
187,好人贷支持周末借款吗？,0.9572859248016004
188,抵押类贷款如何办理,0.9572445249839119
189,好人贷借款后能否修改贷款信息,0.9571978108787182
190,销户后可以再开户吗,0.9570276951298765
191,为何无法提交好人贷申请资料,0.956948958428812
192,令牌无效是什么,0.9569332129144684
193,新网银行二类户如何转入/转出,0.9569031432720535
194,好人贷申请是否可以使用临时身份证,0.9568717684505751
195,新网银行账户可以设置为好人贷借/还款账户吗,0.9568614864585945
196,客服能否查看聊天记录,0.9568332014298012
197,客服能否看到客户申请好人贷的信息,0.9567794338737476
198,可否按照征信订单号开据证明,0.9566929753972107
199,系统升级会影响扣款吗,0.956633671319614
200,为何提示支付平台发卡行拒绝,0.9566303920976351
201,为何征信上有新网银行的贷款审批记录,0.9565277578337135
202,申请好人贷后，可否更改授信结果,0.9565106970360848
203,好人贷当期能否最低还款,0.9564765125685374
204,新网银行存款是否受保障,0.9564581802708815
205,周得利计息规则,0.9564369196499931
206,开据证明时为何提示账户存在异常,0.9563971714284959
207,我行对客邮箱是多少,0.9563511984983506
208,线上开据证明有次数限制吗,0.9563445808534827
209,未接到好人贷回访电话会被拒吗,0.9563161802795394
210,逾期造成的影响是什么,0.9562152371500281
211,系统繁忙是什么原因,0.9562139658494603
212,在线咨询是否支持客户发送语音,0.956176911516078
213,微信号更换成功后何时可以正常使用,0.9561566265193477
214,客户表示没有问题了,0.956147545917146
215,更换银行卡会影响自动扣款吗,0.9560885900752192
216,随心存停售后有影响吗,0.956073164527705
217,存管查询的余额如何提现,0.9560643173987761
218,为什么提示用户不存在,0.9560111150287165
219,如何解约快捷支付？,0.9558946058520724
220,结清证明印章无法查看,0.955873676492998
221,为何申请好人贷无结果,0.9558305627763161
222,为何提示交易密码验证失败,0.955636747153876
223,转账到新网银行如何操作,0.9556349564192161
224,新网银行开户支持的证件有哪些,0.9556343500349233
225,好人贷是否支持提前还款,0.9555730031515123
226,好人贷申请的渠道有哪些,0.9555528282215303
227,贷款证明如何开据,0.9554438345488738
228,开具结清证明时为何无法登录,0.9554433439005311
229,为何存管查询提示没有密码,0.9553823126576471
230,征信是什么,0.9553542065136162
231,什么是分批次扣款,0.9552580854794753
232,新网银行的活期利率是多少,0.9552528987011749
233,好人贷审核时是否给填写的联系人去电,0.9552177982622954
234,银行渠道维护是指什么,0.9551768150505731
235,黑户/白户是否可以申请好人贷,0.9551413731315556
236,好人贷还款记录如何查询,0.9550266911006047
237,如何查询申请相关的协议书,0.9549671763982749
238,存款利率是多少,0.954868790043358
239,征信报告是什么样的,0.9547740795598703
240,什么是我的额度和可借额度,0.9546943113406943
241,好人贷借款记录如何查询,0.9546056881364281
242,好事贷收取哪些费用,0.9545913952255826
243,查询结清证明申请是否已提交,0.9545857852447511
244,开据证明时为何需要实名认证,0.9544849665568679
245,贷款证明开据失败怎么办,0.9544784638661041
246,申请好人贷有区域或者号段等限制吗,0.9544677338885361
247,申请好人贷需要公积金、社保吗？,0.9543043199327349
248,为什么收到提额短信但额度未提升,0.9542994922380045
249,手机号归属地与定位地不一致是否有影响,0.9542797230092456
250,合同为何无法打开,0.9542772934974025
251,贷款证明的电子章是否具有法律效应,0.9542426396745826
252,如何开据存款证明,0.9541674000524634
253,客服是否是随机分配,0.9540937742803184
254,为何申请好人贷后显示未获取额度,0.9540934508935205
255,申请好人贷需要什么条件,0.9540225639482196
256,关闭其他平台额度后，能否恢复好人贷额度,0.9540174456960326
257,好人贷申请是否查询芝麻信用,0.9539943117105154
258,通过本人微信找回密码是指什么,0.9539813526116867
259,登录密码为何无法重置,0.9539277588340516
260,申请好人贷需要下载APP吗？,0.9539116873766481
261,随心存是什么,0.9537652376759697
262,为何图文验证码输入正确却提示错误,0.9536382485125819
263,征信上显示的贷款金额是否包含利息,0.9536312922588367
264,审核电话可更改接听电话吗,0.9536003576068204
265,银联在线支付是什么,0.9535866700412775
266,随心存可以在我行公众号查询/操作吗,0.95358522185325
267,如何查询好人贷申请的授信结果,0.9535166385834146
268,什么是无卡支付及免密支付,0.9534818582334157
269,可以咨询吗,0.9534740934500742
270,在哪个平台操作提现,0.9534021705289585
271,好人贷借款如何上报征信,0.9533989742639877
272,如何查看贷款合同,0.9531781139331508
273,银行渠道维护无法操作怎么办,0.9531603203954357
274,好人贷提额会查询征信吗,0.9530632062299184
275,开户是什么意思,0.9530544042932027
276,为什么拍照认证时总是不成功或显示系统崩溃,0.9529922992515408
277,存在迁户问题怎么处理,0.9529819896654494
278,好人贷-云闪付如何提前还款,0.9529033490074806
279,实际申请金额与放款金额不一致可否取消车贷,0.9528762745769354
280,新网银行二类户与好人贷是否为同一个手机号码,0.9527906397173798
281,补扣会影响信用吗,0.9527546384349425
282,提额会有通知吗,0.9527415441177625
283,好人贷可以重新申请吗,0.9526983241354933
284,如何修改新网随心存注册号码,0.9526858596878126
285,如何查看优惠券的使用情况,0.952666551335628
286,申请好人贷需要开个人账户吗？,0.9526446400306537
287,为何收到新网银行逾期提醒短信,0.9526110545349922
288,白骑士认证失败是什么意思,0.9525967902976832
289,新网银行以何名义查询征信,0.9525457721764067
290,客户咨询其他平台催收问题,0.9524874476316901
291,好人贷支持随借随还吗,0.9524784991023868
292,为何无法登录存管查询,0.952462083348419
293,如何查询是否开通银联在线支付,0.9524183931659976
294,修改手机号码/微信号是否会影响自动扣款,0.9523349621817752
295,自动扣款如何操作,0.9523249617382509
296,好人贷支持随时借款吗,0.9522369371560694
297,申请好人贷后为何页面显示仍可提交申请,0.9522123194915366
298,随心存如何修改交易密码,0.9520696429537447
299,销户与否会产生什么影响,0.9519977014970438
300,如何取消征信查询及使用授权书,0.9519889204643099
301,他人可以使用本人信息申请好人贷吗,0.9519646003154276
302,新办的手机号可以申请好人贷吗,0.9519209616130506
303,为何征信上有新网银行上报的逾期,0.9518040635886676
304,新网银行人工客服电话打不通,0.9517961608715424
305,视频认证录制失败的原因是什么,0.9517639790107489
306,什么情况算逾期,0.9517532593912454
307,为何提示支付平台账户余额不足,0.9516922351618653
308,银行卡挂失会影响自动扣款吗,0.951688051939758
309,能否开具非恶意逾期证明,0.9516878562193368
310,获取验证码次数超限怎么办,0.9516227932286433
311,好人贷支持在国外发起借款吗,0.9515112097458015
312,视频认证的步骤是什么,0.9514894352156147
313,京东存款如何修改注册手机号码,0.9514687058358613
314,实名认证是否查询征信,0.9513678813975122
315,新网银行存款属于理财产品吗,0.9510549530481195
316,页面为何无法打开,0.9509877541865468
317,为什么没有扣款,0.950794448499661
318,存管密码被锁定怎么办,0.950756065546908
319,好人贷审核不通过对个人有什么影响,0.9505869373783381
320,支持绑定的银行卡类型有哪些,0.9504539697025852
321,可以重新注册吗,0.950425842018342
322,好人贷扣款账户如何查看,0.9503998510814632
323,新网银行有哪些产品可以提额,0.950387464340976
324,交易密码无法设置,0.9503504152835023
325,好人贷申请成功会有短信通知吗,0.9503149137770462
326,随心存产品停售原因,0.9502638010270105
327,好人贷利率为什么高,0.9502185927430669
328,活体检测失败怎么办,0.9501832845445453
329,有额度不使用有什么影响吗,0.9501607111006565
330,为何提示该证件已被使用,0.9500497815940987
331,可以查询注册手机号码吗,0.9499286595842875
332,美团客服热线是多少,0.9498747104724067
333,注册手机号及微信号需要实名制吗,0.9498267036905124
334,一个身份证可以申请好人贷两次吗？,0.9498215463369186
335,为何提示支付平台支取金额超过可用余额,0.9497359108769541
336,随心存如何计息,0.9496538453433067
337,为何提示支付平台渠道不支持的银行,0.9495742522969843
338,转账到新网银行账户是否还款成功,0.9495715874491371
339,企业邮箱验证码可否重新获取,0.9494417682470317
340,新网银行存款类产品有哪些,0.9494260639294542
341,申请好人贷必须填写联系人信息吗,0.9493777526618306
342,好人贷支持微信/支付宝扣款吗,0.9493392682487033
343,好人贷注册手机号无法使用,0.9493340420472701
344,如何查询账户是否冻结,0.9493337134312657
345,如何查看手机号是否实名制,0.949329519096321
346,新网银行账户的交易记录如何查看,0.9492994147513015
347,为何人脸识别提示光线太足,0.949247521601
348,目前支持的银行有哪些,0.9492141181951196
349,季得利如何计息,0.9492011030863843
350,如何签署借款合同,0.9491767754123331
351,如何办理对公业务,0.9491657782925933
352,操作好人贷是否需要开启定位,0.9491638005756168
353,退汇是什么意思,0.9490963800487175
354,存管提现到账时间是多久,0.9490433178647579
355,为何提示支付平台其他错误,0.9489988625249771
356,为何提示支付平台账户状态异常,0.9488996677766638
357,新网银行合作的存管平台有哪些,0.948856303157945
358,新网银行有企业贷款吗？,0.9488178881442016
359,可以查询个人信息资料吗？,0.9488166506810457
360,新网银行二类户限额是多少,0.9487994728086256
361,"好人贷有回访电话吗""",0.9487256957962539
362,申请好人贷后有没有回复,0.9486667462414088
363,申请好人贷没有公司邮箱怎么办,0.9486549213173634
364,银联在线支付如何开通,0.948650976043236
365,好人贷申请是否支持人工受理,0.9486225076266184
366,自动扣款失败怎么办,0.9486034062323886
367,新网银行的官网地址是什么,0.9485898102500228
368,存款产品是否保本保息,0.9485445668131655
369,如何通过线下方式转入新网二类户,0.9485388478057064
370,为什么无法注册,0.9485298325309581
371,为何销户后还能看到好人贷信息,0.94852861119982
372,如何把注册用户与结算用户都注销,0.9485119820956246
373,新网银行合作平台有哪些,0.948499307556088
374,新网银行以什么名义放款,0.9484507444531639
375,迁户是什么意思,0.9484034400739166
376,为何提示支付平台银行卡未开通银联无卡认证支付,0.9482507794060866
377,为何重置密码后仍提示密码错误,0.9482407912188453
378,微信/支付宝等可否与新网银行账户互相绑定,0.9482319847204596
379,身份证信息变更后如何更新,0.9480465091922079
380,居住信息如何填写,0.9480241908111764
381,注册规则是什么,0.947995353317859
382,绑定银行卡产生费用吗,0.9476275230876614
383,什么是银行卡预留手机号？,0.9476083787257538
384,可否取消银行卡限额,0.9475509034525988
385,新网银行有哪些活动,0.9475496006832997
386,季得利是什么,0.9474918002135251
387,新网账户绑定微信/支付宝后支持提现或充值吗,0.9474793046010813
388,好人贷自动扣款规则,0.947447789180876
389,好人贷需要面签吗,0.9473771901966677
390,销户后为何还能解绑银行卡,0.9473317744910096
391,好人贷申请需要填写哪些个人信息,0.9473185270387426
392,客户提到投诉,0.9472409518425355
393,新网银行公众号如何取消关注,0.9471439833207719
394,能否让客服回电,0.9470879985816069
395,好人贷-云闪付是什么,0.9470711109716087
396,新网银行自动扣款时间,0.9468867578546145
397,为何提示用户未实名认证,0.946814269711442
398,如何更改其他平台的注册手机号码,0.9467572318190952
399,转入新网银行使用的密码是交易密码还是银行卡密码,0.9467255151297083
400,如何查询其他平台扣款银行卡,0.9466139819032949
401,好人贷为什么无法登录,0.946590156124382
402,如何查看银行卡管理列表,0.9465838021753136
403,为何提示系统异常,0.9465731156888727
404,创客贷额度是多少,0.9465497126256603
405,哪些渠道可以购买京东存款产品？,0.9464858801791906
406,非绑定银行卡可否与新网二类户转账,0.9462874056533396
407,如何查询转账到新网银行的记录,0.9461727146945921
408,好人贷账户是否为新网银行二类户？,0.9461708664236762
409,申请好人贷需要哪些资料,0.9461083286064932
410,好人贷收取哪些费用,0.9460815533352288
411,接收短信的手机号是否为注册手机号,0.9460631671080563
412,存款产品如何重置交易密码,0.9460203792859359
413,可以通过他人银行卡转入到新网银行账户吗,0.9458785487779321
414,页面为什么异常跳转,0.9458548671278143
415,如何知晓已注销成功,0.9458331000006953
416,好人贷为什么无法借款,0.9457992047519104
417,新网银行账户可以在哪些地方使用,0.9457185770999809
418,好人贷只能使用微信登录吗？,0.9455708602952554
419,合作平台如何还款,0.945415787703065
420,密码被锁定怎么办,0.9453285456520626
421,新网银行如何联系客户,0.9451594874497579
422,手机号无法使用为什么,0.9451132789835959
423,其他贷款怎么办理,0.9450616291289576
424,申请好人贷是否都有额度,0.9450426460173582
