425,新网银行三类户是什么,0.9447127297691412
426,结清证明开据时间是多久,0.9446951050124268
427,新网银行地址在哪里,0.9445800540016525
428,为什么收到美利车金融的短信,0.9445615279853896
429,存款产品如何修改手机号,0.944554160756863
430,如何查询当期车贷还款金额,0.9443609199826178
431,线下转账如何填写新网银行开户信息,0.9443523736797259
432,客户表示知道了,0.9441711317150645
433,好人贷能否人工操作提额,0.9441467331584239
434,新网诺诺发票贷如何申请,0.944043495592898
435,如何设置存管支付密码,0.9440155188324123
436,新网账户之间能否互相转账,0.9439368799148075
437,实名认证失败的原因是什么,0.9438632070840759
438,审核电话内容是什么,0.943831334129626
439,如何获取线上核身链接,0.9438155117462419
440,什么是当期账单,0.9437913330234521
441,好人贷-云闪付如何更换收/还款银行卡,0.9437679251210316
442,额度冻结是什么意思？,0.9436134259766618
443,什么是还款日,0.943599735831856
444,绑卡时页面上的银行卡预留手机号码可以修改吗,0.9435534078476854
445,存款需要先开立银行账户吗,0.9435037036090966
446,如何激活新网二类户,0.9434171022009085
447,如何查看开户结果,0.9431927698521723
448,合作平台如何取消贷款,0.9431719375160181
449,上传身份证时需填写的内容是什么,0.9431421112704438
450,好人贷申请必须使用身份证原件吗,0.9428687009855156
451,新网银行行号是多少,0.9428081051997499
452,企业邮箱填写错误怎么办,0.942742280821193
453,新网银行发送的短信验证码的有效时长？,0.9427411422923304
454,我们是四川新网银行吗,0.9426439847718755
455,好人贷必须绑定银行卡使用吗,0.9426003852986062
456,存款产品支取通用路径,0.9425855145983049
457,好人贷有额度后如何进行贷款,0.9424261937148795
458,如何更换微信号,0.9423557509746092
459,车贷还款只扣除部分是什么原因,0.9423043658785484
460,新网银行自动扣款次数,0.9420491892681089
461,好人贷有回访电话吗,0.9419924770658712
462,如何注销新网注册用户,0.9419361271278782
463,人工是否可操作扣款,0.9418847224011105
464,好人卡绑定云闪付/微信等失败怎么办,0.9418407279996223
465,新网银行视频认证的QQ号码是多少,0.9417016656331577
466,新网银行能否绑定云闪付,0.9416129189898216
467,修改手机号后是否需要重置登录密码,0.9414959130205397
468,好人贷为何无法还款,0.9413203085797218
469,如何获得优惠券,0.9412313780233758
470,验证码发送至什么手机号,0.9407714399475605
471,怎样才能成功申请到额度,0.9405680638587558
472,新网银行好事贷如何申请,0.9403384864138132
473,电脑端可以登录好人贷吗,0.9402964298727636
474,自动扣款时间段是多久,0.9402660458974521
475,新网有哪些产品,0.9400391904576272
476,如何退出微信公众号,0.9399866274198279
477,如何更换好人贷默认还款账户,0.939962777850072
478,新网银行有实体卡片吗,0.9398860908618312
479,什么情况算违约,0.939861202129192
480,实名认证为什么不符,0.9397188181756473
481,什么是综合评估,0.9396242449999243
482,人脸识别使用的是照片还是视频,0.9394999144062463
483,查询车贷的注册手机号码是什么,0.9393959529418866
484,查询各类工单办理进度,0.9392361993493876
485,销户后是否上征信,0.9392319571540535
486,存管是什么,0.9390949241285234
487,客户发送截图以及个人信息等,0.9390706705348407
488,核身链接失效的原因,0.9390456395811929
489,企业邮箱为何验证不了,0.9390170407602523
490,好人贷个人资料如何修改,0.9385718666907852
491,申请被拒怎么办,0.9384090571177408
492,如何查询是否已申请好人贷,0.9383789996820555
493,新网银行是否上市,0.9383138564736714
494,好人贷通过率多少,0.9382895977072843
495,存管账户充值限额,0.938225454308353
496,好人贷电话回访时间,0.9380070189946185
497,开通什么业务,0.9379941863403449
498,如何关注新网银行公众号,0.9379341380523712
499,好人贷年化利率是多少,0.9378514683437439
500,客户表示稍等,0.937823532021335
501,如何查询征信报告,0.937708989002829
502,好人贷账户如何更换手机号码,0.9376162033695529
503,如何修改实名认证手机号码,0.9375523182995407
504,什么是一、二、三类户,0.937516298786051
505,罚息能否减免,0.9374614798117018
506,身份证过期可以申请好人贷吗,0.9372615171441774
507,好人贷是邀请制吗,0.9370876356515891
508,客户表示需要考虑,0.9368847692709039
509,如何修改征信上的个人信息,0.9368154051273192
510,好人贷额度是否会发生变化,0.9367511385217505
511,手机获取验证码失败,0.9365303968886639
512,公众号如何注册,0.9364542507248036
513,如何操作随心存大额存款,0.936413317735427
514,好人贷借款合同有效期是多久,0.9362126317418337
515,修改手机号码的处理时间是多久,0.9361719763258819
516,如何查询存管账户流水,0.9359563094969766
517,银行转账未到账怎么办,0.9359338031750006
518,如何购买新网银行存款产品,0.9359142782443765
519,好人贷申请能否撤销,0.9355787321050282
520,存管账户如何查询,0.935530876522891
521,好人贷额度是否循环使用,0.9354499182311921
522,经侦是指什么,0.9354340187552811
523,客户称赞服务好,0.9354241617766269
524,扣款失败的原因,0.9352755713016057
525,银行渠道维护时间一般是多久,0.9352035136477274
526,好人贷申请身份证可否添加水印,0.9351318786434435
527,随心存如何登录,0.9350420135520677
528,车贷扣款支持的银行卡有哪些,0.9349903529736681
529,新网银行有几个网点,0.9348643447983057
530,申请好人贷使用的邮箱是公司邮箱还是个人邮箱,0.9344744164344082
531,车贷合同里的金额是否包含利息,0.9342621048007452
532,好人贷如何试算利息,0.9341869871822377
533,如何修改存管账户预留手机号码,0.9341721471666686
534,好人贷如何降低利率,0.9341320843628592
535,如何查询好人贷借据收款银行卡,0.9340856630112356
536,借款失败怎么办,0.9338660059430618
537,新网银行人工客服服务时间,0.9335920120701671
538,什么是注册号码？,0.9335433836151061
539,能否删除个人信息,0.9333424197465736
540,好人贷月利率是多少,0.9332995137050445
541,好人贷上征信吗,0.9332584088585475
542,关于客户个人信息安全问题,0.9331488846265005
543,更改银行卡预留手机号的方法,0.9330206481604818
544,什么是风控审核中,0.932704645519067
545,58车金融客服电话是多少,0.9327023324656665
546,可绑定银行卡数量上限,0.9323769584650476
547,随心存存入限额,0.932192188009809
548,新网银行业务办理时间,0.9319862870934084
549,如何查询车贷还款日,0.9319013699671078
550,手持身份证拍照的注意事项,0.9313902301325854
551,车贷还款记录如何查询,0.9313422381935692
552,如何登录微信公众号,0.9312511848654402
553,客户要求发送相关模板,0.9307353699254621
554,优惠券如何使用,0.9305904440970955
555,新网银行有信用卡吗,0.930586707857571
556,实名认证审核时间,0.9305579267078252
557,如何办理好人卡？,0.9302836635903413
558,人脸识别失败怎么办,0.9301695384644285
559,有多少人获得好人贷额度,0.930157959931249
560,可否补充企业邮箱,0.9301416662687546
561,如何更换借款收款银行卡,0.930003101322016
562,房产保证金是什么,0.9299937156811678
563,好人贷如何提高额度,0.9299628036504262
564,开户失败原因,0.9297716144093278
565,如何注销公众号,0.9296721078724487
566,企业邮箱格式是什么,0.9296006773099948
567,新网银行有招聘吗,0.9295614367979508
568,消费凭证有效期是多久,0.9294573002269987
569,他行渠道汇入新网账户的到账时间是多久,0.9293939976303033
570,忘记密码怎么办,0.9292667861524024
571,如何降低/关闭额度,0.9292336852488013
572,为何页面出现多个新网银行账户,0.928977678648087
573,好人贷利率是多少,0.9288373916743565
574,好人贷能否绑定他人银行卡,0.9287582265681565
575,季得利如何支取,0.9287493174802535
576,好人贷额度他人能否使用,0.9287196874475527
577,身份证上传失败怎么办,0.9286386003977934
578,什么是活体检测,0.9285497914677376
579,为何无法销户,0.9284574643295637
580,客户表示有合作意向,0.9282312623831313
581,工新借是什么,0.9281434092372536
582,客户表示不满,0.9280981582622049
583,是否需要使用本人手机操作好人贷,0.9279278717333708
584,好人贷账户如何挂失,0.9277582762284988
585,如何进入个人中心,0.9277308776357421
586,罚息介绍,0.9274632061217145
587,车贷合同为何无法查看,0.9271644142509857
588,如何进入好人贷页面,0.9263643019233616
589,如何开立存管账户,0.9261689528129539
590,如何录制活体检测,0.9261086477953993
591,如何注销新网二类户,0.9255781071957161
592,车贷可以修改还款日吗,0.9245879699490946
593,获取额度后多久可发起借款,0.9239925862899957
594,密码如何修改,0.9231725178078674
595,绑定银行卡失败,0.9230644186675039
596,输入身份证号码时，为何无法输入字母,0.9225035562783531
597,好人贷为什么额度低,0.922464201862087
598,好人贷还款后多久到账,0.9224334172845577
599,好人贷是否有临时额度,0.9221835541460937
600,人脸拍摄规范,0.9216395766311338
601,车贷利息是多少,0.9205901646335535
602,可否延期还款,0.9203044465414868
603,好人贷放款至什么账户,0.9173251020537272
604,美利车联系电话,0.9173166446588203
605,车贷能否绑定他人银行卡,0.9169626828336114
606,车贷申请多久可以放款,0.9167156808695436
607,关于消费凭证,0.91653347026582
608,好人贷如何实名认证,0.9161756408493638
609,个人可以在新网开立几个账户,0.9157386707076417
610,好人贷账户如何查询,0.9154366686683322
611,车辆信息如何查询,0.915309409910543
612,线上转入新网银行账户到账时间是多久,0.9152103756728609
613,如何邀请好友申请好人贷,0.9145278391379836
614,可否对公还款,0.9143699098489706
615,车贷合同如何查看,0.9136856910099737
616,车贷如何办理解押手续,0.9131043541315538
617,批扣时间段是多久,0.9129256078676876
618,存管账户如何注销,0.9119905291248611
619,好人贷如何提前还款,0.9114985653623113
620,好人贷如何自助提额,0.9108850248670133
621,新网银行账户是什么,0.9107945263089405
622,车贷逾期如何还款,0.9102064275927794
623,如何冻结新网银行账户,0.9098787084902562
624,如何查询新网账户,0.9092243628256992
625,车贷支持手动还款吗,0.9082536123507374
626,车贷如何还款？,0.9075411993343152
627,工新借如何申请,0.9074938060428792
628,好人贷借款规则,0.9070744680958133
629,额度冻结怎么办,0.9066614642762979
630,好人贷如何审核,0.9064773010975906
631,车贷收取哪些费用,0.9059705232153658
632,为何无法申请好人贷,0.9054078980982065
633,好人贷额度是多少,0.9041654565776535
634,如何在新网银行开户,0.9032237359984526
635,好人贷贷款期限是多久,0.9021984836080627
636,额度占用问题,0.9021444007638938
637,好人贷是什么,0.9011864283917759
638,车贷如何修改注册手机号码,0.9007057622284795
639,好人贷审核时间是多久,0.9005901353154258
640,新网银行简介,0.9000003646405801
641,好人贷的办理时间,0.8999731553330257
642,如何绑定银行卡,0.8988892366622772
643,客户提出建议,0.8979206449799982
644,好人贷额度有效期是多久,0.8973441669007245
645,好人贷提额周期是多久,0.8965229933752913
646,怎样用其他手机登录好人贷,0.8961959817620309
647,注销账户的处理时间,0.8957664771721334
648,如何换绑银行卡,0.8957479172452535
649,好人贷如何主动还款,0.8952410459002031
650,什么是登录密码,0.8946230361862323
651,好人贷消费用途,0.892486324686019
652,如何解绑银行卡,0.8922686984578093
653,车贷如何更换还款银行卡,0.8918764960592319
654,新网银行APP下载,0.8912978599441649
655,车贷如何提前还款,0.8909881556206063
656,车贷平台如何查询,0.8903565764349013
657,车贷如何解绑银行卡,0.8879893978212867
658,好事贷如何还款,0.8832610017975469
659,好人贷如何申请,0.8809680941172264
660,什么平台的贷款,0.8778592411212016
661,如何删除身份证信息,0.8725385952125387
662,如何增加银行卡,0.8724908772910607
663,车贷如何申请,0.8717689757230399
664,好人贷借款多久到账,0.8463623023480424
665,好人贷账户如何注销,0.8416667497426341
666,好人贷如何还款,0.8408907976947269
