0,早上10点忘记存钱进去有影响吗,1.0
1,半年得利提前支取影响已发放利息吗,0.9739585065930937
2,提前还款会影响个人征信吗,0.9739368296099015
3,季得利提前支取影响已发放利息吗,0.9732513343245237
4,银行卡挂失会影响自动扣款吗,0.9723670184394337
5,更换银行卡会影响自动扣款吗,0.9717175526440209
6,收款卡发卡行拒绝放款失败什么意思？,0.9709297947409092
7,补扣会影响信用吗,0.9691918162921125
8,无法提供消费凭证可以取消贷款吗,0.9690243539476293
9,为什么点击拍照没有反应,0.96860970145371
10,未接到好人贷回访电话会被拒吗,0.9684658812225297
11,视频认证录制失败的原因是什么,0.9682764165144149
12,白骑士认证失败是什么意思,0.9677081906485807
13,为何同时收到了还款成功和失败的短信,0.9674932242475013
14,自动扣款失败怎么办,0.9672188219393071
15,借款合同是否有展示提前还款会收取违约金的情况,0.966987705002059
16,手机号归属地与定位地不一致是否有影响,0.96664166550582
17,系统升级会影响扣款吗,0.9665483592542105
18,未正常还款我行会进行催收吗,0.9662795821510934
19,进入随心存为何提示手机号码不一致,0.9659816422045329
20,贷款证明开据失败怎么办,0.9658919664572345
21,为何提示交易密码验证失败,0.9653636915101326
22,修改手机号码/微信号是否会影响自动扣款,0.965142549303721
23,好人贷借款超时未到账如何处理,0.9649992243887029
24,为什么拍照认证时总是不成功或显示系统崩溃,0.9647815088250615
25,银行卡是二类户影响扣款吗,0.9645868130686682
26,银行渠道维护无法操作怎么办,0.9641222801526508
27,为何之前绑定的银行卡不支持扣款了,0.9641104190970923
28,逾期后还款金额是否会增加,0.9631829563792459
29,为何存管查询提示没有密码,0.9629541399245115
30,存管密码被锁定怎么办,0.9628034682521877
31,扣款结果会有短信提示吗,0.9626830233576641
32,页面为何提示“开户失败”、“账户存在异常操作/账户异常”,0.9626126072855191
33,为何提示还款卡不存在,0.9624983288447188
34,为何存管信息与平台显示不一致,0.9623422249208448
35,提前结清贷款后还会扣款吗,0.962281729480397
36,借款到账后页面未更新借款状态,0.9622712100723295
37,好人贷审核不通过对个人有什么影响,0.9621041779721657
38,为什么好人贷第一期还款金额与之后不一致,0.9620799714755734
39,为何提示支付平台该客户无默认扣款卡，交易没有发给统一支付,0.9617959872610776
40,为何征信上的放款日期与实际借款日期不一致,0.9614568884965334
41,线上开据证明为何和征信金额不符,0.9610731535427264
42,是否会发生重复扣款情况,0.9610029723759539
43,下一次开放时间是什么意思,0.9607003027783804
44,定期存款操作的渠道有哪些,0.9606737129028687
45,绑卡时页面上的银行卡预留手机号码可以修改吗,0.9604122575583532
46,实名认证失败的原因是什么,0.9603443376471583
47,借款成功会有短信等提醒吗,0.9601465363666026
48,好人贷不借款会产生利息或费用吗,0.9601406120778465
49,为什么提前还款显示联合贷批次执行中？,0.9600877441112314
50,为何图文验证码输入正确却提示错误,0.9600366682591577
51,存管查询为何提示用户不存在或者信息有误,0.9599882656495794
52,交易密码无法设置,0.9599592711479362
53,通过本人微信找回密码是指什么,0.9599224484457008
54,为何提示不具备开具资格,0.9596936541819024
55,活体检测失败怎么办,0.9595339611489573
56,手机获取验证码失败,0.9589868657844667
57,好人贷只能通过绑定的银行卡还款吗,0.9588406444205305
58,随心存停售后有影响吗,0.958738425742053
59,好人贷注册手机号与银行卡预留手机号是否需要一致？,0.9586128845380965
60,贷款证明的电子章是否具有法律效应,0.9584386843073012
61,京东存款是否支持提前支取/提前部分支取？,0.9580434378066144
62,贷款结清之后能否删除贷款记录,0.9578780997830176
63,银行卡开通银联在线支付后是否可正常还款,0.9577830359588008
64,为何重置密码后仍提示密码错误,0.9575508549167085
65,结清贷款后征信上是否会显示结清,0.957543114308222
66,扣款失败的原因,0.9574377051588486
67,平台还款信息为何与新网银行不一致,0.9573581755818683
68,是否可以取消自动扣款,0.9572871772798012
69,好人贷被拒后为何没有下次开放时间,0.9572778719273721
70,好人贷手动还款时为何提示批次执行中,0.9572549321367169
71,好人贷支持扣款的银行有哪些,0.9572476609493183
72,注册手机号更换成功后何时可以正常使用,0.957162006197565
73,获取验证码次数超限怎么办,0.9570929116949535
74,微信号更换成功后何时可以正常使用,0.9570516136479659
75,平台方手机号变更导致我行无法直接开据结清证明问题,0.9570401447775709
76,结清贷款后什么时候可以开据结清证明,0.9567662676504332
77,为何提示支付平台签约关系不存在,0.9567608459195571
78,购买存款页面为何提示“额度不足，无法购买”,0.9566462055856909
79,好人卡绑定云闪付/微信等失败怎么办,0.9564722343245898
80,结清证明印章无法查看,0.9563791200585615
81,我行放款的其他平台借款会上报征信吗,0.9561659794637926
82,为什么取消了提前部分还款,0.9561037071329742
83,为何人脸识别提示光线太足,0.9559339288175847
84,随心存操作渠道有哪些,0.955907072685997
85,随心存利率为何会发生变化,0.9558415897260202
86,为什么提示用户不存在,0.9558367491617364
87,有额度不使用有什么影响吗,0.9558040509670211
88,线上是否可开据征信版结清证明,0.9557639210111534
89,提前还款有次数限制吗,0.9557505099574953
90,为何提示支付平台不允许持卡人进行的交易,0.9557213797774885
91,提前还款手续费是多少,0.9553023178417693
92,为何提示还款存在差错,0.9551280074921561
93,为何提示支付平台持卡人信息有误,0.9550827139406816
94,为何提示支付平台受发卡行资金用途限制拒绝交易,0.954952161320955
95,修改手机号后是否需要重置登录密码,0.954911104020397
96,使用优惠券后提前还款利息如何计算,0.9548820575858158
97,人脸识别失败怎么办,0.954808201633138
98,好人贷审核时是否给填写的联系人去电,0.9547729211456417
99,逾期未还款如何处理,0.954643983088119
100,企业邮箱填写错误怎么办,0.9544559534494855
101,为何提示支付平台当日交易次数超限,0.9542499810625821
102,线上开据证明有次数限制吗,0.9541272700967572
103,为何征信上有新网上报的贷款记录,0.9541245452280759
104,提前支取有限制吗,0.9540872778506433
105,为什么收到提额短信但额度未提升,0.9540317233219633
106,还款银行卡是否需要开通银联在线支付业务,0.9538401634503778
107,好人贷申请成功会有短信通知吗,0.9537610532739481
108,新网银行发送的短信验证码的有效时长？,0.9537404884332509
109,电话客服是否可以受理结清证明,0.9535872844722383
110,存款页面是否会显示每日收益,0.9534510999865604
111,好人贷是否支持提前还当期账单,0.9534135486742868
112,还款日当天支持手动还款吗,0.9533792843593805
113,优信扣款成功后为何显示待还款,0.953375347673769
114,好人贷为什么提示“账户存在异常操作”,0.9532092991542641
115,可否按照征信订单号开据证明,0.953143031925683
116,征信上显示的贷款金额是否包含利息,0.953041582158178
117,密码被锁定怎么办,0.9529855203426777
118,还款日可以修改吗,0.9529209656525927
119,拨打我行人工客服电话是否收费,0.9527239343272962
120,新网银行扣款通道是什么,0.9525504945042439
121,如何确保还款日当天会扣款成功,0.9524928726018869
122,为何收到新网银行逾期提醒短信,0.9524172321823738
123,合同为何无法打开,0.952371929633495
124,审核电话可更改接听电话吗,0.9523651552843931
125,接收短信的手机号是否为注册手机号,0.9521976379089827
126,五年定期存款支持提前支取吗,0.9519752303539148
127,登录时的图文验证码是否区分大小写,0.9519639052165608
128,绑定银行卡产生费用吗,0.9519556878321319
129,转账时为何提示未面核,0.9518957580094407
130,公众号是否有还款提示,0.9517231415551336
131,开据证明时为何需要实名认证,0.951678297228872
132,存管查询的余额如何提现,0.9516744587685864
133,开据证明为何显示没有符合要求的订单,0.9516095206218861
134,为何提示缺少必要参数,0.9515931112469211
135,为什么银行还款存在限额？,0.9515180362188828
136,手机号无法使用为什么,0.951495110318008
137,客服能否查看聊天记录,0.9514349186400617
138,可以查询个人信息资料吗？,0.9514152652859179
139,随心存利率是多少,0.9512976461465809
140,按期还款和任性还款的区别是什么,0.9512209113427973
141,转入新网银行使用的密码是交易密码还是银行卡密码,0.9510679240219828
142,注册手机号及微信号需要实名制吗,0.951046296038253
143,支持绑定的银行卡类型有哪些,0.95098175943405
144,核身链接失效的原因,0.9508959288798011
145,季得利的操作渠道有哪些,0.9508516379342895
146,为何按期还款只能选择部分贷款期限,0.9508511162544301
147,注销注册用户后是否可恢复？,0.9507874827713546
148,选择任何还款方式都可以提前还款吗,0.9507633557871679
149,逾期造成的影响是什么,0.950686980133428
150,京东存款为什么显示当日额度为什么已售罄？,0.9506693523050156
151,为何提示支付平台暂不支持的银行或限额,0.9506612835409799
152,公众号页面的“我的排号”是什么意思,0.9505933745151973
153,好人贷提前还款最低还多少,0.9504715102836583
154,借款时选错收款账户怎么办？,0.9500839664880529
155,为何提示支付平台渠道不支持的银行,0.9500344625400462
156,新办的手机号可以申请好人贷吗,0.9499822585888529
157,结清证明是否是还款记录证明,0.9497126987554515
158,申请诺诺发票贷需要什么条件,0.9496915797702059
159,登录密码为何无法重置,0.9494829044363338
160,好人贷只能使用微信登录吗？,0.9494481703701003
161,为何提示支付平台其他错误,0.9493901212402015
162,为何提示支付平台银行卡未开通银联无卡认证支付,0.9492177235138336
163,随心存支持提前支取吗,0.9491101006661768
164,还款后为何未更新还款状态,0.9489748879982729
165,在线客服是否是人工客服,0.9488980622796396
166,为何提示支付平台支取金额超过可用余额,0.9488293334510717
167,还款日当天是否自动扣款,0.9487380507240989
168,为何无法登录存管查询,0.9487041059761264
169,结清证明的印章是否可以用公章,0.9486921241303503
170,新网银行二类户与好人贷是否为同一个手机号码,0.9485997653567081
171,存款产品的资金可以用于好人贷还款吗,0.9484811800079465
172,申请好人贷没有公司邮箱怎么办,0.9484115445684022
173,人脸识别使用的是照片还是视频,0.9483619364091422
174,申请好人贷后，可否更改授信结果,0.9483069392455948
175,再次申请好人贷会查询征信吗,0.9481436183934149
176,页面为何无法打开,0.9480422766481073
177,随心存可以在我行公众号查询/操作吗,0.947969650123961
178,关闭其他平台额度后，能否恢复好人贷额度,0.94775401581985
179,开户失败原因,0.9477132355753215
180,能否开具非恶意逾期证明,0.9476732748373667
181,查询结清证明申请是否已提交,0.9476097445098615
182,好人贷申请需要填写哪些个人信息,0.9475997024091765
183,借款后如何判定下次还款日期,0.9475775514194882
184,新网二类户转入/转出收取手续费吗,0.9475584744313207
185,银联在线支付是什么,0.947502233647916
186,申请好人贷需要下载APP吗？,0.9474983550248297
187,如何查看手机号是否实名制,0.9474458892417328
188,好人贷是否支持归还逾期部分账单,0.9474403490624802
189,为何申请好人贷后显示未获取额度,0.9473878951335609
190,结清证明的发送方式有哪些,0.9473682961452325
191,平台方提供的客户审批资料能否提供给客户,0.9472711128891472
192,征信报告是什么样的,0.9471802585730239
193,为何申请好人贷页面显示暂无资格,0.9471057191658074
194,新网银行有哪些产品可以提额,0.9469833530900206
195,为何征信上有新网银行的贷款审批记录,0.9468944433486003
196,好人贷借款金额与到账金额是否一致,0.9468149805064067
197,为何提示支付平台交易金额超限,0.9467055260464413
198,新网银行合作的存管平台有哪些,0.9466665965757389
199,为何提示支付平台账户余额不足,0.946643266710185
200,新网二类户可以升级为一类户吗？,0.9465405553680812
201,如何查询是否开通银联在线支付,0.9465140231015876
202,为何提示支付平台发卡行拒绝,0.946468064751191
203,好人贷注册手机号无法使用,0.9464350170318232
204,自助提额什么时候上线,0.9463926475177723
205,实名认证为什么不符,0.9462580590328606
206,实名认证是否查询征信,0.9461625451697954
207,随心存提前支取到账时间,0.9461027288335434
208,随心存如何查看收益情况,0.9461017884075065
209,新网银行人工客服电话打不通,0.9459873950481196
210,好人贷审核电话是多少,0.9457712933809321
211,新网银行存款是否受保障,0.9457331158662241
212,好人贷以什么贷款类型上报人行征信？,0.9456687200500224
213,新网二类户转入/转出有时间限制吗,0.9455776061899475
214,绑定银行卡失败,0.9455727374393754
215,开具结清证明时为何无法登录,0.9455380671539375
216,挖财还款是否为新网银行代扣,0.9455343943287391
217,页面为什么异常跳转,0.9455334609852243
218,好人贷提额会查询征信吗,0.9455181624350506
219,滴水贷客服电话是多少,0.9455012080261729
220,咨询可以发送图片吗？,0.9454327862649079
221,随心存存款期限有哪些,0.9454076639963579
222,银行渠道维护是指什么,0.945383947817594
223,操作好人贷是否需要开启定位,0.9453619273929582
224,好人贷还款后额度何时恢复,0.9452873236232224
225,好人贷申请是否查询芝麻信用,0.9451883361902816
226,联系新网银行客服有哪几种方式,0.9451828107386309
227,可以查询注册手机号码吗,0.9450163280291575
228,好人贷如何查看所支持的还款方式,0.9449634073378875
229,选择任性还款/按期还款利息如何计算,0.9449608691367448
230,诺诺发票贷的利率是多少,0.944955311053557
231,还款金额超银行卡限额怎么办,0.9448946788038445
232,如何取消征信查询及使用授权书,0.94474869554169
233,申请好人贷后有没有回复,0.9447463110949892
234,好人贷授信首页显示利率是否为固定利率,0.9447315604089785
235,新网二类户上的资金是否计息,0.9446911839857022
236,为何提示用户未实名认证,0.9444916594692181
237,好人贷交易密码如何设置,0.9444855168009003
238,好人贷申请是否可以使用临时身份证,0.944367124984572
239,提前支取时为何显示存入,0.9443334098342978
240,新网银行有实体卡片吗,0.9442287357252119
241,新网银行开户支持的证件有哪些,0.9442156998665342
242,好人贷申请的渠道有哪些,0.9442148466886573
243,企业邮箱验证码可否重新获取,0.9440983349055881
244,借款失败怎么办,0.9440408069974657
245,新网二类户为何无法转入/转出,0.9440042753919548
246,为何征信上有新网银行上报的逾期,0.9439953993554229
247,随心存如何修改交易密码,0.9439856203542788
248,身份证更换期间会影响好人贷贷款吗,0.9439437049750239
249,什么情况算违约,0.9436545774848688
250,还款后页面显示等待中,0.94363253774957
251,节假日可以操作各类存款吗,0.943516679545367
252,在线咨询是否支持客户发送语音,0.9434741250644327
253,如何查看委托支付协议,0.9434636692105959
254,名下所有卡被冻结后如何还款,0.9433895166889882
255,当期账单支持再分期吗,0.9433536520031718
256,如何设置存管支付密码,0.9432830524275425
257,银联在线支付如何开通,0.943279350461756
258,实际申请金额与放款金额不一致可否取消车贷,0.9432629138997628
259,如何查看随心存购买情况,0.9432388950346778
260,目前支持的银行有哪些,0.9432164665546764
261,如何查询合作平台贷款是否结清,0.9430768961793368
262,为何无法提交好人贷申请资料,0.9430192078092678
263,好人贷为什么无法登录,0.9429216760036572
264,为何好人贷还款时提示“交易处理中”,0.9428815206347574
265,为何提示系统异常,0.9428644325027419
266,京东存款如何修改注册手机号码,0.9428262589107796
267,存在迁户问题怎么处理,0.94269255222515
268,申请好人贷必须填写联系人信息吗,0.9426670774193645
269,为何结清证明显示日期与平台不符,0.9424322330302672
270,好人贷借款时还会审核吗,0.9423582903570398
271,能否人工开据贷款证明,0.9423142462261198
272,为何收到新网银行还款短信,0.9421722515767922
273,开据证明时为何提示账户存在异常,0.9421168567059786
274,为什么没有扣款,0.9420927916460962
275,新网银行视频认证的QQ号码是多少,0.9420797986304162
276,新网账户绑定微信/支付宝后支持提现或充值吗,0.9419664686357216
277,银行卡还款限额是多少,0.9418457191522898
278,新网银行以何名义查询征信,0.9417878525839506
279,客服能否看到客户申请好人贷的信息,0.9417876969085804
280,如何查看优惠券的使用情况,0.9417151135500107
281,申请好人贷需要公积金、社保吗？,0.9416067341039472
282,系统繁忙是什么原因,0.9415360430150239
283,好人贷部分提前还款规则,0.9415122213256033
284,好人贷借款后能否修改贷款信息,0.9414686564533221
285,什么是无卡支付及免密支付,0.9413831510547411
286,好人贷支持微信/支付宝扣款吗,0.9411953072725125
287,节假日可以借/还款吗,0.9411523920297238
288,存款产品是否存满五年才能支取,0.9410298011191077
289,如何查询好人贷申请的授信结果,0.9410096972973202
290,申请好人贷需要开个人账户吗？,0.9410053820852914
291,哪些渠道可以购买京东存款产品？,0.9407955011837288
292,视频认证的步骤是什么,0.9407672845459719
293,什么是银行卡预留手机号？,0.9407333664314599
294,月得利提前支取如何计息,0.9404933652629177
295,定期存款的利率是多少,0.9403004417427633
296,京东存款的计息规则及计息公式,0.940218212232931
297,好人贷必须绑定银行卡使用吗,0.9401417681494023
298,申请创客贷需要什么条件,0.9398180850147052
299,提额会有通知吗,0.9396304666743793
300,企业邮箱为何验证不了,0.9395730640108377
301,申请好人贷有区域或者号段等限制吗,0.939456156364351
302,申请被拒怎么办,0.9392453791356081
303,为何提示支付平台账户状态异常,0.9391956752886785
304,新网银行自动扣款时间,0.9391860265424584
305,为何申请好人贷无结果,0.9391564390394879
306,随心存到期后何时到账,0.9391544211404224
307,如何修改实名认证手机号码,0.9391197518524271
308,什么是单笔借据和多笔借据,0.9391050880394647
309,客户催促需要加急办理,0.9390474876457707
310,能否删除个人信息,0.9390168137590954
311,新网银行自动扣款次数,0.9389800038240955
312,他人可以使用本人信息申请好人贷吗,0.9389464793214073
313,转账到新网银行如何操作,0.9389089103471094
314,令牌无效是什么,0.9388646738502503
315,自动扣款如何操作,0.9387945855379669
316,好人贷可以重新申请吗,0.9387895249851217
317,在哪个平台操作提现,0.938653972615749
318,可以让别人代还款吗？,0.9384277000343689
319,五年定期存款的利率是多少,0.9382627119114064
320,新网银行人工客服电话是多少,0.9382578888988982
321,定期存款是否有存单,0.9382145247882906
322,好人贷额度必须一次性借完吗,0.9380952354346551
323,审核电话内容是什么,0.9380529012573963
324,微信/支付宝等可否与新网银行账户互相绑定,0.9380000515223642
325,随心存T+1是什么,0.9379867690822868
326,客服是否是随机分配,0.9379087612717459
327,新网银行合作平台有哪些,0.9378527220947847
328,存管提现到账时间是多久,0.9377643135549847
329,好人贷额度为什么变低了,0.937670164227486
330,可否取消银行卡限额,0.9375482589829813
331,新网银行账户可以在哪些地方使用,0.9374736128113638
332,银行转账未到账怎么办,0.9374538081388234
333,为什么收到美利车金融的短信,0.9374526114210742
334,罚息能否减免,0.9373383366379548
335,还款记录如何查看,0.9373321697666729
336,关于客户个人信息安全问题,0.9372845388330244
337,新网银行存款类产品有哪些,0.9372723829796686
338,什么情况算逾期,0.9372577322979654
339,申请好人贷需要哪些资料,0.9372485207735024
340,销户与否会产生什么影响,0.9371096384329183
341,如何查看好人贷相关协议/合同？,0.9370509968650388
342,为什么无法注册,0.9369921329973755
343,"好人贷有回访电话吗""",0.9369153730851008
344,好人贷利率为什么调高了,0.936906610322327
345,周得利提前支取如何计息,0.936800276965547
346,更改银行卡预留手机号的方法,0.9367975413595881
347,为何还款后额度恢复减少了,0.936726726242309
348,如何查看银行卡管理列表,0.9367185372984798
349,存款产品如何重置交易密码,0.9365879633696667
350,客户表示还款成功,0.9365692863868529
351,忘记密码怎么办,0.9363215660748822
352,客户咨询其他平台催收问题,0.9362713593576055
353,如何查询转账到新网银行的记录,0.9361190443320727
354,申请好人贷工作信息如何填写,0.9359948370548908
355,结清证明会展示哪些信息,0.9359693136982039
356,好人贷定位如何开启,0.9359627257720382
357,申请好人贷后为何页面显示仍可提交申请,0.9358787707836899
358,黑户/白户是否可以申请好人贷,0.9358191479393749
359,如何修改新网随心存注册号码,0.9356910173561812
360,客户表示没有问题了,0.9355382662021754
361,新网银行存款属于理财产品吗,0.9354446525470473
362,新网银行的官网地址是什么,0.9352931433471412
363,新网银行二类户如何转入/转出,0.9351491398602952
364,好人贷自动扣款规则,0.9350883324837872
365,如何更改其他平台的注册手机号码,0.9349646051482556
366,好人贷支持周末借款吗？,0.9349356618377281
367,如何修改征信上的个人信息,0.9348806842246933
368,申请好人贷需要什么条件,0.9347141236743252
369,我行对客邮箱是多少,0.9346708530543097
370,新网银行公众号如何取消关注,0.934668225176864
371,如何查询申请相关的协议书,0.9346283910523401
372,电脑端可以登录好人贷吗,0.9344526232406534
373,验证码发送至什么手机号,0.9342680993454049
374,征信上报周期及更新时间,0.9340947994375917
375,如何修改存管账户预留手机号码,0.9340412998817504
376,新网银行的活期利率是多少,0.9338734929778728
377,可以通过他人银行卡转入到新网银行账户吗,0.9338082065919148
378,新网银行能否绑定云闪付,0.9336015171713983
379,怎样才能成功申请到额度,0.9335777713194907
380,好人贷还款方式有哪些,0.9335500457290776
381,好人贷需要面签吗,0.9332849282522254
382,如何查看贷款合同,0.9330802012130437
383,好事贷收取哪些费用,0.9330184210481778
384,新网银行账户的交易记录如何查看,0.9326167878245842
385,新网银行有企业贷款吗？,0.9325046386888636
386,一个身份证可以申请好人贷两次吗？,0.9324816855165199
387,为何提示该证件已被使用,0.9322124795823635
388,好人贷还款记录如何查询,0.932119395385232
389,好人贷与其他平台类似产品的区别是什么,0.9320185256154264
390,好人贷贷款利息如何计算,0.9320140051754635
391,非绑定银行卡可否与新网二类户转账,0.9319641110157726
392,美团客服热线是多少,0.93194498356348
393,好人贷申请是否支持人工受理,0.9318970024027772
394,销户后可以再开户吗,0.9318944440357828
395,优信客服电话是多少,0.9316608607527593
396,身份证上传失败怎么办,0.9316594906213315
397,新网银行地址在哪里,0.9316050383250499
398,好人贷是否支持提前还款,0.9315836500263132
399,居住信息如何填写,0.9312005456488893
400,好人贷账户是否为新网银行二类户？,0.9311911741766302
401,新网银行存款产品为何暂停交易,0.9310330973023371
402,新网银行有哪些活动,0.93098223100635
403,如何解约快捷支付？,0.9309231283882629
404,客户发送截图以及个人信息等,0.9308987313447553
405,好人贷借款记录如何查询,0.9303790982338213
406,存款需要先开立银行账户吗,0.9303740031631184
407,合作平台如何取消贷款,0.9302991128052663
408,销户后为何还能解绑银行卡,0.9302889001370205
409,如何查看好人贷还款计划,0.9301165304586455
410,人工是否可操作扣款,0.9300507770352686
411,征信是什么,0.9299541863475523
412,抵押类贷款如何办理,0.9299168011734608
413,新网银行二类户限额是多少,0.9298838078150705
414,贷款证明如何开据,0.929879291830763
415,好人贷有回访电话吗,0.9295862058600165
416,存款产品如何修改手机号,0.9291385134015151
417,好人贷为什么无法借款,0.9291116703057659
418,新网银行是否上市,0.9288216175438913
419,好人贷申请必须使用身份证原件吗,0.9288199640783976
420,转账到新网银行账户是否还款成功,0.9287943602531171
