421,修改手机号码的处理时间是多久,0.9286921593451319
422,新网银行账户可以设置为好人贷借/还款账户吗,0.9286536876087882
423,线下转账如何填写新网银行开户信息,0.9284713337390591
424,好人贷-云闪付是什么,0.9284670913945682
425,随心存产品停售原因,0.9280811064500424
426,如何退出微信公众号,0.927988928973483
427,可以重新注册吗,0.9279824677465142
428,好人贷借款如何上报征信,0.9278903828573808
429,按期还款是什么,0.9278818747522816
430,好人贷支持随时借款吗,0.9277786436612908
431,可以咨询吗,0.9277612004952305
432,车贷合同里的金额是否包含利息,0.9276959503044596
433,如何获取线上核身链接,0.9274982625769509
434,可绑定银行卡数量上限,0.9274752743104044
435,开户是什么意思,0.9273361496170213
436,什么是我的额度和可借额度,0.9273070753545102
437,好人贷收取哪些费用,0.9272806441836732
438,好人贷个人资料如何修改,0.9269389451009611
439,如何开据存款证明,0.926132235570315
440,查询各类工单办理进度,0.9260838075693555
441,查询车贷的注册手机号码是什么,0.9260731155699528
442,申请好人贷是否都有额度,0.9259013218353528
443,好人贷支持随借随还吗,0.9258596165843797
444,如何通过线下方式转入新网二类户,0.9257046721573529
445,如何查询其他平台扣款银行卡,0.9255931014291172
446,实名认证审核时间,0.9253550305940883
447,退汇是什么意思,0.9253333919026404
448,好人贷-云闪付如何提前还款,0.9251328496379722
449,申请好人贷使用的邮箱是公司邮箱还是个人邮箱,0.9250959099825122
450,周得利计息规则,0.9249506903837754
451,好人贷支持在国外发起借款吗,0.9246948793316234
452,什么是分批次扣款,0.9246311098936262
453,人脸拍摄规范,0.9245746653968115
454,销户后是否上征信,0.9244482654183175
455,什么是风控审核中,0.9244183380910523
456,如何把注册用户与结算用户都注销,0.9238969000929
457,新网银行以什么名义放款,0.9237924645290388
458,如何操作随心存大额存款,0.9235986842715069
459,自动扣款时间段是多久,0.9234513327379499
460,新网银行有信用卡吗,0.9234446576915817
461,为何销户后还能看到好人贷信息,0.9233336697401482
462,可否补充企业邮箱,0.9233260117948928
463,任性还款是什么,0.9231746136203935
464,好人贷当期能否最低还款,0.9230521731128726
465,好人贷扣款账户如何查看,0.9230163164084627
466,好人贷利率为什么高,0.9226252238221984
467,如何知晓已注销成功,0.9224651487779911
468,如何查看开户结果,0.9223907446450851
469,随心存是什么,0.9221329151346764
470,好人贷申请能否撤销,0.9220991996483034
471,好人贷上征信吗,0.9219739272298806
472,如何更换微信号,0.9218921054436674
473,好人贷能否人工操作提额,0.9217284149157411
474,好人贷通过率多少,0.9214094445129917
475,新网银行三类户是什么,0.9210272176269165
476,存款利率是多少,0.9208355602646612
477,车贷扣款支持的银行卡有哪些,0.9206007088397596
478,车贷合同为何无法查看,0.9203610448166363
479,如何查询还款日,0.9202155758816519
480,其他贷款怎么办理,0.9200657468886755
481,如何签署借款合同,0.9197605008209796
482,客户提到投诉,0.9196662361932161
483,好人贷账户如何更换手机号码,0.9196492589790818
484,结清证明开据时间是多久,0.9195423077068455
485,注册规则是什么,0.9193978247396588
486,新网银行如何联系客户,0.919102184434116
487,输入身份证号码时，为何无法输入字母,0.9190473379047016
488,好人贷额度是否会发生变化,0.9186858997243134
489,迁户是什么意思,0.9186627073178116
490,如何选择按期还款/任性还款,0.9186204251294451
491,五年定期存款是什么,0.9183208674329657
492,随心存存入限额,0.9181808900934314
493,能否让客服回电,0.9180897156782366
494,好人贷额度是否循环使用,0.9178255739310148
495,如何查询征信报告,0.9178166506091994
496,新网账户之间能否互相转账,0.9178096666746067
497,企业邮箱格式是什么,0.9175977109684338
498,新网银行行号是多少,0.9171707425334019
499,新网银行有几个网点,0.9170473097680635
500,存管账户充值限额,0.9169332228113193
501,季得利如何计息,0.9166775423957619
502,新网诺诺发票贷如何申请,0.9165631419688854
503,上传身份证时需填写的内容是什么,0.9164036105678441
504,好人贷-云闪付如何更换收/还款银行卡,0.9163066748616648
505,车贷还款只扣除部分是什么原因,0.9162724585691443
506,好人贷如何降低利率,0.9157994049135317
507,新网银行好事贷如何申请,0.9156530018301918
508,随心存如何计息,0.9154812924026207
509,好人贷申请身份证可否添加水印,0.9154350378290743
510,我们是四川新网银行吗,0.9153523117622233
511,创客贷额度是多少,0.915340511681917
512,新网银行有招聘吗,0.9152926450983059
513,如何激活新网二类户,0.9152118959951265
514,如何查询存管账户流水,0.9148272510185061
515,如何关注新网银行公众号,0.9148021360415903
516,身份证信息变更后如何更新,0.9146910953549525
517,客户表示不满,0.9146694879283995
518,如何购买新网银行存款产品,0.9146335902096168
519,如何获得优惠券,0.914248887330531
520,客户表示知道了,0.914209001610745
521,好人贷有额度后如何进行贷款,0.9137006397097965
522,如何登录微信公众号,0.9135911508921992
523,如何查询账户是否冻结,0.9134025311909479
524,新网银行业务办理时间,0.9133170588662091
525,定期存款到期如何支取,0.9132858447919809
526,额度冻结是什么意思？,0.9128970918050676
527,银行渠道维护时间一般是多久,0.9128635166645191
528,如何注销新网注册用户,0.9128029080632
529,身份证过期可以申请好人贷吗,0.9126917953161897
530,开通什么业务,0.9124167953400345
531,如何查询是否已申请好人贷,0.9124102027038115
532,存管账户如何查询,0.9118638039983118
533,存款产品支取通用路径,0.9117999949407362
534,如何查询当期车贷还款金额,0.9116423990579143
535,存管是什么,0.911036970296387
536,如何录制活体检测,0.9108861480145874
537,存款产品是否保本保息,0.9108402118488995
538,什么是活体检测,0.9108319807373134
539,新网有哪些产品,0.9103937594893169
540,什么是注册号码？,0.9100996951078166
541,客户表示需要考虑,0.9100991523620287
542,各还款方式如何进行还款,0.9100985100700917
543,如何办理对公业务,0.9098992398041652
544,好人贷能否绑定他人银行卡,0.9088311064316184
545,季得利是什么,0.9086940612540205
546,好人贷电话回访时间,0.9085119643194914
547,车贷还款记录如何查询,0.9083050807307048
548,是否需要使用本人手机操作好人贷,0.9082129577080876
549,好人贷为何无法还款,0.9076339317591107
550,优惠券如何使用,0.9071074380935596
551,客户要求发送相关模板,0.9068067250352297
552,好人贷是邀请制吗,0.9066794007068751
553,新网银行人工客服服务时间,0.9064931800726848
554,罚息介绍,0.9061178929206468
555,他行渠道汇入新网账户的到账时间是多久,0.906034115398216
556,合作平台如何还款,0.9058369200607311
557,58车金融客服电话是多少,0.9058155556409165
558,有多少人获得好人贷额度,0.9057742259680914
559,什么是综合评估,0.9056797622504397
560,什么是当期账单,0.9055460433546101
561,好人贷账户如何挂失,0.9054188956392658
562,密码如何修改,0.9053658276973774
563,公众号如何注册,0.905307589735727
564,如何注销公众号,0.9047580743817085
565,如何进入好人贷页面,0.9047430750384072
566,如何查询好人贷借据收款银行卡,0.9043855512690688
567,如何更换好人贷默认还款账户,0.9043080636700632
568,好人贷如何试算利息,0.9040961434399094
569,好人贷额度他人能否使用,0.9040880233252176
570,额度占用问题,0.903936243867027
571,为何页面出现多个新网银行账户,0.9037605345107593
572,经侦是指什么,0.9037023153745296
573,如何办理好人卡？,0.9033555753420063
574,如何降低/关闭额度,0.9028305059064575
575,好人贷是否有临时额度,0.9026892280206262
576,获取额度后多久可发起借款,0.9018516504169952
577,消费凭证有效期是多久,0.901581849243092
578,好人贷如何提高额度,0.9010129453195761
579,如何开立存管账户,0.9004811653524886
580,好人贷年化利率是多少,0.9004716634576893
581,好人贷如何实名认证,0.900155660864588
582,好人贷为什么额度低,0.90015190992214
583,车贷可以修改还款日吗,0.9001274112601898
584,手持身份证拍照的注意事项,0.8990417959991965
585,如何更换借款收款银行卡,0.8989614302704396
586,车辆信息如何查询,0.8980284028505012
587,如何查询车贷还款日,0.8971896494213285
588,好人贷借款合同有效期是多久,0.8969299895513773
589,什么是一、二、三类户,0.8967764012481463
590,好人贷月利率是多少,0.89642324169462
591,房产保证金是什么,0.8951907113528175
592,客户称赞服务好,0.8944513334717505
593,线上转入新网银行账户到账时间是多久,0.8939730615593702
594,客户表示稍等,0.8937452310100819
595,随心存如何登录,0.8925908711341698
596,如何进入个人中心,0.8922669176979894
597,车贷能否绑定他人银行卡,0.8920375459347649
598,如何邀请好友申请好人贷,0.890903434301661
599,车贷合同如何查看,0.890649652320197
600,客户表示有合作意向,0.889906341919655
601,关于消费凭证,0.8892322449625186
602,好人贷利率是多少,0.8887667402984295
603,美利车联系电话,0.8883579564547747
604,如何注销新网二类户,0.8882174663615087
605,车贷如何修改注册手机号码,0.8881664072883594
606,好人贷还款后多久到账,0.8874619241269132
607,工新借是什么,0.8865999002796305
608,什么是还款日,0.8863819146931585
609,怎样用其他手机登录好人贷,0.8862538600080903
610,为何无法销户,0.885488553086158
611,车贷申请多久可以放款,0.8842600881068297
612,新网银行账户是什么,0.8839075371952185
613,车贷支持手动还款吗,0.8833039035453676
614,存管账户如何注销,0.8824480437173063
615,批扣时间段是多久,0.8819792890616046
616,季得利如何支取,0.881701008352829
617,为何无法申请好人贷,0.8815844541657782
618,好人贷账户如何查询,0.8809241177965238
619,车贷收取哪些费用,0.8808017560733797
620,车贷利息是多少,0.8803741905276959
621,好人贷放款至什么账户,0.880275496924674
622,好人贷如何审核,0.8799140918379242
623,车贷如何办理解押手续,0.8787850845399189
624,个人可以在新网开立几个账户,0.8787772814551965
625,好人贷如何自助提额,0.878711409925839
626,新网银行APP下载,0.8780508925246164
627,额度冻结怎么办,0.8773605824444322
628,如何绑定银行卡,0.8764904581194818
629,如何查询新网账户,0.8755126438445072
630,可否延期还款,0.8754057800139057
631,什么是登录密码,0.8752051967327474
632,如何在新网银行开户,0.8746752182147146
633,好人贷审核时间是多久,0.872907057768519
634,如何换绑银行卡,0.8724990909898519
635,好人贷如何提前还款,0.8718749833436075
636,好人贷的办理时间,0.870918712787315
637,新网银行简介,0.8698787558886941
638,可否对公还款,0.8685469428247473
639,车贷平台如何查询,0.8683632045832346
640,客户提出建议,0.8678555929481077
641,如何冻结新网银行账户,0.8678320831970936
642,好人贷额度是多少,0.8671653124162144
643,工新借如何申请,0.866718746405562
644,车贷逾期如何还款,0.8652512792148632
645,如何解绑银行卡,0.865218383077404
646,好人贷借款规则,0.8647416652511434
647,好人贷消费用途,0.8629649963529746
648,车贷如何还款？,0.862437231131675
649,注销账户的处理时间,0.8624251681873462
650,车贷如何解绑银行卡,0.8610733233044526
651,好人贷是什么,0.860726859996246
652,好人贷如何主动还款,0.8604607885481658
653,车贷如何更换还款银行卡,0.8548934544430145
654,好人贷额度有效期是多久,0.8537843484861422
655,好人贷提额周期是多久,0.8532083404679102
656,好人贷贷款期限是多久,0.8508459052003631
657,车贷如何提前还款,0.8488638468424748
658,什么平台的贷款,0.846201252789454
659,如何删除身份证信息,0.8409281955140057
660,如何增加银行卡,0.8402079163734807
661,好事贷如何还款,0.8395351722972552
662,好人贷如何申请,0.8387389202348745
663,车贷如何申请,0.8280859246396659
664,好人贷借款多久到账,0.8055529105679312
665,好人贷账户如何注销,0.8005652868131943
666,好人贷如何还款,0.7908194845541412
