0,点击领取额度需要设置微信定位,1.0
1,注册手机号及微信号需要实名制吗,0.977738207337102
2,好人贷注册手机号与银行卡预留手机号是否需要一致？,0.976020811555461
3,线上开据证明为何和征信金额不符,0.9758817646443785
4,绑卡时页面上的银行卡预留手机号码可以修改吗,0.9744232930238235
5,可否按照征信订单号开据证明,0.974398300173783
6,新网银行发送的短信验证码的有效时长？,0.9735873103333544
7,好人贷申请成功会有短信通知吗,0.9733825845963211
8,新网二类户转入/转出收取手续费吗,0.9730897974030354
9,借款成功会有短信等提醒吗,0.973075942883421
10,获取验证码次数超限怎么办,0.9729506824467864
11,借款到账后页面未更新借款状态,0.9728567309123665
12,新网账户绑定微信/支付宝后支持提现或充值吗,0.9724464750018853
13,为什么收到提额短信但额度未提升,0.9721801982450851
14,为何存管查询提示没有密码,0.9720572697933035
15,半年得利提前支取影响已发放利息吗,0.9719059905690088
16,好人贷授信首页显示利率是否为固定利率,0.9717411543132921
17,为何提示支付平台受发卡行资金用途限制拒绝交易,0.9716886720022531
18,线上是否可开据征信版结清证明,0.9714735696713925
19,在线咨询是否支持客户发送语音,0.9708325041717807
20,进入随心存为何提示手机号码不一致,0.9706765751121362
21,为何申请好人贷后显示未获取额度,0.9706636492839923
22,季得利提前支取影响已发放利息吗,0.970619691115296
23,接收短信的手机号是否为注册手机号,0.9706041888682029
24,随心存可以在我行公众号查询/操作吗,0.9703384583846881
25,存管查询为何提示用户不存在或者信息有误,0.970302987070944
26,修改手机号码/微信号是否会影响自动扣款,0.9702891778161951
27,为何提示支付平台当日交易次数超限,0.9702157356432933
28,平台方手机号变更导致我行无法直接开据结清证明问题,0.9699155386508234
29,客服能否看到客户申请好人贷的信息,0.9697710320059864
30,新网银行公众号如何取消关注,0.9696529750847994
31,如何查询好人贷申请的授信结果,0.9696216649122907
32,查询结清证明申请是否已提交,0.969558075333451
33,好人贷手动还款时为何提示批次执行中,0.9695358759316787
34,京东存款如何修改注册手机号码,0.9692487655534546
35,为何征信上有新网上报的贷款记录,0.969239786839732
36,新网银行以何名义查询征信,0.9692182477527662
37,无法提供消费凭证可以取消贷款吗,0.9692149201791681
38,好人贷提额会查询征信吗,0.9692147797812037
39,微信/支付宝等可否与新网银行账户互相绑定,0.9691575492883157
40,好人贷申请是否查询芝麻信用,0.9690007402751076
41,为何征信上的放款日期与实际借款日期不一致,0.9687946694301391
42,优信扣款成功后为何显示待还款,0.9687000489406863
43,征信上显示的贷款金额是否包含利息,0.9686623103057871
44,五年定期存款支持提前支取吗,0.9686349338855822
45,开据证明时为何需要实名认证,0.9685835209266076
46,为何收到新网银行逾期提醒短信,0.9685005782800172
47,申请好人贷必须填写联系人信息吗,0.9684898840251731
48,申请诺诺发票贷需要什么条件,0.968488998564776
49,银行卡开通银联在线支付后是否可正常还款,0.9684790831207417
50,扣款结果会有短信提示吗,0.9683912960671972
51,如何取消征信查询及使用授权书,0.9683812277882812
52,购买存款页面为何提示“额度不足，无法购买”,0.9683780434212222
53,好人贷审核时是否给填写的联系人去电,0.9682384190458606
54,为何提示支付平台该客户无默认扣款卡，交易没有发给统一支付,0.9681967371026898
55,新办的手机号可以申请好人贷吗,0.9680270658457908
56,好人卡绑定云闪付/微信等失败怎么办,0.9678482694512965
57,为何提示用户未实名认证,0.9678386227617893
58,实名认证是否查询征信,0.9677803240547997
59,好人贷只能通过绑定的银行卡还款吗,0.9675206628735332
60,好人贷申请需要填写哪些个人信息,0.967459927516207
61,为何提示支付平台持卡人信息有误,0.9674573175981787
62,注册手机号更换成功后何时可以正常使用,0.9674447951309337
63,为何同时收到了还款成功和失败的短信,0.9672640448348646
64,未接到好人贷回访电话会被拒吗,0.9671974936319957
65,可以查询注册手机号码吗,0.9671477957872417
66,微信号更换成功后何时可以正常使用,0.9670520929763524
67,线上开据证明有次数限制吗,0.9670238325670912
68,我行放款的其他平台借款会上报征信吗,0.9670121139633002
69,为何之前绑定的银行卡不支持扣款了,0.966978594017761
70,为何提示支付平台银行卡未开通银联无卡认证支付,0.9668389165241179
71,新网二类户转入/转出有时间限制吗,0.9667469137967662
72,支持绑定的银行卡类型有哪些,0.9667463596635708
73,公众号是否有还款提示,0.9666964811959038
74,为何提示支付平台支取金额超过可用余额,0.9666362601863859
75,还款银行卡是否需要开通银联在线支付业务,0.9666233695484799
76,为何征信上有新网银行的贷款审批记录,0.9664560770659266
77,如何查询是否开通银联在线支付,0.9664237241033673
78,客服能否查看聊天记录,0.9663611259719388
79,公众号页面的“我的排号”是什么意思,0.9662427169646816
80,拨打我行人工客服电话是否收费,0.9660646094588489
81,电话客服是否可以受理结清证明,0.9660555927685941
82,京东存款的计息规则及计息公式,0.9660533629571931
83,好人贷支持微信/支付宝扣款吗,0.9660462876625864
84,再次申请好人贷会查询征信吗,0.9657209598880651
85,为何提示支付平台不允许持卡人进行的交易,0.9656824475273357
86,为何提示支付平台签约关系不存在,0.9655459007293925
87,线下转账如何填写新网银行开户信息,0.9655311918080828
88,页面为何提示“开户失败”、“账户存在异常操作/账户异常”,0.9654970898878203
89,申请好人贷后，可否更改授信结果,0.9654866834866862
90,通过本人微信找回密码是指什么,0.9654739975680785
91,借款合同是否有展示提前还款会收取违约金的情况,0.9654355193383242
92,为何提示支付平台暂不支持的银行或限额,0.9653480589649271
93,关闭其他平台额度后，能否恢复好人贷额度,0.965190136035914
94,申请好人贷工作信息如何填写,0.9651710644308661
95,好人贷为什么提示“账户存在异常操作”,0.9651178857340057
96,是否可以取消自动扣款,0.9647908028320261
97,征信上报周期及更新时间,0.9647526854817629
98,为何申请好人贷页面显示暂无资格,0.9646208444582881
99,登录时的图文验证码是否区分大小写,0.9646122500967809
100,京东存款是否支持提前支取/提前部分支取？,0.9645872582416644
101,修改手机号后是否需要重置登录密码,0.9645411434892822
102,存管查询的余额如何提现,0.964490818352846
103,如何查看委托支付协议,0.9644821492636769
104,好人贷以什么贷款类型上报人行征信？,0.9643525715152924
105,更换银行卡会影响自动扣款吗,0.9642687792069132
106,银行卡挂失会影响自动扣款吗,0.964176637791501
107,使用优惠券后提前还款利息如何计算,0.9641750088128758
108,好人贷只能使用微信登录吗？,0.9641253017883683
109,转入新网银行使用的密码是交易密码还是银行卡密码,0.964124558060697
110,新网银行人工客服电话打不通,0.9640935140018146
111,申请好人贷有区域或者号段等限制吗,0.9640794269302961
112,新网银行视频认证的QQ号码是多少,0.9640121915306206
113,为什么提前还款显示联合贷批次执行中？,0.9640007579650727
114,绑定银行卡产生费用吗,0.9639607024624334
115,京东存款为什么显示当日额度为什么已售罄？,0.963838048420456
116,随心存如何查看收益情况,0.9637681494893305
117,为何提示支付平台发卡行拒绝,0.9637422794377297
118,为何无法登录存管查询,0.9637195181727446
119,手机号归属地与定位地不一致是否有影响,0.963674602043264
120,为何征信上有新网银行上报的逾期,0.963618533354444
121,好人贷被拒后为何没有下次开放时间,0.9635228322132716
122,好人贷借款金额与到账金额是否一致,0.9634989839637913
123,如何查看手机号是否实名制,0.9634821529732978
124,如何查询转账到新网银行的记录,0.9634749530039421
125,为何提示支付平台交易金额超限,0.9630797378354886
126,存管密码被锁定怎么办,0.9629913450215701
127,为何收到新网银行还款短信,0.9629657323416687
128,好人贷注册手机号无法使用,0.9629261459741244
129,收款卡发卡行拒绝放款失败什么意思？,0.9628110958192572
130,联系新网银行客服有哪几种方式,0.9627852091172908
131,如何修改存管账户预留手机号码,0.9627107362534177
132,如何修改实名认证手机号码,0.9626253346332794
133,为什么好人贷第一期还款金额与之后不一致,0.9626234218916561
134,新网银行二类户与好人贷是否为同一个手机号码,0.9626205959658226
135,为什么取消了提前部分还款,0.9625903364259077
136,申请好人贷需要下载APP吗？,0.9624850073974898
137,定期存款操作的渠道有哪些,0.9624350354926995
138,银行渠道维护无法操作怎么办,0.9623797904811029
139,客户催促需要加急办理,0.9623797057557119
140,新网二类户上的资金是否计息,0.9623590514731896
141,好人贷借款超时未到账如何处理,0.9622594041842603
142,非绑定银行卡可否与新网二类户转账,0.9622456584153124
143,审核电话可更改接听电话吗,0.9622314011976575
144,好人贷必须绑定银行卡使用吗,0.9622011250221867
145,结清贷款后征信上是否会显示结清,0.9620881573011993
146,银联在线支付如何开通,0.961984904801958
147,开据证明时为何提示账户存在异常,0.9619648305030128
148,平台方提供的客户审批资料能否提供给客户,0.9618221365561485
149,新网银行人工客服电话是多少,0.961745279888896
150,为何无法提交好人贷申请资料,0.9616301792637686
151,为何图文验证码输入正确却提示错误,0.9616116019384879
152,如何更改其他平台的注册手机号码,0.9615005255312877
153,为何提示交易密码验证失败,0.9612719179806842
154,存款页面是否会显示每日收益,0.9612563130362645
155,企业邮箱验证码可否重新获取,0.9611865379981707
156,随心存到期后何时到账,0.9611208755981809
157,好人贷是否支持提前还当期账单,0.9610071114415877
158,为何按期还款只能选择部分贷款期限,0.9609737032464183
159,为何存管信息与平台显示不一致,0.9609357529177417
160,贷款证明的电子章是否具有法律效应,0.9608398136914602
161,为何提示支付平台渠道不支持的银行,0.9607735497066874
162,为何重置密码后仍提示密码错误,0.9607256567991638
163,为什么点击拍照没有反应,0.9606813578452186
164,新网银行扣款通道是什么,0.9605990300908833
165,还款金额超银行卡限额怎么办,0.9605889275078515
166,为何提示支付平台账户余额不足,0.9605643801890367
167,申请好人贷没有公司邮箱怎么办,0.960493101464559
168,为什么拍照认证时总是不成功或显示系统崩溃,0.9604720837350704
169,手机获取验证码失败,0.9603876794986707
170,贷款证明开据失败怎么办,0.9602661897651363
171,交易密码无法设置,0.9602365108327784
172,验证码发送至什么手机号,0.9601379768828442
173,贷款结清之后能否删除贷款记录,0.9601243705876198
174,可以查询个人信息资料吗？,0.9601119741561122
175,开据证明为何显示没有符合要求的订单,0.9601089953348898
176,随心存提前支取到账时间,0.9601079927151137
177,如何查看随心存购买情况,0.9600669811260735
178,好人贷如何查看所支持的还款方式,0.9599834060922376
179,为何提示不具备开具资格,0.9599541242666733
180,新网银行自动扣款时间,0.9599531897783543
181,客户咨询其他平台催收问题,0.9598592134703164
182,新网二类户为何无法转入/转出,0.9598454976146764
183,新网银行账户的交易记录如何查看,0.9598393573970928
184,提前还款会影响个人征信吗,0.9597954724933908
185,平台还款信息为何与新网银行不一致,0.9596865087820603
186,申请创客贷需要什么条件,0.9596212484265166
187,好人贷支持扣款的银行有哪些,0.95960045091457
188,如何查看银行卡管理列表,0.9593801268411745
189,操作好人贷是否需要开启定位,0.9593506387944453
190,新网银行自动扣款次数,0.9592235874646682
191,为什么提示用户不存在,0.9592158743164102
192,可绑定银行卡数量上限,0.9591029274043
193,申请好人贷后为何页面显示仍可提交申请,0.9590281123501662
194,查询各类工单办理进度,0.9590168494361401
195,新网银行开户支持的证件有哪些,0.9588463246461177
196,银行卡是二类户影响扣款吗,0.9587965059094518
197,如何查询合作平台贷款是否结清,0.9587700279646127
198,好人贷不借款会产生利息或费用吗,0.9587365617679486
199,更改银行卡预留手机号的方法,0.9586122830991108
200,好人贷借款后能否修改贷款信息,0.9585325164641519
201,为何提示缺少必要参数,0.958528859763069
202,在线客服是否是人工客服,0.9585154856058297
203,诺诺发票贷的利率是多少,0.9584430750212636
204,如何查询申请相关的协议书,0.9584327589492345
205,结清贷款后什么时候可以开据结清证明,0.9584005038466917
206,系统升级会影响扣款吗,0.9583960940494034
207,申请好人贷需要开个人账户吗？,0.9582240358203487
208,未正常还款我行会进行催收吗,0.9582232868598749
209,好人贷额度必须一次性借完吗,0.9581982662084269
210,结清证明印章无法查看,0.9581082817019135
211,新网银行能否绑定云闪付,0.9580694690478544
212,提前支取时为何显示存入,0.9580452710178629
213,能否人工开据贷款证明,0.958016679517941
214,为何提示还款卡不存在,0.958002817483791
215,怎样才能成功申请到额度,0.9579554036067164
216,转账时为何提示未面核,0.957832826691923
217,为何人脸识别提示光线太足,0.957793526932516
218,随心存利率是多少,0.9576390553627483
219,征信报告是什么样的,0.9576056590283364
220,当期账单支持再分期吗,0.9575757809972119
221,选择任性还款/按期还款利息如何计算,0.9574642484366179
222,新网银行合作的存管平台有哪些,0.957378945671259
223,如何设置存管支付密码,0.9571476226505891
224,注销注册用户后是否可恢复？,0.9571320731774552
225,为何提示支付平台账户状态异常,0.9571317082252532
226,如何查看优惠券的使用情况,0.9571229522186449
227,借款时选错收款账户怎么办？,0.9570740884480589
228,为何申请好人贷无结果,0.9570592693319806
229,咨询可以发送图片吗？,0.9568885678384212
230,他人可以使用本人信息申请好人贷吗,0.956853078646766
231,客户发送截图以及个人信息等,0.9568168577053735
232,好人贷申请的渠道有哪些,0.9566988147960145
233,随心存利率为何会发生变化,0.9566699960181729
234,自助提额什么时候上线,0.956629842787346
235,月得利提前支取如何计息,0.9565323012546956
236,好人贷是否支持归还逾期部分账单,0.9564933902408036
237,美团客服热线是多少,0.9564747335221013
238,提前结清贷款后还会扣款吗,0.9564687913324903
239,季得利的操作渠道有哪些,0.9564320028716431
240,如何修改新网随心存注册号码,0.956399871322726
241,好人贷交易密码如何设置,0.9563927866230441
242,什么是银行卡预留手机号？,0.9563392355648268
243,什么是单笔借据和多笔借据,0.9562776993836773
244,好人贷申请是否可以使用临时身份证,0.9562675408870172
245,新网银行有实体卡片吗,0.9562277597393811
246,新网银行二类户如何转入/转出,0.9560867611646217
247,随心存支持提前支取吗,0.9559276651169019
248,存款产品的资金可以用于好人贷还款吗,0.9558756791641277
249,银行渠道维护是指什么,0.9558275892026721
250,密码被锁定怎么办,0.9557539728305688
251,滴水贷客服电话是多少,0.955651154964722
252,如何确保还款日当天会扣款成功,0.9556324366151292
253,实际申请金额与放款金额不一致可否取消车贷,0.9556126903821799
254,好人贷自动扣款规则,0.9556042435078025
255,好人贷定位如何开启,0.955579031508062
256,转账到新网银行如何操作,0.9555231666354091
257,如何退出微信公众号,0.9554769505025841
258,销户后为何还能解绑银行卡,0.955336569702112
259,如何修改征信上的个人信息,0.95529097482586
260,可以通过他人银行卡转入到新网银行账户吗,0.9552896870589138
261,好人贷借款记录如何查询,0.9552640828659372
262,随心存操作渠道有哪些,0.9552029867638215
263,还款日当天支持手动还款吗,0.9549820329143042
264,新网银行的活期利率是多少,0.9549014369217068
265,获取额度后多久可发起借款,0.9548819236548021
266,借款后如何判定下次还款日期,0.9548675078499654
267,好人贷审核电话是多少,0.9548328106763424
268,还款日当天是否自动扣款,0.9546988773443015
269,新网二类户可以升级为一类户吗？,0.9546602747024826
270,银行转账未到账怎么办,0.9545943589188022
271,好人贷还款后额度何时恢复,0.9543795292377147
272,新网银行账户可以设置为好人贷借/还款账户吗,0.9542046004925329
273,修改手机号码的处理时间是多久,0.9541787216308268
274,存款产品是否存满五年才能支取,0.954165126679503
275,存管提现到账时间是多久,0.9540327161913942
276,新网银行存款属于理财产品吗,0.9540092137291406
277,好人贷申请是否支持人工受理,0.9539149445952099
278,申请好人贷需要哪些资料,0.9538620831784065
279,还款后页面显示等待中,0.9537432169607877
280,登录密码为何无法重置,0.9537318960555109
281,好人贷借款如何上报征信,0.9536681642728357
282,实名认证审核时间,0.9533836343808505
283,结清证明的发送方式有哪些,0.953293286576601
284,什么是无卡支付及免密支付,0.9532824720427177
285,为何好人贷还款时提示“交易处理中”,0.9531096252608098
286,好人贷部分提前还款规则,0.95295629218154
287,好人贷还款记录如何查询,0.9529520647265449
288,优信客服电话是多少,0.952926054736101
289,是否会发生重复扣款情况,0.9528224070866462
290,补扣会影响信用吗,0.9528183474734923
291,五年定期存款的利率是多少,0.9527689416766193
292,可否取消银行卡限额,0.9527490096643514
293,存款需要先开立银行账户吗,0.9526464737662552
294,为什么收到美利车金融的短信,0.9525963042541904
295,合同为何无法打开,0.9525107294911239
296,新网银行二类户限额是多少,0.952503102359027
297,新网银行的官网地址是什么,0.9524912783684972
298,视频认证录制失败的原因是什么,0.9524630568849775
299,好人贷借款时还会审核吗,0.9524382426692076
300,结清证明的印章是否可以用公章,0.9524367569721219
301,好人贷账户如何更换手机号码,0.9523677133994785
302,银行卡还款限额是多少,0.9523524252650223
303,视频认证的步骤是什么,0.9523024712646688
304,新网银行账户可以在哪些地方使用,0.9522975104276004
305,新网银行有哪些产品可以提额,0.9522922780091456
306,页面为何无法打开,0.9521968433917376
307,如何查看贷款合同,0.952080838270468
308,好人贷扣款账户如何查看,0.951995996739179
309,目前支持的银行有哪些,0.9519701716830168
310,挖财还款是否为新网银行代扣,0.9518353187816934
311,名下所有卡被冻结后如何还款,0.9518118181009423
312,手机号无法使用为什么,0.9517317239466184
313,新网银行存款是否受保障,0.9517156217184863
314,如何把注册用户与结算用户都注销,0.9516152437225908
315,"好人贷有回访电话吗""",0.9515944078676369
316,定期存款的利率是多少,0.9515628390566089
317,为什么银行还款存在限额？,0.9514159283347712
318,周得利提前支取如何计息,0.9513951665199465
319,新网银行合作平台有哪些,0.9512715780360997
320,如何查询其他平台扣款银行卡,0.9512120591067814
321,人脸识别使用的是照片还是视频,0.9511831889706814
322,居住信息如何填写,0.9511813724970665
323,按期还款和任性还款的区别是什么,0.9511769970482478
324,如何关注新网银行公众号,0.9510911146601384
325,随心存存款期限有哪些,0.950933662385376
326,申请好人贷需要什么条件,0.9507828198758779
327,为何提示支付平台其他错误,0.9507310935296573
328,还款后为何未更新还款状态,0.9506143523080145
329,如何查看好人贷相关协议/合同？,0.9505677442739623
330,企业邮箱填写错误怎么办,0.9505205811796866
331,节假日可以操作各类存款吗,0.9503693154690536
332,申请好人贷后有没有回复,0.9502995693717042
333,周得利计息规则,0.9502837552779801
334,逾期后还款金额是否会增加,0.9502524421128177
335,随心存如何修改交易密码,0.9502069342519792
336,新网银行存款产品为何暂停交易,0.9501706684154717
337,好人贷利率为什么调高了,0.9501562203416671
338,好人贷-云闪付是什么,0.9500206434314905
339,自动扣款失败怎么办,0.9499525563115638
340,好人贷额度为什么变低了,0.9498624768269369
341,如何查询存管账户流水,0.9498579253239847
342,申请被拒怎么办,0.9498561322893062
343,好人贷与其他平台类似产品的区别是什么,0.9498411854182482
344,白骑士认证失败是什么意思,0.9497029262131479
345,为何销户后还能看到好人贷信息,0.9496937820191856
346,如何登录微信公众号,0.9496517917727477
347,活体检测失败怎么办,0.9495539718774905
348,身份证更换期间会影响好人贷贷款吗,0.9495277590125613
349,如何通过线下方式转入新网二类户,0.949464163503944
350,开具结清证明时为何无法登录,0.949438082085428
351,客服是否是随机分配,0.9494357616253969
352,为何还款后额度恢复减少了,0.9492706676018818
353,新网账户之间能否互相转账,0.949208948219145
354,好人贷账户是否为新网银行二类户？,0.9491976504782648
355,银联在线支付是什么,0.9490903834067339
356,申请好人贷使用的邮箱是公司邮箱还是个人邮箱,0.9489920815471997
357,哪些渠道可以购买京东存款产品？,0.9488202328170088
358,好人贷支持随时借款吗,0.9487575400311392
359,新网银行存款类产品有哪些,0.9487395155618784
360,好人贷申请必须使用身份证原件吗,0.9486610022950607
361,好人贷贷款利息如何计算,0.9485835760677045
362,什么是我的额度和可借额度,0.9484454148486602
363,如何查询征信报告,0.9484183772725004
364,还款记录如何查看,0.9484018489335727
365,转账到新网银行账户是否还款成功,0.9483497167186701
366,好人贷支持在国外发起借款吗,0.9481417876205831
367,电脑端可以登录好人贷吗,0.9480374237213448
368,人脸识别失败怎么办,0.9479856276547249
369,逾期未还款如何处理,0.9479566933138464
370,实名认证为什么不符,0.9478561152159113
371,为何提示该证件已被使用,0.9477609823579877
372,合作平台如何取消贷款,0.9477608608204529
373,关于客户个人信息安全问题,0.9476473142325048
374,为何结清证明显示日期与平台不符,0.9476141364209806
375,销户后是否上征信,0.9475080569813984
376,好人贷为什么无法登录,0.9474543247920308
377,提前还款有次数限制吗,0.9472007187845191
378,好人贷支持周末借款吗？,0.947194236977885
379,好人贷提前还款最低还多少,0.9471382758229999
380,如何查看好人贷还款计划,0.9471181720592519
381,自动扣款如何操作,0.9470319206521726
382,公众号如何注册,0.9470150651899734
383,下一次开放时间是什么意思,0.9468991638438826
384,提额会有通知吗,0.94687286497074
385,页面为什么异常跳转,0.9468444329763875
386,结清证明是否是还款记录证明,0.9468333882701541
387,新网银行以什么名义放款,0.9467219903122597
388,新网银行业务办理时间,0.9466916676513141
389,好人贷需要面签吗,0.9466320149523968
390,申请好人贷需要公积金、社保吗？,0.9464564649511129
391,如何更换微信号,0.946219313043341
392,他行渠道汇入新网账户的到账时间是多久,0.9459906739959486
393,申请好人贷是否都有额度,0.9459250759976162
394,存管账户充值限额,0.9459184065491238
395,抵押类贷款如何办理,0.9458718353182103
396,为何提示系统异常,0.9458143958389003
397,好事贷收取哪些费用,0.9458032267760826
398,绑定银行卡失败,0.9456480629312932
399,如何获取线上核身链接,0.9455106427231557
400,新网银行如何联系客户,0.9453624339352124
401,好人贷有回访电话吗,0.9453221719637597
402,结清证明会展示哪些信息,0.9452124766587706
403,提前还款手续费是多少,0.9448219391741136
404,存款产品如何修改手机号,0.9447105499370392
405,存管账户如何查询,0.9446864312294218
406,提前支取有限制吗,0.9446249118915677
407,好人贷上征信吗,0.944531414306461
408,系统繁忙是什么原因,0.9444419433904596
409,能否开具非恶意逾期证明,0.9443703741715442
410,在哪个平台操作提现,0.9443039893969065
411,好人贷支持随借随还吗,0.9442763524173926
412,好人贷审核不通过对个人有什么影响,0.9441138531024877
413,好人贷可以重新申请吗,0.9440045275102662
414,好人贷收取哪些费用,0.9438500901902562
415,实名认证失败的原因是什么,0.9436777843626847
