416,选择任何还款方式都可以提前还款吗,0.9436595110105191
417,存在迁户问题怎么处理,0.9436024527618376
418,好人贷个人资料如何修改,0.9433136440420498
419,能否删除个人信息,0.9433019509999759
420,还款日可以修改吗,0.943012191900574
421,查询车贷的注册手机号码是什么,0.9429919487868099
422,好人贷为什么无法借款,0.942934425809776
423,为什么无法注册,0.9429212345708643
424,可以咨询吗,0.9428926608978917
425,自动扣款时间段是多久,0.9428518124776495
426,征信是什么,0.9427308770123608
427,什么是分批次扣款,0.9423459374396671
428,好人贷申请能否撤销,0.9422584407188753
429,我行对客邮箱是多少,0.9422020105984367
430,一个身份证可以申请好人贷两次吗？,0.942012156170427
431,客户表示还款成功,0.9419192909084776
432,为何提示还款存在差错,0.9418823788312155
433,新网银行有几个网点,0.9418519107018913
434,贷款证明如何开据,0.9417444579972448
435,新网银行有信用卡吗,0.9416262068675942
436,定期存款是否有存单,0.9416230923925705
437,新网银行人工客服服务时间,0.9415972512131341
438,客户要求发送相关模板,0.9415071756027827
439,有额度不使用有什么影响吗,0.9412493443443893
440,存款产品如何重置交易密码,0.941089232056235
441,新网诺诺发票贷如何申请,0.9410801440470828
442,好人贷是否支持提前还款,0.9410790002948094
443,银行渠道维护时间一般是多久,0.9410061318966859
444,如何注销新网注册用户,0.9408817200403922
445,如何解约快捷支付？,0.9408294485215567
446,企业邮箱为何验证不了,0.9405125727096425
447,新网银行有哪些活动,0.9404133564594054
448,创客贷额度是多少,0.9403690241633244
449,黑户/白户是否可以申请好人贷,0.9403282450821827
450,好人贷有额度后如何进行贷款,0.9403206952602929
451,其他贷款怎么办理,0.9402370296101333
452,新网银行三类户是什么,0.940184149813345
453,忘记密码怎么办,0.9401723411994134
454,好人贷还款方式有哪些,0.9401413699614504
455,随心存停售后有影响吗,0.9401372199020042
456,销户后可以再开户吗,0.9400189350965179
457,好人贷能否人工操作提额,0.9399284349827941
458,定期存款到期如何支取,0.939767968843364
459,好人贷额度是否循环使用,0.9397156933939284
460,人工是否可操作扣款,0.9396458715776088
461,新网银行有企业贷款吗？,0.9396269794638399
462,什么情况算逾期,0.9396123251052089
463,新网银行有招聘吗,0.9396061462822275
464,新网银行地址在哪里,0.93946452741879
465,客户表示没有问题了,0.9393678436392341
466,核身链接失效的原因,0.9393204307180298
467,如何查询好人贷借据收款银行卡,0.9391651775319845
468,审核电话内容是什么,0.939098041991549
469,好人贷-云闪付如何提前还款,0.9390973484250287
470,人脸拍摄规范,0.9389449837421893
471,如何操作随心存大额存款,0.9386836023190138
472,节假日可以借/还款吗,0.9385099603043124
473,存款产品支取通用路径,0.938281669995148
474,新网银行行号是多少,0.9382746489469069
475,好人贷利率为什么高,0.9381766897190802
476,好人贷为什么额度低,0.9380810152937908
477,为何页面出现多个新网银行账户,0.9377681181783466
478,如何签署借款合同,0.9377092151970388
479,好人贷-云闪付如何更换收/还款银行卡,0.9374901052310731
480,如何激活新网二类户,0.9373774747538477
481,结清证明开据时间是多久,0.9370361636901882
482,好人贷能否绑定他人银行卡,0.9369513915207897
483,可否补充企业邮箱,0.9369053008379707
484,如何开据存款证明,0.9366881242518341
485,随心存T+1是什么,0.9363307839257748
486,如何查看开户结果,0.9360794235191524
487,好人贷电话回访时间,0.9359825737748563
488,注册规则是什么,0.9358098869423586
489,上传身份证时需填写的内容是什么,0.9357285086217604
490,如何注销公众号,0.9354382555437524
491,线上转入新网银行账户到账时间是多久,0.9353736084094765
492,为什么没有扣款,0.9350779886467129
493,好人贷当期能否最低还款,0.9349040154604465
494,销户与否会产生什么影响,0.9345029981723134
495,客户表示知道了,0.9342638883000411
496,我们是四川新网银行吗,0.9341134751935434
497,如何获得优惠券,0.9340374329695507
498,随心存产品停售原因,0.9338688371314108
499,随心存存入限额,0.9337992100894098
500,有多少人获得好人贷额度,0.9337543075945917
501,如何查询是否已申请好人贷,0.9336171413163932
502,如何购买新网银行存款产品,0.9335178246654652
503,新网银行是否上市,0.9332363545988042
504,能否让客服回电,0.9329931100153658
505,车贷合同里的金额是否包含利息,0.9328707644679043
506,客户表示需要考虑,0.9326118648709406
507,如何知晓已注销成功,0.9325786997931441
508,客户提到投诉,0.9321363031297634
509,如何选择按期还款/任性还款,0.932096860655751
510,新网银行好事贷如何申请,0.9318797859618303
511,好人贷通过率多少,0.9318768272362478
512,如何查询还款日,0.9317693313894165
513,好人贷年化利率是多少,0.9316940176949812
514,随心存如何计息,0.9316569221955557
515,五年定期存款是什么,0.9316037371461142
516,扣款失败的原因,0.9314102866057656
517,如何查询当期车贷还款金额,0.9311218245796133
518,好人贷申请身份证可否添加水印,0.931106619095539
519,好人贷额度是否会发生变化,0.9308223155047464
520,好人贷如何提高额度,0.9306375338928509
521,借款失败怎么办,0.9304915146002133
522,逾期造成的影响是什么,0.9301452013432417
523,存款利率是多少,0.9300207076636263
524,输入身份证号码时，为何无法输入字母,0.9300041461956712
525,如何查询账户是否冻结,0.9295314069550631
526,可以重新注册吗,0.9295282282817338
527,好人贷账户如何挂失,0.9293403454123895
528,好人贷额度他人能否使用,0.9288247015837306
529,消费凭证有效期是多久,0.9288108221883102
530,什么是风控审核中,0.9287662478167987
531,可以让别人代还款吗？,0.9286640738289864
532,什么是注册号码？,0.9286506432820302
533,开通什么业务,0.9285846941255725
534,各还款方式如何进行还款,0.9285347939695722
535,身份证过期可以申请好人贷吗,0.9284906561824016
536,如何进入好人贷页面,0.9283924532771847
537,身份证上传失败怎么办,0.928258198458932
538,开户失败原因,0.9277970574215826
539,好人贷月利率是多少,0.9269600303783141
540,额度占用问题,0.9269396567013534
541,好人贷是否有临时额度,0.9268740873106178
542,如何开立存管账户,0.9267485264200725
543,任性还款是什么,0.9267389769788531
544,好人贷借款合同有效期是多久,0.9267036051883252
545,季得利如何计息,0.9266674868820646
546,如何降低/关闭额度,0.9265399395814788
547,客户称赞服务好,0.9264874555562289
548,身份证信息变更后如何更新,0.9262125940961671
549,是否需要使用本人手机操作好人贷,0.9261472545133148
550,如何办理对公业务,0.9259630494606513
551,车贷扣款支持的银行卡有哪些,0.9258928407422325
552,好人贷是邀请制吗,0.9258709342159521
553,令牌无效是什么,0.9255905052733023
554,如何更换好人贷默认还款账户,0.9253750488019121
555,车贷合同为何无法查看,0.9252316191733311
556,按期还款是什么,0.9248737689968217
557,额度冻结是什么意思？,0.9248659300406241
558,好人贷如何降低利率,0.9246443032026384
559,随心存是什么,0.9246069274433131
560,58车金融客服电话是多少,0.9242228154963383
561,好人贷如何试算利息,0.9241838012324001
562,优惠券如何使用,0.9239901172451583
563,车贷还款记录如何查询,0.9237818249265184
564,企业邮箱格式是什么,0.9237722842355782
565,什么是综合评估,0.923591135041794
566,罚息能否减免,0.9235092166628087
567,好人贷如何实名认证,0.9235089413947372
568,密码如何修改,0.9233086556955685
569,如何更换借款收款银行卡,0.9232890506812037
570,如何录制活体检测,0.9232019654664839
571,什么情况算违约,0.9221449187792443
572,手持身份证拍照的注意事项,0.9221267078745395
573,关于消费凭证,0.921913653714891
574,新网银行APP下载,0.9219047727133978
575,客户表示不满,0.9218869696559574
576,如何办理好人卡？,0.9217472820019775
577,客户表示稍等,0.9216556495932924
578,好人贷为何无法还款,0.9200256193267996
579,如何邀请好友申请好人贷,0.9198588348570473
580,好人贷账户如何查询,0.9198508206629088
581,存款产品是否保本保息,0.9187460409350959
582,迁户是什么意思,0.9184898313966708
583,罚息介绍,0.918391406975795
584,开户是什么意思,0.9181373384831151
585,存管账户如何注销,0.9174202834534235
586,个人可以在新网开立几个账户,0.9173331432418945
587,客户表示有合作意向,0.9170638705506072
588,车贷还款只扣除部分是什么原因,0.9160364357411414
589,什么是当期账单,0.9156532265919248
590,如何查询新网账户,0.9142789226441804
591,车贷能否绑定他人银行卡,0.9142372950493985
592,好人贷还款后多久到账,0.9138831649450148
593,什么是活体检测,0.9134514314553317
594,车贷如何修改注册手机号码,0.9130351940073558
595,新网有哪些产品,0.9127600598700952
596,好人贷放款至什么账户,0.9126013295820834
597,合作平台如何还款,0.911437775415629
598,车辆信息如何查询,0.9113270635927497
599,存管是什么,0.9111444662169232
600,怎样用其他手机登录好人贷,0.9109880380665984
601,额度冻结怎么办,0.9102786174181305
602,车贷申请多久可以放款,0.9096788582634844
603,季得利是什么,0.9094715531521975
604,如何进入个人中心,0.9094519073455594
605,经侦是指什么,0.9090106137634032
606,注销账户的处理时间,0.9088520195483
607,如何查询车贷还款日,0.908775059863177
608,新网银行账户是什么,0.907470881984034
609,如何注销新网二类户,0.9071398126220588
610,什么是一、二、三类户,0.9070953897050372
611,车贷可以修改还款日吗,0.9070208730581408
612,好人贷利率是多少,0.9069537210815259
613,如何绑定银行卡,0.9069474823828759
614,好人贷的办理时间,0.9065609224116545
615,为何无法申请好人贷,0.9057878075911007
616,美利车联系电话,0.9055771617002469
617,新网银行简介,0.9053466734049512
618,车贷合同如何查看,0.9049011636832061
619,批扣时间段是多久,0.9045928402016337
620,如何冻结新网银行账户,0.9030571311334966
621,好人贷如何审核,0.9023765316305435
622,退汇是什么意思,0.9018314569671286
623,房产保证金是什么,0.900969795549994
624,好人贷如何自助提额,0.900579386751368
625,随心存如何登录,0.8996132135021574
626,好人贷审核时间是多久,0.8991206909108593
627,为何无法销户,0.8991106683393271
628,工新借是什么,0.8991032410806225
629,工新借如何申请,0.8990635886085668
630,客户提出建议,0.8974253563414982
631,好人贷额度是多少,0.8970280205662416
632,如何换绑银行卡,0.8969834468450499
633,如何在新网银行开户,0.896782002567613
634,季得利如何支取,0.8967744531586024
635,车贷利息是多少,0.8953290810526562
636,好人贷借款规则,0.8946354469492269
637,好人贷消费用途,0.8937496628918464
638,车贷收取哪些费用,0.8928945792877677
639,好人贷提额周期是多久,0.8928880076155415
640,如何解绑银行卡,0.890510885663574
641,好人贷额度有效期是多久,0.8904195346468953
642,车贷支持手动还款吗,0.8902932905032855
643,车贷如何办理解押手续,0.8896262163826217
644,什么是还款日,0.8870449770663725
645,车贷如何解绑银行卡,0.885985512818924
646,好人贷贷款期限是多久,0.8843849485894897
647,好人贷如何提前还款,0.8839330030207869
648,车贷平台如何查询,0.8836851209347454
649,可否延期还款,0.8803847738471545
650,车贷如何更换还款银行卡,0.8778366115075406
651,什么平台的贷款,0.877456560874741
652,好人贷是什么,0.8773429166635118
653,什么是登录密码,0.8734921019647924
654,可否对公还款,0.8729914038863968
655,好人贷如何主动还款,0.8729651640873789
656,车贷逾期如何还款,0.8727361512938036
657,车贷如何还款？,0.8697670660332454
658,好人贷如何申请,0.8695605053023776
659,如何增加银行卡,0.8665055976840711
660,如何删除身份证信息,0.8626942623826007
661,车贷如何提前还款,0.8565434591113638
662,车贷如何申请,0.8539636510640378
663,好人贷借款多久到账,0.8502457716182608
664,好事贷如何还款,0.8477433943010668
665,好人贷账户如何注销,0.8364638056302632
666,好人贷如何还款,0.8115422295400763
