420,一个身份证可以申请好人贷两次吗？,0.9210397418713951
421,新网银行业务办理时间,0.9209844990456287
422,忘记密码怎么办,0.920761361907014
423,新网银行如何联系客户,0.9207052490914333
424,企业邮箱格式是什么,0.9205462299345878
425,好人贷扣款账户如何查看,0.9205272783224407
426,车贷扣款支持的银行卡有哪些,0.9201386598191278
427,如何解约快捷支付？,0.9199331124514677
428,周得利提前支取如何计息,0.9198465281293791
429,好人贷个人资料如何修改,0.9198112289230231
430,输入身份证号码时，为何无法输入字母,0.9197913993606389
431,为何还款后额度恢复减少了,0.9197133907066168
432,如何查询其他平台扣款银行卡,0.9196968236373162
433,好人贷申请能否撤销,0.9195113475850845
434,好人贷还款记录如何查询,0.9194501795046801
435,车贷合同里的金额是否包含利息,0.9194399010648474
436,新网银行行号是多少,0.9187982525169448
437,好人贷贷款利息如何计算,0.9186244508822613
438,如何通过线下方式转入新网二类户,0.9185266208962343
439,周得利计息规则,0.9185250584362787
440,新网银行是否上市,0.9184236320894409
441,如何把注册用户与结算用户都注销,0.9180568948553922
442,为何销户后还能看到好人贷信息,0.9180019044818103
443,还款记录如何查看,0.9179461420678849
444,存款产品如何修改手机号,0.9179195685216126
445,定期存款是否有存单,0.917702937885187
446,随心存产品停售原因,0.9172276428037109
447,好人贷支持周末借款吗？,0.9170324980522382
448,上传身份证时需填写的内容是什么,0.917021943467954
449,好事贷收取哪些费用,0.9169305997865482
450,好人贷支持在国外发起借款吗,0.9168769509965993
451,好人贷能否绑定他人银行卡,0.916473322764477
452,什么是我的额度和可借额度,0.9162646768017898
453,好人贷收取哪些费用,0.9162445133580192
454,如何登录微信公众号,0.916207084869271
455,如何操作随心存大额存款,0.9160369569296134
456,好人贷账户如何更换手机号码,0.9157791901129796
457,新网账户之间能否互相转账,0.9157417749661759
458,可否补充企业邮箱,0.9153372459184689
459,新网银行有几个网点,0.9153111434288541
460,好人贷上征信吗,0.915283643551188
461,如何更换微信号,0.9151448443988349
462,如何查看好人贷还款计划,0.9151230751129737
463,好人贷有回访电话吗,0.9150154060142961
464,如何获取线上核身链接,0.9146483433885556
465,新网银行有招聘吗,0.914576596566658
466,如何知晓已注销成功,0.9144972153694746
467,好人贷支持随时借款吗,0.9143355780111405
468,好人贷为什么无法借款,0.9142569078036836
469,贷款证明如何开据,0.9141352270997832
470,如何查询存管账户流水,0.9140846507352284
471,好人贷通过率多少,0.9140712823024247
472,节假日可以借/还款吗,0.9140370305405169
473,客户表示知道了,0.914001147786206
474,如何关注新网银行公众号,0.9137020957095157
475,什么是分批次扣款,0.91365243342102
476,好人贷还款方式有哪些,0.9135210807699387
477,申请好人贷是否都有额度,0.9134246465950489
478,好人贷支持随借随还吗,0.9133542001113645
479,我们是四川新网银行吗,0.9132709467155092
480,注册规则是什么,0.913261418901799
481,可以咨询吗,0.9130333374247297
482,自动扣款时间段是多久,0.9127520966777353
483,新网银行人工客服服务时间,0.9126537636489785
484,如何查看开户结果,0.9125632960219338
485,可以重新注册吗,0.9124880389767801
486,如何查询征信报告,0.9121838093280562
487,客户提到投诉,0.9119700418127612
488,好人贷能否人工操作提额,0.9115933448831768
489,开户是什么意思,0.9114518603275833
490,结清证明开据时间是多久,0.9114271692927741
491,车贷还款只扣除部分是什么原因,0.9112511520209533
492,客户要求发送相关模板,0.9110470185979497
493,随心存存入限额,0.910765349125138
494,存管账户如何查询,0.9107647675618639
495,如何激活新网二类户,0.910451603149416
496,好人贷利率为什么高,0.9096799270513466
497,好人贷额度是否循环使用,0.9082330799320605
498,如何开据存款证明,0.9082122744539323
499,好人贷是否支持提前还款,0.9081368495009474
500,存款产品支取通用路径,0.9080975200346698
501,为何页面出现多个新网银行账户,0.9077872476688528
502,58车金融客服电话是多少,0.907749655960795
503,可以让别人代还款吗？,0.9077375590931062
504,如何注销新网注册用户,0.9076438175958376
505,额度冻结是什么意思？,0.9076402429803235
506,好人贷申请身份证可否添加水印,0.9075452648540976
507,如何查询账户是否冻结,0.9073178301999905
508,新网诺诺发票贷如何申请,0.9071758652336577
509,他行渠道汇入新网账户的到账时间是多久,0.9069293599872325
510,如何购买新网银行存款产品,0.9063302683318895
511,如何签署借款合同,0.9061307678085083
512,退汇是什么意思,0.9059697231065227
513,迁户是什么意思,0.9056838403554356
514,获取额度后多久可发起借款,0.9054716834956748
515,能否让客服回电,0.9054030513840102
516,额度占用问题,0.9052819552805539
517,新网银行好事贷如何申请,0.9052488700411536
518,开通什么业务,0.904922783616216
519,公众号如何注册,0.9047556897164398
520,好人贷电话回访时间,0.9043607798587463
521,其他贷款怎么办理,0.9043028165556799
522,身份证信息变更后如何更新,0.9042983586768354
523,存款利率是多少,0.9040106041785247
524,客户表示需要考虑,0.9037405878601722
525,好人贷账户如何挂失,0.9036166511324992
526,银行渠道维护时间一般是多久,0.9036106695024503
527,好人贷额度是否会发生变化,0.903506652345673
528,好人贷-云闪付如何提前还款,0.9034452644262729
529,好人贷-云闪付如何更换收/还款银行卡,0.9033079769590797
530,身份证过期可以申请好人贷吗,0.9025413767628989
531,如何查询好人贷借据收款银行卡,0.9014401140756985
532,什么是注册号码？,0.9014108764019495
533,什么是活体检测,0.9012561198469156
534,创客贷额度是多少,0.9012037718932416
535,好人贷如何实名认证,0.9011291949106625
536,客户称赞服务好,0.9010941783880564
537,如何注销公众号,0.9010494167970833
538,如何获得优惠券,0.9008913796774743
539,随心存是什么,0.900840217126336
540,好人贷是邀请制吗,0.9005698795640301
541,随心存如何计息,0.9000336641669975
542,好人贷当期能否最低还款,0.8999253594599033
543,车贷还款记录如何查询,0.8999038370392896
544,好人贷如何降低利率,0.8995318728863609
545,如何办理对公业务,0.8994564044505552
546,密码如何修改,0.8993385271428996
547,如何查询当期车贷还款金额,0.8986787248112826
548,如何查询是否已申请好人贷,0.8985545688805839
549,五年定期存款是什么,0.8985089529838886
550,车贷能否绑定他人银行卡,0.8977537629617958
551,什么是综合评估,0.8976990253356535
552,任性还款是什么,0.8973303996608198
553,如何录制活体检测,0.8973114949364063
554,消费凭证有效期是多久,0.8972818798419369
555,好人贷额度他人能否使用,0.8969726061408082
556,好人贷有额度后如何进行贷款,0.8968462898981898
557,罚息介绍,0.8967421785568608
558,是否需要使用本人手机操作好人贷,0.8965002822487345
559,优惠券如何使用,0.8963013517833242
560,如何办理好人卡？,0.8961712009914886
561,有多少人获得好人贷额度,0.8961126398536963
562,按期还款是什么,0.8958396900577994
563,如何开立存管账户,0.8957185603070295
564,如何更换好人贷默认还款账户,0.8953878376444181
565,季得利如何计息,0.894931903582407
566,定期存款到期如何支取,0.8948572075021193
567,好人贷借款合同有效期是多久,0.8948099653964574
568,线上转入新网银行账户到账时间是多久,0.8944002523528665
569,经侦是指什么,0.8943885532626379
570,如何查询还款日,0.8942803017300028
571,存管是什么,0.8942023105844404
572,好人贷年化利率是多少,0.8927792512763937
573,手持身份证拍照的注意事项,0.8921127004028844
574,美利车联系电话,0.8919844021658243
575,车贷可以修改还款日吗,0.8915144803945421
576,客户表示稍等,0.8914819630281844
577,客户表示有合作意向,0.8914420335982671
578,新网有哪些产品,0.8914364637036286
579,车贷合同如何查看,0.8912912951613576
580,如何选择按期还款/任性还款,0.8909887686394226
581,如何降低/关闭额度,0.8908088324093203
582,车辆信息如何查询,0.8902437665603739
583,好人贷为何无法还款,0.8895034482967312
584,存款产品是否保本保息,0.8893020049030046
585,好人贷为什么额度低,0.8891013792808671
586,好人贷如何提高额度,0.8883097500743967
587,如何进入好人贷页面,0.8881628198856595
588,各还款方式如何进行还款,0.8876604737005431
589,新网银行APP下载,0.8873883419801638
590,什么是当期账单,0.8871854593565422
591,车贷如何修改注册手机号码,0.8868137617399168
592,好人贷如何试算利息,0.8865571162060122
593,好人贷月利率是多少,0.886404974953882
594,合作平台如何还款,0.8860012391143662
595,好人贷是否有临时额度,0.8859263882483134
596,新网银行账户是什么,0.8851554047672482
597,如何更换借款收款银行卡,0.8849166803835075
598,关于消费凭证,0.8832472345068283
599,什么是一、二、三类户,0.8817568984102935
600,如何进入个人中心,0.8816304585265885
601,如何注销新网二类户,0.881230148187449
602,季得利是什么,0.880309378104613
603,如何邀请好友申请好人贷,0.8795913897243116
604,存管账户如何注销,0.8792353397553133
605,好人贷账户如何查询,0.8791407967847863
606,房产保证金是什么,0.8789898037515945
607,如何查询车贷还款日,0.8784555311491812
608,随心存如何登录,0.8783034026677453
609,车贷申请多久可以放款,0.8781158008278594
610,个人可以在新网开立几个账户,0.8773489420284785
611,怎样用其他手机登录好人贷,0.8765192642085587
612,为何无法销户,0.8763139115604037
613,如何绑定银行卡,0.8760202540162769
614,车贷支持手动还款吗,0.875829292929074
615,车贷收取哪些费用,0.875138192556259
616,好人贷利率是多少,0.8742363791193046
617,好人贷放款至什么账户,0.873889900570999
618,好人贷如何审核,0.8730292703492546
619,新网银行简介,0.8728389754854318
620,批扣时间段是多久,0.8719144602127106
621,额度冻结怎么办,0.871665195301053
622,车贷如何办理解押手续,0.8705881555895563
623,为何无法申请好人贷,0.870525826526182
624,好人贷还款后多久到账,0.8700827751545724
625,车贷利息是多少,0.8698375504398956
626,如何冻结新网银行账户,0.8684721317311764
627,如何换绑银行卡,0.8682424797720294
628,如何查询新网账户,0.8681393697550807
629,工新借是什么,0.8677427089813945
630,如何在新网银行开户,0.8674071254091323
631,好人贷审核时间是多久,0.8657524458003637
632,好人贷借款规则,0.8652039664303159
633,注销账户的处理时间,0.8632091017639902
634,车贷平台如何查询,0.8621831255718133
635,好人贷的办理时间,0.8613464149168644
636,什么是登录密码,0.8605945859622676
637,客户提出建议,0.8603724873321787
638,季得利如何支取,0.8590864919114695
639,如何解绑银行卡,0.858913821171052
640,车贷如何解绑银行卡,0.8578594862034168
641,什么是还款日,0.8571358977906165
642,工新借如何申请,0.8565980270488397
643,好人贷如何自助提额,0.8551497173512205
644,好人贷消费用途,0.8529806356170931
645,好人贷额度是多少,0.8523700760183827
646,好人贷额度有效期是多久,0.8474865680322311
647,车贷如何更换还款银行卡,0.8459552594200838
648,可否对公还款,0.844253534640588
649,车贷逾期如何还款,0.8434239610409032
650,车贷如何还款？,0.8423496278869791
651,可否延期还款,0.8412550686950239
652,好人贷提额周期是多久,0.8396446277161873
653,好人贷是什么,0.8394254968373851
654,好人贷如何提前还款,0.8392520127070905
655,好人贷贷款期限是多久,0.8382575203683579
656,好人贷如何主动还款,0.8339038015667299
657,如何删除身份证信息,0.8329530993702706
658,如何增加银行卡,0.8287211166636852
659,车贷如何提前还款,0.8275765997825527
660,什么平台的贷款,0.8267804669040595
661,好人贷如何申请,0.8231522904732304
662,车贷如何申请,0.8171913030266007
663,好事贷如何还款,0.8056933481173467
664,好人贷借款多久到账,0.8011487032676461
665,好人贷账户如何注销,0.7911005064584783
666,好人贷如何还款,0.7626620569802555
