0,绑卡不成功姓名与卡号不符合,1.0
1,银行卡挂失会影响自动扣款吗,0.9734910725262558
2,收款卡发卡行拒绝放款失败什么意思？,0.9730034801577547
3,银行卡是二类户影响扣款吗,0.9707054352865425
4,为何之前绑定的银行卡不支持扣款了,0.9701141041496115
5,好人卡绑定云闪付/微信等失败怎么办,0.9694796598041597
6,更换银行卡会影响自动扣款吗,0.9693602373545527
7,绑卡时页面上的银行卡预留手机号码可以修改吗,0.9692129366481337
8,为何提示交易密码验证失败,0.9692083935203633
9,绑定银行卡失败,0.9690244244829218
10,页面为何提示“开户失败”、“账户存在异常操作/账户异常”,0.9685551758900056
11,白骑士认证失败是什么意思,0.9684301038350559
12,交易密码无法设置,0.9673696124261928
13,绑定银行卡产生费用吗,0.966591700456351
14,手机号归属地与定位地不一致是否有影响,0.9662731220811447
15,为什么拍照认证时总是不成功或显示系统崩溃,0.9656604015403668
16,为何提示支付平台该客户无默认扣款卡，交易没有发给统一支付,0.9654819493379274
17,为何提示支付平台受发卡行资金用途限制拒绝交易,0.9649542497855552
18,支持绑定的银行卡类型有哪些,0.9648475934750637
19,补扣会影响信用吗,0.9644841100659873
20,系统升级会影响扣款吗,0.9644597375090438
21,未接到好人贷回访电话会被拒吗,0.9642994338022186
22,进入随心存为何提示手机号码不一致,0.9640324741702172
23,好人贷注册手机号与银行卡预留手机号是否需要一致？,0.9637332917276595
24,手机获取验证码失败,0.9636987224307051
25,为何提示支付平台银行卡未开通银联无卡认证支付,0.9633206545535842
26,实名认证失败的原因是什么,0.9631662781593175
27,视频认证录制失败的原因是什么,0.9630275079118278
28,银行渠道维护无法操作怎么办,0.962979554720639
29,线上开据证明为何和征信金额不符,0.9627407199084927
30,存管密码被锁定怎么办,0.962198879814441
31,半年得利提前支取影响已发放利息吗,0.9621303705487265
32,获取验证码次数超限怎么办,0.9620637881071268
33,未正常还款我行会进行催收吗,0.9619364671872516
34,为何提示支付平台不允许持卡人进行的交易,0.9617274327203384
35,季得利提前支取影响已发放利息吗,0.9612829647132437
36,为何存管查询提示没有密码,0.9612009585353927
37,为何同时收到了还款成功和失败的短信,0.9609387366042588
38,新网银行发送的短信验证码的有效时长？,0.9604850000763748
39,无法提供消费凭证可以取消贷款吗,0.9604369903819715
40,好人贷只能通过绑定的银行卡还款吗,0.9603848189291687
41,贷款证明开据失败怎么办,0.959994953915167
42,修改手机号码/微信号是否会影响自动扣款,0.959975191189296
43,为何存管信息与平台显示不一致,0.9599304604556519
44,为何提示支付平台持卡人信息有误,0.9595652725662303
45,结清证明印章无法查看,0.9595285107412733
46,好人贷审核不通过对个人有什么影响,0.9592966359135987
47,为何提示支付平台签约关系不存在,0.9592334355219272
48,注册手机号及微信号需要实名制吗,0.9591811555314685
49,借款成功会有短信等提醒吗,0.959165075449194
50,提前还款会影响个人征信吗,0.9587770455858535
51,好人贷为什么提示“账户存在异常操作”,0.9583043968920357
52,好人贷申请成功会有短信通知吗,0.9582546114834938
53,通过本人微信找回密码是指什么,0.9582251674913538
54,平台方手机号变更导致我行无法直接开据结清证明问题,0.9581801696345208
55,借款到账后页面未更新借款状态,0.9581618053966957
56,转入新网银行使用的密码是交易密码还是银行卡密码,0.9581147266957953
57,为何图文验证码输入正确却提示错误,0.9579406671197662
58,修改手机号后是否需要重置登录密码,0.9578131585496409
59,为何提示支付平台发卡行拒绝,0.9576409838488908
60,实名认证是否查询征信,0.9575858173527858
61,为何征信上的放款日期与实际借款日期不一致,0.9575658861965667
62,实名认证为什么不符,0.9575123698293798
63,自动扣款失败怎么办,0.9573783608938793
64,为何重置密码后仍提示密码错误,0.9568359410730851
65,存管查询为何提示用户不存在或者信息有误,0.9567894656897432
66,借款合同是否有展示提前还款会收取违约金的情况,0.9565122538793113
67,新网银行二类户与好人贷是否为同一个手机号码,0.9562367526126138
68,企业邮箱填写错误怎么办,0.9558272655603112
69,扣款结果会有短信提示吗,0.955794977765619
70,银行卡开通银联在线支付后是否可正常还款,0.9557032641436862
71,好人贷必须绑定银行卡使用吗,0.9552676347676147
72,新网银行人工客服电话打不通,0.9551968592776552
73,为何提示用户未实名认证,0.9551547790355529
74,可否按照征信订单号开据证明,0.9547410998267388
75,扣款失败的原因,0.9545014197997413
76,购买存款页面为何提示“额度不足，无法购买”,0.9544337766623109
77,线上是否可开据征信版结清证明,0.954320518451124
78,企业邮箱验证码可否重新获取,0.9541996985238751
79,开据证明时为何需要实名认证,0.9539931690893941
80,核身链接失效的原因,0.9536462409363559
81,登录时的图文验证码是否区分大小写,0.9535270020332298
82,线上开据证明有次数限制吗,0.9535173452437583
83,公众号页面的“我的排号”是什么意思,0.9534906132519263
84,人脸识别失败怎么办,0.9534832615507369
85,平台还款信息为何与新网银行不一致,0.9531458213017691
86,接收短信的手机号是否为注册手机号,0.9529900691567107
87,为何提示支付平台当日交易次数超限,0.9529847969954396
88,登录密码为何无法重置,0.9522454473602031
89,为何提示不具备开具资格,0.9521909345962287
90,我行放款的其他平台借款会上报征信吗,0.9521154543457757
91,是否会发生重复扣款情况,0.9520098673099762
92,企业邮箱为何验证不了,0.9519424874311981
93,注册手机号更换成功后何时可以正常使用,0.9519281419268806
94,活体检测失败怎么办,0.9516859577679424
95,微信号更换成功后何时可以正常使用,0.9516226777687531
96,好人贷申请需要填写哪些个人信息,0.9515944022311806
97,为何征信上有新网上报的贷款记录,0.9514609480249016
98,好人贷审核时是否给填写的联系人去电,0.9513181982800968
99,开户失败原因,0.9511750559475379
100,密码被锁定怎么办,0.9510847695414884
101,为何提示支付平台暂不支持的银行或限额,0.9510803293320191
102,贷款证明的电子章是否具有法律效应,0.9510257875686196
103,微信/支付宝等可否与新网银行账户互相绑定,0.9509130623265445
104,新网银行合作的存管平台有哪些,0.9508434929081924
105,好人贷借款超时未到账如何处理,0.9508130695789392
106,为何提示还款卡不存在,0.950807217788414
107,新网账户绑定微信/支付宝后支持提现或充值吗,0.9506803577918504
108,好人贷只能使用微信登录吗？,0.9505130134458428
109,联系新网银行客服有哪几种方式,0.9504940650894044
110,征信上显示的贷款金额是否包含利息,0.9504008994119002
111,新网银行以何名义查询征信,0.9503633835077676
112,好人贷注册手机号无法使用,0.9502883441361158
113,电话客服是否可以受理结清证明,0.9502048273899599
114,结清贷款后征信上是否会显示结清,0.9500848390051494
115,新网银行扣款通道是什么,0.9500722501293054
116,随心存可以在我行公众号查询/操作吗,0.9500505374908529
117,为何征信上有新网银行的贷款审批记录,0.9499891459802547
118,新网银行视频认证的QQ号码是多少,0.9499327629183635
119,为何收到新网银行逾期提醒短信,0.9498438192200703
120,为什么点击拍照没有反应,0.9494898652563868
121,新网银行有实体卡片吗,0.9492896329129474
122,为何提示支付平台其他错误,0.9492160719616856
123,好人贷申请是否查询芝麻信用,0.9492043550813245
124,贷款结清之后能否删除贷款记录,0.9491352083532323
125,为什么提示用户不存在,0.9486358879658692
126,非绑定银行卡可否与新网二类户转账,0.9485477701690419
127,为何提示支付平台账户余额不足,0.9484834879403803
128,查询结清证明申请是否已提交,0.9484372482925889
129,新办的手机号可以申请好人贷吗,0.9484041119063533
130,能否开具非恶意逾期证明,0.9483026276035863
131,为何提示支付平台渠道不支持的银行,0.948161289443282
132,手机号无法使用为什么,0.9480521586479957
133,好人贷手动还款时为何提示批次执行中,0.9480310586443627
134,为何无法登录存管查询,0.9479216884563498
135,新网二类户转入/转出收取手续费吗,0.9478913461931879
136,好人贷支持扣款的银行有哪些,0.9476231103928627
137,拨打我行人工客服电话是否收费,0.9473974841365335
138,如何查看手机号是否实名制,0.9473889063191956
139,客服能否查看聊天记录,0.9472066790813237
140,是否可以取消自动扣款,0.9469271391137365
141,好人贷被拒后为何没有下次开放时间,0.9468800117313722
142,在线客服是否是人工客服,0.9466755143674674
143,为什么收到提额短信但额度未提升,0.946651859062591
144,申请好人贷必须填写联系人信息吗,0.9465625837594895
145,优信扣款成功后为何显示待还款,0.9464937331178086
146,平台方提供的客户审批资料能否提供给客户,0.9463236267137117
147,为什么好人贷第一期还款金额与之后不一致,0.9463153842948246
148,为何提示支付平台交易金额超限,0.9462275616576822
149,还款银行卡是否需要开通银联在线支付业务,0.9462225425071622
150,为什么提前还款显示联合贷批次执行中？,0.9462164066936061
151,转账时为何提示未面核,0.9460083881251797
152,审核电话可更改接听电话吗,0.9459677571031893
153,开据证明为何显示没有符合要求的订单,0.9457991231064149
154,为何提示支付平台账户状态异常,0.9457650911876458
155,新网二类户上的资金是否计息,0.9456672053498358
156,为何申请好人贷后显示未获取额度,0.9456255658650659
157,可绑定银行卡数量上限,0.9455909659118684
158,随心存停售后有影响吗,0.9455413471063258
159,提前结清贷款后还会扣款吗,0.9454702600727997
160,为何征信上有新网银行上报的逾期,0.9454495684067338
161,为何申请好人贷页面显示暂无资格,0.9454088777733226
162,如何取消征信查询及使用授权书,0.9453354423405577
163,结清证明的印章是否可以用公章,0.9452209522012002
164,为何人脸识别提示光线太足,0.945190027968524
165,开具结清证明时为何无法登录,0.9450863016926304
166,存管查询的余额如何提现,0.9449999739666568
167,操作好人贷是否需要开启定位,0.9449487393975818
168,新网银行开户支持的证件有哪些,0.9447512785430023
169,好人贷不借款会产生利息或费用吗,0.9446997866087198
170,申请诺诺发票贷需要什么条件,0.9446613826316519
171,新网二类户可以升级为一类户吗？,0.9445790662718714
172,更改银行卡预留手机号的方法,0.9445299346666608
173,随心存操作渠道有哪些,0.9445281066045866
174,注销注册用户后是否可恢复？,0.9444671152176921
175,再次申请好人贷会查询征信吗,0.9444427099268402
176,合同为何无法打开,0.944377444219311
177,新网银行人工客服电话是多少,0.9443678166946169
178,申请好人贷没有公司邮箱怎么办,0.9443398200939844
179,定期存款操作的渠道有哪些,0.9442328790436192
180,好人贷交易密码如何设置,0.9441087104375893
181,为何提示支付平台支取金额超过可用余额,0.9438645076151202
182,好人贷授信首页显示利率是否为固定利率,0.9435806331084257
183,申请好人贷后，可否更改授信结果,0.9435158058178553
184,京东存款是否支持提前支取/提前部分支取？,0.9434452140379485
185,好人贷提额会查询征信吗,0.9430303392008474
186,随心存如何修改交易密码,0.9429691984742411
187,在线咨询是否支持客户发送语音,0.9428430376014056
188,开据证明时为何提示账户存在异常,0.9427854613380044
189,好人贷借款金额与到账金额是否一致,0.9427447562045066
190,可以查询个人信息资料吗？,0.9427344479593276
191,结清证明的发送方式有哪些,0.9426516942200514
192,征信报告是什么样的,0.9426240947607492
193,季得利的操作渠道有哪些,0.9425814411661908
194,新网银行公众号如何取消关注,0.9425026043250897
195,页面为什么异常跳转,0.9424757135088622
196,新网二类户为何无法转入/转出,0.942248566741161
197,申请好人贷有区域或者号段等限制吗,0.9420811638188352
198,客服能否看到客户申请好人贷的信息,0.9419005093766741
199,新网二类户转入/转出有时间限制吗,0.9418984403097437
200,好人贷以什么贷款类型上报人行征信？,0.94185706411198
201,新网银行能否绑定云闪付,0.941767967566229
202,为何提示缺少必要参数,0.9417520208356392
203,客户咨询其他平台催收问题,0.9417160465383664
204,客户催促需要加急办理,0.9416184421701187
205,新网银行自动扣款次数,0.9415818186410931
206,如何修改实名认证手机号码,0.9415095932656854
207,结清贷款后什么时候可以开据结清证明,0.9413008788893209
208,新网银行合作平台有哪些,0.9412109909364064
209,新网银行账户的交易记录如何查看,0.9410282523224317
210,随心存利率为何会发生变化,0.9409638678133609
211,如何设置存管支付密码,0.9409359319808535
212,好人贷审核电话是多少,0.9408770570246886
213,京东存款为什么显示当日额度为什么已售罄？,0.9408364274988753
214,实名认证审核时间,0.9407609726743904
215,什么是无卡支付及免密支付,0.9404976265239076
216,为何结清证明显示日期与平台不符,0.9404334743890871
217,京东存款如何修改注册手机号码,0.9404062796177154
218,能否删除个人信息,0.9401531376648572
219,可否取消银行卡限额,0.9400646228559845
220,实际申请金额与放款金额不一致可否取消车贷,0.9400531261707259
221,新网银行自动扣款时间,0.9400280584351435
222,好人贷支持微信/支付宝扣款吗,0.9399780713704692
223,名下所有卡被冻结后如何还款,0.9399498146342253
224,挖财还款是否为新网银行代扣,0.9399163606467467
225,新网银行存款是否受保障,0.9397853773880536
226,人脸识别使用的是照片还是视频,0.9397775896090338
227,随心存利率是多少,0.9397608909241995
228,银行渠道维护是指什么,0.9397476708628892
229,银联在线支付是什么,0.9397251436542944
230,逾期后还款金额是否会增加,0.9397248503868427
231,转账到新网银行如何操作,0.9396899342282123
232,银联在线支付如何开通,0.9393331573273697
233,为何无法提交好人贷申请资料,0.9393199245610071
234,如何查看银行卡管理列表,0.9391460056948143
235,关闭其他平台额度后，能否恢复好人贷额度,0.9390136782647479
236,申请好人贷需要下载APP吗？,0.9389255386039347
237,如何查询好人贷申请的授信结果,0.938914598007463
238,使用优惠券后提前还款利息如何计算,0.9388903719695821
239,新网银行有哪些产品可以提额,0.9388858196419042
240,好人贷账户是否为新网银行二类户？,0.9387681494685962
241,还款金额超银行卡限额怎么办,0.9384324456251156
242,滴水贷客服电话是多少,0.9383837435928267
243,如何查询是否开通银联在线支付,0.9383577123070928
244,客户发送截图以及个人信息等,0.9382653825868178
245,公众号是否有还款提示,0.9382406096193434
246,可以查询注册手机号码吗,0.938239847697183
247,如何查询合作平台贷款是否结清,0.9380979713415262
248,咨询可以发送图片吗？,0.9380152014482502
249,五年定期存款支持提前支取吗,0.9379891818950514
250,好人贷是否支持归还逾期部分账单,0.9379785089550154
251,新网银行二类户如何转入/转出,0.9379070990258769
252,如何查看委托支付协议,0.9377788394185441
253,什么是银行卡预留手机号？,0.93764811621711
254,有额度不使用有什么影响吗,0.9374853431294529
255,关于客户个人信息安全问题,0.9374807425381964
256,申请好人贷需要开个人账户吗？,0.9374208652873156
257,随心存支持提前支取吗,0.9373693380233803
258,新网银行二类户限额是多少,0.937143869959078
259,新网银行的官网地址是什么,0.937119225191659
260,当期账单支持再分期吗,0.9369762650776368
261,存款页面是否会显示每日收益,0.9368458678164794
262,随心存如何查看收益情况,0.9368273489524335
263,客服是否是随机分配,0.9366808952949042
264,为何提示系统异常,0.936658543411434
265,页面为何无法打开,0.936454776698891
266,什么情况算违约,0.9364288645349679
267,为何提示还款存在差错,0.9363119425418658
268,存在迁户问题怎么处理,0.9361614528952544
269,京东存款的计息规则及计息公式,0.93600908359749
270,申请好人贷工作信息如何填写,0.9360036065338059
271,他人可以使用本人信息申请好人贷吗,0.9359290893611381
272,借款时选错收款账户怎么办？,0.9358824530733164
273,美团客服热线是多少,0.9358659337246547
274,如何修改征信上的个人信息,0.9357917007756084
275,可以通过他人银行卡转入到新网银行账户吗,0.9357383166535439
276,诺诺发票贷的利率是多少,0.9357129284474884
277,新网银行存款类产品有哪些,0.9356983162217138
278,好人贷借款后能否修改贷款信息,0.9355739030263109
279,好人贷是否支持提前还当期账单,0.9355226825834039
280,如何查看随心存购买情况,0.935441569135096
281,新网银行存款产品为何暂停交易,0.935297534179513
282,身份证更换期间会影响好人贷贷款吗,0.9351668085330389
283,销户后为何还能解绑银行卡,0.9350186000089208
284,如何修改存管账户预留手机号码,0.9350047823095955
285,下一次开放时间是什么意思,0.9349529737001201
286,验证码发送至什么手机号,0.9348881580790692
287,系统繁忙是什么原因,0.934817413465668
288,如何查询转账到新网银行的记录,0.9347659015136228
289,如何查看好人贷相关协议/合同？,0.9347498508748011
290,好人贷自动扣款规则,0.9345445559940813
291,线下转账如何填写新网银行开户信息,0.9345432855519605
292,新网银行账户可以在哪些地方使用,0.9345227505270879
293,如何确保还款日当天会扣款成功,0.934502776204456
294,为何收到新网银行还款短信,0.9344067218477736
295,好人贷如何查看所支持的还款方式,0.9343700142804183
296,好人贷为什么无法登录,0.9340864171649211
297,视频认证的步骤是什么,0.9339875510534411
298,能否人工开据贷款证明,0.9338559869917338
299,还款日可以修改吗,0.9338499402440613
300,新网银行存款属于理财产品吗,0.9336896012762567
301,为何申请好人贷无结果,0.9336729869598804
302,节假日可以操作各类存款吗,0.9336446252763679
303,逾期造成的影响是什么,0.9335678868766377
304,为什么取消了提前部分还款,0.9335633342819364
305,好人贷申请的渠道有哪些,0.9332359171718047
306,如何查看优惠券的使用情况,0.9331904122295915
307,银行卡还款限额是多少,0.9331813585788696
308,还款日当天支持手动还款吗,0.9330761834289647
309,随心存提前支取到账时间,0.9330524349708059
310,好人贷申请是否可以使用临时身份证,0.9330447488689637
311,我行对客邮箱是多少,0.9329621744534635
312,存款产品的资金可以用于好人贷还款吗,0.9327880948843474
313,身份证上传失败怎么办,0.9326736304559313
314,新网银行的活期利率是多少,0.9326061539648628
315,申请好人贷后有没有回复,0.9325038540688577
316,征信上报周期及更新时间,0.9324846524008586
317,存款产品如何重置交易密码,0.9324737039504182
318,如何修改新网随心存注册号码,0.932429431226187
319,如何更改其他平台的注册手机号码,0.9322987490618961
320,逾期未还款如何处理,0.9322941908096013
321,优信客服电话是多少,0.9320929537086938
322,结清证明是否是还款记录证明,0.9318713652010209
323,按期还款和任性还款的区别是什么,0.9318630962394918
324,目前支持的银行有哪些,0.9318393419152345
325,申请好人贷需要公积金、社保吗？,0.9316162161088515
326,如何查询申请相关的协议书,0.9314623194375977
327,为何好人贷还款时提示“交易处理中”,0.9314113601054528
328,审核电话内容是什么,0.931409603456327
329,提前支取有限制吗,0.9312089425365044
330,存款产品是否存满五年才能支取,0.9311228383087223
331,银行转账未到账怎么办,0.9310198586156524
332,查询各类工单办理进度,0.9306165255040177
333,怎样才能成功申请到额度,0.9305786641082157
334,好人贷借款时还会审核吗,0.9305401340959486
335,新网银行有信用卡吗,0.9302570205422183
336,申请创客贷需要什么条件,0.9301615505816335
337,为何按期还款只能选择部分贷款期限,0.929984773203651
338,好人贷与其他平台类似产品的区别是什么,0.9299786707137844
339,结清证明会展示哪些信息,0.9299138530987939
340,提前还款有次数限制吗,0.9297624871499731
341,在哪个平台操作提现,0.929751375324438
342,电脑端可以登录好人贷吗,0.9297270562151406
343,什么是单笔借据和多笔借据,0.9295773729924187
344,申请被拒怎么办,0.929554154137844
345,提前还款手续费是多少,0.9294488994630314
346,提前支取时为何显示存入,0.9293149684471697
347,申请好人贷后为何页面显示仍可提交申请,0.9292603195817108
348,客户表示没有问题了,0.9290195005853097
349,新网银行账户可以设置为好人贷借/还款账户吗,0.9288894937946705
350,存款需要先开立银行账户吗,0.9286949793667287
351,随心存存款期限有哪些,0.9284663471316933
352,为什么无法注册,0.928453043710671
353,为什么银行还款存在限额？,0.9283977249000945
354,新网银行三类户是什么,0.9281279844480634
355,好人贷申请是否支持人工受理,0.9280834948231573
356,好人贷需要面签吗,0.927987240986196
357,合作平台如何取消贷款,0.9277774811131168
358,随心存到期后何时到账,0.9276933203426957
359,令牌无效是什么,0.9274711091017014
360,为什么收到美利车金融的短信,0.9274186190091795
361,客户表示还款成功,0.9274034512709819
362,自动扣款如何操作,0.9270874564980568
363,好人贷提前还款最低还多少,0.927085302194181
364,还款后页面显示等待中,0.926992293305773
365,选择任何还款方式都可以提前还款吗,0.9267104981994412
366,存管提现到账时间是多久,0.9267014975243301
367,好人贷利率为什么调高了,0.9266982975552773
368,好人贷额度必须一次性借完吗,0.9265700444115125
369,借款后如何判定下次还款日期,0.9265216974844332
370,为何提示该证件已被使用,0.926379076750768
371,还款日当天是否自动扣款,0.9263397665720094
372,转账到新网银行账户是否还款成功,0.926285198601035
373,借款失败怎么办,0.9262450930781281
374,好人贷定位如何开启,0.9260787778163514
375,提额会有通知吗,0.9260175732325399
376,申请好人贷需要哪些资料,0.9259196415031674
377,新网银行地址在哪里,0.9256707266673573
378,月得利提前支取如何计息,0.9256306626458934
379,如何退出微信公众号,0.9252990939704633
380,销户与否会产生什么影响,0.9252795894151916
381,哪些渠道可以购买京东存款产品？,0.9251588007898041
382,好人贷还款后额度何时恢复,0.9251123161295183
383,黑户/白户是否可以申请好人贷,0.9247270279315053
384,申请好人贷使用的邮箱是公司邮箱还是个人邮箱,0.9246820361339273
385,申请好人贷需要什么条件,0.9244153115097189
386,好人贷借款记录如何查询,0.9242773205170062
387,人脸拍摄规范,0.924215477460661
388,好人贷部分提前还款规则,0.9242099745403745
389,新网银行有哪些活动,0.9241677328994551
390,五年定期存款的利率是多少,0.9240198714181281
391,选择任性还款/按期还款利息如何计算,0.9239775403918863
392,新网银行有企业贷款吗？,0.9239357106766937
393,还款后为何未更新还款状态,0.9239185479531443
394,修改手机号码的处理时间是多久,0.9239066308293834
395,为什么没有扣款,0.9238890967759349
396,征信是什么,0.923653857519681
397,自助提额什么时候上线,0.9236129115454589
398,什么情况算逾期,0.9234849330235658
399,好人贷可以重新申请吗,0.9234511548726179
400,人工是否可操作扣款,0.9234189956575583
401,好人贷额度为什么变低了,0.9232492857321788
402,销户后可以再开户吗,0.9231151904155915
403,什么是风控审核中,0.9229723462429215
404,销户后是否上征信,0.9228539771170026
405,居住信息如何填写,0.9228390297813484
406,好人贷借款如何上报征信,0.9225666481956083
407,客户表示不满,0.922526467984776
408,"好人贷有回访电话吗""",0.9224855314738689
409,好人贷-云闪付是什么,0.9224228862385562
410,罚息能否减免,0.922399258367503
411,随心存T+1是什么,0.9221042068530415
412,存管账户充值限额,0.9219675989780379
413,定期存款的利率是多少,0.9218828101156324
414,车贷合同为何无法查看,0.9217837465609521
415,好人贷申请必须使用身份证原件吗,0.9216527962760284
416,查询车贷的注册手机号码是什么,0.9215829615084303
417,如何查看贷款合同,0.9213432176026822
418,抵押类贷款如何办理,0.9211139917667042
419,新网银行以什么名义放款,0.9210864012049642
