0,首次登录的号码不是车贷合同号码,1.0
1,查询车贷的注册手机号码是什么,0.97622040250666
2,绑卡时页面上的银行卡预留手机号码可以修改吗,0.9705287371670326
3,平台还款信息为何与新网银行不一致,0.9681232187529764
4,实际申请金额与放款金额不一致可否取消车贷,0.9680261000377357
5,平台方手机号变更导致我行无法直接开据结清证明问题,0.9680222217762591
6,好人贷注册手机号与银行卡预留手机号是否需要一致？,0.9678351445421653
7,注册手机号及微信号需要实名制吗,0.9671578888776907
8,新网银行发送的短信验证码的有效时长？,0.9668497787610236
9,进入随心存为何提示手机号码不一致,0.9664451495587956
10,页面为何提示“开户失败”、“账户存在异常操作/账户异常”,0.9660445595275008
11,为什么提前还款显示联合贷批次执行中？,0.9659732434588482
12,为何征信上的放款日期与实际借款日期不一致,0.9658262798361351
13,线上开据证明为何和征信金额不符,0.9657324308524873
14,为何存管查询提示没有密码,0.965612421799432
15,我行放款的其他平台借款会上报征信吗,0.965574936853372
16,可否按照征信订单号开据证明,0.965470063417527
17,注册手机号更换成功后何时可以正常使用,0.9653913974410595
18,京东存款如何修改注册手机号码,0.9652157756861129
19,借款到账后页面未更新借款状态,0.9650785709176816
20,为何提示支付平台该客户无默认扣款卡，交易没有发给统一支付,0.9650733360766615
21,为什么收到美利车金融的短信,0.9650475492519814
22,转入新网银行使用的密码是交易密码还是银行卡密码,0.9647960085258197
23,新网银行扣款通道是什么,0.9646881685665354
24,为何同时收到了还款成功和失败的短信,0.9644271162162673
25,为何征信上有新网上报的贷款记录,0.9642940994704824
26,好人贷只能通过绑定的银行卡还款吗,0.9642468584896744
27,新网银行视频认证的QQ号码是多少,0.9640666357801672
28,好人贷手动还款时为何提示批次执行中,0.9640656236264434
29,新办的手机号可以申请好人贷吗,0.9638496073150983
30,借款合同是否有展示提前还款会收取违约金的情况,0.9636194074035112
31,车贷合同为何无法查看,0.9635538569844563
32,为何之前绑定的银行卡不支持扣款了,0.963510652202489
33,为何提示支付平台持卡人信息有误,0.9634756134838767
34,更换银行卡会影响自动扣款吗,0.9634616333343146
35,如何更改其他平台的注册手机号码,0.963365306751652
36,登录时的图文验证码是否区分大小写,0.9633106029005898
37,公众号页面的“我的排号”是什么意思,0.9632185318732736
38,银行卡挂失会影响自动扣款吗,0.9629915782465928
39,线上是否可开据征信版结清证明,0.9627771711897684
40,修改手机号码/微信号是否会影响自动扣款,0.962695535888667
41,借款成功会有短信等提醒吗,0.9625895029853605
42,提前还款会影响个人征信吗,0.9624834698318074
43,新网账户绑定微信/支付宝后支持提现或充值吗,0.9624746536503358
44,好人卡绑定云闪付/微信等失败怎么办,0.9624610109925439
45,优信扣款成功后为何显示待还款,0.9624296729704468
46,车贷合同里的金额是否包含利息,0.962286673917968
47,季得利提前支取影响已发放利息吗,0.9622671197368337
48,新网银行二类户与好人贷是否为同一个手机号码,0.9621733508591873
49,为何提示还款卡不存在,0.9621134659568596
50,修改手机号后是否需要重置登录密码,0.9620843718983727
51,如何修改存管账户预留手机号码,0.9619825587237846
52,新网银行开户支持的证件有哪些,0.9619767258386401
53,通过本人微信找回密码是指什么,0.9619091217798469
54,为何提示交易密码验证失败,0.9617303857049951
55,为何收到新网银行逾期提醒短信,0.9616707758623042
56,未接到好人贷回访电话会被拒吗,0.9616482065126148
57,为何征信上有新网银行的贷款审批记录,0.9616048966364567
58,半年得利提前支取影响已发放利息吗,0.9615636444987523
59,银行卡开通银联在线支付后是否可正常还款,0.9614073902693591
60,为什么好人贷第一期还款金额与之后不一致,0.96139909522898
61,好人贷为什么提示“账户存在异常操作”,0.9612988038248043
62,扣款结果会有短信提示吗,0.9612474633721136
63,银行卡是二类户影响扣款吗,0.9612425132478711
64,定期存款操作的渠道有哪些,0.9610334895475589
65,接收短信的手机号是否为注册手机号,0.9609442060382097
66,联系新网银行客服有哪几种方式,0.9609050926369569
67,新网银行以何名义查询征信,0.9608988879961875
68,收款卡发卡行拒绝放款失败什么意思？,0.9608003795133548
69,为何重置密码后仍提示密码错误,0.9607368673807595
70,为何提示支付平台银行卡未开通银联无卡认证支付,0.960649846532283
71,可以查询注册手机号码吗,0.9603736971135834
72,新网银行账户的交易记录如何查看,0.9603712710541785
73,使用优惠券后提前还款利息如何计算,0.9602689114310711
74,为何提示支付平台受发卡行资金用途限制拒绝交易,0.9601784350643994
75,好人贷申请成功会有短信通知吗,0.9600343944959955
76,公众号是否有还款提示,0.9599590127919598
77,为何提示支付平台不允许持卡人进行的交易,0.959909393747686
78,如何查看手机号是否实名制,0.9598901076673052
79,借款时选错收款账户怎么办？,0.9597397573233952
80,如何修改新网随心存注册号码,0.9597348145319423
81,为何图文验证码输入正确却提示错误,0.9596160925175997
82,为何提示支付平台签约关系不存在,0.9594778519348457
83,随心存可以在我行公众号查询/操作吗,0.9594594218101281
84,手机号归属地与定位地不一致是否有影响,0.9593658284626577
85,贷款证明开据失败怎么办,0.9592645314054884
86,如何查询合作平台贷款是否结清,0.9592350190797676
87,获取验证码次数超限怎么办,0.9591479792070059
88,如何查询好人贷申请的授信结果,0.9591392490033449
89,还款银行卡是否需要开通银联在线支付业务,0.9589948589348329
90,为何存管信息与平台显示不一致,0.9589554751684204
91,开据证明时为何需要实名认证,0.9589526402991632
92,银行渠道维护无法操作怎么办,0.9589473337894999
93,如何查询转账到新网银行的记录,0.9588815911567701
94,好人贷只能使用微信登录吗？,0.9588265122039722
95,为何提示支付平台当日交易次数超限,0.9586750140628866
96,为何收到新网银行还款短信,0.9586553484897313
97,微信/支付宝等可否与新网银行账户互相绑定,0.9586422262790398
98,新网二类户转入/转出收取手续费吗,0.9586356150097295
99,结清贷款后什么时候可以开据结清证明,0.9585141549289274
100,为什么拍照认证时总是不成功或显示系统崩溃,0.9584652882832181
101,存管查询为何提示用户不存在或者信息有误,0.9584562527648621
102,诺诺发票贷的利率是多少,0.958421365109752
103,好人贷注册手机号无法使用,0.9583931975671173
104,如何修改实名认证手机号码,0.9583014598260805
105,为何征信上有新网银行上报的逾期,0.9582309570890089
106,为何提示支付平台暂不支持的银行或限额,0.9580459922473079
107,好人贷如何查看所支持的还款方式,0.9580350982210194
108,好人贷以什么贷款类型上报人行征信？,0.9580229495900501
109,贷款证明的电子章是否具有法律效应,0.9579949151354593
110,注销注册用户后是否可恢复？,0.9579463711244941
111,存管密码被锁定怎么办,0.957942601739237
112,好人贷交易密码如何设置,0.9578290753125617
113,微信号更换成功后何时可以正常使用,0.9577126849999492
114,新网银行合作的存管平台有哪些,0.9576103822928376
115,为何提示支付平台发卡行拒绝,0.9574443176578219
116,新网银行人工客服电话是多少,0.9574020184504834
117,新网银行公众号如何取消关注,0.9573749514757613
118,无法提供消费凭证可以取消贷款吗,0.9573558061916931
119,交易密码无法设置,0.9571643605492752
120,好人贷审核时是否给填写的联系人去电,0.957157365907122
121,提前结清贷款后还会扣款吗,0.9571439090328204
122,好人贷借款超时未到账如何处理,0.9571298281960015
123,银行渠道维护是指什么,0.9571077259363354
124,电话客服是否可以受理结清证明,0.9570251389171152
125,车贷扣款支持的银行卡有哪些,0.9569883330904924
126,未正常还款我行会进行催收吗,0.9569203306376103
127,结清证明印章无法查看,0.9568461770887551
128,购买存款页面为何提示“额度不足，无法购买”,0.9568415839284824
129,绑定银行卡产生费用吗,0.9568304572256187
130,如何查询是否开通银联在线支付,0.9567969288787518
131,支持绑定的银行卡类型有哪些,0.9567557852807125
132,拨打我行人工客服电话是否收费,0.9566548227667834
133,审核电话可更改接听电话吗,0.9566195743863506
134,开据证明时为何提示账户存在异常,0.9565526332240801
135,视频认证录制失败的原因是什么,0.9564954545502443
136,挖财还款是否为新网银行代扣,0.9564496024605574
137,存管查询的余额如何提现,0.9563570268477275
138,好人贷授信首页显示利率是否为固定利率,0.9563536188568762
139,申请诺诺发票贷需要什么条件,0.9563490073027405
140,为何提示支付平台渠道不支持的银行,0.9562081741881858
141,如何取消征信查询及使用授权书,0.9561378462227806
142,好人贷支持扣款的银行有哪些,0.9560654890745339
143,为何提示不具备开具资格,0.9560188526314097
144,新网银行人工客服电话打不通,0.955959371581497
145,季得利的操作渠道有哪些,0.9559410818081988
146,线下转账如何填写新网银行开户信息,0.9559093673538366
147,如何查询当期车贷还款金额,0.9558352247692169
148,随心存如何查看收益情况,0.9557402711731419
149,为何提示支付平台账户余额不足,0.9556916911123666
150,为什么取消了提前部分还款,0.9556755110680443
151,新网银行的官网地址是什么,0.9555483598688321
152,征信报告是什么样的,0.9555329973842308
153,贷款结清之后能否删除贷款记录,0.9554077414351679
154,转账到新网银行如何操作,0.9553950484702205
155,线上开据证明有次数限制吗,0.9553792746677899
156,为何提示用户未实名认证,0.9553246088883897
157,什么是银行卡预留手机号？,0.95527643053695
158,可以查询个人信息资料吗？,0.9552406596730434
159,客服能否查看聊天记录,0.9551808820858567
160,为什么点击拍照没有反应,0.9551562240862398
161,好人贷提额会查询征信吗,0.9551473572924352
162,客服能否看到客户申请好人贷的信息,0.9549989260723677
163,如何确保还款日当天会扣款成功,0.9549969444957179
164,结清贷款后征信上是否会显示结清,0.9549164001724783
165,企业邮箱验证码可否重新获取,0.9549108250633439
166,申请好人贷有区域或者号段等限制吗,0.9548781523100464
167,企业邮箱填写错误怎么办,0.9548473277925499
168,京东存款的计息规则及计息公式,0.9546214583801649
169,申请好人贷后，可否更改授信结果,0.9546108482045442
170,车贷还款记录如何查询,0.9545459149435873
171,白骑士认证失败是什么意思,0.954445333351197
172,如何设置存管支付密码,0.9542581558297559
173,如何查看委托支付协议,0.9542134764921544
174,银联在线支付如何开通,0.9541954416411232
175,好人贷不借款会产生利息或费用吗,0.9540998796149125
176,58车金融客服电话是多少,0.9540864310323091
177,新网二类户可以升级为一类户吗？,0.9540561834974459
178,手机获取验证码失败,0.9540531968170328
179,新网二类户上的资金是否计息,0.954013376753801
180,好人贷审核电话是多少,0.9539725421494931
181,新网银行存款属于理财产品吗,0.9538942867354735
182,征信上显示的贷款金额是否包含利息,0.9538846586094908
183,还款金额超银行卡限额怎么办,0.9538687036275431
184,新网银行自动扣款时间,0.9538102253966696
185,更改银行卡预留手机号的方法,0.9537524083752702
186,为什么银行还款存在限额？,0.9537437196072553
187,新网银行合作平台有哪些,0.9537206123483926
188,随心存如何修改交易密码,0.9536332744658459
189,京东存款是否支持提前支取/提前部分支取？,0.9536071165038539
190,五年定期存款支持提前支取吗,0.9535881137810226
191,在线咨询是否支持客户发送语音,0.9535518290317433
192,登录密码为何无法重置,0.9535199875490729
193,新网银行有哪些产品可以提额,0.9533686809701599
194,是否可以取消自动扣款,0.9533652602237835
195,新网二类户转入/转出有时间限制吗,0.953293258832602
196,系统升级会影响扣款吗,0.953288323249026
197,新网银行自动扣款次数,0.9532806223631997
198,非绑定银行卡可否与新网二类户转账,0.9532287754339381
199,为何提示支付平台支取金额超过可用余额,0.9531594449943872
200,新网银行能否绑定云闪付,0.9531217185414773
201,能否人工开据贷款证明,0.9530686090654835
202,新网银行存款是否受保障,0.9530658656606478
203,如何查看随心存购买情况,0.9530632269657945
204,结清证明的发送方式有哪些,0.9530615942130357
205,名下所有卡被冻结后如何还款,0.9530405562521747
206,为何按期还款只能选择部分贷款期限,0.9530009880992599
207,新网银行二类户如何转入/转出,0.9529999615712984
208,新网银行有实体卡片吗,0.9528782270996751
209,好人贷是否支持提前还当期账单,0.9528763273966494
210,销户后为何还能解绑银行卡,0.952814578980466
211,为何提示支付平台账户状态异常,0.952734603348888
212,如何查看优惠券的使用情况,0.9527265790493039
213,好人贷被拒后为何没有下次开放时间,0.952674607332493
214,滴水贷客服电话是多少,0.9525005262397925
215,借款后如何判定下次还款日期,0.9524874736220903
216,查询结清证明申请是否已提交,0.9524636470697638
217,还款日当天支持手动还款吗,0.9524126209099394
218,新网银行存款类产品有哪些,0.952364750868022
219,如何查看好人贷相关协议/合同？,0.9523457706151351
220,为何提示支付平台交易金额超限,0.9522964369061878
221,为什么收到提额短信但额度未提升,0.9522866606391724
222,可以通过他人银行卡转入到新网银行账户吗,0.9522670917541877
223,好人贷支持微信/支付宝扣款吗,0.9522439859010213
224,是否会发生重复扣款情况,0.9521681338485518
225,存款页面是否会显示每日收益,0.9521521940069305
226,什么是单笔借据和多笔借据,0.9520937225264153
227,好人贷借款金额与到账金额是否一致,0.9520852477327072
228,新网银行账户可以在哪些地方使用,0.952074439584425
229,随心存利率是多少,0.9519347249589594
230,密码被锁定怎么办,0.9518845541072171
231,随心存操作渠道有哪些,0.9518633586077526
232,京东存款为什么显示当日额度为什么已售罄？,0.9518475627775276
233,好人贷申请是否查询芝麻信用,0.9518443235695595
234,车贷如何修改注册手机号码,0.9518442115844955
235,存款产品的资金可以用于好人贷还款吗,0.9517794113102053
236,新网银行的活期利率是多少,0.9517216680763599
237,如何查询其他平台扣款银行卡,0.9516080029605988
238,为何人脸识别提示光线太足,0.951594567516946
239,好人贷必须绑定银行卡使用吗,0.9515179084314009
240,申请好人贷没有公司邮箱怎么办,0.9514873907725859
241,申请好人贷工作信息如何填写,0.951443346228643
242,开据证明为何显示没有符合要求的订单,0.951297818235965
243,结清证明的印章是否可以用公章,0.9512550824315538
244,实名认证是否查询征信,0.9511901927521499
245,如何查看贷款合同,0.9511895857838897
246,再次申请好人贷会查询征信吗,0.9511633617564489
247,申请好人贷必须填写联系人信息吗,0.951139802600292
248,验证码发送至什么手机号,0.9510723669025186
249,结清证明是否是还款记录证明,0.9509510383612093
250,银行卡还款限额是多少,0.950900982988413
251,自动扣款失败怎么办,0.9508414610462522
252,还款日当天是否自动扣款,0.9508372799735901
253,为何无法登录存管查询,0.9508137641033731
254,新网二类户为何无法转入/转出,0.9507389844415002
255,操作好人贷是否需要开启定位,0.9507315283516994
256,如何查看银行卡管理列表,0.950692802233584
257,存款需要先开立银行账户吗,0.9505392308957062
258,好人贷定位如何开启,0.9505284208244776
259,车贷还款只扣除部分是什么原因,0.9503559254584887
260,为何申请好人贷页面显示暂无资格,0.9503384286858046
261,平台方提供的客户审批资料能否提供给客户,0.9502893939484602
262,为何提示还款存在差错,0.9501704144247953
263,在线客服是否是人工客服,0.9501137014419689
264,转账时为何提示未面核,0.9500456865056762
265,为什么提示用户不存在,0.9500229118952649
266,为何提示支付平台其他错误,0.9500093647797377
267,为何好人贷还款时提示“交易处理中”,0.9499665924886239
268,好人贷申请需要填写哪些个人信息,0.9499422222003103
269,补扣会影响信用吗,0.9499292371806465
270,活体检测失败怎么办,0.9499018288670864
271,还款记录如何查看,0.9498787103969095
272,新网银行二类户限额是多少,0.9497007792193357
273,提前还款手续费是多少,0.9496764137967593
274,随心存提前支取到账时间,0.9496249520796046
275,按期还款和任性还款的区别是什么,0.9495379314229061
276,申请好人贷需要开个人账户吗？,0.9494048351681766
277,当期账单支持再分期吗,0.9494002050283028
278,选择任性还款/按期还款利息如何计算,0.9493907088660611
279,咨询可以发送图片吗？,0.9492385553010226
280,为何申请好人贷后显示未获取额度,0.9492084364047334
281,合同为何无法打开,0.9491683546545108
282,车贷合同如何查看,0.9491291287232853
283,车辆信息如何查询,0.9490689706022837
284,随心存利率为何会发生变化,0.9489961804861532
285,新网银行账户可以设置为好人贷借/还款账户吗,0.9489901056574437
286,如何修改征信上的个人信息,0.9487755498125797
287,好人贷借款后能否修改贷款信息,0.9487274185653621
288,提前支取时为何显示存入,0.9486932197895667
289,为何结清证明显示日期与平台不符,0.9486820349339338
290,还款日可以修改吗,0.9483378572141843
291,手机号无法使用为什么,0.9482167931956789
292,好人贷账户是否为新网银行二类户？,0.948089593666397
293,实名认证失败的原因是什么,0.9480430947252547
294,逾期后还款金额是否会增加,0.9479625194015192
295,好人贷与其他平台类似产品的区别是什么,0.9479403988124976
296,视频认证的步骤是什么,0.9478664754568582
297,人脸识别失败怎么办,0.9477382685474998
298,为何提示缺少必要参数,0.9477319126094389
299,能否开具非恶意逾期证明,0.9476242437213901
300,还款后为何未更新还款状态,0.9476180714654084
301,选择任何还款方式都可以提前还款吗,0.9475924462388157
302,为何无法提交好人贷申请资料,0.9475633563900301
303,如何查询申请相关的协议书,0.9474992137730816
304,如何把注册用户与结算用户都注销,0.9474699435158935
305,申请好人贷需要下载APP吗？,0.9474026194189604
306,银联在线支付是什么,0.947329146571421
307,新网银行地址在哪里,0.9468740873304906
308,居住信息如何填写,0.9468665986357707
309,好人贷申请的渠道有哪些,0.9468629010311618
310,申请创客贷需要什么条件,0.9467303914879269
311,银行转账未到账怎么办,0.946683355704133
312,定期存款的利率是多少,0.9465719859161741
313,新网银行以什么名义放款,0.946566584865052
314,好人贷账户如何更换手机号码,0.946507591349466
315,开具结清证明时为何无法登录,0.9464469017092842
316,提前还款有次数限制吗,0.9464359988090298
317,查询各类工单办理进度,0.9464341711093356
318,修改手机号码的处理时间是多久,0.946429434170701
319,还款后页面显示等待中,0.9463870913168098
320,存款产品如何重置交易密码,0.946343487029616
321,好人贷是否支持归还逾期部分账单,0.946333753433597
322,关闭其他平台额度后，能否恢复好人贷额度,0.9463200770829594
323,五年定期存款的利率是多少,0.9461861370009499
324,好人贷借款记录如何查询,0.9461205443219165
325,客户咨询其他平台催收问题,0.9460592294146343
326,什么是无卡支付及免密支付,0.9459922558083196
327,好人贷扣款账户如何查看,0.9459799236887434
328,人脸识别使用的是照片还是视频,0.9459253680626687
329,我行对客邮箱是多少,0.9457701191954342
330,优信客服电话是多少,0.945728011291663
331,随心存到期后何时到账,0.9457059095698971
332,好人贷借款如何上报征信,0.9456906111543404
333,逾期未还款如何处理,0.9456880057797457
334,新网银行存款产品为何暂停交易,0.9455387739336634
335,节假日可以操作各类存款吗,0.9455187973127764
336,结清证明会展示哪些信息,0.9454419566099498
337,好人贷提前还款最低还多少,0.9454169293089049
338,好人贷自动扣款规则,0.945411048735147
339,客户发送截图以及个人信息等,0.9454054711739434
340,新网银行有哪些活动,0.9453465336526279
341,"好人贷有回访电话吗""",0.9452058329503703
342,好人贷还款记录如何查询,0.9450330922314047
343,车贷可以修改还款日吗,0.9449561037511316
344,他人可以使用本人信息申请好人贷吗,0.9448641582477769
345,在哪个平台操作提现,0.9446426723290737
346,客户催促需要加急办理,0.9446414295301534
347,存管提现到账时间是多久,0.9446394299630875
348,下一次开放时间是什么意思,0.9445864825929898
349,如何通过线下方式转入新网二类户,0.9445709888808965
350,好人贷部分提前还款规则,0.944555513128836
351,为何申请好人贷无结果,0.9445350593969227
352,目前支持的银行有哪些,0.9445081072824655
353,好人贷为什么无法登录,0.9441712178799574
354,页面为什么异常跳转,0.9441324528690055
355,实名认证为什么不符,0.9441058293019353
356,绑定银行卡失败,0.9440686323864804
357,如何查看好人贷还款计划,0.9438308936989521
358,征信上报周期及更新时间,0.943825663954835
359,为什么无法注册,0.9437970160548435
360,美团客服热线是多少,0.9437136532676239
361,随心存支持提前支取吗,0.943556552814847
362,合作平台如何取消贷款,0.9435122526086105
363,如何关注新网银行公众号,0.9434543105472828
364,销户后可以再开户吗,0.943313072675293
365,好人贷借款时还会审核吗,0.9432713229989345
366,新网银行三类户是什么,0.94327094983594
367,哪些渠道可以购买京东存款产品？,0.9432548378926471
368,存款产品是否存满五年才能支取,0.9431271190794102
369,如何查询存管账户流水,0.9431199473573378
370,转账到新网银行账户是否还款成功,0.9431112644689212
371,可绑定银行卡数量上限,0.9428215263478997
372,新网银行如何联系客户,0.9428190212202635
373,抵押类贷款如何办理,0.9425998338175222
374,为何提示系统异常,0.9425958010391016
375,贷款证明如何开据,0.9425328622719268
376,好人贷利率为什么调高了,0.9423939452597425
377,身份证更换期间会影响好人贷贷款吗,0.9423766310079862
378,可否取消银行卡限额,0.9423545158026874
379,电脑端可以登录好人贷吗,0.9423089689561986
380,月得利提前支取如何计息,0.9421144417505476
381,新网银行行号是多少,0.9420998082156596
382,存在迁户问题怎么处理,0.9420072988492817
383,存款产品如何修改手机号,0.9419249199787451
384,好人贷申请是否可以使用临时身份证,0.9417749384898524
385,好人贷-云闪付是什么,0.9417448735900663
386,如何查看开户结果,0.9417105248659154
387,黑户/白户是否可以申请好人贷,0.9416840789837392
388,好人贷审核不通过对个人有什么影响,0.9416642036359829
389,企业邮箱为何验证不了,0.9416306380837576
390,好人贷贷款利息如何计算,0.9415477324604892
391,客户表示还款成功,0.9413053022378985
392,为何提示该证件已被使用,0.9412941890216754
393,开户失败原因,0.9412608900294827
394,为何销户后还能看到好人贷信息,0.941164242098609
395,如何退出微信公众号,0.9410341059283638
396,如何查询车贷还款日,0.9410293440975335
397,好人贷额度必须一次性借完吗,0.9409918751203434
398,新网银行业务办理时间,0.9409477031695168
399,自助提额什么时候上线,0.9409261504235552
400,关于客户个人信息安全问题,0.9409124019935357
401,扣款失败的原因,0.940897113614365
402,自动扣款如何操作,0.940654336895568
403,好人贷-云闪付如何提前还款,0.9406540072812424
404,好人贷还款后额度何时恢复,0.9404647661121391
405,注册规则是什么,0.9403572411805806
406,申请好人贷需要公积金、社保吗？,0.9402679952519631
407,申请好人贷使用的邮箱是公司邮箱还是个人邮箱,0.9402413071559975
408,如何更换微信号,0.9401098406385275
409,什么是注册号码？,0.9400458710216757
410,如何登录微信公众号,0.9400194363794221
411,新网银行有企业贷款吗？,0.9398748112522972
412,页面为何无法打开,0.9396338502904807
413,随心存存款期限有哪些,0.9394851325155711
414,申请好人贷后为何页面显示仍可提交申请,0.9394805685251948
415,新网银行有几个网点,0.9394663315055319
