416,如何查询征信报告,0.9392527694131126
417,如何开据存款证明,0.939048096072735
418,新网银行是否上市,0.9390207229528384
419,好人贷有回访电话吗,0.9389532415610045
420,周得利提前支取如何计息,0.9388909371272137
421,能否删除个人信息,0.9388403868544283
422,好人贷还款方式有哪些,0.9387338849701063
423,新网账户之间能否互相转账,0.9387260808033663
424,如何注销新网注册用户,0.9387070413220117
425,核身链接失效的原因,0.938563062432885
426,征信是什么,0.938450068492867
427,我们是四川新网银行吗,0.9382754509976079
428,如何解约快捷支付？,0.9382665694851087
429,提前支取有限制吗,0.9382312977650986
430,销户后是否上征信,0.9381920790176473
431,随心存停售后有影响吗,0.938062676575888
432,客服是否是随机分配,0.9380484482286684
433,他行渠道汇入新网账户的到账时间是多久,0.9380262275090187
434,新网诺诺发票贷如何申请,0.9379706482178006
435,实名认证审核时间,0.9378510655273657
436,如何购买新网银行存款产品,0.9378287826921492
437,审核电话内容是什么,0.9375727771467117
438,公众号如何注册,0.9373660059466359
439,提额会有通知吗,0.9370022648781888
440,如何操作随心存大额存款,0.9369984131232305
441,系统繁忙是什么原因,0.9367737840770592
442,申请好人贷需要哪些资料,0.9367653654095923
443,如何签署借款合同,0.9367500110713045
444,什么是分批次扣款,0.9367096979630125
445,令牌无效是什么,0.9366821945578301
446,周得利计息规则,0.9366784531157113
447,什么情况算逾期,0.936625033630331
448,存管账户如何查询,0.9366232243421281
449,为何还款后额度恢复减少了,0.9365960463107401
450,申请好人贷后有没有回复,0.9365613223196406
451,节假日可以借/还款吗,0.9364825214516488
452,新网银行有信用卡吗,0.9364608149116843
453,如何激活新网二类户,0.9361217923014483
454,好人贷个人资料如何修改,0.936036083568994
455,忘记密码怎么办,0.9359906853393342
456,好人贷是否支持提前还款,0.9359546437429754
457,好人贷需要面签吗,0.9359083368389716
458,可以让别人代还款吗？,0.9358854373876982
459,车贷能否绑定他人银行卡,0.9357415930727749
460,存管账户充值限额,0.9354793934629716
461,定期存款是否有存单,0.9354243316368568
462,好人贷额度为什么变低了,0.9353402754239986
463,美利车联系电话,0.9353255792315567
464,可以重新注册吗,0.9352650564014451
465,好人贷为什么无法借款,0.9352229213725758
466,如何获取线上核身链接,0.9347328012967973
467,新网银行有招聘吗,0.9346280636335421
468,人工是否可操作扣款,0.9345254658817325
469,如何查询账户是否冻结,0.934485127974974
470,车贷如何办理解押手续,0.9344636187478991
471,好人贷-云闪付如何更换收/还款银行卡,0.9344195494426489
472,申请好人贷需要什么条件,0.9337669176017774
473,好人贷当期能否最低还款,0.9337618016153417
474,什么情况算违约,0.9336985305805707
475,好人贷可以重新申请吗,0.9336326383363677
476,其他贷款怎么办理,0.9336224114477293
477,可否补充企业邮箱,0.9336201461367899
478,好人贷申请必须使用身份证原件吗,0.9334903904327353
479,好人贷支持周末借款吗？,0.9334475002426016
480,结清证明开据时间是多久,0.9333165267209395
481,好人贷利率为什么高,0.9327921717655212
482,自动扣款时间段是多久,0.9327861625847096
483,逾期造成的影响是什么,0.9327601940353086
484,新网银行好事贷如何申请,0.9327180663572413
485,好人贷上征信吗,0.9326502239180201
486,好人贷支持随时借款吗,0.9326482784433541
487,怎样才能成功申请到额度,0.9325941013096378
488,为什么没有扣款,0.9325496571688631
489,如何查询还款日,0.9324594391031839
490,好事贷收取哪些费用,0.9322380148657115
491,开户是什么意思,0.9321411709723837
492,好人贷申请是否支持人工受理,0.9320789123525663
493,申请被拒怎么办,0.9317832176274076
494,销户与否会产生什么影响,0.9316053433834095
495,好人贷支持随借随还吗,0.9315301061837444
496,银行渠道维护时间一般是多久,0.9314479782397233
497,什么是我的额度和可借额度,0.9314244826051346
498,借款失败怎么办,0.931403434289002
499,车贷平台如何查询,0.9313306895612773
500,企业邮箱格式是什么,0.9310305076297358
501,一个身份证可以申请好人贷两次吗？,0.9309717075633949
502,人脸拍摄规范,0.9307722989481594
503,好人贷支持在国外发起借款吗,0.9307043835599396
504,好人贷账户如何挂失,0.9301025309550743
505,有额度不使用有什么影响吗,0.9300923523219229
506,客户表示没有问题了,0.9300789692444438
507,随心存T+1是什么,0.9300746814022244
508,如何知晓已注销成功,0.9298901041091058
509,可以咨询吗,0.929748162000502
510,好人贷能否人工操作提额,0.9297369154095114
511,如何选择按期还款/任性还款,0.9294963149483195
512,车贷支持手动还款吗,0.9293011437695682
513,按期还款是什么,0.929158819671259
514,任性还款是什么,0.9289187287887828
515,车贷收取哪些费用,0.9287593114827154
516,好人贷通过率多少,0.9284719468069301
517,好人贷收取哪些费用,0.9283939534761423
518,车贷申请多久可以放款,0.9283562634310004
519,输入身份证号码时，为何无法输入字母,0.9282586078320774
520,为何页面出现多个新网银行账户,0.9282134370615109
521,新网银行人工客服服务时间,0.9279009422130243
522,如何注销公众号,0.9277611725787814
523,如何办理对公业务,0.9275782694688072
524,什么是风控审核中,0.9275675526372819
525,如何查询好人贷借据收款银行卡,0.9274748373739995
526,创客贷额度是多少,0.9271387861788969
527,如何开立存管账户,0.9271147852167331
528,开通什么业务,0.9269546139615066
529,罚息能否减免,0.9268273939071702
530,随心存产品停售原因,0.9266120239896352
531,定期存款到期如何支取,0.9264515410865938
532,好人贷如何降低利率,0.9260324202572948
533,好人贷能否绑定他人银行卡,0.9260057337004712
534,存款利率是多少,0.9258767604493471
535,身份证上传失败怎么办,0.9258303595620809
536,如何获得优惠券,0.9258130824631228
537,客户提到投诉,0.9249688806677465
538,申请好人贷是否都有额度,0.92490308340541
539,如何更换好人贷默认还款账户,0.9246458109098781
540,好人贷有额度后如何进行贷款,0.9245781602626991
541,五年定期存款是什么,0.9245453759811936
542,上传身份证时需填写的内容是什么,0.924535813480484
543,合作平台如何还款,0.9244601645218112
544,能否让客服回电,0.9239875927492136
545,好人贷申请能否撤销,0.923903917413295
546,各还款方式如何进行还款,0.923885655537479
547,客户要求发送相关模板,0.923846256935728
548,如何查询是否已申请好人贷,0.9229999063896556
549,存款产品支取通用路径,0.9229839883570939
550,如何录制活体检测,0.9226183702570232
551,好人贷如何试算利息,0.9225265418368388
552,密码如何修改,0.9223307512705862
553,随心存如何计息,0.922269859279841
554,如何更换借款收款银行卡,0.9219846380626442
555,客户表示知道了,0.921828442532252
556,车贷利息是多少,0.9217830127921591
557,线上转入新网银行账户到账时间是多久,0.9217207108533765
558,迁户是什么意思,0.9213313598216583
559,获取额度后多久可发起借款,0.9212657629754047
560,身份证信息变更后如何更新,0.9211860188333706
561,如何办理好人卡？,0.92067324858791
562,好人贷额度是否循环使用,0.9202987876068567
563,季得利如何计息,0.9202236326651309
564,随心存是什么,0.9193055942958224
565,好人贷为何无法还款,0.9188730059847416
566,新网有哪些产品,0.918791464382446
567,优惠券如何使用,0.9184043592970216
568,好人贷电话回访时间,0.9180198242743277
569,什么是当期账单,0.9180002231310956
570,好人贷如何实名认证,0.9177679996932623
571,什么是活体检测,0.91775147388876
572,经侦是指什么,0.9174368276010083
573,如何进入好人贷页面,0.9174107299161337
574,什么是综合评估,0.9168673770587542
575,好人贷借款合同有效期是多久,0.9167827914306353
576,车贷如何解绑银行卡,0.9166854877102051
577,好人贷申请身份证可否添加水印,0.9162815320368112
578,罚息介绍,0.9162636327260569
579,存款产品是否保本保息,0.916211864279318
580,随心存存入限额,0.916117901769528
581,好人贷年化利率是多少,0.9160605914680744
582,好人贷为什么额度低,0.9157550847048402
583,消费凭证有效期是多久,0.9152437488831008
584,好人贷月利率是多少,0.9149280534486893
585,好人贷如何提高额度,0.9145602615481496
586,有多少人获得好人贷额度,0.9143641784215261
587,客户表示需要考虑,0.9143134060049132
588,新网银行账户是什么,0.9136682188756666
589,是否需要使用本人手机操作好人贷,0.9135039774300897
590,身份证过期可以申请好人贷吗,0.9130106119321929
591,车贷如何更换还款银行卡,0.9129780100309217
592,存管账户如何注销,0.9127354633438356
593,存管是什么,0.9125142007377579
594,好人贷额度是否会发生变化,0.9124710104538104
595,退汇是什么意思,0.912287755032993
596,季得利是什么,0.9121835875392877
597,额度冻结是什么意思？,0.9121328926106008
598,新网银行APP下载,0.9120807820337029
599,如何注销新网二类户,0.9120345592144717
600,房产保证金是什么,0.9119343998977348
601,车贷逾期如何还款,0.91183005951941
602,个人可以在新网开立几个账户,0.9108698288660745
603,如何降低/关闭额度,0.9105514548555556
604,如何查询新网账户,0.9104093663488896
605,车贷如何还款？,0.9100293681952115
606,客户表示不满,0.9100106417625242
607,好人贷是邀请制吗,0.9097426630904628
608,好人贷账户如何查询,0.909179830316165
609,手持身份证拍照的注意事项,0.9087248813177797
610,如何绑定银行卡,0.9082790366907236
611,好人贷额度他人能否使用,0.9081911802842142
612,客户表示稍等,0.9064740269338267
613,客户称赞服务好,0.9058351270892716
614,如何邀请好友申请好人贷,0.9057927424332046
615,如何在新网银行开户,0.9056775748954918
616,关于消费凭证,0.9055656761665477
617,什么是一、二、三类户,0.9055229174691876
618,好人贷是否有临时额度,0.9054565367567389
619,怎样用其他手机登录好人贷,0.9053441695037143
620,如何换绑银行卡,0.9043518447487019
621,好人贷还款后多久到账,0.9039502063983285
622,工新借是什么,0.9039260503028966
623,好人贷放款至什么账户,0.9031535033341669
624,新网银行简介,0.902033426752123
625,车贷如何提前还款,0.9017121684077817
626,如何进入个人中心,0.9016919726846542
627,随心存如何登录,0.9008834942926434
628,如何冻结新网银行账户,0.8996431962761875
629,注销账户的处理时间,0.8994870121374671
630,客户表示有合作意向,0.8989774304552935
631,额度占用问题,0.8986128017993293
632,好人贷利率是多少,0.8979882360268467
633,如何解绑银行卡,0.8978830836673866
634,批扣时间段是多久,0.8962915031956515
635,什么是登录密码,0.8931027546296401
636,好人贷如何审核,0.8922991618228587
637,工新借如何申请,0.8922407681641966
638,好人贷如何自助提额,0.8918019884331154
639,什么是还款日,0.891402759612576
640,好人贷如何提前还款,0.8913954731788976
641,为何无法销户,0.890561805843726
642,额度冻结怎么办,0.8894980814770717
643,为何无法申请好人贷,0.8884962095399895
644,好人贷的办理时间,0.8884025025051552
645,车贷如何申请,0.888168958057873
646,好人贷审核时间是多久,0.887373586371051
647,季得利如何支取,0.8872122299248519
648,好人贷如何主动还款,0.8853285536703726
649,可否延期还款,0.8850868561439753
650,可否对公还款,0.8814287573966955
651,好人贷借款规则,0.8807032492546099
652,好人贷消费用途,0.8805147789897829
653,好人贷是什么,0.8745867253433025
654,好人贷额度是多少,0.8738775902599812
655,什么平台的贷款,0.8736894286721182
656,好人贷提额周期是多久,0.8728124943548912
657,如何增加银行卡,0.8722959481803861
658,客户提出建议,0.8711596242555376
659,好人贷贷款期限是多久,0.8698121120690651
660,好人贷额度有效期是多久,0.8695742200018322
661,好人贷如何申请,0.8580639347010851
662,好事贷如何还款,0.8548201485406381
663,如何删除身份证信息,0.853554447124213
664,好人贷账户如何注销,0.8356312721532221
665,好人贷借款多久到账,0.8348488148206055
666,好人贷如何还款,0.8189760042906091
